url,name,ein,score,star_rating,keywords,website,address,phone,organization_mission,IRS_ruling_year,contain_keywords
https://www.charitynavigator.org/ein/311280688,HILL STATION BAPTIST CHURCH,311280688,,,"Not rated, This organization is not rated, Not currently rated",,"7100 HILL STATION RD, GOSHEN, OH, 45122-8420",,Mission not available,1963,Yes
https://www.charitynavigator.org/ein/311280873,INTERNATIONAL ASSOCIATION OF LIONS CLUBS,311280873,,,"Not rated, This organization is not rated, Not currently rated",,"7500 GOODALL RD, MOUNT VERNON, OH, 43050-9547",,Mission not available,1972,Yes
https://www.charitynavigator.org/ein/311280638,WOODLAND CHRISTIAN CHURCH,311280638,,,"Not rated, This organization is not rated, Not currently rated",,"143 WOODLAND AVE, COLUMBUS, OH, 43203-1775",,Mission not available,1951,Yes
https://www.charitynavigator.org/ein/311281163,Advocates for Youth Education Inc.,311281163,,,"Not rated, This organization is not rated, Not currently rated",,"4911 MAXWELL DR, MASON, OH, 45040-4627",,Mission not available,1998,Yes
https://www.charitynavigator.org/ein/311280881,SOUTHWEST OHIO CHAPTER OF THE PROJECT MANAGEMENT INSTITUTE,311280881,,,"Not rated, This organization is not rated, Not currently rated",,"PO BOX 42107, CINCINNATI, OH, 45242-0107",,Mission not available,1999,Yes
https://www.charitynavigator.org/ein/311281080,DEMOLAY INTERNATIONAL,311281080,,,"Not rated, This organization is not rated, Not currently rated",,"4260 VICTORIAN GREEN DR UNIT 54, CINCINNATI, OH, 45211-2475",,Mission not available,1996,Yes
https://www.charitynavigator.org/ein/311281274,PORTAGE TRAIL CARE CENTER INC,311281274,81%,3,,http://WWW.NATIONALCHURCHRESIDENCES.ORG,"2245 N BANK DR, COLUMBUS, OH, 43220-5422",614-451-2151,"ORIGINATING FROM A CHRISTIAN COMMITMENT OF SERVICE, OUR MISSION IS TO PROVIDE HIGH QUALITY CARE, SERVICES AND RESIDENTIAL COMMUNITIES FOR ALL SENIORS.",1982,No
https://www.charitynavigator.org/ein/311281468,Old North Dayton Neighborhood Association Inc.,311281468,,,"Not rated, This organization is not rated, Not currently rated",,"PO BOX 64, DAYTON, OH, 45404-0064",,Mission not available,2001,Yes
https://www.charitynavigator.org/ein/311281230,700 BOWLING CLUBS OF AMERICA,311281230,,,"Not rated, This organization is not rated, Not currently rated",,"1964 SUMMIT AVE, SAINT PAUL, MN, 55105-1460",,Mission not available,1955,Yes
https://www.charitynavigator.org/ein/311281486,Alexander Parent Teacher Organization,311281486,,,"Not rated, This organization is not rated, Not currently rated",,"6101 AYERS RD, ALBANY, OH, 45710-0000",,Mission not available,2017,Yes
https://www.charitynavigator.org/ein/311281565,UNIOTO SUPPORT ASSOCIATION,311281565,,,"Not rated, This organization is not rated, Not currently rated",,"7185 EGYPT PIKE, CHILLICOTHE, OH, 45601-9078",,Mission not available,1991,Yes
https://www.charitynavigator.org/ein/311281501,Serving America First,311281501,,,"Not rated, This organization is not rated, Not currently rated",,"RR 1 BOX 319, MOUNDSVILLE, WV, 26041-9695",,Mission not available,1990,Yes
https://www.charitynavigator.org/ein/311281616,GIVENS CHAPEL,311281616,,,"Not rated, This organization is not rated, Not currently rated",,"8026 GERMANY RD, WAVERLY, OH, 45690-0000",,Mission not available,1961,Yes
https://www.charitynavigator.org/ein/311281626,Mt. Logan Riding Club Inc.,311281626,,,"Not rated, This organization is not rated, Not currently rated",,"2538 RAGGED RIDGE RD, FRANKFORT, OH, 45628-9058",,Mission not available,2001,Yes
https://www.charitynavigator.org/ein/311281708,Shalem Institute,311281708,56%,1,,http://www.shalemcenter.org,"881 HIGH ST, WORTHINGTON, OH, 43085-4109",614-441-9773,"MENTAL HEALTH, PASTORAL CARE AND SPIRITUAL DIRECTION SERVICES",1992,No
https://www.charitynavigator.org/ein/311281758,Central Illinois Islamic Center,311281758,,,"Not rated, This organization is not rated, Not currently rated",,"106 S LINCOLN AVE, URBANA, IL, 61801-3017",,Mission not available,2004,Yes
https://www.charitynavigator.org/ein/311281814,Arcanum Community Rescue Squad Inc.,311281814,67%,2,,,"208 S MAIN ST 208 SOUTH MAIN ST, ARCANUM, OH, 45304-0000",937-417-1769,RESCUE AND AMBULANCE SERVICE,1990,No
https://www.charitynavigator.org/ein/311281637,PTA OHIO CONGRESS,311281637,,,"Not rated, This organization is not rated, Not currently rated",,"839 SPRING ST, WILLIAMSBURG, OH, 45176-1041",,Mission not available,1973,Yes
https://www.charitynavigator.org/ein/311281646,DAYTON NEWSPAPER GUILD LOCAL 34157,311281646,,,"Not rated, This organization is not rated, Not currently rated",,"PO BOX 427, DAYTON, OH, 45409-0427",,Mission not available,2021,Yes
https://www.charitynavigator.org/ein/311281912,Greater Liberty Temple Church of God in Christ,311281912,,,"Not rated, This organization is not rated, Not currently rated",,"PO BOX 24051, COLUMBUS, OH, 43224-0051",,Mission not available,2001,Yes
https://www.charitynavigator.org/ein/311281749,DELTA GAMMA FRATERNITY HOUSING CORPORATION,311281749,,,"Not rated, This organization is not rated, Not currently rated",http://WWW.DELTAGAMMA.ORG/FRATERNITY_HOUSING_CORPORATION,"3220 RIVERSIDE DRIVE A-2, COLUMBUS, OH, 43221-1752",614-487-5599,"TO FOSTER HIGH IDEALS OF FRIENDSHIP AMONG THE MEMBERS OF DELTA GAMMA FRATERNITY, TO PROMOTE THEIR EDUCATIONAL AND CULTURAL INTERESTS, TO CREATE IN THEM A TRUE SENSE ... (More)",1990,Yes
https://www.charitynavigator.org/ein/311281973,CHURCH OF GOD,311281973,,,"Not rated, This organization is not rated, Not currently rated",,"185 LAKE ST, DELAWARE, OH, 43015-1861",,Mission not available,1972,Yes
https://www.charitynavigator.org/ein/311282078,Ccrn Campus Ministries,311282078,,,"Not rated, This organization is not rated, Not currently rated",,"PO BOX 11327, CINCINNATI, OH, 45211-0327",,Mission not available,1990,Yes
https://www.charitynavigator.org/ein/311281991,ISLAMIC SOCIETY OF BROOKINGS,311281991,,,"Not rated, This organization is not rated, Not currently rated",,"724 11TH AVE, BROOKINGS, SD, 57006-1529",,Mission not available,1983,Yes
https://www.charitynavigator.org/ein/311281993,Light of the World Apostolic Assembly,311281993,,,"Not rated, This organization is not rated, Not currently rated",,"1010 FIELDS ST, HAMMOND, IN, 46320-2657",,Mission not available,1990,Yes
https://www.charitynavigator.org/ein/311282113,US Grant Homestead Association,311282113,,,"Not rated, This organization is not rated, Not currently rated",,"112 N WATER ST, GEORGETOWN, OH, 45121-1332",,Mission not available,1997,Yes
https://www.charitynavigator.org/ein/311282158,BUTLER VOCATIONAL EDUCATION ASSO,311282158,,,"Not rated, This organization is not rated, Not currently rated",,"3603 HAMILTON MIDDLETOWN RD, FAIRFIELD TWP, OH, 45011-2241",,Mission not available,1991,Yes
https://www.charitynavigator.org/ein/311282149,Capital City Community Urban Redevelopment Corporation,311282149,,,"Not rated, This organization is not rated, Not currently rated",,"912 CHERRYFIELD AVE, COLUMBUS, OH, 43235-1769",614-882-1477,THE COMPANY IS CURRENTLY INACTIVE. IT IS REMAINING OPEN PENDING THE SETTLEMENT OF A LAWSUIT IN WHICH IT IS A PLAINTIFF.,1991,Yes
https://www.charitynavigator.org/ein/311282237,PUBLIC EMPLOYEE RETIREES INC,311282237,,,"Not rated, This organization is not rated, Not currently rated",,"659 PARK MEADOW RD STE F, WESTERVILLE, OH, 43081-2879",,Mission not available,1976,Yes
https://www.charitynavigator.org/ein/311282341,Decorative Arts Society of Cincinnati,311282341,,,"Not rated, This organization is not rated, Not currently rated",,"110 HOLLY WOODS DR, FORT THOMAS, KY, 41075-2416",,Mission not available,1990,Yes
https://www.charitynavigator.org/ein/311282342,Ohio Young Farmers Association Inc.,311282342,,,"Not rated, This organization is not rated, Not currently rated",,"6870 LICKING VALLEY RD, FRAZEYSBURG, OH, 43822-9563",,Mission not available,1997,Yes
https://www.charitynavigator.org/ein/311282471,Bravo Music Inc.,311282471,,,"Not rated, This organization is not rated, Not currently rated",,"644 LINN ST STE 1200, CINCINNATI, OH, 45203-1742",,Mission not available,1990,Yes
https://www.charitynavigator.org/ein/311282521,Goodwin & Goodwin Incorporated,311282521,79%,3,,,"548 N DREXEL AVE, BEXLEY, OH, 43209-1046",,PROVIDE CARE AND HABILITATION SERVICES FOR DEVELOPMENTALLY DISABLED PERSONS.,1990,No
https://www.charitynavigator.org/ein/311282530,Friends of Cornell School,311282530,,,"Not rated, This organization is not rated, Not currently rated",,"5250 JOHNSTOWN ALEXANDRIA RD, JOHNSTOWN, OH, 43031-9575",,Mission not available,1990,Yes
https://www.charitynavigator.org/ein/311282408,DELTA ZETA SORORITY,311282408,,,"Not rated, This organization is not rated, Not currently rated",,"202 E CHURCH ST, OXFORD, OH, 45056-1320",,Mission not available,1970,Yes
https://www.charitynavigator.org/ein/311282578,BETHANY CHRISTIAN SERVICES,311282578,,,"Not rated, This organization is not rated, Not currently rated",,"108521 PERRY HWY STE 200, WEXFORD, PA, 15090-0000",,Mission not available,1987,Yes
https://www.charitynavigator.org/ein/311282579,BETHANY CHRISTIAN SERVICES,311282579,,,"Not rated, This organization is not rated, Not currently rated",,"901 EASTERN AVE NE, GRAND RAPIDS, MI, 49503-1201",,Mission not available,1987,Yes
https://www.charitynavigator.org/ein/311282580,BETHANY CHRISTIAN SERVICES,311282580,,,"Not rated, This organization is not rated, Not currently rated",,"2142 PREIST BRIDGE CT STE 1, CROFTON, MD, 21114-0000",,Mission not available,1987,Yes
https://www.charitynavigator.org/ein/311282587,AMISH MENNONITE AID,311282587,,,"Not rated, This organization is not rated, Not currently rated",,"99 S GROFFDALE RD, LEOLA, PA, 17540-9533",,Mission not available,1989,Yes
https://www.charitynavigator.org/ein/311282594,Greater Cincinnati Friends of Jung,311282594,,,"Not rated, This organization is not rated, Not currently rated",,"2128 JULIE TER, CINCINNATI, OH, 45215-3932",,Mission not available,1990,Yes
https://www.charitynavigator.org/ein/311282595,Ohio High School Fast Pitch Softball Coaches Association,311282595,,,"Not rated, This organization is not rated, Not currently rated",,"PO BOX 5453, POLAND, OH, 44514-0453",,Mission not available,1990,Yes
https://www.charitynavigator.org/ein/311282613,TOASTMASTERS INTERNATIONAL,311282613,,,"Not rated, This organization is not rated, Not currently rated",,"216 STURGIS AVE, CINCINNATI, OH, 45217-1924",,Mission not available,1945,Yes
https://www.charitynavigator.org/ein/311282775,VILLAGE CHRISTMAS COMMITTEE,311282775,,,"Not rated, This organization is not rated, Not currently rated",,"PO BOX 179, CLEVES, OH, 45002-0179",,Mission not available,1991,Yes
https://www.charitynavigator.org/ein/311282777,CLERMONT COUNTY CHAPTER OF THE OHIO RETIRED TEACHERS ASSOCIATION,311282777,,,"Not rated, This organization is not rated, Not currently rated",,"4 COMANCHE COURT, LOVELAND, OH, 45140-0000",,Mission not available,1990,Yes
https://www.charitynavigator.org/ein/311282812,FRATERNAL ORDER OF POLICE,311282812,,,"Not rated, This organization is not rated, Not currently rated",http://WWW.WCFOP103.ORG,"PO BOX 464, KINGS MILLS, OH, 45034-0464",513-417-5875,"PROVIDING RELIEF OF THE POOR, RELIEF OF THE DISTRESSED, PROMOTE HEALTH, TO EDUCATE, LESSEN COMMUNITY TENSIONS, DEFENDING HUMAN AND CIVIL RIGHTS SECURED BY LAW, AND C ... (More)",1952,Yes
https://www.charitynavigator.org/ein/311282865,Spirit of Peace Missionary Baptist Church Inc.,311282865,,,"Not rated, This organization is not rated, Not currently rated",,"2032 W RIVERVIEW AVE, DAYTON, OH, 45402-5923",,Mission not available,2001,Yes
https://www.charitynavigator.org/ein/311283162,ILLUMINATING ENGINEERING SOCIETY,311283162,,,"Not rated, This organization is not rated, Not currently rated",,"5460 N MEADOWS BLVD, COLUMBUS, OH, 43229-4133",,Mission not available,1991,Yes
https://www.charitynavigator.org/ein/311282866,C G Jung Association of Central Ohio,311282866,,,"Not rated, This organization is not rated, Not currently rated",,"1320 CAMBRIDGE BLVD, COLUMBUS, OH, 43212-3207",,Mission not available,1991,Yes
https://www.charitynavigator.org/ein/311283164,ILLUMINATING ENGINEERING SOCIETY,311283164,,,"Not rated, This organization is not rated, Not currently rated",,"1514 MONTROSE AVE, ROYAL OAK, MI, 48073-2744",,Mission not available,1991,Yes
https://www.charitynavigator.org/ein/311283327,Sunrise Acres Ranch,311283327,73%,2,,,"PO BOX 376, BARNESVILLE, OH, 43713-0000",740-758-5518,To provide housing for individuals with disabilities,1991,No
https://www.charitynavigator.org/ein/311283360,Southwest Christian Church of Hamilton County,311283360,,,"Not rated, This organization is not rated, Not currently rated",,"PO BOX 654, HARRISON, OH, 45030-0654",,Mission not available,1997,Yes
https://www.charitynavigator.org/ein/311283361,Columbus Blues Alliance,311283361,,,"Not rated, This organization is not rated, Not currently rated",,"1391 W 5TH AVE, COLUMBUS, OH, 43212-2902",,Mission not available,2014,Yes
https://www.charitynavigator.org/ein/311283392,KAPPA SIGMA FRATERNITY,311283392,,,"Not rated, This organization is not rated, Not currently rated",,"410 UNIVERSITY BLVD, MOREHEAD, KY, 40351-1678",,Mission not available,1940,Yes
https://www.charitynavigator.org/ein/311283728,OHIO ASSOCIATION OF MAGISTRATES,311283728,,,"Not rated, This organization is not rated, Not currently rated",,"373 S HIGH STREET, COLUMBUS, OH, 43215-4591",614-525-4450,CONDUCT SEMINARS FOR MAGISTRATES FOR CONTINUING EDUCATION AND EDUCATION ACTIVITIES.,1990,Yes
https://www.charitynavigator.org/ein/311283793,KAPPA DELTA PI,311283793,,,"Not rated, This organization is not rated, Not currently rated",,"PO BOX 681008, INDIANAPOLIS, IN, 46268-7008",,Mission not available,1954,Yes
https://www.charitynavigator.org/ein/311283876,Augsburg Scholarship Fund,311283876,,,"Not rated, This organization is not rated, Not currently rated",,"PO BOX 33515, WPAFB, OH, 45433-0515",,Mission not available,1990,Yes
https://www.charitynavigator.org/ein/311283918,Christian Meeting Room Inc.,311283918,,,"Not rated, This organization is not rated, Not currently rated",,"404 ARMOR HILL DR, GAHANNA, OH, 43230-2554",,Mission not available,1967,Yes
https://www.charitynavigator.org/ein/311283926,INTERNATIONAL WILLOW COLLECTORS,311283926,,,"Not rated, This organization is not rated, Not currently rated",,"6730 MAIN ST, CINCINNATI, OH, 45244-3433",,Mission not available,2022,Yes
https://www.charitynavigator.org/ein/311283939,DELTA GAMMA FRATERNITY,311283939,,,"Not rated, This organization is not rated, Not currently rated",,"PO BOX 21397, COLUMBUS, OH, 43221-0397",,Mission not available,1970,Yes
https://www.charitynavigator.org/ein/311284026,Hocking County Childrens Chorus,311284026,,,"Not rated, This organization is not rated, Not currently rated",,"7265 KONOLD CT, CANAL WNCHSTR, OH, 43110-7775",,Mission not available,2004,Yes
https://www.charitynavigator.org/ein/311284041,Hillside Baptist Church,311284041,,,"Not rated, This organization is not rated, Not currently rated",,"39724 STATE ROUTE 143, POMEROY, OH, 45769-9373",,Mission not available,1990,Yes
https://www.charitynavigator.org/ein/311284108,FASTIQUES ROD & CUSTOM OF SOUTHERN OHIO INC,311284108,,,"Not rated, This organization is not rated, Not currently rated",http://PUMPKINRUNNATIONALS.COM,"PO BOX 745, OWENSVILLE, OH, 45160-0745",513-625-8555,THE PRIMARY PURPOSE IS TO RAISE MONEY TO DONATE TO VARIOUS CHARITIES THROUGH SWAPMEETS AND CAR SHOWS.,1993,Yes
https://www.charitynavigator.org/ein/311284110,Licking Land Trust,311284110,57%,1,,http://WWW.LICKINGLANDTRUST.ORG,"PO BOX 196, GRANVILLE, OH, 43023-0196",740-587-4104,"THE MISSION OF THE LICKING LAND TRUST IS THE PRESERVATION AND PERMANENT PROTECTION OF CENTRAL OHIO GREEN SPACES, WETLANDS, WOODS, FARMLANDS, RIPARIAN CORRIDERS, AND ... (More)",1990,No
https://www.charitynavigator.org/ein/311284116,CARBON HILL CHRISTIAN CHURCH,311284116,,,"Not rated, This organization is not rated, Not currently rated",,"PO BOX 64, CARBON HILL, OH, 43111-0064",,Mission not available,1951,Yes
https://www.charitynavigator.org/ein/311284213,GREENS RUN CHRISTIAN CHURCH,311284213,,,"Not rated, This organization is not rated, Not currently rated",,"8881 STATE ROUTE 685, GLOUSTER, OH, 45732-9240",,Mission not available,1951,Yes
https://www.charitynavigator.org/ein/311284309,Roscoe Village Foundation Inc.,311284309,,,"Not rated, This organization is not rated, Not currently rated",,"600 N WHITEWOMAN ST, COSHOCTON, OH, 43812-1072",,Mission not available,1989,Yes
https://www.charitynavigator.org/ein/311284344,Ak Steel Foundation,311284344,,,"Not rated, This organization is not rated, Not currently rated",,"200 PUBLIC SQ STE 3300, CLEVELAND, OH, 44114-2315",,Mission not available,1993,Yes
https://www.charitynavigator.org/ein/311284376,OHIO APPLE MARKETING PROGRAM,311284376,,,"Not rated, This organization is not rated, Not currently rated",,"6870 LICKING VALLEY RD, FRAZEYSBURG, OH, 43822-9563",,Mission not available,1995,Yes
https://www.charitynavigator.org/ein/311284443,WOMEN LAWYERS OF FRANKLIN COUNTY INC,311284443,,,"Not rated, This organization is not rated, Not currently rated",,"230 WEST ST STE 100, COLUMBUS, OH, 43215-2391",,Mission not available,1995,Yes
https://www.charitynavigator.org/ein/311284450,John N Browning Family Fund C Inc.,311284450,,,"Not rated, This organization is not rated, Not currently rated",,"PO BOX 634, MILWAUKEE, WI, 53201-0634",,Mission not available,1994,Yes
https://www.charitynavigator.org/ein/311284482,NATIONAL SOCIETY OF THE SONS OF THE AMERICAN REVOLUTION,311284482,,,"Not rated, This organization is not rated, Not currently rated",,"153 SUNSHINE DR, LEWISBURG, WV, 24901-1290",,Mission not available,1944,Yes
https://www.charitynavigator.org/ein/311284723,Centerville Community Band,311284723,,,"Not rated, This organization is not rated, Not currently rated",,"PO BOX 751986, DAYTON, OH, 45475-1986",,Mission not available,2014,Yes
https://www.charitynavigator.org/ein/311284756,Ohio Premier Soccer Club of Dublin Ohio,311284756,58%,1,,http://WWW.OPSOCCER.COM,"PO BOX 56, DUBLIN, OH, 43017-0056",614-336-4217,"TO PROVIDE A POSITIVE ENVIRONMENT FOR COMPETITIVE MALE AND FEMALE SOCCER PLAYERS OF ALL ABILITY AND SKILL LEVELS, AGES 4 AND ABOVE. TO PROMOTE THE PERSONAL DEVELOPME ... (More)",2016,No
https://www.charitynavigator.org/ein/311284816,HEALING WORD AG,311284816,,,"Not rated, This organization is not rated, Not currently rated",,"5303 S DIXIE HWY, FRANKLIN, OH, 45005-5343",,Mission not available,1964,Yes
https://www.charitynavigator.org/ein/311284873,Laborers for Christ Committee,311284873,,,"Not rated, This organization is not rated, Not currently rated",,"PO BOX 32318, COLUMBUS, OH, 43232-0318",,Mission not available,1997,Yes
https://www.charitynavigator.org/ein/311284893,ILLUMINATING ENGINEERING SOCIETY,311284893,,,"Not rated, This organization is not rated, Not currently rated",,"1580 PLEASANT WOOD NE, ROCKFORD, MI, 49341-7576",,Mission not available,1991,Yes
https://www.charitynavigator.org/ein/311284896,AMERICAN FEDERATION OF STATE COUNTY & MUNICIPAL EMPLOYEES,311284896,,,"Not rated, This organization is not rated, Not currently rated",,"9705 DUNRAVEN DR, CINCINNATI, OH, 45251-1621",,Mission not available,1957,Yes
https://www.charitynavigator.org/ein/311284937,Pastoral Assistance Foundation Tt,311284937,,,"Not rated, This organization is not rated, Not currently rated",,"3109 BALSAM CT, EDGEWOOD, KY, 41017-3334",,Mission not available,1990,Yes
https://www.charitynavigator.org/ein/311285044,Amateur Cyclesport Organization of Ohio Inc.,311285044,,,"Not rated, This organization is not rated, Not currently rated",,"1437 BEAVER RUN RD SE, HEBRON, OH, 43025-9408",,Mission not available,1990,Yes
https://www.charitynavigator.org/ein/311285046,The Center for Community Based Care Incorporated,311285046,,,"Not rated, This organization is not rated, Not currently rated",,"1105 SCHROCK RD STE 120, COLUMBUS, OH, 43229-1174",,Mission not available,2021,Yes
https://www.charitynavigator.org/ein/311285048,NEWTON TEACHERS ASSOCIATION,311285048,,,"Not rated, This organization is not rated, Not currently rated",,"201 N LONG ST, PLEASANT HILL, OH, 45359-8077",,Mission not available,2006,Yes
https://www.charitynavigator.org/ein/311285126,Reno Volunteer Fire Department,311285126,67%,2,,,"PO BOX 346, RENO, OH, 45773-0346",740-373-9800,EMERGENCY AND FIRE SERVICES,1997,No
https://www.charitynavigator.org/ein/311285129,REYNOLDSBURG VISITORS AND COMMUNITY ACTIVITIES BUREAU,311285129,,,"Not rated, This organization is not rated, Not currently rated",,"PO BOX 357, REYNOLDSBURG, OH, 43068-0357",,Mission not available,1996,Yes
https://www.charitynavigator.org/ein/311285207,CHILDRENS INTERNATIONAL SUMMER VILLAGES INC,311285207,,,"Not rated, This organization is not rated, Not currently rated",,"PO BOX 4939, PITTSBURGH, PA, 15206-0939",,Mission not available,1971,Yes
https://www.charitynavigator.org/ein/311285217,WESTLAND AREA BUSINESS ASSOCIATION,311285217,,,"Not rated, This organization is not rated, Not currently rated",,"4923 W BROAD ST, COLUMBUS, OH, 43228-1603",,Mission not available,2015,Yes
https://www.charitynavigator.org/ein/311285245,National Association of State Motorcycle Safety Administrators,311285245,73%,2,,,"1434 TRIM TREE RD, INDIANA, PA, 15701-5928",724-801-8075,Motorcycle Safety Education,1998,No
https://www.charitynavigator.org/ein/311285318,WINGS OF LOVE CRUSADES INC,311285318,,,"Not rated, This organization is not rated, Not currently rated",,"112 DARTMOUTH RD, SPRINGFIELD, OH, 45504-0000",,Mission not available,1964,Yes
https://www.charitynavigator.org/ein/311285419,Mishpachah Inc.,311285419,33%,0,,,"348 WESTERN ROW RD, MASON, OH, 45040-1437",,FAITH BASED RELIGIOUS CHRISTIAN YOUTH MINISTRY. LIVE MUSICAL PERFORMANCE FOUNDED TO HELP ALLEVIATE THE BURDENS FACED BY MANY YOUNG PEOPLE AS THEY ATTEMPT TO BECOME P ... (More),2012,No
https://www.charitynavigator.org/ein/311285420,Columbus Marathon,311285420,69%,2,,http://COLUMBUSMARATHON.COM,"136 E BROAD ST, COLUMBUS, OH, 43215-3606",614-738-5079,"TO PROMOTE AND ORGANIZE THE ANNUAL MARATHON AND 1/2 MARATHON HELD IN COLUMBUS, OHIO.",1991,No
https://www.charitynavigator.org/ein/311285489,Institute for Mediterranean Studies,311285489,97%,4,,http://WWW.INST4MEDSTUDIES.ORG,"425 WALNUT ST STE 1800, CINCINNATI, OH, 45202-3920",513-631-4749,TO FOSTER AND ENCOURAGE INTEREST IN AND THE STUDY OF THE MEDITERRANEAN BASIN.,1992,No
https://www.charitynavigator.org/ein/311285595,MOST WORSHIPFUL PRINCE HALL GRAND LODGE FREE AND ACCEPTED MASON OF,311285595,,,"Not rated, This organization is not rated, Not currently rated",,"3000 E MAIN, COLUMBUS, OH, 43209-3717",,Mission not available,1990,Yes
https://www.charitynavigator.org/ein/311285615,Lewis Street Praise and Worship Center,311285615,,,"Not rated, This organization is not rated, Not currently rated",,"720 S BREIEL BLVD, MIDDLETOWN, OH, 45044-6202",,Mission not available,1990,Yes
https://www.charitynavigator.org/ein/311285636,Envoy Christian Mission Inc.,311285636,,,"Not rated, This organization is not rated, Not currently rated",,"651 MARSHALL DR, XENIA, OH, 45385-1740",,Mission not available,1990,Yes
https://www.charitynavigator.org/ein/311285637,Life Connection of Ohio,311285637,94%,4,,http://WWW.LIFECONNECTIONOFOHIO.ORG,"480 W DUSSEL DRIVE, MAUMEE, OH, 43537-1639",419-893-4891,SECURE ORGAN AND TISSUE DONORS AND COORDINATE TRANSPLANT SERVICES.,1990,No
https://www.charitynavigator.org/ein/311285712,AMVETS,311285712,,,"Not rated, This organization is not rated, Not currently rated",,"11495 LOWER VALLEY PIKE, MEDWAY, OH, 45341-9714",,Mission not available,1945,Yes
https://www.charitynavigator.org/ein/311285800,Cincinnati Transit Historical Association Inc.,311285800,,,"Not rated, This organization is not rated, Not currently rated",,"3916 O LEARY AVE, CINCINNATI, OH, 45236-3030",,Mission not available,1990,Yes
https://www.charitynavigator.org/ein/311285850,NATIONAL ASSOCIATION OF CHARITABLE GIFT PLANNERS,311285850,,,"Not rated, This organization is not rated, Not currently rated",,"4010 EXECUTIVE PARK DR STE 100, CINCINNATI, OH, 45241-2021",,Mission not available,1992,Yes
https://www.charitynavigator.org/ein/311285936,Olentangy Youth Athletic Association,311285936,81%,3,,http://www.oyaa.org,"PO BOX 476, LEWIS CENTER, OH, 43035-0476",614-799-9098,"Promotes and regulates sports for individuals under age 18 by organizing local competitions, promulgating rules, organizing officials, presenting seminars and otherw ... (More)",1992,No
https://www.charitynavigator.org/ein/311286025,CROSSPOINT WESLEYAN CHURCH,311286025,,,"Not rated, This organization is not rated, Not currently rated",,"300 W MAIN ST, MOUNT ORAB, OH, 45154-9434",,Mission not available,1970,Yes
https://www.charitynavigator.org/ein/311286074,Portsmouth Area Beautification Society,311286074,,,"Not rated, This organization is not rated, Not currently rated",,"2885 CIRCLE DR, PORTSMOUTH, OH, 45662-2444",,Mission not available,1990,Yes
https://www.charitynavigator.org/ein/311286085,Shadow of the Almighty,311286085,,,"Not rated, This organization is not rated, Not currently rated",,"1634 11TH ST, PORTSMOUTH, OH, 45662-4526",,Mission not available,1994,Yes
https://www.charitynavigator.org/ein/311286367,OHIO IOTA HOUSE CORP,311286367,,,"Not rated, This organization is not rated, Not currently rated",,"1035 FOREST CREST PL, VANDALIA, OH, 45377-1700",,Mission not available,1990,Yes
https://www.charitynavigator.org/ein/311286479,Tuppers Plains Volunteer Fire Department,311286479,,,"Not rated, This organization is not rated, Not currently rated",,"PO BOX 142, TUPPERS PLNS, OH, 45783-0142",,Mission not available,2020,Yes
