url,name,ein,score,star_rating,keywords,website,address,phone,organization_mission,IRS_ruling_year,contain_keywords
https://www.charitynavigator.org/ein/134021563,Morris Gordon Foundation for Photography Inc.,134021563,,,"Not rated, This organization is not rated, Not currently rated",,"PO BOX 164, PRIDES XING, MA, 01965-0164",,Mission not available,2023,Yes
https://www.charitynavigator.org/ein/134022249,Tamar Rogoff Performance Projects Inc.,134022249,,,"Not rated, This organization is not rated, Not currently rated",,"170 AVENUE C APT 19G, NEW YORK, NY, 10009-4241",,Mission not available,1998,Yes
https://www.charitynavigator.org/ein/134022483,Hadassah Foundation,134022483,,,"Not rated, This organization is not rated, Review Before Proceeding",http://WWW.HADASSAHFOUNDATION.ORG,"40 WALL STREET, NEW YORK, NY, 10005-1304",212-355-7900,"TO IMPROVE THE STATUS, HEALTH AND WELL BEING OF WOMEN AND GIRLS IN ISRAEL AND THE UNITED STATES.",1999,Yes
https://www.charitynavigator.org/ein/134022625,Oneg Shabbat of the West Side,134022625,96%,4,,http://ONEGSHABBAT.ORG,"650 W END AVENUE APT 2A, NEW YORK, NY, 10025-7355",212-666-4600,"THE ORGANIZATION'S PRIMARY EXEMPT PURPOSE IS TO ACCEPT CONTRIBUTIONS OF, AND/OR TO PURCHASE FOOD FOR DISTRIBUTION TO THE POOR AND NEEDY",1998,No
https://www.charitynavigator.org/ein/134022669,Good Shephard Church,134022669,,,"Not rated, This organization is not rated, Not currently rated",,"7 E LINCOLN AVE, MOUNT VERNON, NY, 10552-3207",,Mission not available,1999,Yes
https://www.charitynavigator.org/ein/134022546,Association for Science in Autism Treatment Inc.,134022546,,,"Not rated, This organization is not rated, Not currently rated",,"PO BOX 1447, HOBOKEN, NJ, 07030-1447",,Mission not available,1998,Yes
https://www.charitynavigator.org/ein/134022704,Dorothy and Jack Entratter Foundation,134022704,,,"Not rated, This organization is not rated, Not currently rated",,"235 PARK AVENUE SOUTH 8TH FLOOR, NEW YORK, NY, 10003-1405",,Mission not available,1999,Yes
https://www.charitynavigator.org/ein/134022639,Hastings-On-Hudson Affordable Housing Development Fund Co Inc.,134022639,,,"Not rated, This organization is not rated, Not currently rated",,"7 MAPLE AVENUE, HASTINGSONHUDSON, NY, 10706-1434",,Mission not available,1999,Yes
https://www.charitynavigator.org/ein/134022751,Grodzins Fund,134022751,,,"Not rated, This organization is not rated, Not currently rated",,"155 E 77TH ST APT 3F, NEW YORK, NY, 10075-1915",,Mission not available,1998,Yes
https://www.charitynavigator.org/ein/134022812,Foundation for Integrated Medicine,134022812,56%,1,,http://WWW.MDHEAL.ORG,"142 FIFTH AVENUE, NEW YORK, NY, 10011-4312",212-816-9000,"TO EDUCATE THE PUBLIC AND MEDICAL PROFESSIONALS ON THE PRINCIPALS, CONCEPTS AND BENEFITS RELATING TO INTEGRATED MEDICINE",1999,No
https://www.charitynavigator.org/ein/134023093,Pan Thea Institute Inc.,134023093,,,"Not rated, This organization is not rated, Not currently rated",,"67 S CHESTNUT ST, NEW PALTZ, NY, 12561-1912",,Mission not available,2019,Yes
https://www.charitynavigator.org/ein/134023108,Japan Performing Arts Inc.,134023108,,,"Not rated, This organization is not rated, Not currently rated",,"827 10TH AVE APT 5N, NEW YORK, NY, 10019-7727",,Mission not available,2000,Yes
https://www.charitynavigator.org/ein/134023251,Sisters of Pi Psi Omega Community Fund Inc.,134023251,,,"Not rated, This organization is not rated, Not currently rated",,"PO BOX 1748, SPRING VALLEY, NY, 10977-8748",,Mission not available,1999,Yes
https://www.charitynavigator.org/ein/134023378,West Patent Elementary School Association,134023378,73%,2,,,"80 W PATENT RD, BEDFORD HILLS, NY, 10507-2223",914-666-2190,"PROVIDE SUPPORT AND ACTIVITIES FOR THE CHILDREN AND TEACHERS OF WEST PATENT ELEMENTARY SCHOOL, BEDFORD HILLS, NY",2000,No
https://www.charitynavigator.org/ein/134024096,Still Mind Zendo,134024096,,,"Not rated, This organization is not rated, Not currently rated",,"34 WEST 15TH STREET 3RD FLR, NEW YORK, NY, 10011-6815",,Mission not available,1999,Yes
https://www.charitynavigator.org/ein/134024165,CIVIL SERVICE EMPLOYEES ASSOCIATION,134024165,,,"Not rated, This organization is not rated, Not currently rated",,"143 WASHINGTON AVE, ALBANY, NY, 12210-2303",,Mission not available,1970,Yes
https://www.charitynavigator.org/ein/134023553,Anne Walker Scholarship Fund,134023553,,,"Not rated, This organization is not rated, Not currently rated",,"322 WEST 48TH STREET, NEW YORK, NY, 10036-1308",,Mission not available,1998,Yes
https://www.charitynavigator.org/ein/134023480,Mame-Loshn-Ltd,134023480,,,"Not rated, This organization is not rated, Not currently rated",,"237 4TH ST, JERSEY CITY, NJ, 07302-2407",,Mission not available,1999,Yes
https://www.charitynavigator.org/ein/134024259,Chief Executives for Corporate Purpose Inc.,134024259,77%,3,,http://WWW.CECP.CO,"447 BROADWAY 2ND FL 547, NEW YORK, NY, 10013-2562",212-825-1000,CECP'S MISSION IS TO CREATE A BETTER WORLD THROUGH BUSINESS. CECP IS A CEO-LED COALITION THAT BELIEVES THAT A COMPANY'S SOCIAL STRATEGY HOW IT ENGAGES WITH KEY STAKE ... (More),1999,No
https://www.charitynavigator.org/ein/134024347,Educational & Cultural Enrichment Center,134024347,,,"Not rated, This organization is not rated, Not currently rated",,"110 PINEBROOK RD, CHESTNUT RDG, NY, 10977-6620",,Mission not available,2014,Yes
https://www.charitynavigator.org/ein/134024417,Beatrice Beebe Phd Infant Research Fund Inc.,134024417,,,"Not rated, This organization is not rated, Not currently rated",,"219 WEST 22ND STREET, NEW YORK, NY, 10011-0000",,Mission not available,1999,Yes
https://www.charitynavigator.org/ein/134024584,The New York City Arts-In-Education Roundtable Inc.,134024584,96%,4,,http://WWW.NYCAIEROUNDTABLE.ORG,"PO BOX 2094, NEW YORK, NY, 10108-2094",212-642-5979,"NYC ARTS IN EDUCATION ROUNDTABLE IS A SERVICE ORGANIZATION AND A COMMUNITY OF ARTS EDUCATION PRACTITIONERS SHARING INFORMATION, PROVIDING PROFESSIONAL DEVELOPMENT, A ... (More)",1998,No
https://www.charitynavigator.org/ein/134024627,Working in Support of Education,134024627,98%,4,,http://WWW.WISE-NY.ORG,"227 EAST 56TH STREET, NEW YORK, NY, 10022-3754",212-421-2700,TO IMPROVE ECONOMIC MOBILITY THROUGH PROGRAMS THAT DEVELOP FINANCIAL LITERACY AND READINESS FOR COLLEGE AND CAREERS.,1999,No
https://www.charitynavigator.org/ein/134024768,NEW YORK COVENANT CHURCH-NEW ROCHELLE NY,134024768,,,"Not rated, This organization is not rated, Not currently rated",,"500 MAIN ST, NEW ROCHELLE, NY, 10801-6304",,Mission not available,1975,Yes
https://www.charitynavigator.org/ein/134024805,The Woodhull Institute for Ethical Leadership Inc.,134024805,,,"Review Before Proceeding, Not rated, This organization is not rated, Not currently rated, Confirmed Revocation",,"380 LEXINGTON AVE FL 17, NEW YORK, NY, 10168-1799",,Mission not available,1999,Yes
https://www.charitynavigator.org/ein/134025019,P S 89 Parents and Teachers Association Inc.,134025019,90%,4,,http://PS89.ORG,"201 WARREN ST, NEW YORK, NY, 10282-1002",212-967-1100,"TO SUPPORT THE EDUCATIONAL CURRICULUM OF PS/IS 89, A NEW YORK CITY PUBLIC ELEMENTARY SCHOOL.",1999,No
https://www.charitynavigator.org/ein/134025160,PTA NEW YORK CONGRESS,134025160,,,"Not rated, This organization is not rated, Not currently rated",,"375 KNEELAND AVE, YONKERS, NY, 10704-2722",,Mission not available,1954,Yes
https://www.charitynavigator.org/ein/134025205,Kings College Alumni Association Inc.,134025205,,,"Not rated, This organization is not rated, Not currently rated",,"110 SEAMAN AVE APT 5M, NEW YORK, NY, 10034-2810",,Mission not available,1999,Yes
https://www.charitynavigator.org/ein/134025258,Vatra Foundation Inc.,134025258,,,"Not rated, This organization is not rated, Not currently rated",,"193 S PLANK ROAD STE 5, NEWBURGH, NY, 12550-3037",,Mission not available,1999,Yes
https://www.charitynavigator.org/ein/134025290,DREAM,134025290,90%,4,,https://www.wearedream.org/,"1991 Second Avenue, Second Floor, New York, NY, 10029",212-722-0232,DREAM ensures that all young people recognize their potential and realize their dreams. We level the playing field in our schools and communities by investing in the ... (More),1999,No
https://www.charitynavigator.org/ein/134025603,ENVIRONMENTAL CONTRACTORS ASSOCIATION INC,134025603,,,"Not rated, This organization is not rated, Not currently rated",http://WWW.ECANYC.ORG,"5 PENN PLAZA 19TH FLOOR, NEW YORK, NY, 10001-1738",212-682-0062,"BUSINESS ADVOCACY TO ADVANCE THE NEEDS OF ENVIRONMENTAL CONTRACTORS BY ADHERING TO HIGH PROFESSIONAL, SAFETY AND INTEGRITY STANDARDS.",2001,Yes
https://www.charitynavigator.org/ein/134025667,Career School of Ny Inc.,134025667,69%,2,,http://www.careerschoolny.com,"350 ST MARKS PLACE, STATEN ISLAND, NY, 10301-2416",,Provide Educational Services,1998,No
https://www.charitynavigator.org/ein/134025880,Congregation Shar Hatalmid Inc.,134025880,,,"Not rated, This organization is not rated, Not currently rated",,"32 RITA AVE, MONSEY, NY, 10952-2625",,Mission not available,1999,Yes
https://www.charitynavigator.org/ein/134025619,Shalom Foundation Inc.,134025619,,,"Not rated, This organization is not rated, Not currently rated",,"PO BOX 442, TALLMAN, NY, 10982-0442",,Mission not available,1999,Yes
https://www.charitynavigator.org/ein/134026241,Frankel Family Foundation Inc.,134026241,,,"Not rated, This organization is not rated, Not currently rated",,"60 CUTTERMILL RD STE 210, GREAT NECK, NY, 11021-3104",,Mission not available,1998,Yes
https://www.charitynavigator.org/ein/134026304,Fubu Foundation Inc.,134026304,,,"Not rated, This organization is not rated, Not currently rated",,"450 SEVENTH AVENUE SUITE 2710, NEW YORK, NY, 10123-0000",,Mission not available,1999,Yes
https://www.charitynavigator.org/ein/134026345,Ims Foundation,134026345,,,"Not rated, This organization is not rated, Not currently rated",,"506 QUENTIN RD, BROOKLYN, NY, 11223-2006",,Mission not available,1999,Yes
https://www.charitynavigator.org/ein/134026641,Belmont Boulevard II Housing Development Fund Corporation,134026641,64%,2,,,"660 EAST 183RD STREET, BRONX, NY, 10458-8742",,TO PROVIDE AFFORDABLE SUBSIDIZED HOUSING FOR SENIOR CITIZENS AND HANDICAPPED INDIVIDUALS UNDER THE SECTION 202/08 PROGRAM UNDER THE JURISDICTION OF THE U.S. DEPT OF ... (More),1999,No
https://www.charitynavigator.org/ein/134026746,Times Up Inc.,134026746,,,"Not rated, This organization is not rated, Not currently rated",,"PO BOX 550, NEW YORK, NY, 10009-0550",,Mission not available,1999,Yes
https://www.charitynavigator.org/ein/134026381,Grace Pentecostal Assembly,134026381,,,"Not rated, This organization is not rated, Not currently rated",,"2872 BRIGGS AVE, BRONX, NY, 10458-2805",,Mission not available,1999,Yes
https://www.charitynavigator.org/ein/134026767,South Asian Womens Creative Collective,134026767,,,"Not rated, This organization is not rated, Not currently rated",,"112 WEST 27TH STREET, NEW YORK, NY, 10001-6240",,Mission not available,2000,Yes
https://www.charitynavigator.org/ein/134026952,Hourglass Group Ltd.,134026952,,,"Not rated, This organization is not rated, Not currently rated",,"39-21 48TH STREET APT 1, SUNNYSIDE, NY, 11104-1021",,Mission not available,1999,Yes
https://www.charitynavigator.org/ein/134027009,Roy and Niuta Titus Foundation Inc.,134027009,,,"Not rated, This organization is not rated, Not currently rated",,"136 BAXTER ST, NEW YORK, NY, 10013-3692",,Mission not available,1998,Yes
https://www.charitynavigator.org/ein/134027049,Shanken Family Foundation,134027049,,,"Not rated, This organization is not rated, Not currently rated",,"825 8TH AVE FL 33, NEW YORK, NY, 10019-7640",,Mission not available,1999,Yes
https://www.charitynavigator.org/ein/134027116,SONS OF UNION VETERANS OF THE CIVIL WAR,134027116,,,"Not rated, This organization is not rated, Not currently rated",,"19 GREGORY DR, GOSHEN, NY, 10924-1018",,Mission not available,1941,Yes
https://www.charitynavigator.org/ein/134027334,Centro Comunal General Gregorio Luperon Inc.,134027334,,,"Not rated, This organization is not rated, Not currently rated",,"652 W 189TH ST 1 D, NEW YORK, NY, 10040-0412",,Mission not available,1999,Yes
https://www.charitynavigator.org/ein/134027383,Centro Civico Cultural Dominicano,134027383,,,"Not rated, This organization is not rated, Not currently rated",,"619 W 145TH STREET STE 201, NEW YORK, NY, 10031-5002",,"ENRICH AND EMPOWER THE DOMINICAN AND HISPANIC COMMUNITIES PROFESSIONALLY, EDUCATIONALLY, CIVICALLY, AND CULTURALLY THROUGH WORKSHOPS, ART EXHIBITS, AND PROMOTIONS",1999,Yes
https://www.charitynavigator.org/ein/134027846,Druze Research and Publications Institute Inc.,134027846,,,"Not rated, This organization is not rated, Not currently rated",,"247 WEST 38TH STREET, NEW YORK, NY, 10018-4447",,Mission not available,1998,Yes
https://www.charitynavigator.org/ein/134027386,EAST 64TH STREET LEXINGTON TO THIRD AVE NEIGHBORS ASSOCIATION INC,134027386,,,"Not rated, This organization is not rated, Not currently rated",,"185 E 64TH ST, NEW YORK, NY, 10065-6653",212-249-1002,"THE ASSOCIATION, IN COOPERATION WITH NEW YORK CITY AND ITS AGENCIES, PRESERVES AND BEAUTIFIES THE STREET AND PREVENTS ITS PHYSICAL DETERIORATION. THE ASSOCIATION TAK ... (More)",1998,Yes
https://www.charitynavigator.org/ein/134028054,TIE-NY LTD,134028054,,,"Not rated, This organization is not rated, Not currently rated",,"401 PARK AVE SOUTH 10TH FLOOR, NEW YORK, NY, 10016-8808",,Mission not available,1999,Yes
https://www.charitynavigator.org/ein/134027467,Educational Projects Foundation Inc.,134027467,,,"Not rated, This organization is not rated, Not currently rated",,"CO DAVID COHN 535 W 110TH ST 12, NEW YORK, NY, 10025-0000",,Mission not available,1999,Yes
https://www.charitynavigator.org/ein/134028218,STANLEY WOHLGEMUTH MEMORIAL FOUNDATION,134028218,,,"Not rated, This organization is not rated, Not currently rated",,"400 E 77TH ST APT 3K, NEW YORK, NY, 10075-2366",,Mission not available,1999,Yes
https://www.charitynavigator.org/ein/134028298,True Warriors Ministries Inc.,134028298,90%,4,,http://www.eddyfarm.com,"PO BOX 500, SPARROWBUSH, NY, 12780-0000",845-858-4300,"To provide facilities and services to churches, its leaders and those who are called to praise and honor our Lord and Savior Jesus Christ.",2000,No
https://www.charitynavigator.org/ein/134027930,Vergel Foundation,134027930,,,"Not rated, This organization is not rated, Not currently rated",,"180 VARICK ST RM 1102, NEW YORK, NY, 10014-9601",,Mission not available,1999,Yes
https://www.charitynavigator.org/ein/134028433,Girls Inc. of New York City,134028433,96%,4,,http://www.girlsincnyc.org/,"25 Broadway, 12th Floor, New York, NY, 10004, Mail donations to:, 25 Broadway, 12th Floor, New York, NY, 10004",212-531-7620,"SERVING GIRLS IN NEW YORK CITY THROUGH TRAINING AND EDUCATION. 
GINYC’s mission is to inspire girls to be strong, smart, and bold. We serve approximately 10,000 girl ... (More)",1999,No
https://www.charitynavigator.org/ein/134028456,United Church of God Seventh Day,134028456,,,"Not rated, This organization is not rated, Not currently rated",,"180 DENTON AVE, LYNBROOK, NY, 11563-2620",,Mission not available,1998,Yes
https://www.charitynavigator.org/ein/134028567,Humpty Dumpty Institute Inc.,134028567,58%,1,,http://www.thehdi.org,"527 HUDSON STREET UNIT 20194, NEW YORK, NY, 10014-2678",609-582-6436,The Humpty Dumpty Institute is an organization dedicated to tackling difficult global and domestic issues by establishing innovative and strategic public/private par ... (More),1999,No
https://www.charitynavigator.org/ein/134028486,Saadiyah Qadiriya Order of America,134028486,,,"Not rated, This organization is not rated, Not currently rated",,"45 CHURCH ST, SPRING VALLEY, NY, 10977-0000",,Mission not available,1999,Yes
https://www.charitynavigator.org/ein/134028905,Selfhelp-United Help Kissena Apts,134028905,65%,2,,,"909 3RD AVE FL 11, NEW YORK, NY, 10022-4731",212-971-7730,TO PROVIDE AFFORDABLE HOUSING TO ELDERLY AND DISABLED PERSONS OF LOW INCOME IN THE COUNTY OF QUEENS.,1998,No
https://www.charitynavigator.org/ein/134029397,Perimeter Media and Culture Projects Incorporated,134029397,,,"Not rated, This organization is not rated, Not currently rated",,"200 W 60TH ST APT 10G, NEW YORK, NY, 10023-8505",,Mission not available,2001,Yes
https://www.charitynavigator.org/ein/134029791,Metropolitan Diabetes Society,134029791,,,"Not rated, This organization is not rated, Not currently rated",,"35 EAST 85TH STREET, NEW YORK, NY, 10028-0954",,Mission not available,1999,Yes
https://www.charitynavigator.org/ein/134029849,Geller Family Religious Foundation,134029849,,,"Not rated, This organization is not rated, Not currently rated",,"57 WESLEY CHAPEL RD, SUFFERN, NY, 10901-2603",,Mission not available,1999,Yes
https://www.charitynavigator.org/ein/134029586,Stany Foundation Inc.,134029586,,,"Not rated, This organization is not rated, Not currently rated",,"61 BROADWAY RM 1601, NEW YORK, NY, 10006-2756",,Mission not available,1999,Yes
https://www.charitynavigator.org/ein/134029646,Garden Club of East Hampton Inc.,134029646,,,"Not rated, This organization is not rated, Not currently rated",,"PO BOX 879, EAST HAMPTON, NY, 11937-0701",,Mission not available,1999,Yes
https://www.charitynavigator.org/ein/134029933,56 Ps Ptan,134029933,33%,0,,,"250 KRAMER AVE, STATEN ISLAND, NY, 10309-4227",917-621-7996,"FUNDS RAISED PROVIDED VITAL DOLLARS FOR THE SCHOOLS OPERATIONS & EXPENSES, 5TH GRADE. ACT, EVENING EVENTS PARENT DIR, ETC.",2007,No
https://www.charitynavigator.org/ein/134029939,Westchester Womens Bar Association Foundation Inc.,134029939,,,"Not rated, This organization is not rated, Not currently rated",,"CO JACKSON 44 SO BROADWAY 14TH F, WHITE PLAINS, NY, 10601-0000",,Mission not available,1999,Yes
https://www.charitynavigator.org/ein/134030092,Al-Ihsan Inc.,134030092,,,"Not rated, This organization is not rated, Not currently rated",,"406 STAINT MARKS PLACE, STATEN ISLAND, NY, 10301-0000",,Mission not available,2002,Yes
https://www.charitynavigator.org/ein/134030496,Special Kids of N Y,134030496,,,"Not rated, This organization is not rated, Not currently rated",,"6 SUTTON PL, KATONAH, NY, 10536-3003",,Mission not available,2000,Yes
https://www.charitynavigator.org/ein/134030534,Church Without Borders Inc.,134030534,,,"Not rated, This organization is not rated, Not currently rated",,"100 W 141ST ST APT 74, NEW YORK, NY, 10030-1811",,Mission not available,2000,Yes
https://www.charitynavigator.org/ein/134030666,Noor Al-Islam Society,134030666,,,"Not rated, This organization is not rated, Not currently rated",,"3075 RICHMOND TERRACE, STATEN ISLAND, NY, 10303-1300",,Mission not available,2000,Yes
https://www.charitynavigator.org/ein/134030356,Anshei Bnai Torah,134030356,,,"Not rated, This organization is not rated, Not currently rated",,"164 SEMINOLE DR, LAKEWOOD, NJ, 08701-1156",,Mission not available,1999,Yes
https://www.charitynavigator.org/ein/134030684,Committee on Teaching About the United Nations,134030684,,,"Not rated, This organization is not rated, Not currently rated",,"3 LINWOOD PL, WHITE PLAINS, NY, 10606-3109",,Mission not available,2001,Yes
https://www.charitynavigator.org/ein/134030709,The Eisner Charitable Foundation Inc.,134030709,,,"Not rated, This organization is not rated, Not currently rated",,"1716 47TH ST, BROOKLYN, NY, 11204-1227",,Mission not available,2000,Yes
https://www.charitynavigator.org/ein/134030748,Lilies International Christian Outreach,134030748,,,"Not rated, This organization is not rated, Not currently rated",,"1315 BROADWAY STE 104, HEWLETT, NY, 11557-2166",,Mission not available,2009,Yes
https://www.charitynavigator.org/ein/134031037,Sisters of Charity Housing Development Corporation,134031037,97%,4,,http://WWW.SCHDCORP.ORG/,"150 BRIELLE AVENUE, STATEN ISLAND, NY, 10314-6400",718-477-6803,"FOSTER, PLAN, DEVELOP AND COORDINATE THE ACTIVITIES OF AFFILIATED ORGANIZATIONS WHICH PROVIDE LOW-INCOME HOUSING.",1999,No
https://www.charitynavigator.org/ein/134031038,Ziiz Inc.,134031038,,,"Not rated, This organization is not rated, Not currently rated",,"575 LEXINGTON AVENUE 34TH FL, NEW YORK, NY, 10022-6131",,Mission not available,2000,Yes
https://www.charitynavigator.org/ein/134031082,Rogers Family Foundation Inc.,134031082,,,"Not rated, This organization is not rated, Not currently rated",,"122 E 42ND ST RM 2005, NEW YORK, NY, 10168-2103",,Mission not available,1999,Yes
https://www.charitynavigator.org/ein/134031163,The Fall Collection Inc.,134031163,,,"Not rated, This organization is not rated, Not currently rated",,"166 NORFOLK ST APT 3C, NEW YORK, NY, 10002-1672",,Mission not available,1999,Yes
https://www.charitynavigator.org/ein/134031153,Cat Assistance Inc.,134031153,,,"Not rated, This organization is not rated, Not currently rated",,"116 EMERSON AVE, HARTSDALE, NY, 10530-1350",,Mission not available,1999,Yes
https://www.charitynavigator.org/ein/134031176,Shirley G Benerofe Foundation Inc.,134031176,,,"Not rated, This organization is not rated, Not currently rated",,"10 NEW KING ST STE 209, WHITE PLAINS, NY, 10604-1211",,Mission not available,1999,Yes
https://www.charitynavigator.org/ein/134031280,Clover Housing Deveopment Fund Corporation,134031280,,,"Not rated, This organization is not rated, Not currently rated",,"42 WEST 39TH ST 14TH FL, NEW YORK, NY, 10018-2082",212-292-8400,SUPPORTIVE HOUSING AND SOCIAL SERVICES,1999,Yes
https://www.charitynavigator.org/ein/134031432,Sarvadeo Mandir Inc.,134031432,,,"Not rated, This organization is not rated, Not currently rated",,"11404 JAMAICA AVE, RICHMOND HILL, NY, 11418-2442",,Mission not available,1998,Yes
https://www.charitynavigator.org/ein/134032078,Ahrc Health Care Inc.,134032078,,,"Not rated, This organization is not rated, Not currently rated",,"83 MAIDEN LANE 8TH FLOOR, NEW YORK, NY, 10038-5196",,Mission not available,1999,Yes
https://www.charitynavigator.org/ein/134031509,Manhattan Central Methodist Church,134031509,,,"Not rated, This organization is not rated, Not currently rated",,"48 SAINT MARKS PL, NEW YORK, NY, 10003-8129",,Mission not available,1999,Yes
https://www.charitynavigator.org/ein/134031694,Friends of the Nanuet Library Incorporated,134031694,,,"Not rated, This organization is not rated, Not currently rated",,"152 EAGLE RIDGE WAY, NANUET, NY, 10954-1019",,Mission not available,2013,Yes
https://www.charitynavigator.org/ein/134031869,Mohegan Volunteer Fire Association Volunteer Ambulance Corps Inc.,134031869,73%,2,,http://WWW.MOHEGANFIRE.COM,"PO BOX 517, LAKE MOHEGAN, NY, 10547-0517",,"PROVIDE EMERGENCY MEDICAL TREATMENT AND RELATED TRANSPORTATION FOR INVALIDS, CASUALTIES, THE SICK AND THE INFIRM.",1999,No
https://www.charitynavigator.org/ein/134031729,RAMAPO VALLEY SOCCER CLUB INC,134031729,,,"Not rated, This organization is not rated, Not currently rated",http://WWW.RVSOCCER.ORG,"PO BOX 24, SLOATSBURG, NY, 10974-0024",914-282-4391,TO COORDINATE AND DIRECT THE ACTIVITIES FOR THE YOUTH SOCCER CLUB,2022,Yes
https://www.charitynavigator.org/ein/134031995,CALVARY UNITED WORSHIP CENTER,134031995,,,"Not rated, This organization is not rated, Not currently rated",,"4557 FURMAN AVE, BRONX, NY, 10470-1601",,Mission not available,2001,Yes
https://www.charitynavigator.org/ein/134032101,Rockland Community Development Center Inc.,134032101,,,"Not rated, This organization is not rated, Not currently rated",,"40 ROBERT PITT DR, MONSEY, NY, 10952-3333",,Mission not available,1999,Yes
https://www.charitynavigator.org/ein/134032142,Donald and Barbara Zulker Foundation Inc.,134032142,,,"Not rated, This organization is not rated, Not currently rated",,"103 W 55TH ST, NEW YORK, NY, 10019-5306",,Mission not available,2000,Yes
https://www.charitynavigator.org/ein/134032385,Gemach Hatzolah Corp,134032385,,,"Not rated, This organization is not rated, Not currently rated",,"11 QUICKWAY RD UNIT 104, MONROE, NY, 10950-8883",,Mission not available,1999,Yes
https://www.charitynavigator.org/ein/134032468,Pine Hill Zendo Inc.,134032468,,,"Not rated, This organization is not rated, Not currently rated",,"18 HISCOX RD, WESTERLY, RI, 02891-1112",,Mission not available,2001,Yes
https://www.charitynavigator.org/ein/134032452,L E R Housing Development Fund Corporation,134032452,65%,2,,,"413 E 120TH ST, NEW YORK, NY, 10035-3602",212-410-7900,"THIS CORPORATION WAS ORGANIZED EXCLUSIVELY FOR THE PURPOSE OF DEVELOPING, ON A NON-PROFIT BASIS, A HOUSING PROJECT FOR PERSONS OF LOW INCOME AND NEEDY, PURSUANT TO S ... (More)",2003,No
https://www.charitynavigator.org/ein/134032578,Eglise Protestante Baptiste Oeuvres,134032578,,,"Not rated, This organization is not rated, Not currently rated",,"960 ANDERSON AVE, BRONX, NY, 10452-5610",267-346-7889,THE ORGANIZATION IS A CHURCH WITH OBJECTIVE TO SPREAD THE GOOD NEWS OF JESUS CHRIST TO ITS MEMBERS AND THE COMMUNITY,2000,Yes
https://www.charitynavigator.org/ein/134032761,Native American Music Association,134032761,,,"Not rated, This organization is not rated, Not currently rated",,"21 LIDO PKWY, LINDENHURST, NY, 11757-6018",,Mission not available,1999,Yes
https://www.charitynavigator.org/ein/134032583,CROSSLANDS COMMUNITY CHURCH,134032583,,,"Not rated, This organization is not rated, Not currently rated",,"1057 OREGON RD, CORTLANDT MNR, NY, 10567-1120",,Mission not available,1965,Yes
https://www.charitynavigator.org/ein/134032999,Saint John the Baptist Monastery Foundation of New York State Inc.,134032999,,,"Not rated, This organization is not rated, Not currently rated",,"90 INTERBOUROUGH PKWY, BROOKLYN, NY, 11207-0000",,Mission not available,1999,Yes
https://www.charitynavigator.org/ein/134033237,Joy of Giving Something Inc.,134033237,,,"Not rated, This organization is not rated, Not currently rated",,"5173 SKYLINE DR, SYRACUSE, NY, 13215-2445",,Mission not available,1999,Yes
