url,name,ein,score,star_rating,keywords,website,address,phone,organization_mission,IRS_ruling_year,contain_keywords
https://www.charitynavigator.org/ein/464862968,Dare Animal Rescue Inc.,464862968,,,"Not currently rated, This organization is not rated, Not rated",,"1709 GORNTO RD STE A, VALDOSTA, GA, 31601-8407",,Mission not available,2014,Yes
https://www.charitynavigator.org/ein/464863325,Awareness is Prevention,464863325,,,"Not currently rated, This organization is not rated, Not rated",http://WWW.AIPNV.ORG,"2179 CLEARWATER LAKE DR, HENDERSON, NV, 89044-0103",702-810-5618,PROVIDE TRAINING & EDUCATION CLASSES TO CIVILIANS AT PUBLIC AND PRIVATE LOCATIONS & SCHOOLS. LAW ENFORCEMENT TRAINING IS CONDUCTED AT OFFICIAL INSTALLATIONS BY SUBJE ... (More),2016,Yes
https://www.charitynavigator.org/ein/464864368,One Accord Life Ministries,464864368,,,"Not currently rated, This organization is not rated, Not rated",,"4802 W UNION AVE, DENVER, CO, 80236-3318",,Mission not available,2014,Yes
https://www.charitynavigator.org/ein/464864307,Honor Flight Bay Area Foundation,464864307,97%,4,,http://WWW.HONORFLIGHTBAYAREA.ORG,"PO BOX 391528, MOUNTAIN VIEW, CA, 94039-1528",408-925-1999,"TO PLAN, FUND & CONDUCT TRIPS TO WASHINGTON, D.C. FOR WORLD WAR II,KOREAN, & VIETNAM WAR VETERANS TO VISIT MEMORIALS THAT ARE DEDICATEDTO THEIR SERVICE & SACRIFICES. ... (More)",2014,No
https://www.charitynavigator.org/ein/464864404,Garage of Blessings,464864404,,,"Not currently rated, This organization is not rated, Not rated",,"PO BOX 115, OAK HARBOR, WA, 98277-0115",,Mission not available,2014,Yes
https://www.charitynavigator.org/ein/464864983,New Life Calvary Inc.,464864983,,,"Not currently rated, This organization is not rated, Not rated",,"4600 BONANZA RD, LAKE WORTH, FL, 33467-4765",,Mission not available,2017,Yes
https://www.charitynavigator.org/ein/464864386,Aloha Kuamoo Aina,464864386,73%,2,,,"65-5259 PUUKAPU ST, KAMUELA, HI, 96743-0000",808-349-0162,"TO PROMOTE ALOHA 'AINA - ECOLOGICAL AND SOCIAL JUSTICE - AS CONSISTANT WITH THE MO'OLELO AND VALUES OF KUAMO'O TO ACHIEVE JUSTICE AND PEACE FOR HAWAII'S PEAOPLE, ENV ... (More)",2015,No
https://www.charitynavigator.org/ein/464864208,Greenplay Northwest,464864208,,,"Not currently rated, This organization is not rated, Not rated",,"PO BOX 11081, SPOKANE VLY, WA, 99211-1081",,Mission not available,2015,Yes
https://www.charitynavigator.org/ein/464865561,Friends of Hollywood Florida Inc.,464865561,,,"Not currently rated, This organization is not rated, Not rated",,"PO BOX 814355, HOLLYWOOD, FL, 33081-4355",,Mission not available,2014,Yes
https://www.charitynavigator.org/ein/464865058,Chabad Lubavitch of West Davie Inc.,464865058,,,"Not currently rated, This organization is not rated, Not rated",,"12945 SW 34TH PL, DAVIE, FL, 33330-1258",,Mission not available,2015,Yes
https://www.charitynavigator.org/ein/464866680,Idaho Association of Community Theatre,464866680,,,"Not currently rated, This organization is not rated, Not rated",,"PO BOX 6604, BOISE, ID, 83707-0604",,Mission not available,2017,Yes
https://www.charitynavigator.org/ein/464866759,100 Men Who Cook,464866759,,,"Not currently rated, This organization is not rated, Not rated",,"2825 HOLLY ST, DENVER, CO, 80207-2736",,Mission not available,2015,Yes
https://www.charitynavigator.org/ein/464867711,Mountaineers School of Autism,464867711,35%,0,,,"1340 KENWOOD RD, WEST PALM BCH, FL, 33401-7408",561-962-5075,"MOUNTAINEER'S SCHOOL OF AUTISM IS A PRIVATE, NON-PROFIT SCHOOL TAILORED TO MEET THE INDIVIDUAL NEEDS OF STUDENTS WITH AUTISM AND OTHER DISABILITIES",2014,No
https://www.charitynavigator.org/ein/464868006,NEW BEGINNINGS COMMUNITY CHURCH OF THE BAY AREA,464868006,,,"Not currently rated, This organization is not rated, Not rated",,"PO BOX 51650, PALO ALTO, CA, 94303-0714",,Mission not available,2015,Yes
https://www.charitynavigator.org/ein/464868514,Corridor Interfaith Alliance for Families,464868514,,,"Not currently rated, This organization is not rated, Not rated",,"302 ELM ST, BUDA, TX, 78610-2743",,Mission not available,2014,Yes
https://www.charitynavigator.org/ein/464868606,SPIRITUAL ASSEMBLY OF THE BAHAIS OF NASSAU COUNTY,464868606,,,"Not currently rated, This organization is not rated, Not rated",,"87623 HAVEN RD, YULEE, FL, 32097-7324",,Mission not available,1995,Yes
https://www.charitynavigator.org/ein/464867415,Know Before You Go Corp,464867415,,,"Not currently rated, This organization is not rated, Not rated",,"1422 EDINGER AVE STE 230, TUSTIN, CA, 92780-6298",,Mission not available,2015,Yes
https://www.charitynavigator.org/ein/464868379,Christ is Alive Evangelistic Ministries Inc.,464868379,,,"Not currently rated, This organization is not rated, Not rated",,"PO BOX 1974, CORDOVA, TN, 38088-1974",,Mission not available,2014,Yes
https://www.charitynavigator.org/ein/464869048,SCHOLARSHIP AMERICA INC,464869048,,,"Not currently rated, Review Before Proceeding, This organization is not rated, Not rated",,"41870 MCALBY CT, MURRIETA, CA, 92562-7036",,Mission not available,1962,Yes
https://www.charitynavigator.org/ein/464869278,North Mountain Business Alliance,464869278,,,"Not currently rated, This organization is not rated, Not rated",,"2201 W DESERT COVE AVE, PHOENIX, AZ, 85029-4912",,Mission not available,2015,Yes
https://www.charitynavigator.org/ein/464869466,Growleader Foundation,464869466,,,"Not currently rated, This organization is not rated, Not rated",http://www.traffickinghopela.org,"3660 GRANDVIEW PARKWAY, BIRMINGHAM, AL, 35243-3330",225-290-7598,"Bring public awareness, prevention, and education to the problem of domestic human sex trafficking",2014,Yes
https://www.charitynavigator.org/ein/464869492,Indonesian Cultural Association,464869492,,,"Not currently rated, This organization is not rated, Not rated",,"30346 10TH AVE S, FEDERAL WAY, WA, 98003-4104",,Mission not available,2018,Yes
https://www.charitynavigator.org/ein/464868725,Shades Mountain United Appeal Fund Inc.,464868725,,,"Not currently rated, This organization is not rated, Not rated",,"2281 OLD TYLER RD, HOOVER, AL, 35226-1701",,Mission not available,2014,Yes
https://www.charitynavigator.org/ein/464869829,Grace Dunamis Ministries,464869829,,,"Not currently rated, This organization is not rated, Not rated",,"11823 CHANERA AVE, HAWTHORNE, CA, 90250-1825",,Mission not available,2017,Yes
https://www.charitynavigator.org/ein/464869099,Christ Church of Redemption,464869099,,,"Not currently rated, This organization is not rated, Not rated",,"104 S FORESTDALE AVE, COVINA, CA, 91723-2443",,Mission not available,2016,Yes
https://www.charitynavigator.org/ein/464869893,Sals Soldiers,464869893,,,"Not currently rated, This organization is not rated, Not rated",,"2814 W SAINT ISABEL ST, TAMPA, FL, 33607-6344",,Mission not available,2015,Yes
https://www.charitynavigator.org/ein/464870540,Sprouting to Success Inc.,464870540,70%,2,,,"18061 NW 27TH AVE, MIAMI GARDENS, FL, 33056-3506",,"Sprouting to Success, Inc. meets individuals where they are and takes them to where they need to go; academically, socially, spiritually, and economically; bridging ... (More)",2020,No
https://www.charitynavigator.org/ein/464870661,91st Booster Club,464870661,,,"Not currently rated, This organization is not rated, Not rated",,"7515 HANGAR LOOP DR BLDG 56, MACDILL AFB, FL, 33621-5201",,Mission not available,2022,Yes
https://www.charitynavigator.org/ein/464869886,Safe Haven Refuge,464869886,,,"Not currently rated, This organization is not rated, Not rated",,"2510 S VENICE DR, PEARLAND, TX, 77581-7574",,Mission not available,2014,Yes
https://www.charitynavigator.org/ein/464870522,Paws Rescue Incorporated,464870522,,,"Not currently rated, This organization is not rated, Not rated",,"538 MONTE VISTA DR, TWIN FALLS, ID, 83301-4343",,Mission not available,2014,Yes
https://www.charitynavigator.org/ein/464872486,Fundacion Semillas De Amor,464872486,,,"Not currently rated, This organization is not rated, Not rated",,"9898 SW 56TH AVE, OCALA, FL, 34476-0707",,Mission not available,2022,Yes
https://www.charitynavigator.org/ein/464872327,COTTONWOOD ECONOMIC DEVELOPMENT COUNCIL,464872327,,,"Not currently rated, This organization is not rated, Not rated",,"849 COVE PKWY STE C, COTTONWOOD, AZ, 86326-4682",,Mission not available,2014,Yes
https://www.charitynavigator.org/ein/464872517,Siba Scholarship Fund Inc.,464872517,,,"Not currently rated, This organization is not rated, Not rated",,"1521 WASHINGTON AVE, SAINT LOUIS, MO, 63103-1803",,Mission not available,2014,Yes
https://www.charitynavigator.org/ein/464872703,Arabic Lutheran Ministries,464872703,,,"Not currently rated, This organization is not rated, Not rated",,"1565 SUMMER CHASE LN, FENTON, MO, 63026-6947",,Mission not available,2022,Yes
https://www.charitynavigator.org/ein/464872854,RIVERS OF LIFE ASSEMBLY OF GOD,464872854,,,"Not currently rated, This organization is not rated, Not rated",,"PO BOX 39174, NINILCHIK, AK, 99639-0174",,Mission not available,1964,Yes
https://www.charitynavigator.org/ein/464869516,Labs 4 Free,464869516,,,"Not currently rated, This organization is not rated, Not rated",,"2023 EIGHTH STREET, BERKELEY, CA, 94710-2026",,"Our mission is to fund life-saving laboratory tests for children and adults with rare diseases and chronic disorders, ensuring equal access for all.",2023,Yes
https://www.charitynavigator.org/ein/464872948,Sue Dandridge Memorial Scholarship Fund,464872948,,,"Not currently rated, This organization is not rated, Not rated",,"3216 SUNRISE DR, GUNTERSVILLE, AL, 35976-2523",,Mission not available,2024,Yes
https://www.charitynavigator.org/ein/464873267,Mdj Ministries Inc.,464873267,,,"Not currently rated, This organization is not rated, Not rated",,"3368 MORAVIA DR, STONECREST, GA, 30038-2640",,Mission not available,2022,Yes
https://www.charitynavigator.org/ein/464873070,Selamta International,464873070,,,"Not currently rated, Review Before Proceeding, This organization is not rated, Not rated",,"PO BOX 11261, GLENDALE, CA, 91226-7261",,Mission not available,2014,Yes
https://www.charitynavigator.org/ein/464873378,Riverside Poly High School Theater Booster Club Corporation,464873378,,,"Not currently rated, Review Before Proceeding, This organization is not rated, Not rated",,"5450 VICTORIA AVE, RIVERSIDE, CA, 92506-3362",,Mission not available,2014,Yes
https://www.charitynavigator.org/ein/464873566,Souls Feeding Souls,464873566,,,"Not currently rated, This organization is not rated, Not rated",,"2281 SUSSEX LN, ALLEN, TX, 75013-5673",,Mission not available,2014,Yes
https://www.charitynavigator.org/ein/464873420,We Love Animals Rescue Inc.,464873420,,,"Not currently rated, This organization is not rated, Not rated",,"5835 TYLER ST, HOLLYWOOD, FL, 33021-6341",,Mission not available,2014,Yes
https://www.charitynavigator.org/ein/464873626,Lasalle County A&M Club,464873626,,,"Not currently rated, This organization is not rated, Not rated",,"1005 LEONA, COTULLA, TX, 78014-3131",,Mission not available,2014,Yes
https://www.charitynavigator.org/ein/464873914,Speaking Truth in Love Ministry,464873914,,,"Not currently rated, This organization is not rated, Not rated",,"PO BOX 1656, GRIFFIN, GA, 30224-0039",,Mission not available,2020,Yes
https://www.charitynavigator.org/ein/464873958,Sweaat Inc.,464873958,,,"Not currently rated, This organization is not rated, Not rated",,"6870 BRIARFIELD LN, BARTLETT, TN, 38135-3503",,Mission not available,2015,Yes
https://www.charitynavigator.org/ein/464874151,Life Learning Global Inc.,464874151,,,"Not currently rated, This organization is not rated, Not rated",,"6254 STURBRIDGE CT, SARASOTA, FL, 34238-2793",,Mission not available,2014,Yes
https://www.charitynavigator.org/ein/464874748,Bobby and Susan Albert Foundation,464874748,,,"Not currently rated, This organization is not rated, Not rated",,"4912 QUAIL SPRINGS DR, WICHITA FALLS, TX, 76302-3900",,Mission not available,2014,Yes
https://www.charitynavigator.org/ein/464874785,Karpel Foundation,464874785,,,"Not currently rated, This organization is not rated, Not rated",,"120 S CENTRAL AVE STE 700, SAINT LOUIS, MO, 63105-1794",,Mission not available,2014,Yes
https://www.charitynavigator.org/ein/464874823,Florida Commodores Association Foundation Inc.,464874823,,,"Not currently rated, This organization is not rated, Not rated",,"4323 AMERICAN POETS DR, NICEVILLE, FL, 32578-4174",,Mission not available,2015,Yes
https://www.charitynavigator.org/ein/464874864,Florida Alliance for Civic Engagement Inc.,464874864,67%,2,,,"25550 SW 152ND AVE, HOMESTEAD, FL, 33032-5216",407-697-0823,"IMPROVING COMMUNICATION, STRATEGIC PLANNING AND SHARING OF TOOLS AMONG 501(C)3 ORGANIZATIONS WORKING TO FURTHER CIVIC PARTICIPATION; IMPROVING THE ABILITY OF 501(C)3 ... (More)",2015,No
https://www.charitynavigator.org/ein/464875047,Sound Off,464875047,84%,3,,http://WWW.SOUND-OFF.COM,"4040 BROADWAY, Suite 501, San Antonio, TX, 78209-6350",800-227-4460,Sound Off's mission is to provide mental health support to Veterans and Service Members in such a way that the 47%+ of those suffering who otherwise refuse to seek h ... (More),2015,No
https://www.charitynavigator.org/ein/464874862,Van Courtlandt Foundation,464874862,,,"Not currently rated, This organization is not rated, Not rated",,"PO BOX 461766, SAN ANTONIO, TX, 78246-1766",,Mission not available,2014,Yes
