url,name,ein,score,star_rating,keywords,website,address,phone,organization_mission,IRS_ruling_year,contain_keywords
https://www.charitynavigator.org/ein/237291994,WINSTON COUNTY FARM BUREAU INC,237291994,,,"Not currently rated, Not rated, This organization is not rated",,"PO BOX 452, DOUBLE SPGS, AL, 35553-0452",205-489-5687,"THE ORGANIZATION'S PRIMARY EXEMPT PURPOSE IS TO ADVANCE AND TO IMPROVE THE AGRICULTURE OF WINSTON COUNTY, ALABAMA; AND TO BRING BETTER ECONOMIC, SOCIAL AND EDUCATION ... (More)",1973,Yes
https://www.charitynavigator.org/ein/237292090,ROTARY INTERNATIONAL,237292090,,,"Not currently rated, Not rated, This organization is not rated",,"PO BOX 5321, HUDSON, FL, 34674-5321",,Mission not available,1942,Yes
https://www.charitynavigator.org/ein/237292125,Tennessee Opportunity Programs Inc.,237292125,81%,3,,http://WWW.TNOPPORTUNITYPROGRAMS.ORG,"332 N SPRING ST ST B, SPARTA, TN, 38583-1334",931-256-8526,"THE ORGANIZATION IS A GENERAL WELFARE CORPORATION CHARTERED IN 1973 TO PROPOSE, DEVELOP, AND ADMINISTER PROGRAMS TO WORK TOWARD ENHANCEMENT OF LIVES OF THE DISADVANT ... (More)",1974,No
https://www.charitynavigator.org/ein/237292092,Dry Palms Foundation Inc.,237292092,,,"Not currently rated, Not rated, This organization is not rated",,"1251 LAMAR RD, N FORT MYERS, FL, 33903-3807",239-218-0500,EDUCATIONAL MEETING RE: PEOPLE WITH ADDICTION PROBLEMS,1984,Yes
https://www.charitynavigator.org/ein/237292128,Universal Christian Holiness Church,237292128,,,"Not currently rated, Not rated, This organization is not rated",,"1815 SHELBY AVE, NASHVILLE, TN, 37206-2151",,Mission not available,2010,Yes
https://www.charitynavigator.org/ein/237292093,ALPHA XI DELTA BUILDING CORPORATION OF ATLANTA GEORGIA,237292093,,,"Not currently rated, Not rated, This organization is not rated",,"5490 MCGINNIS VILLAGE PL STE 210, ALPHARETTA, GA, 30005-1735",,Operates a Sorority House at The Georgia Institute of Technology.,1980,Yes
https://www.charitynavigator.org/ein/237292186,Lakeland Area Chamber Foundation Inc.,237292186,,,"Not currently rated, Not rated, This organization is not rated",,"35 LAKE MORTON DR, LAKELAND, FL, 33801-5342",,Mission not available,1973,Yes
https://www.charitynavigator.org/ein/237292187,Havasu Regional Medical Center Auxiliary,237292187,,,"Not currently rated, Not rated, This organization is not rated",,"101 CIVIC CENTER LN, LK HAVASU CTY, AZ, 86403-5607",,Mission not available,1973,Yes
https://www.charitynavigator.org/ein/237292203,KCBX,237292203,98%,4,,http://www.kcbx.org/,"4100 Vachell Lane, San Luis Obispo, CA, 93401",805-549-8855,KCBX is a cultural resource which exists to enlighten and enrich the quality of life for the people within its listening area. KCBX will strive to serve the listenin ... (More),1974,No
https://www.charitynavigator.org/ein/237292226,Assistance League Coachella Valley,237292226,93%,4,,http://alcoachellavalley.org,"PO BOX 3056, RANCHO MIRAGE, CA, 92270-1092",760-848-0084,"Our mission is to transform the lives of children and adults through community programs in the Coachella Valley. We help children, seniors, assault survivors, and mi ... (More)",1974,No
https://www.charitynavigator.org/ein/237292240,Korean American Youth Foundation Inc.,237292240,76%,3,,http://WWW.CAMPCONIFER.ORG,"2105 E 25TH ST, LOS ANGELES, CA, 90058-1125",,"KOREAN-AMERICAN YOUTH FOUNDATION (KAYF) PROVIDES OPPORTUNITIES FOR YOUTHS OF KOREAN ANCESTRY TO DEVELOP QUALITIES OF LEADERSHIP, SOCIAL RESPONSIBILITY, AND FRIENDSHI ... (More)",1973,No
https://www.charitynavigator.org/ein/237292248,SAN DIEGO COUNTRY ESTATES ASSOCIATION,237292248,,,"Not currently rated, Not rated, This organization is not rated",http://www.sdcea.net,"24157 SAN VICENTE RD, RAMONA, CA, 92065-4166",760-785-3788,"The organization comprises 3,451 member/units that is responsible to maintain, repair and replace the common area as well certain amenities such as a golf course, eq ... (More)",2023,Yes
https://www.charitynavigator.org/ein/237292314,One Hundred Club of San Antonio,237292314,96%,4,,http://WWW.100CLUBSA.ORG,"PO BOX 6741, SAN ANTONIO, TX, 78209-0741",210-421-3384,THE ONE HUNDRED CLUB OF SAN ANTONIO IS A TEXAS NON-PROFIT CORPORATION FORMED IN 1973. THE ORGANIZATION PROVIDES PROGRAMS AND ACTIVITIES TO ASSIST SURVIVOR SPOUSES AN ... (More),1975,No
https://www.charitynavigator.org/ein/237292205,CIVITAN INTERNATIONAL,237292205,,,"Not currently rated, Not rated, This organization is not rated",,"PO BOX 62, WINTERVILLE, GA, 30683-0062",,Mission not available,2006,Yes
https://www.charitynavigator.org/ein/237292391,Optometry Cares-The Aoa Foundation,237292391,88%,3,,http://WWW.AOAFOUNDATION.ORG,"243 NORTH LINDBERGH BLVD, ST LOUIS, MO, 63141-7851",314-991-4100,"OPTOMETRY CARES, THE AOA FOUNDATION, IS COMMITTED TO EXPAND EYE CARE AWARENESS, EDUCATION, RESEARCH, AND ACCESS TO EYE HEALTH AND VISION CARE TO EVERYONE IN THE U.S.",2005,No
https://www.charitynavigator.org/ein/237292421,FRIENDSHIP BIBLE CHURCH,237292421,,,"Not currently rated, Not rated, This organization is not rated",,"PO BOX 1007, KEYSTONE HGTS, FL, 32656-1007",,Mission not available,1972,Yes
https://www.charitynavigator.org/ein/237292463,FAYETTE COUNTY INDUSTRIAL FOUNDATION INC,237292463,,,"Not currently rated, Not rated, This organization is not rated",,"PO BOX 430, LA GRANGE, TX, 78945-0430",,Mission not available,1973,Yes
https://www.charitynavigator.org/ein/237292527,Texas Girls and Boys Ranch,237292527,96%,4,Review Before Proceeding,http://WWW.TXGBR.ORG,"4810 N COUNTY ROAD 2800, LUBBOCK, TX, 79403-7297",806-747-3187,"SHARING JESUS, HEALING HEARTS, TRANSFORMING LIVES.",1973,Yes
https://www.charitynavigator.org/ein/237292237,Historical Society of La Verne,237292237,,,"Not currently rated, Not rated, This organization is not rated",,"4320 EMERALD AVE, LA VERNE, CA, 91750-2702",,Mission not available,1973,Yes
https://www.charitynavigator.org/ein/237292569,Simi Valley Art Association Inc.,237292569,,,"Not currently rated, Not rated, This organization is not rated",,"6621 CHARING ST, SIMI VALLEY, CA, 93063-3924",,Mission not available,2012,Yes
https://www.charitynavigator.org/ein/237292338,INTERNATIONAL ASSOCIATION OF LIONS CLUBS,237292338,,,"Not currently rated, Not rated, This organization is not rated",,"921 BROADWAY ST, PLAINVIEW, TX, 79072-0000",,Mission not available,1969,Yes
https://www.charitynavigator.org/ein/237292587,LOS ANGELES PRINTMAKING SOCIETY,237292587,,,"Not currently rated, Not rated, This organization is not rated",,"1920 HILLHURST AVE STE 153, LOS ANGELES, CA, 90027-2712",,Mission not available,1973,Yes
https://www.charitynavigator.org/ein/237292592,LITTLE LEAGUE BASEBALL INC,237292592,,,"Review Before Proceeding, Not currently rated, Not rated, This organization is not rated",,"PO BOX 710302, SANTEE, CA, 92072-0302",,Mission not available,1967,Yes
https://www.charitynavigator.org/ein/237292441,BLACK JACK BAPTIST CHURCH,237292441,,,"Not currently rated, Not rated, This organization is not rated",,"4906 MEUSE DR, BLACK JACK, MO, 63033-4613",,Mission not available,1965,Yes
https://www.charitynavigator.org/ein/237292598,Redlands Art Association,237292598,73%,2,,http://WWW.REDLANDS-ART.ORG,"215 E STATE ST, REDLANDS, CA, 92373-5232",909-792-8435,ART EDUCATIONAL PROGRAMS ARE HELD FOR THE BENEFIT OF THE CITY OF REDLANDS AND SURROUNDING COMMUNITIES. THE ASSOCIATION ALSO CONDUCTS ART CLASSES AND WORKSHOPS FOR CH ... (More),2022,No
https://www.charitynavigator.org/ein/237292560,Gospel Assembly Church,237292560,,,"Not currently rated, Not rated, This organization is not rated",,"815 HIGHWAY 82 W, GREENVILLE, MS, 38701-5715",,Mission not available,1973,Yes
https://www.charitynavigator.org/ein/237292607,Bible Truth Church,237292607,,,"Not currently rated, Not rated, This organization is not rated",,"3705 W 5TH ST, SANTA ANA, CA, 92703-2709",,Mission not available,1973,Yes
https://www.charitynavigator.org/ein/237292608,Bible Way Baptist Church Inc.,237292608,,,"Not currently rated, Not rated, This organization is not rated",,"5600 W FLYING M ST, TUCSON, AZ, 85713-6419",,Mission not available,1973,Yes
https://www.charitynavigator.org/ein/237292616,CLARKE COUNTY FARM BUREAU INC,237292616,,,"Not currently rated, Not rated, This organization is not rated",,"148 S JACKSON ST, GROVE HILL, AL, 36451-3006",,Mission not available,1973,Yes
https://www.charitynavigator.org/ein/237292619,TALLAPOOSA COUNTY FARM BUREAU INC,237292619,,,"Not currently rated, Not rated, This organization is not rated",,"4578 TALLAPOOSA ST, NOTASULGA, AL, 36866-4517",,Mission not available,1973,Yes
https://www.charitynavigator.org/ein/237292630,Foster Parents Association of Alachua County Inc.,237292630,,,"Not currently rated, Not rated, This organization is not rated",,"5950 NW 1ST PLACE, GAINESVILLE, FL, 32607-6060",,Mission not available,1973,Yes
https://www.charitynavigator.org/ein/237292631,Grace Bible Church of Costa Mesa,237292631,,,"Not currently rated, Not rated, This organization is not rated",,"17602 WILLOWTREE LANE, IRVINE, CA, 92715-2229",,Mission not available,1973,Yes
https://www.charitynavigator.org/ein/237292599,Save Our Mountains Foundation,237292599,,,"Not currently rated, Not rated, This organization is not rated",,"12950 N 7TH ST, PHOENIX, AZ, 85022-5500",,Mission not available,1973,Yes
https://www.charitynavigator.org/ein/237292642,Emily Louise Pollard Charitable Trust,237292642,,,"Not currently rated, Not rated, This organization is not rated",,"6325 S RAINBOW BLVD STE 300, LAS VEGAS, NV, 89118-3278",,Mission not available,1973,Yes
https://www.charitynavigator.org/ein/237292622,ADVISORY BOARD OF THE ARIZONA DISTRICT CHURCH OF THE NAZARENE,237292622,,,"Not currently rated, Not rated, This organization is not rated",,"2420 W RAY RD STE 1, CHANDLER, AZ, 85224-3548",,Mission not available,1963,Yes
https://www.charitynavigator.org/ein/237292635,House of Victory Spiritual Churches Inc.,237292635,,,"Not currently rated, Not rated, This organization is not rated",,"1656 W 35TH ST, JACKSONVILLE, FL, 32209-3266",,Mission not available,1973,Yes
https://www.charitynavigator.org/ein/237292647,Trinity Presbyterian Church of Savannah Inc.,237292647,,,"Not currently rated, Not rated, This organization is not rated",,"732 E 50TH ST, SAVANNAH, GA, 31405-2459",,Mission not available,1973,Yes
https://www.charitynavigator.org/ein/237292636,Koinonia House Inc.,237292636,82%,3,,http://WWW.KHOUSE.ORG,"4055 E 3RD AVE, POST FALLS, ID, 83854-7175",208-773-6310,"TO CREATE, DEVELOP AND DISTRIBUTE MATERIALS TO STIMULATE, ENCOURAGE AND FACILITATE SERIOUS STUDY OF THE BIBLE AS THE INERRANT WORD OF GOD.",1973,No
https://www.charitynavigator.org/ein/237292712,AMVETS LADIES AUXLILIARY DEPARTMENT OF KANSAS,237292712,,,"Not currently rated, Not rated, This organization is not rated",,"5 19TH TER, HUTCHINSON, KS, 67502-3518",,Mission not available,1945,Yes
https://www.charitynavigator.org/ein/237292648,Walter S Pierce Foundation Inc.,237292648,,,"Not currently rated, Not rated, This organization is not rated",,"3302 W AZEELE STREET, TAMPA, FL, 33609-2975",,Mission not available,1973,Yes
https://www.charitynavigator.org/ein/237292743,Friends of the South Pasadena Public Library Inc.,237292743,90%,4,,,"1100 OXLEY ST, S PASADENA, CA, 91030-3159",626-403-7333,"The support of public access to books, magazines and other forms of recorded literature housed in a community library to serve the citizens of South Pasadena and the ... (More)",1988,No
https://www.charitynavigator.org/ein/237292688,PHI MU FRATERNITY,237292688,,,"Not currently rated, Not rated, This organization is not rated",,"400 WESTPARK DR, PEACHTREE CTY, GA, 30269-1482",,Mission not available,1944,Yes
https://www.charitynavigator.org/ein/237292749,Buena Vista Audubon Society,237292749,69%,2,,http://www.bvaudubon.org,"PO BOX 480, OCEANSIDE, CA, 92049-0480",760-439-2473,"CONSERVATION THROUGH EDUCATION, ADVOCACY AND MONITORING",1973,No
https://www.charitynavigator.org/ein/237292826,Florida Wildlife Hospital and Sanctuary Inc.,237292826,92%,4,,http://WWW.FLORIDAWILDLIFEHOSPITAL.ORG,"4650 N US HIGHWAY 1, MELBOURNE, FL, 32935-0000",321-254-8843,"OUR MISSION IS TO AID SICK, INJURED AND ORPHANED NATIVE FLORIDA WILDLIFE AND MIGRATORY BIRDS, AND TO RETURN THEM TO THE ECOSYSTEM. WE ARE COMMITTED TO KEEPING WILDLI ... (More)",1974,No
https://www.charitynavigator.org/ein/237292779,DENT COUNTY FARM BUREAU,237292779,,,"Not currently rated, Not rated, This organization is not rated",,"1414 W SCENIC RIVERS BLVD, SALEM, MO, 65560-2842",,Mission not available,1974,Yes
https://www.charitynavigator.org/ein/237292753,Auxiliary of Mission Hospital Mission Viejo,237292753,73%,2,,,"27700 MEDICAL CENTER RD, MISSION VIEJO, CA, 92691-6426",949-661-7138,TO EXTEND AND ENHANCE HEALTH CARE MINISTRY BY PROVIDING VOLUNTEER SERVICES WHICH REFLECT THE GOALS AND VALUES OF THE SISTERS OF ST. JOSEPH ORANGE. ALSO TO PROVIDE GR ... (More),1973,No
https://www.charitynavigator.org/ein/237292939,KNIGHTS OF COLUMBUS,237292939,,,"Not currently rated, Not rated, This organization is not rated",,"PO BOX 1531, LEESVILLE, LA, 71496-1531",,Mission not available,1940,Yes
https://www.charitynavigator.org/ein/237292950,DELTA SIGMA THETA SORORITY INC,237292950,,,"Not currently rated, Not rated, This organization is not rated",,"PO BOX 141885, ANCHORAGE, AK, 99514-1885",,Mission not available,1952,Yes
https://www.charitynavigator.org/ein/237292848,DEPARTMENT OF WYOMING VFW AUXILIARY,237292848,,,"Not currently rated, Not rated, This organization is not rated",,"305 OAK ST, VAN TASSELL, WY, 82242-8615",,Mission not available,2011,Yes
https://www.charitynavigator.org/ein/237292962,CZECHOSLOVAK SOCIETY OF AMERICA,237292962,,,"Not currently rated, Not rated, This organization is not rated",,"4112 AREZZO POINTE LN, SAN JOSE, CA, 95148-4365",,Mission not available,1940,Yes
https://www.charitynavigator.org/ein/237292907,Soul Christian Assembly Church Inc.,237292907,,,"Not currently rated, Not rated, This organization is not rated",,"1280 W LAMBERT RD STE B2, BREA, CA, 92821-2821",,Mission not available,1973,Yes
https://www.charitynavigator.org/ein/237292972,SOCIETY FOR PRESERVATION & ENCRGMNT OF BARBERSHOP QUARTET SINGING AMER,237292972,,,"Not currently rated, Not rated, This organization is not rated",,"2638 LARIAT LN, WALNUT CREEK, CA, 94596-6611",,Mission not available,1946,Yes
https://www.charitynavigator.org/ein/237293098,Northgate Church of Christ,237293098,,,"Not currently rated, Not rated, This organization is not rated",,"PO BOX 3031, LAFAYETTE, LA, 70502-3031",,Mission not available,1973,Yes
https://www.charitynavigator.org/ein/237292974,American Catholic Faith Association Inc.,237292974,,,"Not currently rated, Not rated, This organization is not rated",,"501 W COLUMBIA ST, TUCSON, AZ, 85714-2525",,Mission not available,1974,Yes
https://www.charitynavigator.org/ein/237293155,ALPHA DELTA KAPPA SORORITY INC,237293155,,,"Not currently rated, Not rated, This organization is not rated",,"1615 W 92ND ST, KANSAS CITY, MO, 64114-3210",,Mission not available,1970,Yes
https://www.charitynavigator.org/ein/237293173,Colonnades Theatre Lab Inc.,237293173,76%,3,,http://GLOBALARTSCORPS.ORG,"C/O RFA 480 JAMES ROBERTSON PKWY, NASHVILLE, TN, 37219-0000",212-281-0896,"GLOBAL ARTS CORPS (GAC) IS A CONSORTIUM OF THEATER ARTISTS WITH A MANDATE TO BRING TOGETHER PERFORMERS FROM OPPOSITE SIDES OF POLITICAL, RELIGIOUS, ETHNIC, AND RACIA ... (More)",1974,No
https://www.charitynavigator.org/ein/237293056,NAIFA-UTAH,237293056,,,"Not currently rated, Not rated, This organization is not rated",,"533 W 2600 S, BOUNTIFUL, UT, 84010-7714",,Mission not available,1973,Yes
https://www.charitynavigator.org/ein/237293193,LACEY COMMUNITY CHURCH DISCIPLES- BRETHREN,237293193,,,"Not currently rated, Not rated, This organization is not rated",,"PO BOX 8307, LACEY, WA, 98509-8307",,Mission not available,1951,Yes
https://www.charitynavigator.org/ein/237293329,PHI THETA KAPPA FRATERNITY,237293329,,,"Not currently rated, Not rated, This organization is not rated",,"PO BOX 13729, JACKSON, MS, 39236-3729",,Mission not available,1956,Yes
https://www.charitynavigator.org/ein/237293199,LITTLE LEAGUE BASEBALL INC,237293199,,,"Not currently rated, Not rated, This organization is not rated",,"PO BOX 13727, SALEM, OR, 97309-1727",,Mission not available,1967,Yes
https://www.charitynavigator.org/ein/237293330,PHI THETA KAPPA FRATERNITY,237293330,,,"Not currently rated, Not rated, This organization is not rated",,"PO BOX 13729, JACKSON, MS, 39236-3729",,Mission not available,1956,Yes
https://www.charitynavigator.org/ein/237293333,PHI THETA KAPPA FRATERNTY,237293333,,,"Not currently rated, Not rated, This organization is not rated",,"PO BOX 13729, JACKSON, MS, 39236-3729",,Mission not available,1956,Yes
https://www.charitynavigator.org/ein/237293334,PHI THETA KAPPA FRATERNITY,237293334,,,"Not currently rated, Not rated, This organization is not rated",,"PO BOX 13729, JACKSON, MS, 39236-3729",,Mission not available,1956,Yes
https://www.charitynavigator.org/ein/237293331,PHI THETA KAPPA FRATERNITY,237293331,,,"Not currently rated, Not rated, This organization is not rated",,"PO BOX 13729, JACKSON, MS, 39236-3729",,Mission not available,1956,Yes
https://www.charitynavigator.org/ein/237293332,PHI THETA KAPPA,237293332,,,"Not currently rated, Not rated, This organization is not rated",,"PO BOX 13729, JACKSON, MS, 39236-3729",,Mission not available,1956,Yes
https://www.charitynavigator.org/ein/237293335,PHI THETA KAPPA FRATERNITY,237293335,,,"Not currently rated, Not rated, This organization is not rated",,"PO BOX 13729, JACKSON, MS, 39236-3729",,Mission not available,1956,Yes
https://www.charitynavigator.org/ein/237293336,PHI THETA KAPPA FRATERNITY,237293336,,,"Not currently rated, Not rated, This organization is not rated",,"PO BOX 13729, JACKSON, MS, 39236-3729",,Mission not available,1956,Yes
https://www.charitynavigator.org/ein/237293338,PHI THETA KAPPA FRATERNITY,237293338,,,"Not currently rated, Not rated, This organization is not rated",,"PO BOX 13729, JACKSON, MS, 39236-3729",,Mission not available,1956,Yes
https://www.charitynavigator.org/ein/237293339,PHI THETA KAPPA FRATERNITY,237293339,,,"Not currently rated, Not rated, This organization is not rated",,"PO BOX 13729, JACKSON, MS, 39236-3729",,Mission not available,1956,Yes
https://www.charitynavigator.org/ein/237293340,PHI THETA KAPPA FRATERNITY,237293340,,,"Not currently rated, Not rated, This organization is not rated",,"PO BOX 13729, JACKSON, MS, 39236-3729",,Mission not available,1974,Yes
https://www.charitynavigator.org/ein/237293346,PHI THETA KAPPA FRATERNITY,237293346,,,"Not currently rated, Not rated, This organization is not rated",,"PO BOX 13729, JACKSON, MS, 39236-3729",,Mission not available,1956,Yes
https://www.charitynavigator.org/ein/237293342,PHI THETA KAPPA FRATERNITY,237293342,,,"Not currently rated, Not rated, This organization is not rated",,"PO BOX 13729, JACKSON, MS, 39236-3729",,Mission not available,1956,Yes
https://www.charitynavigator.org/ein/237293348,PHI THETA KAPPA FRATERNITY,237293348,,,"Not currently rated, Not rated, This organization is not rated",,"PO BOX 13729, JACKSON, MS, 39236-3729",,Mission not available,1956,Yes
https://www.charitynavigator.org/ein/237293356,SURFSIDE PRIVATE BEACH INC,237293356,,,"Not currently rated, Not rated, This organization is not rated",,"PO BOX 3348, FORT PIERCE, FL, 34948-3348",,Mission not available,1973,Yes
https://www.charitynavigator.org/ein/237293362,VETERANS OF FOREIGN WARS OF THE UNITED STATES DEPT OF FLORIDA,237293362,,,"Not currently rated, Not rated, This organization is not rated",,"965 HARBOR LAKE CT, SAFETY HARBOR, FL, 34695-2303",727-729-6436,"The object of the VFW are fraternal, patriotic, historical and educational to preserve and strengthen comradeship among its members to assist worthy comrades to perp ... (More)",1977,Yes
https://www.charitynavigator.org/ein/237293347,PHI THETA KAPPA FRATERNITY,237293347,,,"Not currently rated, Not rated, This organization is not rated",,"PO BOX 13729, JACKSON, MS, 39236-3729",,Mission not available,1956,Yes
https://www.charitynavigator.org/ein/237293573,CALIFORNIA CHIROPRACTIC ASSOCIATION,237293573,,,"Not currently rated, Not rated, This organization is not rated",,"PO BOX 254489, SACRAMENTO, CA, 95865-4489",,Mission not available,1973,Yes
https://www.charitynavigator.org/ein/237293372,Bayard Cemetery Corporation,237293372,,,"Not currently rated, Not rated, This organization is not rated",,"37 STONERIDGE RD, PONCA CITY, OK, 74604-3418",,Mission not available,1973,Yes
https://www.charitynavigator.org/ein/237293397,ANCIENT FREE & ACCEPTED MASONS OF WYOMING,237293397,,,"Not currently rated, Not rated, This organization is not rated",,"1820 CAPITOL AVE, CHEYENNE, WY, 82001-4530",,Mission not available,1973,Yes
https://www.charitynavigator.org/ein/237293607,Santa Monica Bay Auixiliary of the Childrens Hospital of Los Angeles,237293607,,,"Not currently rated, Not rated, This organization is not rated",,"4650 W SUNSET BLVD, LOS ANGELES, CA, 90027-6062",,Mission not available,1973,Yes
https://www.charitynavigator.org/ein/237293610,PEPPERWOOD PARK HOMEOWNERS ASSN GSMOL CHAPTER 765,237293610,,,"Not currently rated, Not rated, This organization is not rated",,"1120 PEPPER DR SPC 114, EL CAJON, CA, 92021-1326",,Mission not available,1973,Yes
https://www.charitynavigator.org/ein/237293619,Crossroads Baptist Church of Burke County Inc.,237293619,,,"Not currently rated, Not rated, This organization is not rated",,"PO BOX 37, HEPHIZIBAH, GA, 30815-0037",,Mission not available,1973,Yes
https://www.charitynavigator.org/ein/237293611,Friends of the Whittier Public Library,237293611,,,"Not currently rated, Not rated, This organization is not rated",,"7344 WASHINGTON AVE, WHITTIER, CA, 90602-1730",,Mission not available,1973,Yes
https://www.charitynavigator.org/ein/237293613,Herta & Paul Amir Foundation,237293613,,,"Not currently rated, Not rated, This organization is not rated",,"8730 WILSHIRE BLVD STE 300, BEVERLY HILLS, CA, 90211-2779",,Mission not available,1973,Yes
https://www.charitynavigator.org/ein/237293620,Cone Cemetery Association,237293620,,,"Not currently rated, Not rated, This organization is not rated",,"905 10TH ST, RALLS, TX, 79357-3508",,Mission not available,1973,Yes
https://www.charitynavigator.org/ein/237293668,Council on Public Higher Education in the State of Missouri,237293668,76%,3,,http://WWW.COPHE.ORG,"200 MCCLAIN BUILDING, KIRKSVILLE, MO, 63501-0000",660-785-4100,TO SUPPORT AND ADVANCE THE MISSION OF MISSOURI'S PUBLIC FOUR-YEAR UNIVERSITIES.,1973,No
https://www.charitynavigator.org/ein/237293684,Spanish Mission Inc.,237293684,,,"Not currently rated, Not rated, This organization is not rated",,"799 PALM AVE, HIALEAH, FL, 33010-4317",,Mission not available,1973,Yes
https://www.charitynavigator.org/ein/237293721,COLORADO INSURANCE GUARANTY ASSN,237293721,,,"Not currently rated, Not rated, This organization is not rated",http://www.coiga.org,"1873 S BELLAIRE ST STE 920, DENVER, CO, 80222-4386",303-759-5066,To efficiently pay covered claims of policyholders and claimants of insolvent property and casualty insurers according to Colorado's guaranty act in cooperation with ... (More),1973,Yes
https://www.charitynavigator.org/ein/237293819,Geary County Historical Society Inc.,237293819,36%,0,,http://www.gchsweb.org,"PO BOX 1161, JUNCTION CITY, KS, 66441-1161",785-238-1666,Historical Preservation & Conservation,1973,No
https://www.charitynavigator.org/ein/237293689,Seattle Garden Club,237293689,83%,3,,http://WWW.SEATTLEGARDENCLUB.ORG,"UW BOTANICAL GARDENS BOX 354115, SEATTLE, WA, 98195-4115",206-914-9584,STIMULATE THE KNOWLEDGE AND LOVE OF GARDENING AND IMPROVE THE QUALITY OF THE ENVIRONMENT,1995,No
https://www.charitynavigator.org/ein/237293852,Kiwanis Camp Wa-Ri-Ki,237293852,78%,3,,http://campwariki.com,"PO BOX 18, WASHOUGAL, WA, 98671-0018",360-837-3168,"Kiwanis Camp wa-ri-ki is a non profit committed to providing an outdoor experience that offers optimal child development and community growth through recreational, e ... (More)",1996,No
https://www.charitynavigator.org/ein/237293874,Kalispell Regional Medical Center Inc.,237293874,90%,4,,http://LOGAN.ORG,"310 SUNNYVIEW LN, KALISPELL, MT, 59901-3129",406-751-5759,"LOGAN HEALTH MEDICAL CENTER IS A 150-BED ACUTE CARE REGIONAL REFERRAL CENTER, PROVIDING A FULL SPECTRUM OF HEALTH CARE SERVICES, INCLUDING CARDIOVASCULAR CARE, ONCOL ... (More)",1973,No
https://www.charitynavigator.org/ein/237293730,St. Vincents Hospital Auxiliary,237293730,53%,1,,,"PO BOX 35200, BILLINGS, MT, 59107-5200",,"THE ORGANIZATION CONSISTS OF VOLUNTEERS. THE VOLUNTEERS MISSION IS TO PROVIDE AN EXTRA DIMENSION OF CARE AND SEVICE TO ST. VINCENT HEALTHCARES PATIENTS, VISITORS AND ... (More)",1973,No
https://www.charitynavigator.org/ein/237293867,INTERNATIONAL ASSOCIATION OF LIONS CLUBS,237293867,,,"Not currently rated, Not rated, This organization is not rated",,"PO BOX 10, LA CROSSE, KS, 67548-0010",,Mission not available,1940,Yes
https://www.charitynavigator.org/ein/237293911,The Corvallis Kiwanis Foundation,237293911,,,"Not currently rated, Not rated, This organization is not rated",,"PO BOX 1602, CORVALLIS, OR, 97339-1602",,Mission not available,1973,Yes
https://www.charitynavigator.org/ein/237293924,VETERANS OF FOREIGN WARS DEPT OF MISSOURI,237293924,,,"Not currently rated, Not rated, This organization is not rated",,"590 HIGHWAY EE, WINFIELD, MO, 63389-3212",,Mission not available,1961,Yes
https://www.charitynavigator.org/ein/237293879,Mountain View Chapel Properties Inc.,237293879,,,"Not currently rated, Not rated, This organization is not rated",,"929 SW HIGGINS ST, MISSOULA, MT, 59803-1460",,Mission not available,1973,Yes
