url,name,ein,score,star_rating,keywords,website,address,phone,organization_mission,IRS_ruling_year,contain_keywords
https://www.charitynavigator.org/ein/270844666,Apple Seeds Foundation Incorporated,270844666,,,"Not currently rated, This organization is not rated, Not rated",,"1201 LIGHTWOOD CT, LOGANVILLE, GA, 30052-4739",,SOCIAL SERVICES TUTORING SERVICES FOOD SERVICES MENTORING PROGRAMS,2014,Yes
https://www.charitynavigator.org/ein/270844868,Pikes Peak Lacrosse,270844868,,,"Not currently rated, This organization is not rated, Not rated",,"6711 MCEWAN ST, COLORADO SPGS, CO, 80922-3108",,Mission not available,2012,Yes
https://www.charitynavigator.org/ein/270845484,Jamie Group,270845484,,,"Not currently rated, This organization is not rated, Not rated",,"PO BOX 4396, AUSTIN, TX, 78765-4396",,Mission not available,2010,Yes
https://www.charitynavigator.org/ein/270845497,Women Giving As One Inc.,270845497,85%,3,,http://WWW.IMPACT100SONOMA.ORG,"PO BOX 1958, SONOMA, CA, 95476-1958",,"TO DRIVE PARTICIPATION AMONG WOMEN IN LOCAL PHILANTHROPY, RAISE AWARENESS OF THE UNMET NEEDS OF NONPROFIT ORGANIZATIONS IN THE SONOMA VALLEY, INSPIRE DONORS TO BECOM ... (More)",2009,No
https://www.charitynavigator.org/ein/270845692,ALTUS ROTARY CLUB,270845692,,,"Not currently rated, This organization is not rated, Not rated",,"PO BOX 137, ALTUS, OK, 73522-0137",,Mission not available,2022,Yes
https://www.charitynavigator.org/ein/270846147,Juanakee Adams Iniative for Excellent Eye Care and Optimum Hea,270846147,,,"Not currently rated, This organization is not rated, Not rated",,"1712 5TH AVE N, BIRMINGHAM, AL, 35203-2023",,Mission not available,2011,Yes
https://www.charitynavigator.org/ein/270846076,MODERN WOODMEN OF AMERICA,270846076,,,"Not currently rated, This organization is not rated, Not rated",,"STE 102 106 E MAIN ST, ROYSE CITY, TX, 75189-3713",,Mission not available,1961,Yes
https://www.charitynavigator.org/ein/270846314,Successful Youth Ministries Inc.,270846314,,,"Not currently rated, This organization is not rated, Not rated",,"12649 SOFTWIND DR, MORENO VALLEY, CA, 92553-5938",,Mission not available,2015,Yes
https://www.charitynavigator.org/ein/270845992,Redeemed Christian Church of God Tower of Refuge - the Woodlands,270845992,,,"Not currently rated, This organization is not rated, Not rated",,"285 SAWDUST RD, SPRING, TX, 77380-2238",,Mission not available,2017,Yes
https://www.charitynavigator.org/ein/270846567,Arkansas Association for Food Protection,270846567,,,"Not currently rated, This organization is not rated, Not rated",,"2200 W DON TYSON PKWY, SPRINGDALE, AR, 72762-6901",,Mission not available,2014,Yes
https://www.charitynavigator.org/ein/270846609,Coreluv International Inc.,270846609,71%,2,,http://WWW.CORELUV.ORG,"502 W MONTGOMERY ST STE 411, WILLIS, TX, 77378-8827",832-857-0588,"TO PROMOTE, EDUCATE, AND EQUIP FOR THE CAUSE OF CARING FOR ORPHANS.",2014,No
https://www.charitynavigator.org/ein/270846051,Benevolence Beyond Politics Inc.,270846051,,,"Not currently rated, This organization is not rated, Not rated",,"2470 STEARNS ST 345, SIMI VALLEY, CA, 93063-2418",,Mission not available,2010,Yes
https://www.charitynavigator.org/ein/270846901,Priority Health Care,270846901,82%,3,,,"4700 WICHERS DRIVE, MARRERO, LA, 70072-3041",504-309-6522,PROVIDE HOLISTIC HEALTH CARE TO UNDERSERVED COMMUNITIES THAT EMPOWER PEOPLE TO LIVE HEALTHY LIVES.,2009,No
https://www.charitynavigator.org/ein/270847538,ST VINCENT SALEM HOSPITAL INC,270847538,70%,2,,http://www.stvincent.org/Locations/Hospitals/Salem,"PO BOX 45998, SAINT LOUIS, MO, 63145-5998",314-733-8000,To improve the health and well-being of all people in the communities we serve.,1946,No
https://www.charitynavigator.org/ein/270846955,Primary Care Providers Foundation of Hawaii,270846955,,,"Not currently rated, This organization is not rated, Not rated",,"1447 ALA LELEU ST, HONOLULU, HI, 96818-1516",,Mission not available,2017,Yes
https://www.charitynavigator.org/ein/270847782,National Aerospace Education Center,270847782,,,"Not currently rated, This organization is not rated, Not rated",,"PO BOX 1301, TULLAHOMA, TN, 37388-1301",,Mission not available,2010,Yes
https://www.charitynavigator.org/ein/270847821,Brookside Health Initiatives,270847821,,,"Not currently rated, This organization is not rated, Not rated",,"1902 S IH 35, AUSTIN, TX, 78704-3628",,Mission not available,2010,Yes
https://www.charitynavigator.org/ein/270848201,Celestial Love Foundation,270848201,,,"Not currently rated, This organization is not rated, Not rated",,"425 DEODAR LN, BRADBURY, CA, 91008-1016",,Mission not available,2010,Yes
https://www.charitynavigator.org/ein/270846916,ARIZONA UROLOGICAL SOCIETY,270846916,,,"Not currently rated, This organization is not rated, Not rated",http://AZUrological.org,"1950 OLD TUSTIN AVE, SANTA ANA, CA, 92705-7812",714-550-9155,The Arizona Urological Society is a professional association of urologic physicians for the purpose of continuing medical educaton for the advancement of patient car ... (More),2013,Yes
https://www.charitynavigator.org/ein/270848213,Vegas Nitro Athletics,270848213,,,"Not currently rated, This organization is not rated, Not rated",,"2682 MIRABELLA ST, HENDERSON, NV, 89052-3172",,Mission not available,2012,Yes
https://www.charitynavigator.org/ein/270847643,Dallas Christian Home Educators,270847643,,,"Not currently rated, This organization is not rated, Not rated",,"PO BOX 1104, CEDAR HILL, TX, 75106-1104",,Mission not available,2012,Yes
https://www.charitynavigator.org/ein/270849015,Joelton Hope Center,270849015,83%,3,,,"212 GIFFORD PL, JOELTON, TN, 37080-8668",,Joelton Hope Center operates as a thrift store that supports a food pantry.,2010,No
https://www.charitynavigator.org/ein/270849161,Eritrean American Community,270849161,,,"Not currently rated, This organization is not rated, Not rated",,"401 BUSINESS PKWY, RICHARDSON, TX, 75081-5012",,Mission not available,2012,Yes
https://www.charitynavigator.org/ein/270849383,Texas Youth Rugby Association,270849383,,,"Not currently rated, This organization is not rated, Not rated",,"12822 BONNYWOOD LN, CYPRESS, TX, 77429-2202",214-914-3133,FACILITATE AND GROW YOUTH (BOYS AND GIRLS) RUGBY IN THE STATE OF TEXAS.,2010,Yes
https://www.charitynavigator.org/ein/270848301,Noah Webster College,270848301,,,"Not currently rated, This organization is not rated, Not rated",,"12820 INDIAN SCHOOL RD NE, ALBUQUERQUE, NM, 87112-4722",,Mission not available,2011,Yes
https://www.charitynavigator.org/ein/270849384,LIBERTY MOVEMENT MINISTRY,270849384,,,"Not currently rated, This organization is not rated, Not rated",,"4603 LAKE WORTH RD, GREENACRES, FL, 33463-3451",,Mission not available,1991,Yes
https://www.charitynavigator.org/ein/270848858,Caribbean Vision Ministries Inc.,270848858,,,"Not currently rated, This organization is not rated, Not rated",,"14458 VIA ROYALE, DELRAY BEACH, FL, 33446-3369",,Mission not available,2010,Yes
https://www.charitynavigator.org/ein/270849483,Rodney E Luckie Foundation for Children -veterans and Families,270849483,,,"Not currently rated, This organization is not rated, Not rated",,"7970 FREDERICKSBURG RD, SAN ANTONIO, TX, 78229-3890",,Mission not available,2018,Yes
https://www.charitynavigator.org/ein/270849168,KNIGHTS OF COLUMBUS,270849168,,,"Not currently rated, This organization is not rated, Not rated",,"4 C ST, LAKE LOTAWANA, MO, 64086-9727",,Mission not available,1940,Yes
https://www.charitynavigator.org/ein/270849509,Umuoji Improvement Union-North America,270849509,,,"Not currently rated, This organization is not rated, Not rated",,"3808 SW BOULDER DR, LEES SUMMIT, MO, 64082-4831",,Mission not available,2011,Yes
https://www.charitynavigator.org/ein/270849601,Community Action for Affordable Neighborhoods,270849601,,,"Not currently rated, This organization is not rated, Not rated",,"PO BOX 51650, KNOXVILLE, TN, 37950-1650",865-244-3080,TO PROVIDE FINANCIAL AND CONSTRUCTION SERVICES TO LOW INCOME INDIVDUALS AND FAMILIES IN KNOXVILLE WHO WISH TO PURCHASE OR CONSTRUCT A HOME IN THE CITY LIMITS.,2010,Yes
https://www.charitynavigator.org/ein/270850059,Giovanni Costigan Foundation,270850059,,,"Not currently rated, This organization is not rated, Not rated",,"6548 JONES AVE NW, SEATTLE, WA, 98117-5741",,Mission not available,2014,Yes
https://www.charitynavigator.org/ein/270850451,ANCIENT MYSTICAL ORDER OF ROSAE,270850451,,,"Not currently rated, This organization is not rated, Not rated",,"1671 W 37TH ST STE 7, HIALEAH, FL, 33012-4639",,Mission not available,1964,Yes
https://www.charitynavigator.org/ein/270850527,El Paso Area Texas Association of School Business Officials,270850527,,,"Not currently rated, This organization is not rated, Not rated",,"5920 W WILLIAM CANNON DR BLDG 1-200, AUSTIN, TX, 78749-1903",,Mission not available,2014,Yes
https://www.charitynavigator.org/ein/270850562,Adoption Dream Foundation Inc.,270850562,,,"Not currently rated, This organization is not rated, Not rated",,"2741 VININGS ORCHARD CIR SE, ATLANTA, GA, 30339-1617",,Mission not available,2011,Yes
https://www.charitynavigator.org/ein/270850961,Psalms Church,270850961,,,"Not currently rated, This organization is not rated, Not rated",,"26640 BOUQUET CANYON RD, SANTA CLARITA, CA, 91350-2355",,Mission not available,2009,Yes
https://www.charitynavigator.org/ein/270851162,Amore Transitional Group Inc.,270851162,,,"Not currently rated, This organization is not rated, Not rated",,"539 W COMMERCE ST, DALLAS, TX, 75208-1953",,Mission not available,2010,Yes
https://www.charitynavigator.org/ein/270850991,Lion Mountain Charity Foundation,270850991,,,"Not currently rated, This organization is not rated, Not rated",,"163 CRESTVIEW CT, WATSONVILLE, CA, 95076-2793",,Mission not available,2010,Yes
https://www.charitynavigator.org/ein/270851570,Climate Prosperity Project Inc.,270851570,,,"Not currently rated, This organization is not rated, Not rated",,"4240 DUNCAN AVE, SAINT LOUIS, MO, 63110-1108",,Mission not available,2010,Yes
https://www.charitynavigator.org/ein/270851334,AWAY STATION INC,270851334,,,"Not currently rated, This organization is not rated, Not rated, Review Before Proceeding",http://WWW.THEAWAYSTATION.ORG,"7599 REDWOOD BLVD STE 210, NOVATO, CA, 94945-7706",415-453-4221,OUR MISSION IS TO PRODUCTIVELY AND CREATIVELY SERVE THE COMMUNITY AND THE PLANET BY THE ORGANIZED COLLECTION AND REDISTRIBUTION OF THE BY-PRODUCTS OF CONSUMPTION. TH ... (More),2010,Yes
https://www.charitynavigator.org/ein/270851441,CHRISTS COWBOY COUNTRY CHURCH,270851441,,,"Not currently rated, This organization is not rated, Not rated",,"2317 CHAPARRO LN, BLACKFOOT, ID, 83221-4027",,Mission not available,1969,Yes
https://www.charitynavigator.org/ein/270851981,Montclair School Peak Partnership,270851981,,,"Not currently rated, This organization is not rated, Not rated",,"1151 NEWPORT ST, DENVER, CO, 80220-4751",,Mission not available,2010,Yes
https://www.charitynavigator.org/ein/270852084,Intown Cares (formerly Intown Collaborative Ministries),270852084,100%,4,,http://intowncares.org,"1026 PONCE DE LEON AVE NE, ATLANTA, GA, 30306-4216",404-590-6956,To prevent and reverse homelessness and hunger in Intown Atlanta.,2010,No
https://www.charitynavigator.org/ein/270851766,Courageous Women Association Inc.,270851766,,,"Not currently rated, This organization is not rated, Not rated",,"1714 FRANKLIN ST, OAKLAND, CA, 94612-3488",,Mission not available,2011,Yes
https://www.charitynavigator.org/ein/270852113,Support Police Inc.,270852113,,,"Not currently rated, This organization is not rated, Not rated",,"1033 HAT CREEK RD, BARTONVILLE, TX, 76226-1709",,Mission not available,2009,Yes
https://www.charitynavigator.org/ein/270852550,Brazos Valley Youth Soccer Association Inc.,270852550,,,"Not currently rated, This organization is not rated, Not rated",,"3908 TRANQUIL PATH DR, COLLEGE STA, TX, 77845-4982",,Mission not available,2020,Yes
https://www.charitynavigator.org/ein/270852282,Y&C Charitable Foundation,270852282,,,"Not currently rated, This organization is not rated, Not rated",,"1888 N SHERMAN ST STE 600, DENVER, CO, 80203-1160",,Mission not available,2011,Yes
https://www.charitynavigator.org/ein/270852377,Ocean Park Food Bank,270852377,,,"Not currently rated, This organization is not rated, Not rated",,"PO BOX 907, OCEAN PARK, WA, 98640-0907",916-502-5671,The mission of Ocean Park Food Bank is to distribute food and other items of personal necessity to those who present themselves in need.,2010,Yes
https://www.charitynavigator.org/ein/270852887,Great Schools for America,270852887,,,"Not currently rated, This organization is not rated, Not rated",,"1030 SW JEFFERSON ST APT 229, PORTLAND, OR, 97201-3449",,Mission not available,2010,Yes
https://www.charitynavigator.org/ein/270852693,Ladies De Classic Inc.,270852693,,,"Not currently rated, This organization is not rated, Not rated",,"1464 PALADIN CT, HAMPTON, GA, 30228-3248",,Mission not available,2021,Yes
https://www.charitynavigator.org/ein/270852937,US COMMITTEE FOR UN FUND FOR WOMEN INC,270852937,,,"Not currently rated, This organization is not rated, Not rated",,"50 LAGUNA STREET, SAN FRANCISCO, CA, 94102-6257",,Mission not available,2010,Yes
https://www.charitynavigator.org/ein/270852695,Central School Parent Teacher Organization Inc.,270852695,,,"Not currently rated, This organization is not rated, Not rated",,"990 RYLAND PIKE, HUNTSVILLE, AL, 35811-8733",,Mission not available,2012,Yes
https://www.charitynavigator.org/ein/270852700,Stanwood Camano Rotary Foundation,270852700,,,"Not currently rated, This organization is not rated, Not rated",,"PO BOX 1754, STANWOOD, WA, 98292-1754",,Mission not available,2010,Yes
https://www.charitynavigator.org/ein/270853506,USBG OREGON CHAPTER,270853506,,,"Not currently rated, This organization is not rated, Not rated",,"2654 W HORIZON RIDGE PKWY B5 PMB252, HENDERSON, NV, 89052-2858",,Mission not available,2020,Yes
https://www.charitynavigator.org/ein/270853035,GRANITE COMMUNITY COUNCIL,270853035,,,"Not currently rated, This organization is not rated, Not rated",,"2743 E KSEL DR, GRANITE, UT, 84092-3449",,Mission not available,2022,Yes
https://www.charitynavigator.org/ein/270853953,Regalos De Dios,270853953,,,"Not currently rated, This organization is not rated, Not rated",,"3392 CLAYTON RD, CONCORD, CA, 94519-2837",,Mission not available,2010,Yes
https://www.charitynavigator.org/ein/270854756,Institute for A Progressive Nevada,270854756,77%,3,,http://www.instituteforaprogressivenevada.org,"2657 WINDMILL PKWY 619, HENDERSON, NV, 89074-3384",702-900-3665,"Institute for a Progressive Nevada educates, empowers, and engages Nevadans to build a state where everyone has a fair opportunity to succeed.",2010,No
https://www.charitynavigator.org/ein/270854213,PARK CITY AREA RESTAURANT ASSOCIATION,270854213,,,"Not currently rated, This organization is not rated, Not rated",http://PARKCITYRESTAURANTS.COM,"PO BOX 3162, PARK CITY, UT, 84060-3162",435-513-9334,TO PROMOTE THE RESTAURANTS OF SUMMIT COUNTY,2010,Yes
https://www.charitynavigator.org/ein/270854283,The Experience,270854283,,,"Not currently rated, This organization is not rated, Not rated",,"1919 21ST STREET, SACRAMENTO, CA, 95811-6827",,Mission not available,2011,Yes
https://www.charitynavigator.org/ein/270854852,BATTLE BORN PROGRESS,270854852,,,"Not currently rated, This organization is not rated, Not rated",http://www.battlebornprogress.org,"2657 WINDMILL PARKWAY 619, HENDERSON, NV, 89074-3384",702-900-3886,"Battle Born Progress, through strategic communication efforts, empowers, engages and mobilizes Nevada voters to build a state where everyone has a fair opportunity t ... (More)",2010,Yes
https://www.charitynavigator.org/ein/270855397,Tftsp Youth Golf Council St. Petersburg Florida Inc.,270855397,66%,2,,http://WWW.THEFIRSTTEESTPETERSBURG.ORG,"3790 22ND AVE S, ST PETERSBURG, FL, 33711-3123",727-685-5758,ARE TO POSITIVELY IMPACT THE YOUTH OF OUR COMMUNITIES BY PROVIDING A LEARNING ENVIRONMENT AND EDUCATIONAL PROGRAMS THAT PROMOTE CHARACTER DEVELOPMENT AND LIFE-ENHANC ... (More),2010,No
https://www.charitynavigator.org/ein/270855403,Community Vision of America,270855403,,,"Not currently rated, This organization is not rated, Not rated",,"2350 SW GREEN OAKS BLVD, ARLINGTON, TX, 76017-3708",,Mission not available,2010,Yes
https://www.charitynavigator.org/ein/270855113,Tampa Bay Charities Inc.,270855113,51%,1,,,"18395 GULF BLVD STE 204, INDIAN SHORES, FL, 33785-2001",727-391-4052,THE CORPORATION IS A VOLUNTEER GROUP ORGANIZED BY COMMUNITY LEADERS OF TAMPA BAY. THE MISSION IS TO RAISE MONEY FOR LOCAL CHARITIES AND SUPPORT THE TAMPA BAY COMMUNI ... (More),2012,No
https://www.charitynavigator.org/ein/270855533,Tba Foundation,270855533,,,"Not currently rated, This organization is not rated, Not rated",,"21005 REYNOLDS AVE 7, TORRANCE, CA, 90503-0000",,Mission not available,2010,Yes
https://www.charitynavigator.org/ein/270855567,Seneca Food Pantry Inc.,270855567,,,"Not currently rated, This organization is not rated, Not rated",,"PO BOX 164, SENECA, MO, 64865-0164",,Mission not available,2009,Yes
https://www.charitynavigator.org/ein/270856024,Emerald Eyes Animal Sanctuary,270856024,,,"Not currently rated, This organization is not rated, Not rated",,"20527 N HIGHWAY 36, BRAZORIA, TX, 77422-8160",,Mission not available,2010,Yes
https://www.charitynavigator.org/ein/270855937,Malama Pupukea-Waimea,270855937,,,"Not currently rated, This organization is not rated, Not rated",,"PO BOX 188, HALEIWA, HI, 96712-0188",,Mission not available,2011,Yes
https://www.charitynavigator.org/ein/270855628,Crowley Foundation Inc.,270855628,81%,3,,http://www.crowleycollegeprep.com,"2065 UINTA ST, DENVER, CO, 80238-3048",,"To provide educational opportunities, life-skills training, andcollege preparatory programs for low-income youth. We foster anddevelop learning and empowerment as a ... (More)",2010,No
https://www.charitynavigator.org/ein/270856047,One Million Aok,270856047,97%,4,,http://thinkkindness.org/,"316 CALIFORNIA AVE, RENO, NV, 89509-1650",,Inspire Kindness,2011,No
https://www.charitynavigator.org/ein/270855660,Winding Road Theater Ensemble,270855660,,,"Not currently rated, This organization is not rated, Not rated",,"PO BOX 64939, TUCSON, AZ, 85728-4939",,Mission not available,2010,Yes
https://www.charitynavigator.org/ein/270856224,Friends of Dreamland,270856224,83%,3,,http://WWW.DREAMLANDBALLROOM.ORG,"800 W 9TH ST, LITTLE ROCK, AR, 72201-4034",501-255-5700,"FRIENDS OF DREAMLAND CELEBRATES THE COMMUNITY OF HISTORIC WEST NINTH STREET, SHARES THE LEGACY OF DREAMLAND BALLROOM, AND PRESERVES THE ORIGINAL INTENT OF TABORIAN H ... (More)",2010,No
https://www.charitynavigator.org/ein/270856345,Tashi Thek Chok Ling,270856345,,,"Not currently rated, This organization is not rated, Not rated",,"524 KEARNEY ST APT 201, EL CERRITO, CA, 94530-3535",,Mission not available,2022,Yes
https://www.charitynavigator.org/ein/270856057,Birchtree Parents Guild,270856057,,,"Not currently rated, This organization is not rated, Not rated",,"PO BOX 2969, PALMER, AK, 99645-0000",,Mission not available,2010,Yes
https://www.charitynavigator.org/ein/270856041,Kitechild,270856041,50%,1,Review Before Proceeding,,"6420 DELAPLANE RD, MALIBU, CA, 90265-1707",760-366-8528,"AT THE MOTHER ESTHER CENTER, WE INSTALLED 3 GREEN HOUSES AND A HALF OPEN LAND DRIPIRRIGATION SYSTEM. THE CHILDREN AT THE CENTER EAT FROM THE FARM, AND THE EXTRA PROD ... (More)",2010,Yes
https://www.charitynavigator.org/ein/270856438,Rising Above International,270856438,,,"Not currently rated, This organization is not rated, Not rated",,"106 RUE BONPAPA, THIBODAUX, LA, 70301-5623",,Mission not available,2010,Yes
https://www.charitynavigator.org/ein/270856560,McLean Cowboy Church,270856560,,,"Not currently rated, This organization is not rated, Not rated",,"PO BOX 89, MCLEAN, TX, 79057-0089",,Mission not available,2011,Yes
https://www.charitynavigator.org/ein/270856575,Nakoa Foundation,270856575,83%,3,,http://WWW.NAPEA.INFO/NAKOA-FOUNDATION,"PO BOX 4887, KAILUA KONA, HI, 96745-4887",808-313-0765,CHILD MENTORING,2015,No
https://www.charitynavigator.org/ein/270856996,North Urban Human Services Alliance,270856996,,,"Not currently rated, This organization is not rated, Not rated",,"PO BOX 60215, SEATTLE, WA, 98160-0215",,Mission not available,2010,Yes
https://www.charitynavigator.org/ein/270856505,Richardson Community Center-Annie Mattox Park North Inc.,270856505,,,"Not currently rated, This organization is not rated, Not rated",,"PO BOX 764, LAKE CITY, FL, 32056-0764",386-754-7096,"TO OVERSEE AND ADVISE MENTORING, TRAINING, TUTORING, PARTNERSHIPS, RECREATION AND ATHLETIC PROGRAMS.",2021,Yes
https://www.charitynavigator.org/ein/270856684,Empower New Mexico Inc.,270856684,,,"Not currently rated, This organization is not rated, Not rated",,"119 SUNLIT DR W, SANTA FE, NM, 87508-9383",,Mission not available,2010,Yes
https://www.charitynavigator.org/ein/270857238,Village Schoolhouse Academy,270857238,,,"Not currently rated, This organization is not rated, Not rated",,"32110 NE 55TH ST, CARNATION, WA, 98014-6309",,Mission not available,2016,Yes
https://www.charitynavigator.org/ein/270857357,TARVALON NET INC,270857357,,,"Not currently rated, This organization is not rated, Not rated",,"1926 ROSALIE RIDGE DR NE, HUNTSVILLE, AL, 35811-2153",,Mission not available,2011,Yes
https://www.charitynavigator.org/ein/270857927,98 Fastpitch Softball,270857927,,,"Not currently rated, This organization is not rated, Not rated",,"5108 CHASTLETON CT, STONE MTN, GA, 30087-1444",,Mission not available,2016,Yes
https://www.charitynavigator.org/ein/270858326,FRANCIS HOWELL SCHOOL DISTRICT SUPPORT ORGANIZATION COUNCIL,270858326,,,"Not currently rated, This organization is not rated, Not rated",,"5201 HIGHWAY N, SAINT CHARLES, MO, 63304-7120",,Mission not available,1993,Yes
https://www.charitynavigator.org/ein/270858417,McNeil Maverick Volleyball Club,270858417,,,"Not currently rated, This organization is not rated, Not rated",,"5720 MCNEIL DR, AUSTIN, TX, 78729-6901",,Mission not available,2014,Yes
https://www.charitynavigator.org/ein/270858440,Santuario 21,270858440,,,"Not currently rated, This organization is not rated, Not rated",,"4850 J M TURK RD, FLOWERY BR, GA, 30542-5112",,Mission not available,2014,Yes
https://www.charitynavigator.org/ein/270858631,Corkins Family Foundation,270858631,,,"Not currently rated, This organization is not rated, Not rated",,"100 FILLMORE SUITE 325, DENVER, CO, 80206-0000",,Mission not available,2010,Yes
https://www.charitynavigator.org/ein/270857301,PARENT BOOSTER USA INC,270857301,,,"Not currently rated, This organization is not rated, Not rated",,"100 WILDCAT WAY, FAYETTEVILLE, GA, 30215-7823",,Mission not available,2005,Yes
https://www.charitynavigator.org/ein/270858731,Last Connection Inc.,270858731,,,"Not currently rated, This organization is not rated, Not rated",,"2740 BAYSHORE DR, NAPLES, FL, 34112-5892",,Mission not available,2012,Yes
https://www.charitynavigator.org/ein/270858890,POP WARNER LITTLE SCHOLARS INC,270858890,,,"Not currently rated, This organization is not rated, Not rated",,"2704 UNITY TREE DR, EDGEWATER, FL, 32141-5212",,Mission not available,1990,Yes
https://www.charitynavigator.org/ein/270858932,Canyon Lake Rotary Foundation,270858932,,,"Not currently rated, This organization is not rated, Not rated",,"PO BOX 1523, CANYON LAKE, TX, 78133-0003",,Mission not available,2010,Yes
https://www.charitynavigator.org/ein/270857345,Yorba Linda High School Basketball Booster Club,270857345,,,"Not currently rated, This organization is not rated, Not rated",,"19900 BASTANCHURY RD, YORBA LINDA, CA, 92886-8417",,Mission not available,2010,Yes
https://www.charitynavigator.org/ein/270857344,Make an Impact Inc.,270857344,,,"Not currently rated, This organization is not rated, Not rated",,"7 BRIAR PL, JOPLIN, MO, 64804-5807",,Mission not available,2011,Yes
https://www.charitynavigator.org/ein/270859354,Griffin Youth Soccer Association Incorporated,270859354,,,"Not currently rated, This organization is not rated, Not rated",,"PO BOX 2031, GRIFFIN, GA, 30224-0052",,Mission not available,2017,Yes
https://www.charitynavigator.org/ein/270859783,New Mexico Alliance for School Based Health Care,270859783,96%,4,,http://NMASBHC.ORG,"3301-R COORS BLVD NW STE 288, ALBUQUERQUE, NM, 87120-1229",505-404-8059,"NEW MEXICO ALLIANCE FOR SCHOOL-BASED HEALTH CARE REPRESENTS SCHOOL-BASED HEALTH CENTERS IN NM AND COLLABORATES WITH OTHER PARTNERS TO PROMOTE, FACILITATE, AND ADVOCA ... (More)",2010,No
https://www.charitynavigator.org/ein/270860328,Mammacare Foundation Inc.,270860328,41%,0,,http://MAMMACARE.ORG,"930 NW 8TH AVE, GAINESVILLE, FL, 32601-5071",352-375-0607,THE FOUNDATION PROVIDES CLINICAL TRAINING TECHNOLOGY FOR BREAST CANCER DETECTION.,2015,No
https://www.charitynavigator.org/ein/270859006,Oikos Latino Ministries Inc.,270859006,,,"Not currently rated, This organization is not rated, Not rated",,"17050 SW 95TH TER, MIAMI, FL, 33196-4758",,Mission not available,2010,Yes
https://www.charitynavigator.org/ein/270860536,Ministerio Restauracion Divina Inc.,270860536,,,"Not currently rated, This organization is not rated, Not rated",,"19038 NW 77TH PL, HIALEAH, FL, 33015-5260",,Mission not available,2013,Yes
https://www.charitynavigator.org/ein/270860750,International Culture Learning,270860750,,,"Not currently rated, This organization is not rated, Not rated, Review Before Proceeding",,"12265 WORLD TRADE DR STE H, SAN DIEGO, CA, 92128-3771",858-676-0408,Provide for Chinese language instruction and cultural enrichment.,2010,Yes
