url,name,ein,score,star_rating,keywords,website,address,phone,organization_mission,IRS_ruling_year,contain_keywords
https://www.charitynavigator.org/ein/743162876,Billerica Yankee Doodle Homecoming Inc.,743162876,,,"Not currently rated, Not rated, This organization is not rated",,"365 BOSTON RD, BILLERICA, MA, 01821-1892",,Mission not available,2010,Yes
https://www.charitynavigator.org/ein/743165462,Gohan Society,743165462,97%,4,,http://WWW.GOHANSOCIETY.ORG,"57 WARREN STREET, NEW YORK, NY, 10007-0033",212-385-3550,"THE MISSION OF THE GOHAN SOCIETY IS TO FOSTER A MUTUAL APPRECIATION OF CULINARY HERITAGE BETWEEN THE UNITED STATES AND JAPAN THROUGH OUTREACH TO CHEFS, CULINARY ARTS ... (More)",2008,No
https://www.charitynavigator.org/ein/743166588,LOVING EDUCATION AT HOME,743166588,,,"Not currently rated, Not rated, This organization is not rated",,"PO BOX 60617, STATEN ISLAND, NY, 10306-0617",,Mission not available,2002,Yes
https://www.charitynavigator.org/ein/743167191,UNIVERSITY OF MASSACHUSETTS,743167191,,,"Not currently rated, Not rated, This organization is not rated",,"463 COLLEGE HWY, SOUTHWICK, MA, 01077-9706",,Mission not available,2013,Yes
https://www.charitynavigator.org/ein/743168275,Friends of Bls Crew Inc.,743168275,,,"Not currently rated, Not rated, This organization is not rated",http://blscrew.org,"57 DENT ST, BOSTON, MA, 02132-3205",617-327-2463,This organization supports the Boston Latin School Crew Team through funding expenses not covered by the Boston public school system.,2006,Yes
https://www.charitynavigator.org/ein/743169269,Robin Kaplan Memorial Fund,743169269,76%,3,,http://www.rkmgt.com,"PO BOX 1171, UPTON, MA, 01568-6171",508-328-3064,"The Robin Kaplan Memorial Fund was established in 2006 to honor the memory of Robin Kaplan, who perished in the 2001 World Trade Center Attack. The fund raises reven ... (More)",2006,No
https://www.charitynavigator.org/ein/743169081,Pacem School Inc.,743169081,,,"Not currently rated, Not rated, This organization is not rated",http://PACEMSCHOOL.ORG,"32 COLLEGE ST STE 100, MONTPELIER, VT, 05602-3675",802-223-1010,EDUCATION,2008,Yes
https://www.charitynavigator.org/ein/743172619,Denniston Hill Corp,743172619,82%,3,,http://WWW.DENNISTONHILL.ORG,"PO BOX 728, GLEN WILD, NY, 12738-0728",845-434-2312,"DENNISTON HILL'S MISSION IS TO CREATE A SUSTAINABLE ENVIRONMENT IN WHICH TO PURSUE ARTISTIC DEVELOPMENT THROUGH RESIDENCES, EXHIBITIONS, AND EDUCATION PROGRAMS AND F ... (More)",2008,No
https://www.charitynavigator.org/ein/743174797,Word of the Lord Community Ministry,743174797,,,"Not currently rated, Not rated, This organization is not rated",,"PO BOX 1162, WYANDANCH, NY, 11798-0162",,Mission not available,2007,Yes
https://www.charitynavigator.org/ein/743174596,American Story Project Theater Company Inc.,743174596,,,"Not currently rated, Not rated, This organization is not rated",,"PO BOX 150240, BROOKLYN, NY, 11215-0240",,Mission not available,2007,Yes
https://www.charitynavigator.org/ein/743175428,Rufus Porter Museum Inc.,743175428,69%,2,,http://www.rufusportermuseum.org,"PO BOX 544, BRIDGTON, ME, 04009-0544",,"Celebrate the life and times of a remarkably creative American genius who worked throughout Maine, New England and beyond.",2006,No
https://www.charitynavigator.org/ein/743175471,Iglesia Cristiana Tesoro De Dios Inc.,743175471,,,"Not currently rated, Not rated, This organization is not rated",,"920 PROSPECT AVE STE 4-G, BRONX, NY, 10459-3960",,Mission not available,2006,Yes
https://www.charitynavigator.org/ein/743175640,New Art Asia Ltd.,743175640,,,"Not currently rated, Not rated, This organization is not rated",,"429 GREENWICH ST APT 5B, NEW YORK, NY, 10013-2053",,Mission not available,2006,Yes
https://www.charitynavigator.org/ein/743175958,Demarest Pto Inc.,743175958,56%,1,,http://DEMARESTPTO.ORG,"92 UNION AVE, CRESSKILL, NJ, 07626-2128",201-768-6060,CHILD ADVOCACY,2008,No
https://www.charitynavigator.org/ein/743176929,Hopedale Firefighters Association,743176929,,,"Not currently rated, Not rated, This organization is not rated",,"40 DUTCHER ST, HOPEDALE, MA, 01747-1223",,Mission not available,2021,Yes
https://www.charitynavigator.org/ein/743177344,UNITED STATES BOWLING CONGRESS INC,743177344,,,"Not currently rated, Not rated, This organization is not rated",,"139 RIVER RD, CLARKSBURG, MA, 01247-2147",,Mission not available,2004,Yes
https://www.charitynavigator.org/ein/743177454,Richmond Medical Center,743177454,81%,3,,http://WWW.RUMCSI.ORG,"355 BARD AVE, STATEN ISLAND, NY, 10310-1664",718-818-2036,"TO PROVIDE PREMIER QUALITY PATIENT CARE THROUGH A FULL SPECTRUM OF EMERGENT, ACUTE, PRIMARY, BEHAVIORAL HEALTH AND EDUCATIONAL SERVICES.",2007,No
https://www.charitynavigator.org/ein/743178289,Faith Power and Deliverance Center Inc.,743178289,,,"Not currently rated, Not rated, This organization is not rated",,"78 PLYMOUTH ST, NEW HAVEN, CT, 06519-2510",,Mission not available,2007,Yes
https://www.charitynavigator.org/ein/743180102,FIRST ASIAN BAPTIST CHURCH,743180102,,,"Not currently rated, Not rated, This organization is not rated",,"124 KINGS HWY E, HADDONFIELD, NJ, 08033-2004",,Mission not available,1955,Yes
https://www.charitynavigator.org/ein/743180274,LIGHTHOUSE ASSEMBLY OF GOD,743180274,,,"Not currently rated, Not rated, This organization is not rated",,"PO BOX 243, GOULDSBORO, ME, 04607-0243",,Mission not available,1964,Yes
https://www.charitynavigator.org/ein/743181556,AMERICAN FEDERATION OF TEACHERS,743181556,,,"Not currently rated, Not rated, This organization is not rated",,"3830 PAULDING AVE, BRONX, NY, 10469-1220",,Mission not available,1967,Yes
https://www.charitynavigator.org/ein/743181629,Masjid Muhammad of Atlantic City,743181629,,,"Not currently rated, Not rated, This organization is not rated",,"300 N ALBANY AVE, ATLANTIC CITY, NJ, 08401-1332",,SPIRITUAL DEVELOPMENT OF THE ISLAMIC RELIGION,2007,Yes
https://www.charitynavigator.org/ein/743182378,Insaan Group,743182378,97%,4,,http://www.insaangroup.org,"105 5TH AVE APT 8C, NEW YORK, NY, 10003-1016",678-656-3896,See Schedule O,2007,No
https://www.charitynavigator.org/ein/743182358,Solidarite Haitienne Pour L Action Sociale,743182358,,,"Not currently rated, Not rated, This organization is not rated",,"PO BOX 847, W HEMPSTEAD, NY, 11552-0847",,Mission not available,2014,Yes
https://www.charitynavigator.org/ein/743182897,Towerbrook Foundation,743182897,,,"Not currently rated, Not rated, This organization is not rated",,"65 PARK AVE, NEW YORK, NY, 10016-3094",,Mission not available,2007,Yes
https://www.charitynavigator.org/ein/743182928,GREEN SPA NETWORK,743182928,,,"Not currently rated, Not rated, This organization is not rated",http://www.greenspanetwork.org,"PO BOX 2170, NANTUCKET, MA, 02584-2170",404-874-9516,THE PURPOSES FOR WHICH THE CORPORATION IS FORMED AND WHICH ARE TO BE PROMOTED OR CARRIED ON BY THE CORPORATION ARE TO OPERATE EXCLUSIVELY AS A TRADE ASSOCIATION FOR ... (More),2009,Yes
https://www.charitynavigator.org/ein/743183114,Arts on the Lake Inc.,743183114,,,"Not currently rated, Not rated, This organization is not rated",,"640 ROUTE 52, CARMEL, NY, 10512-6226",,Mission not available,2007,Yes
https://www.charitynavigator.org/ein/743183154,Friends of Tribute Park Inc.,743183154,,,"Not currently rated, Not rated, This organization is not rated",,"PO BOX 940214, ROCKAWAY PARK, NY, 11694-0214",,Mission not available,2014,Yes
https://www.charitynavigator.org/ein/743184835,Center for the Integration and Advancement of New Americans Inc.,743184835,96%,4,,http://www.cianainc.org,"36-12 34TH AVENUE, ASTORIA, NY, 11106-1358",718-545-4040,TO PREVENT THE GROWING MARGINIZALIZATION OF NEW IMMIGRANTS & REFUGEES FROM HIGHLY TRADITIONAL SOCIETIES THROUGH SPECIAL TRANSITIONAL SERVICES CONT,2008,No
https://www.charitynavigator.org/ein/743186199,Lions District 20-K1 Foundation Inc.,743186199,,,"Not currently rated, Not rated, This organization is not rated",,"PO BOX 238, VALLEY STREAM, NY, 11582-0238",,Mission not available,2008,Yes
https://www.charitynavigator.org/ein/743186259,The Granite State Childrens Alliance,743186259,96%,4,,,"72 S RIVER RD STE 202, BEDFORD, NH, 03110-6759",603-864-0215,"THE ALLIANCE, WORKING CLOSELY WITH LAW ENFORCEMENT OFFICIALS AND DCYF, (SEE SCHEDULE O)FACILITATES A MULTIDISCIPLINARY APPROACH TO CHILD ABUSE INVESTIGATIONS. ADDITI ... (More)",2006,No
https://www.charitynavigator.org/ein/743186476,Albany Barn Inc.,743186476,54%,1,,http://www.albanybarn.org,"56 2ND STREET, ALBANY, NY, 12210-2545",518-935-4858,"Albany Barn is dedicated to providing a sustainable creative arts incubator and community arts center in Albany and Schenectady NY a place for artists to live, work ... (More)",2007,No
https://www.charitynavigator.org/ein/743186923,Deep Roots Ministries Inc.,743186923,,,"Not currently rated, Not rated, This organization is not rated",,"PO BOX 370, GLEN SPEY, NY, 12737-0370",,Mission not available,2006,Yes
https://www.charitynavigator.org/ein/743186759,MORIAH LODGE BUILDING CORPORATION,743186759,,,"Not currently rated, Not rated, This organization is not rated",,"PO BOX 212, BROOKLYN, CT, 06234-0212",,Mission not available,2006,Yes
https://www.charitynavigator.org/ein/743187547,Avalon Volunteer Fire Department,743187547,67%,2,,,"PO BOX 311, AVALON, NJ, 08202-0311",609-967-8242,TO PROVIDE FIRE PROTECTION TO RESIDENTIAL AND COMMERCIAL BUILDINGS. TO PROVIDE FIRE PREVENTION EDUCATION. TO TRAIN MEMBER FIREFIGHTERS AND MAINTAIN APPARATUS.,2014,No
https://www.charitynavigator.org/ein/743188071,AMATEUR ATHLETIC UNION OF THE UNITED STATES,743188071,,,"Not currently rated, Not rated, This organization is not rated",,"998C OLD COUNTRY ROAD 266, PLAINVIEW, NY, 11803-4917",,Mission not available,1966,Yes
https://www.charitynavigator.org/ein/743189940,Gods Touch Healing Ministry Inc.,743189940,,,"Not currently rated, Not rated, This organization is not rated",,"12205 FLATLANDS AVE APT E, BROOKLYN, NY, 11207-9052",,Mission not available,2010,Yes
https://www.charitynavigator.org/ein/743190154,PTA RHODE ISLAND CONGRESS OF PARENTS AND TEACHERS,743190154,,,"Not currently rated, Not rated, This organization is not rated",,"30 NOOSENECK HILL RD, EXETER, RI, 02822-2100",,Mission not available,1964,Yes
https://www.charitynavigator.org/ein/743191456,CIVIL SERVICE EMPLOYEES ASSOCIATION,743191456,,,"Not currently rated, Not rated, This organization is not rated",,"4163, LIVERPOOL, NY, 13090-0000",,Mission not available,1970,Yes
https://www.charitynavigator.org/ein/743191762,Sisters of Greater Long Island,743191762,,,"Not currently rated, Not rated, This organization is not rated",,"121 NATHALIE AVE, AMITYVILLE, NY, 11701-1842",,Mission not available,2008,Yes
https://www.charitynavigator.org/ein/743191623,First Congregational Society in Gilmanton,743191623,,,"Not currently rated, Not rated, This organization is not rated",,"544 MEETING HOUSE RD, GILMANTON, NH, 03237-5220",,Mission not available,2022,Yes
https://www.charitynavigator.org/ein/743191824,Freetown Secondary School for Girls Ex-Pupils Association,743191824,,,"Not currently rated, Not rated, This organization is not rated",,"187 FOUNTAIN AVE, BROOKLYN, NY, 11208-2513",,Mission not available,2015,Yes
https://www.charitynavigator.org/ein/743191907,Kennebunk Soccer Club Inc.,743191907,,,"Not currently rated, Not rated, This organization is not rated",,"PO BOX 164, KENNEBUNK, ME, 04043-0164",,Mission not available,2007,Yes
https://www.charitynavigator.org/ein/743192062,Touch Uganda Inc.,743192062,,,"Not currently rated, Not rated, This organization is not rated",,"186 SUMMIT CIR, SHELBURNE, VT, 05482-6752",,Mission not available,2008,Yes
https://www.charitynavigator.org/ein/743192225,VETERANS ASSOCIATION OF AMERICA,743192225,,,"Not currently rated, Not rated, This organization is not rated",,"522 W 158TH ST APT 34, NEW YORK, NY, 10032-7243",,Mission not available,2009,Yes
https://www.charitynavigator.org/ein/743192695,The New Hampshire School of Ballet Boost Club,743192695,,,"Not currently rated, Not rated, This organization is not rated",,"183 LONDONDERRY TPKE, HOOKSETT, NH, 03106-1938",,Mission not available,2020,Yes
https://www.charitynavigator.org/ein/743193066,Amanuel Ethiopian Orthodox Tewahedo Church Inc.,743193066,,,"Not currently rated, Not rated, This organization is not rated",,"15 DEAN ST, WEST ORANGE, NJ, 07052-5219",,Mission not available,2015,Yes
https://www.charitynavigator.org/ein/743193740,North Reading Firemens Relief Association,743193740,,,"Not currently rated, Not rated, This organization is not rated",,"152 PARK ST, NORTH READING, MA, 01864-2540",,Mission not available,2007,Yes
https://www.charitynavigator.org/ein/743193669,Quinn Elementary School Parent Group Inc.,743193669,,,"Not currently rated, Not rated, This organization is not rated",,"529 HAWTHORN ST, DARTMOUTH, MA, 02747-3714",508-997-3178,"THE ORGANIZATION'S PURPOSE IS TO FOSTER COMMUNITY INTEREST IN THE ACADEMIC ENVIRONMENT OF THE JAMES QUINN ELEMENTARY SCHOOL IN DARTMOUTH, MASSACHUSETTS.",2022,Yes
https://www.charitynavigator.org/ein/743195386,Ivorybill Foundation Inc.,743195386,,,"Not currently rated, Not rated, This organization is not rated",,"30B GROVE ST, PITTSFORD, NY, 14534-1334",,Mission not available,2007,Yes
https://www.charitynavigator.org/ein/743195833,Gods Deliverance Temple Inc.,743195833,,,"Not currently rated, Not rated, This organization is not rated",,"15 ANTWERP ST, BUFFALO, NY, 14211-2001",,Mission not available,2008,Yes
https://www.charitynavigator.org/ein/743196050,Golden Decade Foundation,743196050,,,"Not currently rated, Not rated, This organization is not rated",,"6 LAKE DR, BUCHANAN, NY, 10511-1129",,Mission not available,2019,Yes
https://www.charitynavigator.org/ein/743196837,Have Mercy Ministries Inc.,743196837,,,"Not currently rated, Not rated, This organization is not rated",,"PO BOX 1351, MAPLEWOOD, NJ, 07040-0456",,Mission not available,2007,Yes
https://www.charitynavigator.org/ein/743196968,Genesis Charities of New Jersey,743196968,,,"Not currently rated, Not rated, This organization is not rated",,"377 TANSBORO RD, BERLIN, NJ, 08009-9743",,Mission not available,2007,Yes
https://www.charitynavigator.org/ein/743197137,Kingston Lake Association,743197137,,,"Not currently rated, Not rated, This organization is not rated",,"PO BOX 1018, KINGSTON, NH, 03848-1018",,Mission not available,2008,Yes
https://www.charitynavigator.org/ein/743197704,MAINE STATE CHAMBER PURCHASING ALLIANCE INC,743197704,,,"Not currently rated, Not rated, This organization is not rated",,"128 STATE ST STE 101, AUGUSTA, ME, 04330-5630",,Mission not available,2008,Yes
https://www.charitynavigator.org/ein/743199024,Berkshire Missions Inc.,743199024,83%,3,,http://WWW.AFRICACONNECT.ORG,"PO BOX 315, TYRINGHAM, MA, 01264-0315",413-446-9651,EDUCATION AND REHABILITATION,2016,No
https://www.charitynavigator.org/ein/743199193,West Potsdam Volunteer Fire Department,743199193,76%,3,,http://WPFD.INFO,"801 COUNTY ROUTE 34, POTSDAM, NY, 13676-3537",315-265-2577,"TO DO ALL THINGS NECESSARY, ADVISABLE AND PROPER, BY ITS MEMBERS FOR THE PROTECTION OF PERSONS AND PROPERTY FROM FIRE, INJURY AND DAMAGE, AND IN THE MATTER OF THE FI ... (More)",2011,No
https://www.charitynavigator.org/ein/743201002,Edward S and Winifred G Moseley Foundation,743201002,,,"Not currently rated, Not rated, This organization is not rated",,"PRIO WEALTH 265 FRANKLIN ST 20FL, BOSTON, MA, 02110-0000",,Mission not available,2007,Yes
https://www.charitynavigator.org/ein/743199207,Winnipesaukee Playhouse,743199207,92%,4,,http://WWW.WINNIPESAUKEEPLAYHOUSE.ORG,"33 FOOTLIGHT CIR, MEREDITH, NH, 03253-5517",603-279-0333,"TO ADVANCE THE ART FORM OF THEATRE THROUGH WORK THAT INSPIRES, ENGAGES, AND ENTERTAINS THE PEOPLE OF OUR COMMUNITY AND BEYOND.",2007,No
https://www.charitynavigator.org/ein/743202017,SHRINERS INTERNATIONAL,743202017,,,"Not currently rated, Not rated, This organization is not rated",,"3 GRIST MILL ST, SUTTON, NH, 03221-6804",,Mission not available,1940,Yes
https://www.charitynavigator.org/ein/743202146,Varick Memorial A M E Zion Church,743202146,,,"Not currently rated, Not rated, This organization is not rated",,"PO BOX 210435, BROOKLYN, NY, 11221-0435",,Mission not available,2009,Yes
https://www.charitynavigator.org/ein/743202652,New Jersey Amateur Racquetball,743202652,,,"Not currently rated, Not rated, This organization is not rated",,"14 CRAWFORD RD, MANALAPAN, NJ, 07726-8393",,Mission not available,2007,Yes
https://www.charitynavigator.org/ein/743203078,Clifford Chance Foundation Inc.,743203078,,,"Not currently rated, Not rated, This organization is not rated",,"375 9TH AVE, NEW YORK, NY, 10001-1696",,Mission not available,2007,Yes
https://www.charitynavigator.org/ein/743203534,The Oxford Ecumenical Council Inc.,743203534,,,"Not currently rated, Not rated, This organization is not rated",,"PO BOX 448, OXFORD, MA, 01540-0448",,Mission not available,2007,Yes
https://www.charitynavigator.org/ein/743204389,NEW JERSEY CIVIL JUSTICE REFORM INSTITUTE INC,743204389,,,"Not currently rated, Not rated, This organization is not rated",http://WWW.CIVILJUSTICENJ.ORG,"63 CORYELL ST STE B, LAMBERTVILLE, NJ, 08530-1715",609-392-6557,"STATE'S LEADING ORGANIZATION ADVOCATING FOR THE BUSINESS COMMUNITY ON MATTERS OF LAW AND LEGAL POLICY. TO PROMOTE A FAIR AND PREDICTABLE CIVIL JUSTICE SYSTEM, AND DE ... (More)",2011,Yes
https://www.charitynavigator.org/ein/743204994,The Green Brook Police Officer Civic Assn Inc.,743204994,,,"Not currently rated, Not rated, This organization is not rated",,"PO BOX 7043, GREEN BROOK, NJ, 08812-7043",,Mission not available,2014,Yes
https://www.charitynavigator.org/ein/743205322,PROTEIA INC,743205322,,,"Not currently rated, Not rated, This organization is not rated",,"C/O PETER M WRIGHT 8 W 77 ST APT 8C, NEW YORK, NY, 10024-0000",,Mission not available,2007,Yes
https://www.charitynavigator.org/ein/743205875,Rotary of the Plainfields Inc.,743205875,,,"Not currently rated, Not rated, This organization is not rated",,"342 RAHWAY AVE, S PLAINFIELD, NJ, 07080-3741",,Mission not available,2007,Yes
https://www.charitynavigator.org/ein/743206125,Iglesia Oasis De Esperanza,743206125,,,"Not currently rated, Not rated, This organization is not rated",,"61 ASTORIA AVE, BRIDGEPORT, CT, 06604-1706",,Mission not available,2008,Yes
https://www.charitynavigator.org/ein/743206754,ALPHA EPSILON PHI SORORITY,743206754,,,"Not currently rated, Not rated, This organization is not rated",,"11 LAKE AVENUE EXT STE 1A, DANBURY, CT, 06811-5258",,Mission not available,2011,Yes
https://www.charitynavigator.org/ein/743207162,Global Health Society Inc.,743207162,,,"Not currently rated, Not rated, This organization is not rated",,"151 EYSAMAN RD, LITTLE FALLS, NY, 13365-3846",,Mission not available,2007,Yes
https://www.charitynavigator.org/ein/743208193,Memphremagog Arts Collaborative Inc.,743208193,,,"Not currently rated, Not rated, This organization is not rated",,"158 MAIN ST STE 2, NEWPORT, VT, 05855-4417",,Mission not available,2011,Yes
https://www.charitynavigator.org/ein/743208398,WARDROOM CLUB,743208398,,,"Not currently rated, Not rated, This organization is not rated",,"201 CONCORD TPKE APT 2602, CAMBRIDGE, MA, 02140-2785",,Mission not available,2007,Yes
https://www.charitynavigator.org/ein/743208690,Mount Holly Chitchat Inc.,743208690,,,"Not currently rated, Not rated, This organization is not rated",,"3379 SHUNPIKE RD, MOUNT HOLLY, VT, 05758-9632",,Mission not available,2007,Yes
https://www.charitynavigator.org/ein/743209606,Gottehrer Family Foundation Inc.,743209606,,,"Not currently rated, Not rated, This organization is not rated",,"5114 FORT HAMILTON PKWY, BROOKLYN, NY, 11219-4006",,Mission not available,2007,Yes
https://www.charitynavigator.org/ein/743211443,REVIVAL ASSEMBLY OF GOD,743211443,,,"Not currently rated, Not rated, This organization is not rated",,"14512 SHORE AVE, JAMAICA, NY, 11435-5316",,Mission not available,1964,Yes
https://www.charitynavigator.org/ein/743210509,Friends of the Bristol Animal Shelter,743210509,83%,3,,http://www.friendsoffoley.org/,"11 BROADCOMMON ROAD BOX 155, BRISTOL, RI, 02809-2758",401-457-8581,Design & Operation of Animal Shelter,2007,No
https://www.charitynavigator.org/ein/743212948,New England Regional Theater Company,743212948,,,"Not currently rated, Not rated, This organization is not rated",,"20 DAVIS ST, BRUNSWICK, ME, 04011-3102",,Mission not available,2007,Yes
https://www.charitynavigator.org/ein/743213341,Houlton Area Babe Ruth Baseball,743213341,,,"Not currently rated, Not rated, This organization is not rated",,"44 MEADOW LN, HOULTON, ME, 04730-1952",,Mission not available,2013,Yes
https://www.charitynavigator.org/ein/743213495,Parents Association of Lyceum Kennedy,743213495,,,"Not currently rated, Not rated, This organization is not rated",,"225 EAST 43RD STREET, NEW YORK, NY, 10017-4753",,Mission not available,2022,Yes
https://www.charitynavigator.org/ein/743217310,PORTSMOUTH UNITED FOR EDUCATION INC,743217310,,,"Not currently rated, Not rated, This organization is not rated",,"1351 W MAIN RD, PORTSMOUTH, RI, 02871-1327",,Mission not available,2009,Yes
https://www.charitynavigator.org/ein/743217334,Ssg Joseph M Weiglein Memorial Foundation,743217334,,,"Not currently rated, Not rated, This organization is not rated",,"PO BOX 82, AUDUBON, NJ, 08106-0082",,Mission not available,2007,Yes
https://www.charitynavigator.org/ein/743217479,Gabriela Mistral Foundation Inc.,743217479,,,"Not currently rated, Not rated, This organization is not rated",,"PO BOX 32, BRONX, NY, 10463-0032",,Mission not available,2008,Yes
https://www.charitynavigator.org/ein/743218233,Friends of Massapequa Wrestling Inc.,743218233,,,"Not currently rated, Not rated, This organization is not rated",,"CO TARA TARASI 82 LINDEN STREET, MASSAPEQUA, NY, 11758-0000",,Mission not available,2009,Yes
https://www.charitynavigator.org/ein/743218897,First Step Recovery House Inc.,743218897,,,"Not currently rated, Not rated, This organization is not rated",,"1174 NORTH AVE STE 2, BURLINGTON, VT, 05408-2761",,Mission not available,2010,Yes
https://www.charitynavigator.org/ein/743219295,Guyanese Wives Association,743219295,,,"Not currently rated, Not rated, This organization is not rated",,"998 HEMLOCK ST, BROOKLYN, NY, 11208-5510",,Mission not available,2014,Yes
https://www.charitynavigator.org/ein/743219871,Norwegian Christian Home Foundation,743219871,57%,1,,http://WWW.NCHHC.ORG,"1250 67TH ST, BROOKLYN, NY, 11219-5921",718-232-2322,"THE NCHF HAS BEEN FORMED TO FURTHER THE MISSION OF THE NORWEGIAN CHRISTIAN HOME AND HEALTH CENTER (NCHHC), A NEW YORK NOT FOR PROFIT CORPORATION WHICH STATES ""MOTIVA ... (More)",2008,No
https://www.charitynavigator.org/ein/743220965,East Wallingford Volunteer Fire Department Incorporated,743220965,,,"Not currently rated, Not rated, This organization is not rated",,"2 KONDRACKI LN, WALLINGFORD, CT, 06492-4938",,Mission not available,2012,Yes
https://www.charitynavigator.org/ein/743221390,Millville Police Athletic League,743221390,,,"Not currently rated, Not rated, This organization is not rated",,"PO BOX 1491, MILLVILLE, NJ, 08332-8491",,Mission not available,2008,Yes
https://www.charitynavigator.org/ein/743221430,The Korean Language and Cultural Education Institute Incorporated,743221430,,,"Not currently rated, Not rated, This organization is not rated",,"PO BOX 260150, HARTFORD, CT, 06126-0150",,Mission not available,2009,Yes
https://www.charitynavigator.org/ein/743223951,Knowledge Recovery Fund International,743223951,,,"Not currently rated, Not rated, This organization is not rated",,"4 E 89TH ST PH A, NEW YORK CITY, NY, 10128-0645",,Mission not available,2022,Yes
https://www.charitynavigator.org/ein/743223508,VERMONT HEALTH INFORMATION MANAGEMENT ASSOCIATION INC,743223508,,,"Not currently rated, Not rated, This organization is not rated",,"361 QUECHEE RD, HARTLAND, VT, 05048-9517",,Mission not available,2008,Yes
https://www.charitynavigator.org/ein/743224137,St. Vladimirs Russian Orthodox Catholic Society of America Inc.,743224137,,,"Not currently rated, Not rated, This organization is not rated",,"134 PERRINEVILLE RD, JACKSON, NJ, 08527-4722",,Mission not available,2022,Yes
https://www.charitynavigator.org/ein/743224798,Vineyard Crossroads Church,743224798,,,"Not currently rated, Not rated, This organization is not rated",,"498 MAIN ST, WAREHAM, MA, 02571-1015",,Mission not available,2009,Yes
https://www.charitynavigator.org/ein/743224986,A Destinys Horizon Inc.,743224986,,,"Not currently rated, Not rated, This organization is not rated",http://www.adestinyshorizon.org,"199 RAILROAD AVE, E RUTHERFORD, NJ, 07073-1915",973-380-4994,To provide social Services to Children.,2008,Yes
https://www.charitynavigator.org/ein/743225785,Harvard Farmers Market Inc.,743225785,,,"Not currently rated, Not rated, This organization is not rated",,"32 SCOTT RD, HARVARD, MA, 01451-1642",,Mission not available,2011,Yes
https://www.charitynavigator.org/ein/743226891,Our Lady of Lourdes Benevolent Association Inc.,743226891,,,"Not currently rated, Not rated, This organization is not rated",,"18 HALLOCK DR, WASHINGTONVLE, NY, 10992-1602",,Mission not available,2008,Yes
https://www.charitynavigator.org/ein/743228311,Purple Lancers Drum & Bugle Corps of Auburn Ny Inc.,743228311,,,"Not currently rated, Not rated, This organization is not rated",,"PO BOX 1012, AUBURN, NY, 13021-1082",,Mission not available,2008,Yes
https://www.charitynavigator.org/ein/743228712,New Horizons North Inc.,743228712,,,"Not currently rated, Not rated, This organization is not rated",,"586 PEARSE RD, SCHENECTADY, NY, 12309-2906",,Mission not available,2008,Yes
https://www.charitynavigator.org/ein/743229553,Neerupama Inc.,743229553,,,"Not currently rated, Not rated, This organization is not rated",,"2373 BROADWAY APT 629, NEW YORK, NY, 10024-2851",,Mission not available,2008,Yes
