url,name,ein,score,star_rating,keywords,website,address,phone,organization_mission,IRS_ruling_year,contain_keywords
https://www.charitynavigator.org/ein/223636986,BON SECOURS CHARITY HEALTH SYSTEM INC,223636986,,,"Not rated, Not currently rated, This organization is not rated",,"20 GRAND ST, WARWICK, NY, 10990-1035",,Mission not available,2011,Yes
https://www.charitynavigator.org/ein/223637124,Ferromonte Historical Society of Mine Hill Inc.,223637124,,,"Not rated, Not currently rated, This organization is not rated",,"10 BAKER ST, MINE HILL, NJ, 07803-3006",,Mission not available,1999,Yes
https://www.charitynavigator.org/ein/223637133,New Jersey Grace Baptist Church,223637133,,,"Not rated, Not currently rated, This organization is not rated",,"1075 QUEEN ANNE RD, TEANECK, NJ, 07666-0000",,Mission not available,2000,Yes
https://www.charitynavigator.org/ein/223637097,Livingston Community Partnership Corporation,223637097,97%,4,,http://www.intownlivingston.com/,"250 S LIVINGSTON AVE, LIVINGSTON, NJ, 07039-4047",973-992-8080,TO PROMOTE ECONOMIC DEVELOPMENT AND EMPLOYMENT WITHIN THE DISTRICT.,1999,No
https://www.charitynavigator.org/ein/223637772,Clifton Arts Center Inc.,223637772,,,"Not rated, Not currently rated, This organization is not rated",,"3 OVERLOOK RD, MORRISTOWN, NJ, 07960-4743",,Mission not available,1999,Yes
https://www.charitynavigator.org/ein/223637844,Temple Vision Corporation,223637844,,,"Not rated, Not currently rated, This organization is not rated",,"PO BOX 265, BRIDGETON, NJ, 08302-0203",,Mission not available,2021,Yes
https://www.charitynavigator.org/ein/223638194,Santiago Porcella Scholarship Fund,223638194,,,"Not rated, Not currently rated, This organization is not rated",,"315 RAHWAY AVE, ELIZABETH, NJ, 07202-1806",,Mission not available,2001,Yes
https://www.charitynavigator.org/ein/223638318,Whitehill Foundation A New Jersey Nonprofit Corporation,223638318,,,"Not rated, Not currently rated, This organization is not rated",,"363 BLOOMFIELD AVE, MONTCLAIR, NJ, 07042-3655",,Mission not available,1999,Yes
https://www.charitynavigator.org/ein/223638365,Life Restoration Church,223638365,,,"Not rated, Not currently rated, This organization is not rated",,"PO BOX 1147, NEWBURGH, NY, 12551-1147",,Mission not available,2000,Yes
https://www.charitynavigator.org/ein/223638463,Williamstown Fire Company No 1 Death Fund Inc.,223638463,73%,2,,,"PO BOX 555, WILLIAMSTOWN, NJ, 08094-0555",856-629-6579,TO PROVIDE FINANCIAL SUPPORT TO FAMILIES OF DECEASED FIRE FIGHTERS,1999,No
https://www.charitynavigator.org/ein/223638547,CIVIL SERVICE EMPLOYEES ASSOCIATION,223638547,,,"Not rated, Not currently rated, This organization is not rated",,"6365 ROBERTS DR, VICTOR, NY, 14564-9216",,Mission not available,1970,Yes
https://www.charitynavigator.org/ein/223638645,Cornerstone Soup Kitchen and Food Pantry,223638645,,,"Not rated, Not currently rated, This organization is not rated",,"1767 STATE ROUTE 196, FORT EDWARD, NY, 12828-4110",,Mission not available,2000,Yes
https://www.charitynavigator.org/ein/223638741,Egg Harbor Township Soccer Club,223638741,,,"Not rated, Not currently rated, This organization is not rated",,"5045 ENGLISH CREEK AVE, EGG HBR TWP, NJ, 08234-5743",,Mission not available,2002,Yes
https://www.charitynavigator.org/ein/223638747,Long Beach Police Scholarship Fund,223638747,,,"Not rated, Not currently rated, This organization is not rated",,"6805 LONG BEACH BLVD, LONG BCH TWP, NJ, 08008-3665",,Mission not available,2000,Yes
https://www.charitynavigator.org/ein/223638783,DOVE COMMUNITY CHILD CARE ACADEMY,223638783,,,"Not rated, Not currently rated, This organization is not rated",,"915 STUYVESANT AVE, IRVINGTON, NJ, 07111-1116",973-375-4577,To provide quality pre-school education and care based on curriculum provided by the Irvington Board of Education Daycare Services for toddlers.,1998,Yes
https://www.charitynavigator.org/ein/223638840,PTA NEW JERSEY CONGRESS OF PARENTS & TEACHERS,223638840,,,"Not rated, Not currently rated, This organization is not rated",,"35 PIONEER DR, NEW PROVIDNCE, NJ, 07974-1515",,Mission not available,1972,Yes
https://www.charitynavigator.org/ein/223638911,Hisblood Ministries Inc.,223638911,,,"Not rated, Not currently rated, This organization is not rated",,"PO BOX 5362, TOMS RIVER, NJ, 08754-5362",,Mission not available,1999,Yes
https://www.charitynavigator.org/ein/223639016,The George Dooley Memorial Foundation A Charitable Trust,223639016,,,"Not rated, Not currently rated, This organization is not rated",,"10 COTTER DR, NEW BRUNSWICK, NJ, 08901-1506",,Mission not available,2000,Yes
https://www.charitynavigator.org/ein/223639034,Dr Joseph B-Lillian Stiefel Foundation Inc.,223639034,,,"Not rated, Not currently rated, This organization is not rated",,"2621 PALLISADE AVENUE 5B/C, BRONX, NY, 10463-6106",,Mission not available,1999,Yes
https://www.charitynavigator.org/ein/223639045,Downtown West Orange Alliance Inc.,223639045,76%,3,,http://WWW.DOWNTOWNWO.COM,"66 MAIN ST, WEST ORANGE, NJ, 07052-5404",973-325-4109,"TO IMPROVE THE VISUAL ASPECTS OF THE TOWN OF WEST ORANGE, AND TO SPONSOR EVENTS IN THE SPECIAL IMPROVEMENT DISTRICT (SID).",2000,No
https://www.charitynavigator.org/ein/223639149,PTA NEW JERSEY CONGRESS OF PARENTS & TEACHERS,223639149,,,"Not rated, Not currently rated, This organization is not rated",,"1 VETERANS PLZ, PALISADES PK, NJ, 07650-1947",,Mission not available,1972,Yes
https://www.charitynavigator.org/ein/223639233,Gbg Ministry Inc.,223639233,,,"Not rated, Not currently rated, This organization is not rated",,"PO BOX 4022, TRENTON, NJ, 08610-0022",,Mission not available,2000,Yes
https://www.charitynavigator.org/ein/223639303,Jahma Foundation Inc.,223639303,,,"Not rated, Not currently rated, This organization is not rated",,"535 ROUTE 38 STE 123 # J, CHERRY HILL, NJ, 08002-2971",,Mission not available,1999,Yes
https://www.charitynavigator.org/ein/223639306,Rebuilding Together Essex County Inc.,223639306,,,"Not rated, Not currently rated, This organization is not rated",,"PO BOX 32171, NEWARK, NJ, 07102-0571",,Mission not available,1999,Yes
https://www.charitynavigator.org/ein/223639391,Covenant Life Christian Center Inc.,223639391,,,"Not rated, Not currently rated, This organization is not rated",,"807 EVERGREEN FOREST BLVD, AVENEL, NJ, 07001-2049",,Mission not available,2000,Yes
https://www.charitynavigator.org/ein/223639493,Covenant Community Development Corporation,223639493,,,"Not rated, Not currently rated, This organization is not rated",,"1217 CALHOUN ST, TRENTON, NJ, 08638-4015",,Mission not available,2001,Yes
https://www.charitynavigator.org/ein/223639604,THE CASE ASSOCIATION INC,223639604,,,"Not rated, Not currently rated, This organization is not rated",,"2750 MOUNTAIN RD, WEST SUFFIELD, CT, 06093-3110",,Mission not available,2014,Yes
https://www.charitynavigator.org/ein/223639984,Visions of God Family Worship & Ministries Inc.,223639984,,,"Not rated, Not currently rated, This organization is not rated",,"1132 SPRUCE DR STE 2A, MOUNTAINSIDE, NJ, 07092-2217",,Mission not available,1999,Yes
https://www.charitynavigator.org/ein/223639558,IEEE INDUSTRY STANDARDS AND TECHNOLOGY ORGANIZATION INC,223639558,,,"Not rated, Not currently rated, This organization is not rated",http://www.ieee-isto.org,"445 HOES LN, PISCATAWAY, NJ, 08854-4141",732-465-5856,"ISTO mentors communities developing, certifying, and promoting their technology standards, best practices, guidelines, open source, and implementation activities.",2001,Yes
https://www.charitynavigator.org/ein/223639985,Rockaway Valley School Home and School Association Inc.,223639985,53%,1,,,"11 VALLEY RD, BOONTON, NJ, 07005-9238",973-263-4046,TO BENEFIT THE CHILDREN OF ROCKAWAY VALLEY SCHOOL.,1999,No
https://www.charitynavigator.org/ein/223640057,Ohr Nosson Inc.,223640057,75%,3,,,"C/O STRAUSS 40 12TH STREET, LAKEWOOD, NJ, 08701-0000",732-370-2874,"PREVENTION OF JUVENILE DELINQUENCY AND TEEN CRIME AND DRUGS THROUGH GRANTS FOR MENTORING PROGRAMS, PROVISION OF COUNSELING & JOB/SCHOOL PLACEMENT FOR DROP OUTS AND E ... (More)",1999,No
https://www.charitynavigator.org/ein/223640093,Field Center for Childrens Integrated Development Inc.,223640093,,,"Not rated, Not currently rated, This organization is not rated",,"210 BELLEVUE AVE, MONTCLAIR, NJ, 07043-1821",,Mission not available,1999,Yes
https://www.charitynavigator.org/ein/223640294,NONPROFIT EMPLOYEE BENEFITS TRUST,223640294,,,"Not rated, Not currently rated, This organization is not rated",,"80 W GRAND AVE, ELIZABETH, NJ, 07202-1471",908-354-3040,"THE PLAN PROVIDES HEALTH AND DEATH BENEFITS COVERING SUBSTANTIALLY ALL ACTIVE EMPLOYEES OF COMMUNITY ACCESS UNLIMITED, INC.",2000,Yes
https://www.charitynavigator.org/ein/223640312,Hidden Ponds Foundation Inc.,223640312,,,"Not rated, Not currently rated, This organization is not rated",,"PO BOX 482, NEW VERNON, NJ, 07976-0482",,Mission not available,1999,Yes
https://www.charitynavigator.org/ein/223640340,Jo-Beth Inc.,223640340,,,"Not rated, Not currently rated, This organization is not rated",,"203 JOHNSON AVE, NEWARK, NJ, 07108-2710",,Mission not available,2000,Yes
https://www.charitynavigator.org/ein/223640671,PTA NEW JERSEY CONGRESS OF PARENTS & TEACHERS,223640671,,,"Not rated, Not currently rated, This organization is not rated",,"285 TINGLEY LN, EDISON, NJ, 08820-1408",,Mission not available,1972,Yes
https://www.charitynavigator.org/ein/223640683,LUTHERAN FOUNDATION OF NEW JERSEY INC,223640683,47%,0,,http://WWW.LSMNJ.ORG,"3 MANHATTAN DR, BURLINGTON, NJ, 08016-4119",609-386-7171,A FAITH-BASED FOUNDATION THAT SEEKS GIFTS AND GRANTS FOR CHARITABLE PURPOSES.,1988,No
https://www.charitynavigator.org/ein/223640847,St. Francis Avian Rehabilitation Center Inc.,223640847,,,"Not rated, Not currently rated, This organization is not rated",,"307 DORCHESTER DR, EGG HBR TWP, NJ, 08234-7673",,Mission not available,1999,Yes
https://www.charitynavigator.org/ein/223640887,LABORERS INTERNATIONAL UNION OF NORTH AMERICA,223640887,,,"Not rated, Not currently rated, This organization is not rated",http://WWW.NJLABORERS.ORG,"1 TOWER CENTER BOULEVARD, EAST BRUNSWICK, NJ, 08816-1145",609-860-9223,"THE LABORERS EASTERN REGION ORGANIZING FUND'S PURPOSE IS TO CONCEIVE, DEVELOP, PLAN AND CONDUCT ORGANIZING AND INCIDENTAL ACTIVITIES WITHIN THE JURISDICTIONAL AREAS ... (More)",1968,Yes
https://www.charitynavigator.org/ein/223641029,Sea Girt Elementary School Pto,223641029,,,"Not rated, Not currently rated, This organization is not rated",,"451 BELL PL, SEA GIRT, NJ, 08750-2503",,Mission not available,2002,Yes
https://www.charitynavigator.org/ein/223641160,Middlesex County Fire Prevention and Protection Association,223641160,,,"Not rated, Not currently rated, This organization is not rated",,"1001 FIRE ACADEMY DR, SAYREVILLE, NJ, 08872-1467",,Mission not available,2001,Yes
https://www.charitynavigator.org/ein/223641201,Monmouth County Police Pipes & Drums,223641201,53%,1,,,"PO BOX 1494, WALL, NJ, 07719-1494",732-280-3910,"THE BAND'S MISSION IS TO FOSTER THE SPIRIT, PRIDE, AND PROFESSIONALISM OF LAW ENFORECEMENT TO THE COMMUNITY THROUGH PERFORMANCES AT VARIOUS VENUES SUCH AS LOCAL PARA ... (More)",1999,No
https://www.charitynavigator.org/ein/223641250,St. Fanourios Greek Orthodox Church,223641250,,,"Not rated, Not currently rated, This organization is not rated",,"1034 E JERSEY ST, ELIZABETH, NJ, 07201-2544",,Mission not available,2006,Yes
https://www.charitynavigator.org/ein/223641341,ANCIENT ORDER OF HIBERNIANS IN AMERICA,223641341,,,"Not rated, Not currently rated, This organization is not rated",,"271 SECOND STREET, SOUTH AMBOY, NJ, 08879-1632",,Mission not available,1945,Yes
https://www.charitynavigator.org/ein/223641470,Allamuchy Elementary Parent-Teacher Organization,223641470,,,"Not rated, Not currently rated, This organization is not rated",,"PO BOX 174, ALLAMUCHY, NJ, 07820-0174",,Mission not available,2001,Yes
https://www.charitynavigator.org/ein/223641487,Iglesia Ciudad De Refugio Corp,223641487,,,"Not rated, Not currently rated, This organization is not rated",,"436 MARKET ST, PERTH AMBOY, NJ, 08861-4544",,Mission not available,2001,Yes
https://www.charitynavigator.org/ein/223641730,John P Schmidt and Dorothy E Schmidt Family Foundation Inc.,223641730,,,"Not rated, Not currently rated, This organization is not rated",,"900 HOLLINSHEAD SPRING RD APT F107, SKILLMAN, NJ, 08558-2061",,Mission not available,1999,Yes
https://www.charitynavigator.org/ein/223641737,The Auten Road School Home and School Association,223641737,,,"Not rated, Not currently rated, This organization is not rated",,"281 AUTEN ROAD, HILLSBOROUGH, NJ, 08844-0000",,Mission not available,1999,Yes
https://www.charitynavigator.org/ein/223641835,Avalon Performing Arts Council,223641835,,,"Not rated, Not currently rated, This organization is not rated",,"PO BOX 72, AVALON, NJ, 08202-0072",,Mission not available,2000,Yes
https://www.charitynavigator.org/ein/223641832,Holy Trinity Community Church,223641832,,,"Not rated, Not currently rated, This organization is not rated",,"515 RUTGERS AVE, BURLINGTON, NJ, 08016-2323",,Mission not available,1999,Yes
https://www.charitynavigator.org/ein/223641781,People Helping People Inc.,223641781,,,"Not rated, Not currently rated, This organization is not rated",,"179 ROANOKE ST, WOODBRIDGE, NJ, 07095-2546",,Mission not available,2017,Yes
https://www.charitynavigator.org/ein/223641957,Galloway Township Ambulance Squad Inc.,223641957,50%,1,,,"311 CARTON AVENUE, GALLOWAY, NJ, 08205-0000",609-457-2684,Emergency Rescue and Medical Services,2000,No
https://www.charitynavigator.org/ein/223641965,MARINE CORPS LEAGUE,223641965,,,"Not rated, Not currently rated, This organization is not rated",,"612 LAKE ST, CHITTENANGO, NY, 13037-1228",,Mission not available,1946,Yes
https://www.charitynavigator.org/ein/223642107,Monmouth County Arts Council Inc.,223642107,96%,4,,http://WWW.MONMOUTHARTS.ORG,"105 MONMOUTH ST, RED BANK, NJ, 07701-1108",732-212-1890,"MONMOUTH COUNTY ARTS COUNCIL SUPPORTS ARTISTS AND ARTS GROUPS THROUGH NETWORKING, WORKSHOPS AND RESOURCES; THE MONMOUTH COUNTY TEEN ARTS FESTIVAL; LOCAL ARTS GRANT P ... (More)",1999,No
https://www.charitynavigator.org/ein/223642129,Bakka Corp,223642129,,,"Not rated, Not currently rated, This organization is not rated",,"PO BOX 6607, JERSEY CITY, NJ, 07306-0607",,Mission not available,2022,Yes
https://www.charitynavigator.org/ein/223642165,Love of Jesus Church in Nj,223642165,,,"Not rated, Not currently rated, This organization is not rated",,"12 ELENA PL, BELLEVILLE, NJ, 07109-1322",,Mission not available,1999,Yes
https://www.charitynavigator.org/ein/223642479,Congregation Birchas Chaim Inc.,223642479,,,"Not rated, Not currently rated, This organization is not rated",,"1111 VINE AVE, LAKEWOOD, NJ, 08701-5352",,Mission not available,1999,Yes
https://www.charitynavigator.org/ein/223642737,The Wesley Foundation Inc.,223642737,96%,4,,http://WWW.THEWESLEYCOMMUNITY.ORG,"131 LAWRENCE ST, SARATOGA SPGS, NY, 12866-1346",518-587-3600,THE WESLEY FOUNDATION RAISES PHILANTHROPIC RESOURCES TO SUPPORT THE MISSION OF UNITED METHODIST HEALTH AND HOUSING THROUGH FUND RAISING ACTIVITIES INCLUDING BUT NOT ... (More),1998,No
https://www.charitynavigator.org/ein/223642804,NORTH HUNTERDON UNITED METHODIST CHURCH,223642804,,,"Not rated, Not currently rated, This organization is not rated",,"PO BOX 5331, CLINTON, NJ, 08809-0331",,Mission not available,1974,Yes
https://www.charitynavigator.org/ein/223642867,Maria L Varisco-Rogers Charter School,223642867,81%,3,,http://WWW.MLVRCS.ORG,"233 WOODSIDE AVE, NEWARK, NJ, 07104-3113",973-481-9001,MARIA L VARISCO-RODGERS CHARTER SCHOOL'S MISSION IS TO IMPROVE THE EDUCATIONAL ACHIEVEMENT OF ALL PUPILS BASED ON THE BELIEF THAT ALL CHILDREN CAN LEARN.,1999,No
https://www.charitynavigator.org/ein/223642909,Abrams Family Charitable Foundation Inc.,223642909,,,"Not rated, Not currently rated, This organization is not rated",,"16 GILBERT RD, MONTAUK, NY, 11954-5095",,Mission not available,1999,Yes
https://www.charitynavigator.org/ein/223642943,Household of God Community-Isaiahs Call-A Nj Nonprofit Corp,223642943,,,"Not rated, Not currently rated, This organization is not rated",,"145 COMMISSIONERS PIKE, WOODSTOWN, NJ, 08098-2303",,Mission not available,2000,Yes
https://www.charitynavigator.org/ein/223642974,Sang Myung Church,223642974,,,"Not rated, Not currently rated, This organization is not rated",,"280 WAYNE AVE, RIVER EDGE, NJ, 07661-1108",,Mission not available,1999,Yes
https://www.charitynavigator.org/ein/223643020,Concerned Pastors and Ministers of Trenton and Vicinity Economic Deve,223643020,,,"Not rated, Not currently rated, This organization is not rated",,"715 BELLEVUE AVE, TRENTON, NJ, 08618-4405",,Mission not available,1999,Yes
https://www.charitynavigator.org/ein/223643082,Washington Township Panther Football Inc.,223643082,,,"Not rated, Not currently rated, This organization is not rated",,"83 BRASS CASTLE RD, WASHINGTON, NJ, 07882-4317",,Mission not available,1999,Yes
https://www.charitynavigator.org/ein/223643357,Cooper River Rowing Association Inc.,223643357,,,"Not rated, Not currently rated, This organization is not rated",,"7050 N PARK DR, PENNSAUKEN, NJ, 08109-4202",,Mission not available,2002,Yes
https://www.charitynavigator.org/ein/223643364,Sandyston-Walpack Pto,223643364,,,"Not rated, Not currently rated, This organization is not rated",,"PO BOX 27, LAYTON, NJ, 07851-0027",,Mission not available,2002,Yes
https://www.charitynavigator.org/ein/223643244,MATRI INC,223643244,,,"Not rated, Not currently rated, This organization is not rated",,"1141 GREEN ST, ISELIN, NJ, 08830-2035",,Mission not available,2000,Yes
https://www.charitynavigator.org/ein/223643193,Friends of Hackensack River Greenway Through Teaneck,223643193,,,"Not rated, Not currently rated, This organization is not rated",,"PO BOX 3028, TEANECK, NJ, 07666-9101",,Mission not available,2012,Yes
https://www.charitynavigator.org/ein/223643575,South Jersey Charitable Foundation,223643575,,,"Not rated, Not currently rated, This organization is not rated",,"601 WHITE HORSE RD, VOORHEES, NJ, 08043-2493",,Mission not available,1999,Yes
https://www.charitynavigator.org/ein/223643772,Montville Unico Foundation A New Jersey Nonprofit Corporation,223643772,,,"Not rated, Not currently rated, This organization is not rated",,"21 WYNWOOD DR, PARSIPPANY, NJ, 07054-1318",,Mission not available,2015,Yes
https://www.charitynavigator.org/ein/223643870,ESSEX COUNTY MUNICIPAL COURT ADMINISTRATORS ASSOCIATION,223643870,,,"Not rated, Not currently rated, This organization is not rated",,"357 S LIVINGSTON AVE, LIVINGSTON, NJ, 07039-3927",,Mission not available,2015,Yes
https://www.charitynavigator.org/ein/223644108,Chicken Bone Beach Historical Foundation Inc.,223644108,52%,1,,http://chickenbonebeach.org,"C/O H SHELTON - 1721 MCKINLEY AVE, ATLANTIC CITY, NJ, 08401-0000",609-841-6897,"To create pride in African-American heritage and promote family values and unity in Atlantic County. To educate, by exposing youth, the community and tourists to the ... (More)",2000,No
https://www.charitynavigator.org/ein/223644232,Berkowitz Family Charitable Foundation,223644232,,,"Not rated, Not currently rated, This organization is not rated",,"CO SAX LLP 389 INTERPACE PARKWAY, PARSIPPANY, NJ, 07054-0000",,Mission not available,2000,Yes
https://www.charitynavigator.org/ein/223644482,PORT AUTHORITY PBA TRUST FUND,223644482,,,"Not rated, Not currently rated, This organization is not rated",,"611 PALISADE AVENUE, ENGLEWOOD CLIFFS, NJ, 07632-0000",201-871-2100,"THE WELFARE FUND WAS CREATED TO PROVIDE MEDICAL, DENTAL, OPTICAL, LEGAL, DEATH, AND OTHER BENEFITS TO THE PORT AUTHORITY P.B.A. MEMBERSHIP.",2000,Yes
https://www.charitynavigator.org/ein/223644714,Project Live IX Inc.,223644714,,,"Not rated, Not currently rated, This organization is not rated",,"465-475 BROADWAY AVE, NEWARK, NJ, 07104-4177",,Mission not available,1999,Yes
https://www.charitynavigator.org/ein/223644715,Project Live VIII Inc.,223644715,,,"Not rated, Not currently rated, This organization is not rated",,"465-475 BROADWAY AVE, NEWARK, NJ, 07104-4177",,Mission not available,1999,Yes
https://www.charitynavigator.org/ein/223644875,FLORHAM PISTOL & RIFLE CLUB INC,223644875,,,"Not rated, Not currently rated, This organization is not rated",,"PO BOX 583, FLORHAM PARK, NJ, 07932-0583",,Mission not available,1999,Yes
https://www.charitynavigator.org/ein/223644999,Awaken America Ministries Inc.,223644999,,,"Not rated, Not currently rated, This organization is not rated",,"119 BARNSBORO RD, BARNSBORO, NJ, 08080-4579",,Mission not available,1999,Yes
https://www.charitynavigator.org/ein/223645298,Lincoln-Hubbard School Pto,223645298,,,"Not rated, Not currently rated, This organization is not rated",,"52 WOODLAND AVE, SUMMIT, NJ, 07901-2101",,Mission not available,1999,Yes
https://www.charitynavigator.org/ein/223645538,Jesus Village Presbyterian Church,223645538,,,"Not rated, Not currently rated, This organization is not rated",,"42 COURT ST, HACKENSACK, NJ, 07601-7004",,Mission not available,2000,Yes
https://www.charitynavigator.org/ein/223645689,Yeshivat Keter Torah Inc.,223645689,67%,2,,,"5 MERIDIAN RD, EATONTOWN, NJ, 07724-2242",732-961-9731,EDUCATIONAL,2000,No
https://www.charitynavigator.org/ein/223645790,Mercer County Italian-American Festival Asso Inc.,223645790,50%,1,,http://WWW.ITALIANAMERICANFESTIVAL.COM,"PO BOX 2862, HAMILTON, NJ, 08690-0362",609-631-7544,THE ORGANIZATION EXISTS EXCLUSIVELY TO SUPPORT AND PROMOTE THE HERITAGE OF ITALIAN AMERICANS,2004,No
https://www.charitynavigator.org/ein/223645727,Bethany Independent Bapitist Church Inc.,223645727,,,"Not rated, Not currently rated, This organization is not rated",,"PO BOX 621, HACKENSACK, NJ, 07602-0621",,Mission not available,2001,Yes
https://www.charitynavigator.org/ein/223645568,NATIONAL AIR TRAFFIC CONTROLLERS AS SOCIATION,223645568,,,"Not rated, Not currently rated, This organization is not rated",,"72 BROWN RD, ITHACA, NY, 14850-1248",,Mission not available,1990,Yes
https://www.charitynavigator.org/ein/223645844,VETERANS OF FOREIGN WARS OF THE UNITED STATES DEPT OF NEW JERSEY,223645844,,,"Not rated, Not currently rated, This organization is not rated",,"120 MONMOUTH ROAD, MONROE TOWNSHIP, NJ, 08831-0000",,Mission not available,1944,Yes
https://www.charitynavigator.org/ein/223646142,Tomorrows Services,223646142,,,"Not rated, Not currently rated, This organization is not rated",,"PO BOX 8239, NEWARK, NJ, 07108-0239",,Mission not available,1999,Yes
https://www.charitynavigator.org/ein/223646307,Asian Womens Christian Association Inc.,223646307,84%,3,,http://WWW.AWCANJ.ORG,"9 GENESEE AVE, TEANECK, NJ, 07666-5923",201-862-1665,"ASIAN WOMEN'S CHRISTIAN ASSOCIATION, INC., CENTERED ON THE LOVE OF CHRIST, PROVIDES FAMILIES WITH THE RESOURCES TO BECOME HEALTHY, CONTRIBUTING MEMBERS OF SOCIETY TH ... (More)",2000,No
https://www.charitynavigator.org/ein/223646125,Table To Table Inc,223646125,98%,4,,http://www.tabletotable.org,"160 PEHLE AVE, Suite 303, Saddle Brook, NJ, 07663-5227",201-944-1525,"Nearly 1 million of our neighbors in New Jersey are food insecure. Meanwhile, enough food for over 3 billion meals is wasted each year in our state. Table to Table d ... (More)",1999,No
https://www.charitynavigator.org/ein/223646396,David and Carol Lackland Family Foundation Inc.,223646396,,,"Not rated, Not currently rated, This organization is not rated",,"333 VALLEY RD, WATCHUNG, NJ, 07069-6037",,Mission not available,1999,Yes
https://www.charitynavigator.org/ein/223646316,Newark Downtown District Management Corporation,223646316,81%,3,,http://WWW.DOWNTOWNNEWARK.COM,"60 PARK PL STE 2100, NEWARK, NJ, 07102-5504",973-622-2002,"REVITALIZE DOWNTOWN NEWARK BY IMPROVING THE ECONOMIC VIABILITY OF THE CENTRAL BUSINESS DISTRICT AND ENHANCE THE QUALITY OF LIFE FOR RESIDENTS, WORKERS, STUDENTS AND ... (More)",2000,No
https://www.charitynavigator.org/ein/223646533,Parent Association Supporting Theatre Arts Inc.,223646533,,,"Not rated, Not currently rated, This organization is not rated",,"1055 KLOCKNER RD, HAMILTON, NJ, 08619-3046",,Mission not available,2011,Yes
https://www.charitynavigator.org/ein/223646583,Ministerios Cristianos La Hermosa Inc.,223646583,,,"Not rated, Not currently rated, This organization is not rated",,"6504 BROADWAY APT 2, W NEW YORK, NJ, 07093-3173",,Mission not available,2003,Yes
https://www.charitynavigator.org/ein/223646800,Preservation Alliance of Spring Lake Inc.,223646800,,,"Not rated, Not currently rated, This organization is not rated",,"PO BOX 9, SPRING LAKE, NJ, 07762-0009",,Mission not available,2001,Yes
https://www.charitynavigator.org/ein/223647244,Liberty Academy Charter School Inc.,223647244,,,"Not rated, Not currently rated, This organization is not rated",http://LIBERTYACADEMY.ORG,"211 SHERMAN AVE, JERSEY CITY, NJ, 07307-2040",201-217-6771,The mission of Liberty Academy Charter School is stated as follows We the educational team of the Liberty Academy Charter School are committed to creating a foundati ... (More),2000,Yes
https://www.charitynavigator.org/ein/223647521,Health and Education Foundation Inc.,223647521,,,"Not rated, Not currently rated, This organization is not rated",,"94 UNION ST APT 1413, JERSEY CITY, NJ, 07304-2767",,Mission not available,2000,Yes
https://www.charitynavigator.org/ein/223647408,Cape Ann Interfaith Commission Inc.,223647408,,,"Not rated, Not currently rated, This organization is not rated",,"48 MIDDLE ST, GLOUCESTER, MA, 01930-5716",,Mission not available,2000,Yes
https://www.charitynavigator.org/ein/223647672,Historical and Educational Hall Preservatory Inc.,223647672,,,"Not rated, Not currently rated, This organization is not rated",,"PO BOX 443, SWEDESBORO, NJ, 08085-0443",,Mission not available,2024,Yes
