url,name,ein,score,star_rating,keywords,website,address,phone,organization_mission,IRS_ruling_year,contain_keywords
https://www.charitynavigator.org/ein/113321728,Congregation Olom Moleh Inc.,113321728,,,"Not rated, Not currently rated, This organization is not rated",,"1579 50TH ST, BROOKLYN, NY, 11219-3746",,Mission not available,1997,Yes
https://www.charitynavigator.org/ein/113321836,Williamsburg Art and Historical Center Inc.,113321836,,,"Not rated, Not currently rated, This organization is not rated",,"135 BROADWAY, BROOKLYN, NY, 11211-6129",,Mission not available,1996,Yes
https://www.charitynavigator.org/ein/113321870,East Williston Teachers Association Scholarship Foundation,113321870,,,"Not rated, Not currently rated, This organization is not rated",,"11 BACON RD, OLD WESTBURY, NY, 11568-1502",,Mission not available,1996,Yes
https://www.charitynavigator.org/ein/113321990,Park Ventures Housing Corp,113321990,,,"Not rated, Not currently rated, This organization is not rated",,"121 DEKALB AVE, BROOKLYN, NY, 11201-5425",,Mission not available,1997,Yes
https://www.charitynavigator.org/ein/113322147,Macheneh Fay-Gah Inc.,113322147,,,"Not rated, Not currently rated, This organization is not rated",,"1823 51ST ST, BROOKLYN, NY, 11204-1514",,Mission not available,1997,Yes
https://www.charitynavigator.org/ein/113322279,LITTLE LEAGUE BASEBALL INC,113322279,,,"Not rated, Not currently rated, This organization is not rated",,"PO BOX 70, CHESTER, NY, 10918-0070",,Mission not available,1967,Yes
https://www.charitynavigator.org/ein/113321933,Friends of Zo Artzeinu Inc.,113321933,81%,3,,http://WWW.THISISOURLAND.ORG,"400 5TH AVE, CEDARHURST, NY, 11516-1408",516-295-3222,"EDUCATIONAL, PUBLISHING & INFORMATION; GRANTS COMMUNITY FACILITIES",1997,No
https://www.charitynavigator.org/ein/113322008,SPIRITUAL ASSEMBLY OF THE BAHAIS OF NORTH HEMPSTEAD TOWN,113322008,,,"Not rated, Not currently rated, This organization is not rated",,"3 CHESTNUT HL, ROSLYN, NY, 11576-2803",,Mission not available,1995,Yes
https://www.charitynavigator.org/ein/113322647,Islip Breast Cancer Coalition Inc.,113322647,,,"Not rated, Not currently rated, This organization is not rated",,"309 MAIN ST UNIT 3 # 246, ISLIP, NY, 11751-3449",,Mission not available,1997,Yes
https://www.charitynavigator.org/ein/113322653,Something in Common Inc.,113322653,,,"Not rated, Not currently rated, This organization is not rated",,"15915 84TH DR, JAMAICA, NY, 11432-2528",,Mission not available,2012,Yes
https://www.charitynavigator.org/ein/113322756,SERVICES FOR THE UNDERSERVED INC,113322756,,,"Not rated, Not currently rated, This organization is not rated",,"463 SEVENTH AVE 17TH FL, NEW YORK, NY, 10018-0092",,Mission not available,2006,Yes
https://www.charitynavigator.org/ein/113322904,IBEW LOCAL 1049 VACATION FUND,113322904,,,"Not rated, Not currently rated, This organization is not rated",http://WWW.IBEW1049.ORG,"100 CORPORATE DRIVE, HOLTSVILLE, NY, 11742-2000",631-234-1803,TO PROVIDE VACATION AND OTHER BENEFITS TO ELIGIBLE PARTICIPANTS.,1998,Yes
https://www.charitynavigator.org/ein/113322865,Way of Holiness Church of God Pentecostal Headquarters Internati,113322865,,,"Not rated, Not currently rated, This organization is not rated",,"1006 FULTON ST, BROOKLYN, NY, 11238-2519",,Mission not available,1996,Yes
https://www.charitynavigator.org/ein/113323571,Touching Your World Ministries Inc.,113323571,,,"Not rated, Not currently rated, This organization is not rated",,"114-05 101 STAVE, SOUTH RICHMOND HILL, NY, 11419-0000",,Mission not available,1997,Yes
https://www.charitynavigator.org/ein/113323726,Amc Child Care Center Inc.,113323726,,,"Not rated, Not currently rated, This organization is not rated",,"45 ROSE AVE, ROOSEVELT, NY, 11575-1418",,Mission not available,1998,Yes
https://www.charitynavigator.org/ein/113324040,Brookdale Residence Housing Development Fund Corporation,113324040,81%,3,,http://WWW.BROOKDALEHOSPITAL.ORG,"10101 AVENUE D, BROOKLYN, NY, 11236-1902",718-240-5200,"THE BROOKDALE RESIDENCE HOUSING DEVELOPMENT FUND CORPORATION OWNS AND OPERATES A RESIDENTIAL BUILDING IN BROOKLYN, NEW YORK AND PROVIDES HOUSING EXCLUSIVELY FOR ELDE ... (More)",1996,No
https://www.charitynavigator.org/ein/113324247,Hai Tien Coral Group Inc.,113324247,,,"Not rated, Not currently rated, This organization is not rated",,"3550 78TH ST APT 5A, JACKSON HTS, NY, 11372-4720",,Mission not available,1997,Yes
https://www.charitynavigator.org/ein/113324303,Martin-Lehrer Foundation,113324303,,,"Not rated, Not currently rated, This organization is not rated",,"1441 OLD NORTHERN BLVD, ROSLYN, NY, 11576-2256",,Mission not available,1997,Yes
https://www.charitynavigator.org/ein/113324304,PTA NEW YORK CONGRESS,113324304,,,"Not rated, Not currently rated, This organization is not rated",,"3940 SUNSET AVE, SEAFORD, NY, 11783-2009",,Mission not available,1954,Yes
https://www.charitynavigator.org/ein/113324636,Joseph Horvath Memorial Schlarship Fund Inc.,113324636,,,"Not rated, Not currently rated, This organization is not rated",,"370 COLLINGTON DR, RONKONKOMA, NY, 11779-4939",,Mission not available,1997,Yes
https://www.charitynavigator.org/ein/113324909,PTA NEW YORK CONGRESS,113324909,,,"Not rated, Not currently rated, This organization is not rated",,"137 LEAHY ST, JERICHO, NY, 11753-1667",,Mission not available,1954,Yes
https://www.charitynavigator.org/ein/113324666,Congregation Nachlas Yisroel,113324666,,,"Not rated, Not currently rated, This organization is not rated",,"1530 51ST ST, BROOKLYN, NY, 11219-3737",,Mission not available,1996,Yes
https://www.charitynavigator.org/ein/113324771,American Friends Emek Beracha Inc.,113324771,70%,2,,,"C/O ISAAC GREENBLATT 204 BEACH 9TH, FAR ROCKAWAY, NY, 11516-0000",718-868-1271,SUPPORT OF EDUCATIONAL INSTITUTIONS.,1997,No
https://www.charitynavigator.org/ein/113325058,Afghan School Inc.,113325058,,,"Not rated, Not currently rated, This organization is not rated",,"PO BOX 570686, WHITESTONE, NY, 11357-0686",,Mission not available,2011,Yes
https://www.charitynavigator.org/ein/113325083,Cong Otzar Hachaim,113325083,,,"Not rated, Not currently rated, This organization is not rated",,"3054 BEDFORD AVE, BROOKLYN, NY, 11210-3714",,Mission not available,1996,Yes
https://www.charitynavigator.org/ein/113325187,Union Academy of Belleville,113325187,73%,2,,,"13047 STATE RT 178, ADAMS, NY, 13605-2181",315-232-2607,ENCOURAGE GRADUATES OF BELLEVILLE-HENDERSON CENTRAL SCHOOL TO AVAIL THEMSELVES OF FURTHER EDUCATIONAL OPPORTUNITIES BY PROVIDING SCHOLARSHIPS FOR THEIR USE.,1996,No
https://www.charitynavigator.org/ein/113325506,Narrow Way World Mission Inc.,113325506,,,"Not rated, Not currently rated, This organization is not rated",,"1507 JOHN ST, FORT LEE, NJ, 07024-2560",,Mission not available,1997,Yes
https://www.charitynavigator.org/ein/113325718,Finished Work of Christ Ministries,113325718,,,"Not rated, Not currently rated, This organization is not rated",,"100 E OLD COUNTRY RD STE 6, MINEOLA, NY, 11501-4614",,Mission not available,1998,Yes
https://www.charitynavigator.org/ein/113325339,PTA NEW YORK CONGRESS,113325339,,,"Not rated, Not currently rated, This organization is not rated",,"76 NEWTOWN LN, EAST HAMPTON, NY, 11937-2405",,Mission not available,1954,Yes
https://www.charitynavigator.org/ein/113325341,IGLESIA EVANGELICA PRINCIPE DE PAZ,113325341,,,"Not rated, Not currently rated, This organization is not rated",,"752 44TH ST, BROOKLYN, NY, 11220-1522",,Mission not available,1964,Yes
https://www.charitynavigator.org/ein/113325786,Bayswater Community Mikveh Association,113325786,,,"Not rated, Not currently rated, This organization is not rated",,"1123 BAY 25TH ST, FAR ROCKAWAY, NY, 11691-1751",,Mission not available,1999,Yes
https://www.charitynavigator.org/ein/113325848,NEW YORK-GRAIN,113325848,,,"Not rated, Not currently rated, This organization is not rated",,"134-21 ANTHEM 2ND FLR, FLUSHING, NY, 11354-0000",,Mission not available,1972,Yes
https://www.charitynavigator.org/ein/113326048,Dr Haing S Ngor Foundation,113326048,,,"Not rated, Not currently rated, This organization is not rated",,"600 OLD COUNTRY RD RM 410, GARDEN CITY, NY, 11530-2009",,Mission not available,2011,Yes
https://www.charitynavigator.org/ein/113326070,Lifetime Care Foundation for Jewish Disabled Inc.,113326070,79%,3,,,"156 BEACH 9TH STREET 2ND FLOOR, FAR ROCKAWAY, NY, 11691-5636",718-851-6300,PROVIDE OPERATIONAL ASSSISTANCE AND OVERSIGHT TO COMMUNITY POOLED TRUSTS.,1997,No
https://www.charitynavigator.org/ein/113326328,Ajm Foundation,113326328,,,"Not rated, Not currently rated, This organization is not rated",,"2003 AVENUE J, BROOKLYN, NY, 11210-3646",,Mission not available,1996,Yes
https://www.charitynavigator.org/ein/113326391,Grace & Truth Church Inc.,113326391,,,"Not rated, Not currently rated, This organization is not rated",,"4474 MIDDLE COUNTRY RD, CALVERTON, NY, 11933-1185",,Mission not available,1997,Yes
https://www.charitynavigator.org/ein/113326167,PTA NEW YORK CONGRESS,113326167,,,"Not rated, Not currently rated, This organization is not rated",,"49 DAVISON AVE, LYNBROOK, NY, 11563-1729",,Mission not available,1954,Yes
https://www.charitynavigator.org/ein/113326491,Center of Light Love & Truth Inc.,113326491,,,"Not rated, Not currently rated, This organization is not rated",,"1184 NOSTRAND AVE, BROOKLYN, NY, 11225-5912",,Mission not available,1996,Yes
https://www.charitynavigator.org/ein/113326589,Pan-Megarian Society of America Byzas Inc.,113326589,,,"Not rated, Not currently rated, This organization is not rated",,"2417 BATH AVE, BROOKLYN, NY, 11214-5328",,Mission not available,1996,Yes
https://www.charitynavigator.org/ein/113326877,Congregation Agudas Achim,113326877,,,"Not rated, Not currently rated, This organization is not rated",,"10811 69TH RD, FOREST HILLS, NY, 11375-3839",,Mission not available,1999,Yes
https://www.charitynavigator.org/ein/113327160,Circle of Hope Cancer Foundation,113327160,,,"Not rated, Not currently rated, This organization is not rated",,"1622 E 16TH ST, BROOKLYN, NY, 11229-1108",,Mission not available,1997,Yes
https://www.charitynavigator.org/ein/113327219,Brooklyn College Auxiliary Enterprises Corporation,113327219,41%,0,,http://WWW.BROOKLYN.CUNY.EDU,"2900 BEDFORD AVE STE, BROOKLYN, NY, 11210-2850",718-951-5778,"TO DEVELOP AND CULTIVATE EDUCATIONAL, SOCIAL, CULTURAL, AND RECREATIONAL ACTIVITIES AMONG STUDENTS OF BROOKLYN COLLEGE OF THE CITY UNIVERSITY OF NEW YORK.",1998,No
https://www.charitynavigator.org/ein/113327307,Carle Place Education Foundation Inc.,113327307,,,"Not rated, Not currently rated, This organization is not rated",,"PO BOX 149, CARLE PLACE, NY, 11514-0149",,Mission not available,1997,Yes
https://www.charitynavigator.org/ein/113326974,Congregation Nachlas Meir,113326974,,,"Not rated, Not currently rated, This organization is not rated",,"102 WEBSTER AVE, BROOKLYN, NY, 11230-1016",,Mission not available,2017,Yes
https://www.charitynavigator.org/ein/113327144,Friends of Science East Inc.,113327144,83%,3,Review Before Proceeding,http://TESLASCIENCECENTER.ORG,"PO Box 552, 5 Randall Road, Shoreham, NY, 11786",631-886-2632,"To develop the site of Nikola Teslas last remaining laboratory into a transformative global science center that embraces his bold spirit of invention, provides inno ... (More)",1997,Yes
https://www.charitynavigator.org/ein/113327576,Redemption Community World Ministries Inc.,113327576,,,"Not rated, Not currently rated, This organization is not rated",,"630 E 59TH ST, BROOKLYN, NY, 11234-1302",,Mission not available,1997,Yes
https://www.charitynavigator.org/ein/113327617,Congregation Ohev Yisroel,113327617,,,"Not rated, Not currently rated, This organization is not rated",,"415 E 5TH ST, BROOKLYN, NY, 11218-4004",,Mission not available,1997,Yes
https://www.charitynavigator.org/ein/113327626,Cong Tov Umeitov,113327626,,,"Not rated, Not currently rated, This organization is not rated",,"5014 16TH AVE, BROOKLYN, NY, 11204-1404",,Mission not available,1996,Yes
https://www.charitynavigator.org/ein/113327651,Project Hope the New Direction,113327651,,,"Not rated, Not currently rated, This organization is not rated",http://www.projecthopethenewdirection.org,"10503 220TH ST, QUEENS VLG, NY, 11429-2146",718-412-1837,"Who are we? Project Hopes mission is to help young people living in poverty in NYC develop their strengths, skills, talents and competencies through effective experi ... (More)",1998,Yes
https://www.charitynavigator.org/ein/113328062,Kiwanis Pediatric Trauma Ctr Fndn,113328062,77%,3,,,"19 ZAVRA ST, BOHEMIA, NY, 11716-1713",,"To provide necessary equipment to local hospitals, assist in the education of Ambulance and EMT staff, provide education to elementary students regarding bicycle and ... (More)",1996,No
https://www.charitynavigator.org/ein/113328026,Merkaz Rebbi Initiative,113328026,,,"Not rated, Not currently rated, This organization is not rated",,"8448 123RD ST, KEW GARDENS, NY, 11415-3305",,Mission not available,1996,Yes
https://www.charitynavigator.org/ein/113328066,United Fire Company No 1,113328066,83%,3,,http://CUTCHOGUEFIREDEPT.ORG,"260 NEW SUFFOLK RD, CUTCHOGUE, NY, 11935-2040",631-252-2891,"THE ORGANIZATION PROVIDES SUPPORT TO INDIVIDUALS AND COMMUNITIES THAT ARE IMPACTED BY FIRE, MEDICAL EMERGENCIES, OR BY DISASTERS, WHETHER CAUSED BY NATURE OR INDIVID ... (More)",2023,No
https://www.charitynavigator.org/ein/113328503,Kolel Yetev Lev Djerusalem,113328503,,,"Not rated, Not currently rated, This organization is not rated",,"543 BEDFORD AVE, BROOKLYN, NY, 11211-8511",,Mission not available,1996,Yes
https://www.charitynavigator.org/ein/113328624,Iglesia Hispana De La Comunidad Inc.,113328624,,,"Not rated, Not currently rated, This organization is not rated",,"3269 31ST ST, LONG IS CITY, NY, 11106-2655",,Mission not available,1998,Yes
https://www.charitynavigator.org/ein/113328892,McCann Charitable Foundation Inc.,113328892,,,"Not rated, Not currently rated, This organization is not rated",,"2 JERICHO PLZ STE 200, JERICHO, NY, 11753-1681",,Mission not available,1996,Yes
https://www.charitynavigator.org/ein/113328846,Iglesia Evangelica Pentecostes Arca De Salvacion,113328846,,,"Not rated, Not currently rated, This organization is not rated",,"3514 98TH ST, CORONA, NY, 11368-1861",,Mission not available,1997,Yes
https://www.charitynavigator.org/ein/113329041,Transformation Church Inc.,113329041,,,"Not rated, Not currently rated, This organization is not rated",,"1640 HANCOCK ST, RIDGEWOOD, NY, 11385-4727",,Mission not available,1997,Yes
https://www.charitynavigator.org/ein/113329197,PTA NEW YORK CONGRESS,113329197,,,"Not rated, Not currently rated, This organization is not rated",,"50 BOURNE BLVD, BOHEMIA, NY, 11716-4936",,Mission not available,1954,Yes
https://www.charitynavigator.org/ein/113329205,Anguilla Progressive Association of New York Inc.,113329205,70%,2,,,"244 FIFTH AVENUE SUITE 2912, NEW YORK, NY, 10001-0000",,"The organization raises funds for Anguillians to improve their lives culturally, educationally, socially and economically at home and abroad by promoting education i ... (More)",1999,No
https://www.charitynavigator.org/ein/113329140,Rosale Housing Development Fund Corporation,113329140,71%,2,,,"840 HEGEMAN AVENUE, BROOKLYN, NY, 11207-7365",718-649-7000,PROVIDE HOUSING FOR THE ELDERLY AND/OR DISABLED PERSONS OF LOW INCOME.,1997,No
https://www.charitynavigator.org/ein/113329180,Fountain Christian Center Inc.,113329180,,,"Not rated, Not currently rated, This organization is not rated",,"11 MARCUS GARVEY BLVD, BROOKLYN, NY, 11206-5303",,Mission not available,1997,Yes
https://www.charitynavigator.org/ein/113329244,Destiny Cathedral Inc.,113329244,,,"Not rated, Not currently rated, This organization is not rated",,"536 S FRANKLIN ST, HEMPSTEAD, NY, 11550-7622",,Mission not available,1998,Yes
https://www.charitynavigator.org/ein/113329436,Buddhas Light International Association New York Inc.,113329436,,,"Not rated, Not currently rated, This organization is not rated",,"154-37 BATCLAY AVE, FLUSHING, NY, 11355-0000",,Mission not available,1999,Yes
https://www.charitynavigator.org/ein/113329453,Community Outreach Ministries Inc.,113329453,,,"Not rated, Not currently rated, This organization is not rated",,"668 NEW LOTS AVE, BROOKLYN, NY, 11207-7323",,Mission not available,1996,Yes
https://www.charitynavigator.org/ein/113329517,Step Special Torah Education Program Inc.,113329517,,,"Not rated, Not currently rated, This organization is not rated",,"2555 NOSTRAND AVE 4TH FLOOR, BROOKLYN, NY, 11210-4730",,Mission not available,1997,Yes
https://www.charitynavigator.org/ein/113329452,North Fork Unitarian Universalist,113329452,,,"Not rated, Not currently rated, This organization is not rated",,"3275 ALDRICH LN, LAUREL, NY, 11948-1028",,Mission not available,1997,Yes
https://www.charitynavigator.org/ein/113329558,INTERNATIONAL ASSOCIATION OF LIONS CLUBS,113329558,,,"Not rated, Not currently rated, This organization is not rated",,"32 S PINELAKE DR, PATCHOGUE, NY, 11772-2234",,Mission not available,1940,Yes
https://www.charitynavigator.org/ein/113329513,Hamptons Shakespeare Festival Inc.,113329513,,,"Not rated, Not currently rated, This organization is not rated",,"PO BOX 63, AMAGANSETT, NY, 11930-0063",,Mission not available,1997,Yes
https://www.charitynavigator.org/ein/113329561,Der Yu Temple Inc.,113329561,,,"Not rated, Not currently rated, This organization is not rated",,"4249 78TH ST, ELMHURST, NY, 11373-2953",,Mission not available,2017,Yes
https://www.charitynavigator.org/ein/113329562,St. Pauls Baptist Church,113329562,,,"Not rated, Not currently rated, This organization is not rated",,"14802 130TH AVE, JAMAICA, NY, 11436-2337",,Mission not available,1996,Yes
https://www.charitynavigator.org/ein/113329711,P S 321 Parent-Teacher Association Inc.,113329711,54%,1,,,"180 7TH AVE, BROOKLYN, NY, 11215-2609",718-499-2412,Provide educational support to faculty and students.,1997,No
https://www.charitynavigator.org/ein/113329795,Lifeline Mission Ministries Inc.,113329795,,,"Not rated, Not currently rated, This organization is not rated",,"3101 CLARENDON RD, BROOKLYN, NY, 11226-6415",,Mission not available,2000,Yes
https://www.charitynavigator.org/ein/113330163,Congregation Kahal Yereim Aderes Eliyuke,113330163,,,"Not rated, Not currently rated, This organization is not rated",,"1511 45TH ST, BROOKLYN, NY, 11219-1629",,Mission not available,1996,Yes
https://www.charitynavigator.org/ein/113330235,The Rebuilt Church of the Holy Spirit,113330235,,,"Not rated, Not currently rated, This organization is not rated",,"4002 167TH ST, FLUSHING, NY, 11358-2629",,Mission not available,1997,Yes
https://www.charitynavigator.org/ein/113330282,Torah Ohr Hebrew Academy,113330282,,,"Not rated, Not currently rated, This organization is not rated",,"575 MIDDLE NECK RD, GREAT NECK, NY, 11023-1471",,Mission not available,1996,Yes
https://www.charitynavigator.org/ein/113330467,Sri Lanka Medical Association North America Inc.,113330467,50%,1,,,"54 DOYLE DR, FLORHAM PARK, NJ, 07932-1076",973-615-2190,"BASIC HEALTH CARE, TO THOSE WHO NEED IT AND CAN NOT AFFORD IT.",1999,No
https://www.charitynavigator.org/ein/113330474,Pentecostal Redeemers Temple,113330474,,,"Not rated, Not currently rated, This organization is not rated",,"1537 BERGEN ST # 41, BROOKLYN, NY, 11213-1704",,Mission not available,1998,Yes
https://www.charitynavigator.org/ein/113330299,Khal Talmudim,113330299,,,"Not rated, Not currently rated, This organization is not rated",,"1265 55TH ST, BROOKLYN, NY, 11219-4125",,Mission not available,1996,Yes
https://www.charitynavigator.org/ein/113330575,Get Together Foundation for the Children,113330575,,,"Not rated, Not currently rated, This organization is not rated",,"214 3RD ST, MINEOLA, NY, 11501-4217",,Mission not available,1999,Yes
https://www.charitynavigator.org/ein/113330685,Meals & Memories Inc.,113330685,,,"Not rated, Not currently rated, This organization is not rated",,"2983 BEDFORD AVE, BROOKLYN, NY, 11210-2831",,Mission not available,1997,Yes
https://www.charitynavigator.org/ein/113330711,Congregation Ezra Sholom,113330711,,,"Not rated, Not currently rated, This organization is not rated",,"1966 E 9TH ST, BROOKLYN, NY, 11223-3242",,Mission not available,1996,Yes
https://www.charitynavigator.org/ein/113330747,INTERNATIONAL ASSOCIATION OF HOSPITALITY ACCOUNTANTS,113330747,,,"Not rated, Not currently rated, This organization is not rated",,"PO BOX 5110, EAST HAMPTON, NY, 11937-6141",,Mission not available,1998,Yes
https://www.charitynavigator.org/ein/113330783,Friends of Edward R Murrow High School Inc.,113330783,73%,2,,,"1600 AVENUE L, BROOKLYN, NY, 11230-4419",718-258-9283,TO HELP RAISE CRITICAL FINANCIAL SUPPORT FOR SPECIAL PROJECTS AND OTHER NEEDS FOR WHICH THE CITY CANNOT PROVIDE FUNDING.,1997,No
https://www.charitynavigator.org/ein/113331066,Queens Lesbian & Gay Community Center Inc.,113331066,97%,4,,http://www.Queenspridehouse.org,"975 KELLY ST APT 201, BRONX, NY, 10459-3267",718-429-5309,"Education and services to the LBGT Community, health information, referral and health resources center",1998,No
https://www.charitynavigator.org/ein/113331272,Bread of Life Christian Fellowship,113331272,,,"Not rated, Not currently rated, This organization is not rated",,"87 RADCLIFFE RD, ISLAND PARK, NY, 11558-1444",,Mission not available,1997,Yes
https://www.charitynavigator.org/ein/113331224,Living Soul Church of US A,113331224,,,"Not rated, Not currently rated, This organization is not rated",,"6920 38TH AVE, WOODSIDE, NY, 11377-2921",,Mission not available,1996,Yes
https://www.charitynavigator.org/ein/113331187,New Heaven Presbyterian Church,113331187,,,"Not rated, Not currently rated, This organization is not rated",,"1 MAIN ST, MINEOLA, NY, 11501-4222",,Mission not available,1997,Yes
https://www.charitynavigator.org/ein/113331443,Striving to Achieve & Reach Success Inc.,113331443,,,"Not rated, Not currently rated, This organization is not rated",,"8 COLEMAN SQ, HOWARD BEACH, NY, 11414-3529",,Mission not available,2014,Yes
https://www.charitynavigator.org/ein/113331462,Full Gospel Believers Church Inc.,113331462,,,"Not rated, Not currently rated, This organization is not rated",,"89 MALCOLM X BLVD, BROOKLYN, NY, 11221-2320",,Mission not available,1997,Yes
https://www.charitynavigator.org/ein/113331525,NATIONAL COUNCIL OF YOUNG ISRAEL,113331525,,,"Not rated, Not currently rated, This organization is not rated",,"2082 E 58TH ST, BROOKLYN, NY, 11234-4104",,Mission not available,1952,Yes
https://www.charitynavigator.org/ein/113331303,Bnos Malka Academy,113331303,54%,1,,http://WWW.BNOSMALKA.ORG,"7102 113TH ST, FOREST HILLS, NY, 11375-4654",718-268-2667,THE MISSION OF BNOS MALKA ACADEMY FOR GIRLS IS TO PROVIDE A HIGH QUALITY EDUCATION IN BOTH RELIGIOUS AND SECULAR STUDIES.THE SCHOOL IS COMMITTED TO MAINTAINING A DEV ... (More),1997,No
https://www.charitynavigator.org/ein/113331694,International Pureland Association of USA Inc.,113331694,,,"Not rated, Not currently rated, This organization is not rated",,"3636 MAIN ST STE 2C, FLUSHING, NY, 11354-6517",718-359-0384,To promote the learning of Amitabha Buddha Pureland Dharma.,2002,Yes
https://www.charitynavigator.org/ein/113331770,Assoc of Suffolk County Supervisors for Educational Technologies Inc.,113331770,56%,1,,http://www.assetny.org,"26 RAILROAD AVENUE STE S215, BABYLON, NY, 11702-2204",,Enhance tecnical education K thru 12,2014,No
https://www.charitynavigator.org/ein/113331979,Christian Motivational Ministries International Incorporated,113331979,,,"Not rated, Not currently rated, This organization is not rated",,"16530 145TH AVE, JAMAICA, NY, 11434-5127",,Mission not available,2004,Yes
https://www.charitynavigator.org/ein/113332107,Grumman Retiree Club,113332107,,,"Not rated, Not currently rated, This organization is not rated",,"925 S OYSTER BAY RD, BETHPAGE, NY, 11714-1035",,Mission not available,2002,Yes
https://www.charitynavigator.org/ein/113332491,Citizens Against Recidivism Inc.,113332491,,,"Not rated, Not currently rated, This organization is not rated",,"137-58 THURSTON STREET - LL SUITE, SPRINGFIELD GARDENS, NY, 11413-2677",,Mission not available,2005,Yes
https://www.charitynavigator.org/ein/113332655,FULL GOSPEL OF CHRIST FELLOWSHIP INC,113332655,,,"Not rated, Not currently rated, This organization is not rated",,"359 QUINCY ST, BROOKLYN, NY, 11216-1501",,Mission not available,1991,Yes
https://www.charitynavigator.org/ein/113332800,Khal Bnei Yisrael,113332800,,,"Not rated, Not currently rated, This organization is not rated",,"1043 42ND ST, BROOKLYN, NY, 11219-1204",,Mission not available,1996,Yes
https://www.charitynavigator.org/ein/113332844,Rivka and Aaron M Schreiber Family Foundation Inc.,113332844,,,"Not rated, Not currently rated, This organization is not rated",,"14 MANOR LN, LAWRENCE, NY, 11559-1504",,Mission not available,2016,Yes
https://www.charitynavigator.org/ein/113333036,Christ Apostolic Church of God Mission Inc.,113333036,,,"Not rated, Not currently rated, This organization is not rated",,"736 GLENMORE AVE, BROOKLYN, NY, 11208-2111",,Mission not available,1997,Yes
https://www.charitynavigator.org/ein/113332277,Shema Kolainu Inc.,113332277,,,"Not rated, Not currently rated, This organization is not rated",,"1909 50TH ST, BROOKLYN, NY, 11204-1313",,Mission not available,1997,Yes
https://www.charitynavigator.org/ein/113332514,Greenpoint Monitor Museum,113332514,83%,3,,http://www.greenpointmonitormuseum.org,"PO BOX 220378, BROOKLYN, NY, 11222-0378",347-268-0345,"Education involving the USS Monitor, Civil War history and local Greenpoint (Brooklyn) history where the USS Monitor was constructed & launched. Prepare historic don ... (More)",1997,No
