url,name,ein,score,star_rating,keywords,website,address,phone,organization_mission,IRS_ruling_year,contain_keywords
https://www.charitynavigator.org/ein/311286511,ANCIENT ACCEPTED SCOTTISH RITE OF FREE MASONRY NMJ,311286511,,,"Not rated, This organization is not rated, Not currently rated",,"290 CRAMER CREEK COURT, DUBLIN, OH, 43017-0000",,"The Endowmen is created and shall be operated exclusively for the purpose of receiving, investing and distributing money and other property for the purpose of acquir ... (More)",1940,Yes
https://www.charitynavigator.org/ein/311286558,BRYN DU WOODS ASSOCIATION INC,311286558,,,"Not rated, This organization is not rated, Not currently rated",,"275 S 21ST STREET, NEWARK, OH, 43055-0000",,Mission not available,2002,Yes
https://www.charitynavigator.org/ein/311286582,DAYTON CHINESE CHRISTIAN CHURCH,311286582,,,"Not rated, This organization is not rated, Not currently rated",,"600 PATTERSON RD, DAYTON, OH, 45419-4303",,Mission not available,1963,Yes
https://www.charitynavigator.org/ein/311286613,THE OHIO STATE UNIVERSITY,311286613,,,"Not rated, This organization is not rated, Not currently rated",,"5368 DAVIDSON RD, HILLIARD, OH, 43026-9677",,Mission not available,2013,Yes
https://www.charitynavigator.org/ein/311286856,Athens County Habitat for Humanity,311286856,73%,2,,http://WWW.HABITATSEO.ORG,"14440 STATE ROUTE 13, MILLFIELD, OH, 45761-9800",740-592-0032,"TO PROVIDE DECENT, AFFORDABLE HOUSING IN PARTNERSHIP WITH FAMILIES IN NEED AND OUR COMMUNITIES; TO MAKE ADEQUATE HOUSING A MATTER CONSCIENCE AND ACTION FOR EVERYONE.",1987,No
https://www.charitynavigator.org/ein/311286938,FIRST BAPTIST CHURCH OF NORTHRIDGE TT,311286938,,,"Not rated, This organization is not rated, Not currently rated",,"PO BOX 13622, DAYTON, OH, 45413-0622",,Mission not available,1963,Yes
https://www.charitynavigator.org/ein/311286951,Project Learning Tree Ohio,311286951,,,"Not rated, This organization is not rated, Not currently rated",,"2045 MORSE RD BUILDING H1, COLUMBUS, OH, 43229-6605",,Mission not available,1997,Yes
https://www.charitynavigator.org/ein/311287075,PUBLIC EMPLOYEE RETIREES INC,311287075,,,"Not rated, This organization is not rated, Not currently rated",,"659 PARK MEADOW RD STE F, WESTERVILLE, OH, 43081-2879",,Mission not available,1976,Yes
https://www.charitynavigator.org/ein/311287084,PTA OHIO CONGRESS,311287084,,,"Not rated, This organization is not rated, Not currently rated",,"1490 HARD RD, COLUMBUS, OH, 43235-1992",,Mission not available,1973,Yes
https://www.charitynavigator.org/ein/311287283,Paul L Newman Foundation,311287283,,,"Not rated, This organization is not rated, Not currently rated",,"363 SYCAMORE AVE, MERION STA, PA, 19066-1538",,Mission not available,1994,Yes
https://www.charitynavigator.org/ein/311287194,WHITE OAK,311287194,,,"Not rated, This organization is not rated, Not currently rated",,"604 WHITE OAK RD, BLUE CREEK, OH, 45616-0000",,Mission not available,1961,Yes
https://www.charitynavigator.org/ein/311287409,SEVIER FAMILY ASSOCIATION,311287409,,,"Not rated, This organization is not rated, Not currently rated",,"3424 LENOX DR, DAYTON, OH, 45429-1512",,Mission not available,1990,Yes
https://www.charitynavigator.org/ein/311287496,PUBLIC EMPLOYEE RETIREES INC,311287496,,,"Not rated, This organization is not rated, Not currently rated",,"659 PARK MEADOW RD STE F, WESTERVILLE, OH, 43081-2879",,Mission not available,1976,Yes
https://www.charitynavigator.org/ein/311287564,HORSEMENS BENEVOLENT & PROTECTIVE ASSOC INC OHIO DIVISION,311287564,,,"Not rated, This organization is not rated, Not currently rated",,"3860 BROADWAY, GROVE CITY, OH, 43123-2207",614-875-1269,"TO PROVIDE BENEFITS FOR PERSONS INVOLVED IN THE OWNING, BREEDING, TRAINING OR RACING OF THOROUGHBRED HORSES IN OHIO, EXEMPT FOR RACETRACK OWNERS OR MANAGERS.",1993,Yes
https://www.charitynavigator.org/ein/311287613,COMMUNICATION WORKERS OF AMERICA,311287613,,,"Not rated, This organization is not rated, Not currently rated",,"1040 VERNON RD, GREENVILLE, PA, 16125-9287",,Mission not available,1950,Yes
https://www.charitynavigator.org/ein/311287497,PUBLIC EMPLOYEE RETIREES INC,311287497,,,"Not rated, This organization is not rated, Not currently rated",,"659 PARK MEADOW RD STE F, WESTERVILLE, OH, 43081-2879",,Mission not available,1976,Yes
https://www.charitynavigator.org/ein/311287784,INTERNATIONAL FACILITY MANAGEMENT ASSOCIATION INC,311287784,,,"Not rated, This organization is not rated, Not currently rated",,"240 S HEINCKE RD 603, MIAMISBGURG, OH, 45342-3559",,Mission not available,1989,Yes
https://www.charitynavigator.org/ein/311287081,The Philippine American Society of Greater Dayton Inc.,311287081,,,"Not rated, This organization is not rated, Not currently rated",,"PO BOX 2153, DAYTON, OH, 45401-0000",,Mission not available,2014,Yes
https://www.charitynavigator.org/ein/311287785,Cancer Support Community Greater Cincinnati-Northern Kentucky,311287785,86%,3,,http://cancersupportcincinnati.org/,"4918 Cooper Road, Blue Ash, OH, 45242",513-791-4060,"Cancer Support Community Greater Cincinnati-Northern Kentucky is one of 50 affiliates of the nonprofit Cancer Support Community global network providing emotional, e ... (More)",1990,No
https://www.charitynavigator.org/ein/311287840,Rocksalt Ministries Inc.,311287840,,,"Not rated, This organization is not rated, Not currently rated",,"1100 WATERVLIET AVE, DAYTON, OH, 45420-2720",,Mission not available,1990,Yes
https://www.charitynavigator.org/ein/311287193,Christian Valley Missionary Baptist Church Inc.,311287193,,,"Not rated, This organization is not rated, Not currently rated",,"850 STUDER AVE, COLUMBUS, OH, 43206-1633",,Mission not available,1990,Yes
https://www.charitynavigator.org/ein/311288122,INTERNATIONAL ASSOCIATION OF LIONS CLUB,311288122,,,"Not rated, This organization is not rated, Not currently rated",,"PO BOX 87, FAIRBORN, OH, 45324-0087",,Mission not available,1940,Yes
https://www.charitynavigator.org/ein/311288189,Fort Frye Band Boosters Inc.,311288189,,,"Not rated, This organization is not rated, Not currently rated",,"PO BOX 514, BEVERLY, OH, 45715-0514",,Mission not available,2001,Yes
https://www.charitynavigator.org/ein/311288291,NATIONAL CHURCH RESIDENCES OF,311288291,82%,3,,http://WWW.NATIONALCHURCHRESIDENCES.ORG,"2245 N BANK DR, COLUMBUS, OH, 43220-5422",614-451-2151,PROVIDE HOUSING FOR LOW AND MODERATE INCOME PERSONS.,1982,No
https://www.charitynavigator.org/ein/311288292,NATIONAL CHURCH RESIDENCES OF,311288292,81%,3,,http://WWW.NATIONALCHURCHRESIDENCES.ORG,"2245 N BANK DR, COLUMBUS, OH, 43220-5422",614-451-2151,PROVIDE HOUSING FOR LOW AND MODERATE INCOME PERSONS.,1962,No
https://www.charitynavigator.org/ein/311288294,NCR-VISION CENTER INDEPENDENT HOUSING INC,311288294,82%,3,,http://WWW.NATIONALCHURCHRESIDENCES.ORG,"2245 N BANK DR, COLUMBUS, OH, 43220-5422",614-451-2151,PROVIDE HOUSING FOR LOW AND MODERATE INCOME PERSONS.,1982,No
https://www.charitynavigator.org/ein/311288295,NCR OF QUEENSBURY HOUSING DEVELOPMENT FUND CO,311288295,82%,3,,http://WWW.NATIONALCHURCHRESIDENCES.ORG,"2245 N BANK DR, COLUMBUS, OH, 43220-5422",614-451-2151,PROVIDE HOUSING FOR LOW AND MODERATE INCOME PERSONS.,1982,No
https://www.charitynavigator.org/ein/311288296,NATIONAL CHURCH RESIDENCES OF,311288296,82%,3,,,"2245 N BANK DR, COLUMBUS, OH, 43220-5422",614-451-2151,PROVIDE HOUSING FOR LOW AND MODERATE INCOME PERSONS.,1982,No
https://www.charitynavigator.org/ein/311288297,NATIONAL CHURCH RESIDENCES OF,311288297,81%,3,,http://WWW.NATIONALCHURCHRESIDENCES.ORG,"2245 N BANK DR, COLUMBUS, OH, 43220-5422",614-451-2151,PROVIDE HOUSING FOR LOW AND MODERATE INCOME PERSONS.,1982,No
https://www.charitynavigator.org/ein/311288298,NATIONAL CHURCH RESIDENCES OF,311288298,82%,3,,http://WWW.NATIONALCHURCHRESIDENCES.ORG,"2245 N BANK DR, COLUMBUS, OH, 43220-5422",614-451-2151,PROVIDE HOUSING FOR LOW AND MODERATE INCOME PERSONS.,1982,No
https://www.charitynavigator.org/ein/311288810,TOLLES EDUCATION ASSOCIATION,311288810,,,"Not rated, This organization is not rated, Not currently rated",,"6057 CARRBRIDGE DR, GALLOWAY, OH, 43119-1100",,Mission not available,1990,Yes
https://www.charitynavigator.org/ein/311288939,Majestic Theatre Inc.,311288939,97%,4,,,"230 N PLAZA BLVD, CHILLICOTHE, OH, 45601-1798",740-772-2041,"TO PROMOTE INTEREST IN THE LOCAL AND SURROUNDING AREA IN THE THEATER, AND TO PRESERVE AND RENOVATE THE HISTORICALLY SIGNIFICANT MAJESTIC THEATRE.",1990,No
https://www.charitynavigator.org/ein/311289068,PUBLIC EMPLOYEE RETIREES INC,311289068,,,"Not rated, This organization is not rated, Not currently rated",,"659 PARK MEADOW RD STE F, WESTERVILLE, OH, 43081-2879",,Mission not available,1976,Yes
https://www.charitynavigator.org/ein/311289089,Upper Arlington Rotary Charitable Foundation,311289089,73%,2,,,"1704 SUNDRIDGE DR, COLUMBUS, OH, 43221-1431",614-459-3182,"TO ENCOURAGE AND FOSTER THE SERVICE IDEAL OF SERVICE ABOVE SELF. THE FOUNDATION SUPPORTS THE FIVE AVENUES OF SERVICE, CLUB SERVICE, COMMUNITY SERVICE, INTERNATIONAL ... (More)",1990,No
https://www.charitynavigator.org/ein/311289121,New Covenant Believers Church,311289121,,,"Not rated, This organization is not rated, Not currently rated",,"3400 KOHR BLVD, COLUMBUS, OH, 43224-3051",,Mission not available,1990,Yes
https://www.charitynavigator.org/ein/311289302,Education is the Way,311289302,,,"Not rated, This organization is not rated, Not currently rated",,"PO BOX 452, GROVEPORT, OH, 43125-0452",,Mission not available,1990,Yes
https://www.charitynavigator.org/ein/311289475,222 CORPORATION,311289475,,,"Not rated, This organization is not rated, Not currently rated",http://WWW.FOPOHIO.ORG,"222 EAST TOWN STREET, COLUMBUS, OH, 43215-4611",614-224-5700,THE ORGANIZATION HOLDS TITLE TO REAL PROPERTY THAT IT RENTS TO A RELATED EXEMPT ORGANIZATION.,1991,Yes
https://www.charitynavigator.org/ein/311289576,London Community Foundation,311289576,,,"Not rated, This organization is not rated, Not currently rated",,"86 ELM ST, LONDON, OH, 43140-1192",,Mission not available,1990,Yes
https://www.charitynavigator.org/ein/311289652,First Bible Greater Outreach Church & Bible College,311289652,,,"Not rated, This organization is not rated, Not currently rated",,"2246 GERMANTOWN ST, DAYTON, OH, 45417-3673",,Mission not available,1990,Yes
https://www.charitynavigator.org/ein/311289679,Vision USA - the Ohio Vision Project Inc.,311289679,80%,3,,,"250 E WILSON BRIDGE RD STE 240, WORTHINGTON, OH, 43085-2350",800-874-9111,"TO PROVIDE BASIC EYE, HEALTH, AND VISION CARE WITHOUT CHARGE TO UNINSURED, LOW INCOME WORKERS AND THEIR FAMILIES. ALSO, SUPPORT EDUCATIONAL SCHOLARSHIP AND THE DEVEL ... (More)",1990,No
https://www.charitynavigator.org/ein/311289746,C C D S Foundation,311289746,96%,4,,,"6905 GIVEN RD, CINCINNATI, OH, 45243-0000",513-561-7298,MAINTAIN AN ENDOWMENT FOR THE OPERATIONAL SUPPORT OF THE CINCINNATI COUNTRY DAY SCHOOL.,1991,No
https://www.charitynavigator.org/ein/311289886,GREATER CINCINNATI AND NORTHERN KENTUCKY OF NAIOP,311289886,,,"Not rated, This organization is not rated, Not currently rated",,"1 E 4TH ST STE 1200, CINCINNATI, OH, 45202-3708",,Mission not available,1997,Yes
https://www.charitynavigator.org/ein/311289981,Luebbe Foundation,311289981,,,"Not rated, This organization is not rated, Not currently rated",,"6325 W FORK RD, CINCINNATI, OH, 45247-5703",,Mission not available,1990,Yes
https://www.charitynavigator.org/ein/311290206,COUNCIL ON SPORTS INJURIES AND PHYSICAL FITNESS OF THE AMERICAN,311290206,,,"Not rated, This organization is not rated, Not currently rated",,"103 SOUTH SIXTH STREET, ESTHERVILLE, IA, 51334-2360",,Mission not available,1991,Yes
https://www.charitynavigator.org/ein/311290230,United Church Residences of Marion Ohio Inc.,311290230,60%,2,,http://www.unitedchurchhomes.org/affordable-housing-communities/57-ohio/251-brownstone-terrace,"PO BOX 1806, MARION, OH, 43301-1806",740-382-4885,To Provide Safe and Affordable Housing for Low-Income Elderly and/or Handicapped Persons.,1990,No
https://www.charitynavigator.org/ein/311290231,United Church Residences of Pickerington Ohio Inc.,311290231,57%,1,,http://www.unitedchurchhomes.org/affordable-housing-communities/244-pickfair-square,"PO BOX 1806, MARION, OH, 43301-1806",740-382-4885,To Provide Safe and Affordable Housing to Low-Income Elderly and/or Handicapped Persons.,1990,No
https://www.charitynavigator.org/ein/311290255,SOUTH DAYTON BAPTIST CHURCH,311290255,,,"Not rated, This organization is not rated, Not currently rated",,"2351 RAND AVE, DAYTON, OH, 45439-2841",,Mission not available,1963,Yes
https://www.charitynavigator.org/ein/311290604,MCLUNEY WESLEYAN CHURCH CROOKSVILLE,311290604,,,"Not rated, This organization is not rated, Not currently rated",,"238 S MAPLE HTS, NEW LEXINGTON, OH, 43764-1428",,Mission not available,1970,Yes
https://www.charitynavigator.org/ein/311290637,COOLVILLE ALLEGHENY WESLEYAN METHODIST CHURCH,311290637,,,"Not rated, This organization is not rated, Not currently rated",,"886 STATE ROUTE 7, COOLVILLE, OH, 45723-9773",,Mission not available,1976,Yes
https://www.charitynavigator.org/ein/311290728,AMVETS,311290728,,,"Not rated, This organization is not rated, Not currently rated",,"117 HUNTER AVE, LANCASTER, OH, 43130-4205",740-607-7942,TO ASSIST AND PROMOTE THE HEALTH AND WELFARE OF AMERICAN VETERANS AND THEIR FAMILIES,1945,Yes
https://www.charitynavigator.org/ein/311290751,Columbus Community Clinical Oncology Program,311290751,88%,3,,http://WWW.COLUMBUSCCOP.ORG,"1335 DUBLIN RD SUITE 124 A, COLUMBUS, OH, 43215-7060",614-488-2118,OUR MISSION IS TO DELIVER STATE-OF-THE-ART CANCER CARE TO PATIENTS IN THEIR COMMUNITIES THROUGH CLINICAL TRIALS. THIS ALLOWS INDIVIDUALS TO REMAIN IN THEIR OWN NEIGH ... (More),1990,No
https://www.charitynavigator.org/ein/311290801,BIBLE WAY MINISTERIES INC,311290801,,,"Not rated, This organization is not rated, Not currently rated",,"PO BOX 762, GALLIPOLIS, OH, 45631-0762",,Mission not available,1960,Yes
https://www.charitynavigator.org/ein/311290838,Fairfield West Elementary Parents & Teachers for Children,311290838,,,"Not rated, This organization is not rated, Not currently rated",,"4700 RIVER RD, FAIRFIELD, OH, 45014-1606",,Mission not available,1991,Yes
https://www.charitynavigator.org/ein/311290888,GRANVILLE AREA CHAMBER OF COMMERCE,311290888,,,"Not rated, This organization is not rated, Not currently rated",http://WWW.GRANVILLEOH.COM,"PO BOX 603, GRANVILLE, OH, 43023-0673",740-587-4490,TO PROMOTE LOCAL BUSINESS DEVELOPMENT.,1990,Yes
https://www.charitynavigator.org/ein/311290952,LAKEVIEW BAPTIST CHURCH,311290952,,,"Not rated, This organization is not rated, Not currently rated",,"PO BOX 446, HAMDEN, OH, 45634-0446",,Mission not available,1963,Yes
https://www.charitynavigator.org/ein/311291213,OHIO SOYBEAN COUNCIL,311291213,,,"Not rated, This organization is not rated, Not currently rated",http://WWW.SOYOHIO.ORG,"918 PROPRIETORS RD STE A, WORTHINGTON, OH, 43085-3194",614-476-3100,TO PROMOTE RESEARCH WITHIN THE SOYBEAN INDUSTRY AND TO STRENGTHEN THE INDUSTRY'S POSITION IN THE MARKETPLACE.,1990,Yes
https://www.charitynavigator.org/ein/311290955,Diverse Media Zone Incorporated,311290955,,,"Not rated, This organization is not rated, Not currently rated",,"231 WETMORE RD, COLUMBUS, OH, 43214-2113",,Mission not available,1991,Yes
https://www.charitynavigator.org/ein/311291254,Heart of Ohio Emmaus,311291254,,,"Not rated, This organization is not rated, Not currently rated",,"1075 MARIANNA DR, MANSFIELD, OH, 44903-8872",,Mission not available,1998,Yes
https://www.charitynavigator.org/ein/311291269,Christs Restoration Branch,311291269,,,"Not rated, This organization is not rated, Not currently rated",,"RT 1 BOX 344, LUCASVILLE, OH, 45648-9752",,Mission not available,1991,Yes
https://www.charitynavigator.org/ein/311291320,Greenfield Township Firemans Association Inc.,311291320,,,"Not rated, This organization is not rated, Not currently rated",,"3245 HAVENSPORT RD, CARROLL, OH, 43112-9448",,Mission not available,1990,Yes
https://www.charitynavigator.org/ein/311291602,AMERICAN INNS OF COURT FOUNDATION,311291602,,,"Not rated, This organization is not rated, Not currently rated",,"250 WEST ST STE 700, COLUMBUS, OH, 43215-7509",,Mission not available,1986,Yes
https://www.charitynavigator.org/ein/311291671,KNIGHTS OF COLUMBUS,311291671,,,"Not rated, This organization is not rated, Not currently rated",,"8100 CLYO RD, CENTERVILLE, OH, 45458-2720",,Mission not available,1940,Yes
https://www.charitynavigator.org/ein/311291686,Marietta Soccer League,311291686,,,"Not rated, This organization is not rated, Not currently rated",,"PO BOX 405, MARIETTA, OH, 45750-0405",,Mission not available,1990,Yes
https://www.charitynavigator.org/ein/311291724,Cincinnati Horticultural Society,311291724,,,"Not rated, This organization is not rated, Not currently rated",,"7800 INDIAN HILL RD, CINCINNATI, OH, 45243-3904",,Mission not available,1990,Yes
https://www.charitynavigator.org/ein/311291778,The Literacy Connection,311291778,,,"Not rated, This organization is not rated, Not currently rated",,"3838 LAKEDALE DR, HILLIARD, OH, 43026-8102",,Mission not available,1996,Yes
https://www.charitynavigator.org/ein/311291867,Eastcare II Inc.,311291867,79%,3,,,"600 WAYNE AVE, DAYTON, OH, 45410-1122",937-496-2000,TO PROVIDE MENTALLY ILL PERSONS WITH HOUSING FACILITIES SPECIFICALLY DESIGNED TO MEET THEIR NEEDS AND PROMOTE HEALTH.,1990,No
https://www.charitynavigator.org/ein/311291870,Sustainable Ohio,311291870,,,"Not rated, This organization is not rated, Not currently rated",http://WWW.COSA-OH.ORG,"118 GRACELAND BLVD, COLUMBUS, OH, 43214-1530",614-278-9445,"PROMOTE, ENCOURAGE, AND SUPPORT ALLIANCES FOR SUSTAINABILITY AMONG AND BETWEEN ORGANIZATIONS, COMMUNITIES AND INDIVIDUALS THROUGHOUT CENTRAL OHIO SO AS TO STRENGTHEN ... (More)",1990,Yes
https://www.charitynavigator.org/ein/311291872,Prince Hall Scholarship Foundation,311291872,73%,2,,,"50 HAMILTON PARK, COLUMBUS, OH, 43203-1876",,PROVIDE COLLEGE SCHOLARSHIPS FOR OHIO STUDENTS,1990,No
https://www.charitynavigator.org/ein/311292235,Grace Community Church,311292235,,,"Not rated, This organization is not rated, Not currently rated",,"PO BOX 503, WASHINGTON CH, OH, 43160-0503",,Mission not available,1991,Yes
https://www.charitynavigator.org/ein/311292463,INTERNATIONAL FACILITY MANAGEMENT ASSOCIATION INC,311292463,,,"Not rated, This organization is not rated, Not currently rated",,"PO BOX 340647, COLUMBUS, OH, 43234-0647",,Mission not available,1989,Yes
https://www.charitynavigator.org/ein/311292621,Christian Community Church- westerville,311292621,,,"Not rated, This organization is not rated, Not currently rated",,"PO BOX 494, NEW ALBANY, OH, 43054-0494",,Mission not available,1990,Yes
https://www.charitynavigator.org/ein/311292975,PUBLIC EMPLOYEE RETIREES INC,311292975,,,"Not rated, This organization is not rated, Not currently rated",,"659 PARK MEADOW RD STE F, WESTERVILLE, OH, 43081-2879",,Mission not available,1976,Yes
https://www.charitynavigator.org/ein/311293175,Bellefontaine Cultural Arts Commission,311293175,43%,0,,http://locoartspot.com,"PO BOX 640, BELLEFONTAINE, OH, 43311-0640",,To provide Educational Art Programs to the Logan County community.,1990,No
https://www.charitynavigator.org/ein/311293265,A K STEEL SUPPLEMENTAL CORPORATION COMPENSATION BENEFIT MASTER TRUST,311293265,,,"Not rated, This organization is not rated, Not currently rated",,"9227 CENTRE POINTE DR, WEST CHESTER, OH, 45069-4822",216-222-8220,THE AK STEEL CO LLP SUPPLEMENTAL UNEMPLOYMENT BENEFIT TRUST PROVIDES UNEMPLOYMENT BENEFIT PAYMENTS FOR EMPLOYEES OF AK STEEL CORPORATION,1990,Yes
https://www.charitynavigator.org/ein/311293267,Ohio Senior Olympics Inc.,311293267,,,"Not rated, This organization is not rated, Not currently rated",,"4022 PALOS ST, CINCINNATI, OH, 45205-2113",,Mission not available,1991,Yes
https://www.charitynavigator.org/ein/311292799,MIDWESTERN CRIMINAL JUSTICE ASSOCIATION INC,311292799,,,"Not rated, This organization is not rated, Not currently rated",,"223 HEALTH AND HUMAN SERVICES, BOWLING GREEN, OH, 43403-0001",,Mission not available,1990,Yes
https://www.charitynavigator.org/ein/311293140,COLUMBUS MUZZLE LOADING GUN CLUB INC,311293140,,,"Not rated, This organization is not rated, Not currently rated",,"9156 PARKPOINT LN, LEWIS CENTER, OH, 43035-9582",,Mission not available,1999,Yes
https://www.charitynavigator.org/ein/311293451,Lawrence County Ohio Humane Socity Inc.,311293451,,,"Not rated, This organization is not rated, Not currently rated",,"PO BOX 412, IRONTON, OH, 45638-0412",,Mission not available,2018,Yes
https://www.charitynavigator.org/ein/311293130,Cleaster Mims College Preparatory School Inc.,311293130,,,"Not rated, This organization is not rated, Not currently rated",,"7855 DAWN RD, CINCINNATI, OH, 45237-0000",,Mission not available,1991,Yes
https://www.charitynavigator.org/ein/311293703,Juvenile Education Fund,311293703,,,"Not rated, This organization is not rated, Not currently rated",,"124 E MAIN ST, TROY, OH, 45373-3407",,Mission not available,1990,Yes
https://www.charitynavigator.org/ein/311293797,OHIO CHAPTER OF THE INTERNATIONAL ASSOCIATION OF REHABILITATION,311293797,,,"Not rated, This organization is not rated, Not currently rated",,"3285 SUNGLOW DR, LEWIS CENTER, OH, 43035-8301",,Mission not available,2024,Yes
https://www.charitynavigator.org/ein/311293800,Columbus Coalition for the Homeless,311293800,90%,4,,http://www.columbushomeless.org,"501 E BROAD ST, COLUMBUS, OH, 43215-3822",614-228-1342,"Advocacy, education, and empowerment to help resolve homelessness in Columbus, Ohio.",1990,No
https://www.charitynavigator.org/ein/311293975,Southeast Dayton Neighborhood Development Corporation,311293975,,,"Not rated, This organization is not rated, Not currently rated",,"217 CHATHAM DR, KETTERING, OH, 45429-1407",,Mission not available,1990,Yes
https://www.charitynavigator.org/ein/311294133,Power of Prayer Church,311294133,,,"Not rated, This organization is not rated, Not currently rated",,"2155 CURTIS ST, COLUMBUS, OH, 43207-2593",,Mission not available,1995,Yes
https://www.charitynavigator.org/ein/311294483,GRACEWORKS LUTHERAN SERVICES,311294483,,,"Not rated, This organization is not rated, Not currently rated",,"6430 INNER MISSION WAY, DAYTON, OH, 45459-2795",,Mission not available,1985,Yes
https://www.charitynavigator.org/ein/311294082,African American Spiritual Awareness Crusade,311294082,,,"Not rated, This organization is not rated, Not currently rated",,"2490 CLEVELAND AVE, COLUMBUS, OH, 43211-1642",,Mission not available,1991,Yes
https://www.charitynavigator.org/ein/311294860,PALESTINIAN AMERICAN ASSOCIATION,311294860,,,"Not rated, This organization is not rated, Not currently rated",,"7601 LEE RD, WESTERVILLE, OH, 43081-9611",,Mission not available,1988,Yes
https://www.charitynavigator.org/ein/311295141,MID-AMERICA FOOD PROCESSORS ASSOCIATION,311295141,,,"Not rated, This organization is not rated, Not currently rated",,"PO BOX 307, ST HENRY, OH, 45883-0307",,Mission not available,1990,Yes
https://www.charitynavigator.org/ein/311295248,Community Services Center Inc.,311295248,,,"Not rated, This organization is not rated, Not currently rated",,"PO BOX 360822, COLUMBUS, OH, 43236-0822",,Mission not available,1991,Yes
https://www.charitynavigator.org/ein/311294787,BAHAIS OF BEXLEY,311294787,,,"Not rated, This organization is not rated, Not currently rated",,"194 N STANWOOD RD, BEXLEY, OH, 43209-1503",,Mission not available,1995,Yes
https://www.charitynavigator.org/ein/311295421,Marion Catholic High School Endowment,311295421,,,"Not rated, This organization is not rated, Not currently rated",,"1001 MT VERNON AVE, MARION, OH, 43302-5536",,Mission not available,1990,Yes
https://www.charitynavigator.org/ein/311295448,Greater Lake Cumberland Ralph Bell Crusade,311295448,,,"Not rated, This organization is not rated, Not currently rated",,"PO BOX 3304, SOMERSET, KY, 42564-3304",,Mission not available,1990,Yes
https://www.charitynavigator.org/ein/311295456,GROESBECK FIRST BAPTIST CHURCH,311295456,,,"Not rated, This organization is not rated, Not currently rated",,"3551 POOLE RD, CINCINNATI, OH, 45251-2927",,Mission not available,1963,Yes
https://www.charitynavigator.org/ein/311295471,THE OHIO STATE UNIVERSITY,311295471,,,"Not rated, This organization is not rated, Not currently rated",,"3445 CAMDEN SUGAR VALLEY RD, EATON, OH, 45320-9306",,Mission not available,2013,Yes
https://www.charitynavigator.org/ein/311295329,OMEGA PSI PHI FRATERNITY,311295329,,,"Not rated, This organization is not rated, Not currently rated",,"5505 BEVERLY AVE NE, CANTON, OH, 44721-3277",,Mission not available,1953,Yes
https://www.charitynavigator.org/ein/311295510,LANCASTER SCHOOL SUPPORT ASSOCIATION,311295510,,,"Not rated, This organization is not rated, Not currently rated",,"910 REESE AVE, LANCASTER, OH, 43130-4550",,Mission not available,2010,Yes
https://www.charitynavigator.org/ein/311295587,THE OHIO STATE UNIVERSITY,311295587,,,"Not rated, This organization is not rated, Not currently rated",,"2670 SELMA JAMESTOWN RD, CEDARVILLE, OH, 45314-8592",,Mission not available,2013,Yes
https://www.charitynavigator.org/ein/311295608,VETERANS OF FOREIGN WARS OF THE UNITED STATES DEPARTMENT OF OHIO,311295608,,,"Not rated, This organization is not rated, Not currently rated",,"PO BOX 24, SOMERSET, OH, 43783-0024",,Mission not available,1940,Yes
https://www.charitynavigator.org/ein/311295665,Driscoll Elementary Pto Inc.,311295665,,,"Not rated, This organization is not rated, Not currently rated",,"5767 MARSHALL RD, DAYTON, OH, 45429-6024",,Mission not available,2022,Yes
https://www.charitynavigator.org/ein/311295721,We Care Arts,311295721,93%,4,,http://www.wecarearts.org,"3035 WILMINGTON PIKE, KETTERING, OH, 45429-4001",937-252-3937,To empower and heal through art and community.,1990,No
