url,name,ein,score,star_rating,keywords,website,address,phone,organization_mission,IRS_ruling_year,contain_keywords
https://www.charitynavigator.org/ein/222425855,Rutgers University College of Nursing Alumni Association,222425855,,,"Not rated, Not currently rated, This organization is not rated",,"180 UNIVERSITY AVENUE, NEWARK, NJ, 07102-0000",,Mission not available,2014,Yes
https://www.charitynavigator.org/ein/222426020,ASSEMBLY OF GOD,222426020,,,"Not rated, Not currently rated, This organization is not rated",,"PO BOX 202, ATCO, NJ, 08004-0202",,Mission not available,1964,Yes
https://www.charitynavigator.org/ein/222425563,MARLTON ASSEMBLY OF GOD,222425563,,,"Not rated, Not currently rated, This organization is not rated",,"625 E MAIN ST, MARLTON, NJ, 08053-2303",,Mission not available,1964,Yes
https://www.charitynavigator.org/ein/222426089,First Timothy Missionary Baptist Church,222426089,,,"Not rated, Not currently rated, This organization is not rated",,"215 CHANCELLOR AVE, NEWARK, NJ, 07112-1751",,Mission not available,1983,Yes
https://www.charitynavigator.org/ein/222426171,Holocaust Resource Foundation Inc.,222426171,,,"Not rated, Not currently rated, This organization is not rated",,"820 MORRIS TURNPIKE, SHORT HILLS, NJ, 07078-2624",973-467-5000,"TO FORM AN INCLUSIVE ORGANIZATION TO SERVE NEW JERSEY'S STUDENTS, EDUCATORS, AND PUBLIC, REGARDLESS OF RELIGIOUS, ETHNIC, OR NATIONAL BACKGROUND.",1985,Yes
https://www.charitynavigator.org/ein/222426382,GENERAL COUNCIL OF THE ASSEMBLIES OF GOD,222426382,,,"Not rated, Not currently rated, This organization is not rated",,"180, MARTVILLE, NY, 13111-0000",,Mission not available,1964,Yes
https://www.charitynavigator.org/ein/222426168,NEW JERSEY STATE POLICEMENS BENEVOLENT ASSOCIATION INC,222426168,,,"Not rated, Not currently rated, This organization is not rated",,"103 OVERLOOK AVENUE, NORTH HALEDON, NJ, 07508-2572",,Mission not available,2014,Yes
https://www.charitynavigator.org/ein/222426411,HOPEWELL UNITED METHODIST CHURCH,222426411,,,"Not rated, Not currently rated, This organization is not rated",,"20 BLACKWELL AVE, HOPEWELL, NJ, 08525-1809",,Mission not available,1974,Yes
https://www.charitynavigator.org/ein/222426591,ITALIAN FULL GOSPEL CHURCH,222426591,,,"Not rated, Not currently rated, This organization is not rated",,"96 EMMETT ST, BELLEVILLE, NJ, 07109-2331",,Mission not available,1964,Yes
https://www.charitynavigator.org/ein/222426648,The Academy for Clinical and,222426648,85%,3,,http://ACAPNJ.ORG,"301 S LIVINGSTON AVE STE 202, LIVINGSTON, NJ, 07039-3929",973-629-1001,TRAINING IN MODERN PSYCHOANALYTICS,1986,No
https://www.charitynavigator.org/ein/222426652,Juvenile Education & Awareness Project,222426652,,,"Not rated, Not currently rated, This organization is not rated",,"40 MARKET ST, PASSAIC, NJ, 07055-7404",,Mission not available,2014,Yes
https://www.charitynavigator.org/ein/222426498,Evangelistic Ministries,222426498,,,"Not rated, Not currently rated, This organization is not rated",,"400 E RIDGEWOOD AVE APT 7B, RIDGEWOOD, NJ, 07450-3332",,Mission not available,1983,Yes
https://www.charitynavigator.org/ein/222426711,PLAINFIELD GARDEN CLUB A NEW JERSEY NON PROFIT CORP,222426711,,,"Not rated, Not currently rated, This organization is not rated",,"PO BOX 1312, MOUNTAINSIDE, NJ, 07092-0312",,Mission not available,1985,Yes
https://www.charitynavigator.org/ein/222426751,Silver Ridge Park First Aid Squad,222426751,,,"Not rated, Not currently rated, This organization is not rated",,"PO BOX 3311, TOMS RIVER, NJ, 08756-3311",,Mission not available,1986,Yes
https://www.charitynavigator.org/ein/222426604,Community Holiness Church,222426604,,,"Not rated, Not currently rated, This organization is not rated",,"215 8TH AVE, PATERSON, NJ, 07514-2201",,Mission not available,2010,Yes
https://www.charitynavigator.org/ein/222426825,Oxford Youth Sports Program Inc.,222426825,,,"Not rated, Not currently rated, This organization is not rated",,"5 COLUMBIA ST, OXFORD, NY, 13830-3416",,Mission not available,2020,Yes
https://www.charitynavigator.org/ein/222426769,Christ Care Unit Missionary Baptist Church,222426769,,,"Not rated, Not currently rated, This organization is not rated",,"PO BOX 346, SICKLERVILLE, NJ, 08081-0346",,Mission not available,1983,Yes
https://www.charitynavigator.org/ein/222426895,COMMUNITY PRESBYTERIAN CHURCH OF EDISON NEW JERSEY,222426895,,,"Not rated, Not currently rated, This organization is not rated",,"75 GLENVILLE RD, EDISON, NJ, 08817-4053",,Mission not available,1964,Yes
https://www.charitynavigator.org/ein/222426900,WEST HUDSON CHRISTIAN CENTER,222426900,,,"Not rated, Not currently rated, This organization is not rated",,"557 KEARNY AVE, KEARNY, NJ, 07032-2737",,Mission not available,1964,Yes
https://www.charitynavigator.org/ein/222426882,Oceanport Vol First Aid and Rescue Squad,222426882,76%,3,,http://OCEANPORTFIRSTAID.ORG,"2 PEMBERTON AVE, OCEANPORT, NJ, 07757-1114",732-544-0864,TO PROVIDE FIRST AID TREATMENT AND TRANSPORTATION TO THE BOROUGH RESIDENTS AND THE SURROUNDING COMMUNITY.,2019,No
https://www.charitynavigator.org/ein/222426712,Friends of the Hopewell Township Library,222426712,,,"Not rated, Not currently rated, This organization is not rated",,"245 PENNINGTON TITUSVILLE RD, PENNINGTON, NJ, 08534-1615",,Mission not available,1983,Yes
https://www.charitynavigator.org/ein/222426899,AMERICAN LEGION AUXILIARY,222426899,,,"Not rated, Not currently rated, This organization is not rated",,"220 BUCK ST, MILLVILLE, NJ, 08332-3818",,Mission not available,1946,Yes
https://www.charitynavigator.org/ein/222426902,GRACE ASSEMBLY OF GOD,222426902,,,"Not rated, Not currently rated, This organization is not rated",,"201 ATLANTIC AVE, ATLANTIC CITY, NJ, 08401-7802",,Mission not available,1964,Yes
https://www.charitynavigator.org/ein/222427015,Hudson Valley Community College Foundation Inc.,222427015,94%,4,,http://WWW.HVCC.EDU/FOUNDATION,"80 VANDENBURGH AVENUE, TROY, NY, 12180-6037",518-629-8012,"SUPPORTING THE MISSION, THE STUDENTS, AND THE ALUMNI OF THE HUDSON VALLEY COMMUNITY COLLEGE.",1983,No
https://www.charitynavigator.org/ein/222427019,SOCIETY FOR MARKETING PROFESSIONAL SERVICES,222427019,,,"Not rated, Not currently rated, This organization is not rated",,"40 BEAVER ST, ALBANY, NY, 12207-1524",,Mission not available,1988,Yes
https://www.charitynavigator.org/ein/222427294,Apostolic Church of Jesus Christ,222427294,,,"Not rated, Not currently rated, This organization is not rated",,"347 CORTLAND AVE, SYRACUSE, NY, 13202-3837",,Mission not available,2010,Yes
https://www.charitynavigator.org/ein/222427364,New Jersey Center for Nonprofits Inc.,222427364,96%,4,,http://WWW.NJNONPROFITS.ORG,"3635 QUAKERBRIDGE RD SUITE 35, MERCERVILLE, NJ, 08619-1247",732-227-0800,THE CENTER'S MISSION IS TO BUILD THE POWER OF NEW JERSEY'S NONPROFIT COMMUNITY TO IMPROVE THE QUALITY OF LIFE FOR ALL PEOPLE OF OUR STATE. THROUGH PUBLIC EDUCATION A ... (More),1985,No
https://www.charitynavigator.org/ein/222427710,Eternal Hope Church of God in Christ Inc.,222427710,,,"Not rated, Not currently rated, This organization is not rated",,"19 PAULINE ST, BUFFALO, NY, 14214-2429",,Mission not available,2004,Yes
https://www.charitynavigator.org/ein/222428111,ASSOCIATION FOR COMPUTING MACHINERY,222428111,,,"Not rated, Not currently rated, This organization is not rated",,"PO BOX 1324, PRINCETON, NJ, 08542-1324",,Mission not available,1968,Yes
https://www.charitynavigator.org/ein/222427165,Cape Vincent Improvement League Inc.,222427165,,,"Not rated, Not currently rated, This organization is not rated",,"PO BOX 194, CAPE VINCENT, NY, 13618-0194",,Mission not available,1988,Yes
https://www.charitynavigator.org/ein/222428274,Samaritan Counseling Center of the Southern Tier Inc.,222428274,100%,4,,http://WWW.SAMARITANCOUNSELING.ORG,"3001 E MAIN ST, ENDICOTT, NY, 13760-5843",607-754-2660,PROFESSIONAL COUNSELING,1983,No
https://www.charitynavigator.org/ein/222427189,Pottersville Volunteer Fire Company,222427189,76%,3,,http://PVFC63FIRE.ORG,"PO BOX 98, POTTERSVILLE, NJ, 07979-0098",908-439-2911,ORGANIZED TO PROVIDE FIRE FIGHTING AND FIRE PROTECTION SERVICES TO THE COMMUNITY.,1983,No
https://www.charitynavigator.org/ein/222428365,LEISURE KNOLL MANCHESTER ACTIVITIES COMMITTEE,222428365,,,"Not rated, Not currently rated, This organization is not rated",,"1 BUCKINGHAM DR N, MANCHESTER, NJ, 08759-6703",732-657-6661,PLEASURE AND RECREATION ACTIVITIES FOR SOCIAL CLUBS,1986,Yes
https://www.charitynavigator.org/ein/222428375,TRUSTEES OF PRINCETON UNIVERSITY,222428375,,,"Not rated, Not currently rated, This organization is not rated",,"P O BOX 291, PRINCETON, NJ, 08544-0001",,Mission not available,1984,Yes
https://www.charitynavigator.org/ein/222428304,Foodlink,222428304,97%,4,,http://www.foodlinkny.org,"2011 Mt Read Blvd, Rochester, NY, 14615",585-328-3380,Foodlink is a Rochester-based nonprofit dedicated to ending hunger and building healthier communities by addressing both the symptoms and root causes of food insecur ... (More),1983,No
https://www.charitynavigator.org/ein/222428823,ST PETERS PROPERTIES CORPORATION,222428823,,,"Not rated, Not currently rated, This organization is not rated",http://WWW.SAINTPETERSHCS.COM,"254 EASTON AVE, NEW BRUNSWICK, NJ, 08901-1766",732-745-8600,"REAL ESTATE HOLDINGS TO SUPPORT THE CHARITABLE PURPOSES, PROGRAMS AND SERVICES OF SPUH; A RELATED INTERNAL REVENUE CODE SECTION 501(C)(3) TAX-EXEMPT ORGANIZATION.",1983,Yes
https://www.charitynavigator.org/ein/222428275,St. Josephs Housing Corporation,222428275,,,"Not rated, Not currently rated, This organization is not rated",,"341 CLINTON AVE, ALBANY, NY, 12206-3102",,Mission not available,1983,Yes
https://www.charitynavigator.org/ein/222428919,United Helpers Management Company Inc.,222428919,100%,4,,http://WWW.UNITEDHELPERS.ORG,"8101 STATE HIGHWAY 68, OGDENSBURG, NY, 13669-4403",315-393-3074,TO PROVIDE MANAGEMENT AND ACCOUNTING SERVICES TO COMMONLY CONTROLLED AND OTHER NON-PROFIT CORPORATIONS.,1983,No
https://www.charitynavigator.org/ein/222428967,Albany Pro Musica Inc.,222428967,89%,3,,http://www.albanypromusica.org,"30 2ND ST, TROY, NY, 12180-3292",518-438-6548,Albany Pro Musica's mission is to perform a broad spectrum of quality choral music at the highest levels of artistic excellence that inspires and transforms our audi ... (More),1983,No
https://www.charitynavigator.org/ein/222428976,NEW LIFE CHRISTIAN FELLOWSHIP,222428976,,,"Not rated, Not currently rated, This organization is not rated",,"432 LAKEWOOD BLVD, LINDENWOLD, NJ, 08021-0000",,Mission not available,1964,Yes
https://www.charitynavigator.org/ein/222429072,Council on Compulsive Gambling of New Jersey Inc.,222429072,92%,4,,http://www.800gambler.org/,"3635 QUAKERBRIDGE RD STE 7, HAMILTON, NJ, 08619-1247",,Education of general public on gambling issues and problems,1986,No
https://www.charitynavigator.org/ein/222428915,Creative Environment Day Care Inc.,222428915,92%,4,,http://creativeenvironmentchildrenslearningcenter.org,"28 W MAIN ST, MACEDON, NY, 14502-9101",315-986-8176,"Provide day care services for infants, toddlers, preschoolers, and school-age children.",2022,No
https://www.charitynavigator.org/ein/222429101,LAKE CITY POLICE CLUB,222429101,,,"Not rated, Not currently rated, This organization is not rated",,"169 W 2ND ST, OSWEGO, NY, 13126-2511",,Mission not available,1988,Yes
https://www.charitynavigator.org/ein/222429169,CALVARY EVANGELICAL FREE CHURCH,222429169,,,"Not rated, Not currently rated, This organization is not rated",,"450 FELLS RD, ESSEX FELLS, NJ, 07021-1212",,Mission not available,1965,Yes
https://www.charitynavigator.org/ein/222429288,ROCKAWAY ASSEMBLY OF GOD,222429288,,,"Not rated, Not currently rated, This organization is not rated",,"113 E MAIN ST, ROCKAWAY, NJ, 07866-3517",,Mission not available,1964,Yes
https://www.charitynavigator.org/ein/222429175,PTA NEW JERSEY CONGRESS OF PARENTS & TEACHERS,222429175,,,"Not rated, Not currently rated, This organization is not rated",,"600 PARK AVENUE, HAMILTON, NJ, 08610-0000",,Mission not available,1972,Yes
https://www.charitynavigator.org/ein/222429332,Charles O & Elsie Haynes Trust,222429332,,,"Not rated, Not currently rated, This organization is not rated",,"1410 COUNTY HIGHWAY 48, ONEONTA, NY, 13820-4310",,Mission not available,1983,Yes
https://www.charitynavigator.org/ein/222429385,Faith United Christian Church,222429385,,,"Not rated, Not currently rated, This organization is not rated",,"119 WASHINGTON AVE, BERLIN, NJ, 08009-1640",,Mission not available,1983,Yes
https://www.charitynavigator.org/ein/222429563,Drumthwacket Foundation Inc.,222429563,96%,4,,http://WWW.DRUMTHWACKET.ORG,"354 STOCKTON ST, PRINCETON, NJ, 08540-4406",609-683-0057,"TO INSPIRE PRIDE AND ENHANCE CIVIC AWARENESS FOR ALL NEW JERSEYANS BY RESTORING THE HISTORIC DRUMTHWACKET PROPERTY, THE OFFICIAL RESIDENCE ON NJ GOVERNORS, AND BY ED ... (More)",1983,No
https://www.charitynavigator.org/ein/222429806,Garden Club of Somerset Hills,222429806,,,"Not rated, Not currently rated, This organization is not rated",,"52 BRANCH RD, FAR HILLS, NJ, 07931-2239",,Mission not available,1985,Yes
https://www.charitynavigator.org/ein/222429161,Gibbsboro Home and School Association,222429161,,,"Not rated, Not currently rated, This organization is not rated",,"37 KIRKWOOD RD, GIBBSBORO, NJ, 08026-1432",,Mission not available,2012,Yes
https://www.charitynavigator.org/ein/222429933,PATRIARCHAL PARISHES OF THE RUSSIAN ORTHODOX CHURCH IN THE USA,222429933,,,"Not rated, Not currently rated, This organization is not rated",,"909 RTE 517, HACKETTSTOWN, NJ, 07840-0000",,Mission not available,2017,Yes
https://www.charitynavigator.org/ein/222429611,Central Jersey Bmx Inc.,222429611,,,"Not rated, Not currently rated, This organization is not rated",,"2449 ROUTE 9 NORTH, HOWELL, NJ, 07731-3715",,Mission not available,2019,Yes
https://www.charitynavigator.org/ein/222429587,LIGHTHOUSE CHRISTIAN FELLOWSHIP OF THE ASSEMBLIES OF GOD,222429587,,,"Not rated, Not currently rated, This organization is not rated",,"100 HARDENBURG LN, E BRUNSWICK, NJ, 08816-2508",,Mission not available,1964,Yes
https://www.charitynavigator.org/ein/222429849,UNITED FOOD AND COMMERCIAL WORKERS INTERNATIONAL UNION,222429849,,,"Not rated, Not currently rated, This organization is not rated",,"475 MARKET ST, ELMWOOD PARK, NJ, 07407-3126",973-256-8480,PROMOTES COMMON GOALS OF ORGANIZATION & ITS MEMBERSHIP,1941,Yes
https://www.charitynavigator.org/ein/222430054,GARDEN STATE CREDIT ASSOCIATES INC,222430054,,,"Not rated, Not currently rated, This organization is not rated",,"1 W CAMPANIA LN, FARMINGDALE, NJ, 07727-4350",,Mission not available,2024,Yes
https://www.charitynavigator.org/ein/222430208,Schwarz Foundation,222430208,,,"Not rated, Not currently rated, This organization is not rated",,"200 CENTRAL AVE STE 201, MOUNTAINSIDE, NJ, 07092-1961",,Mission not available,1983,Yes
https://www.charitynavigator.org/ein/222430393,Ronald McDonald House of Southern New Jersey,222430393,97%,4,,http://www.ronaldhouse-snj.org/,"550 Mickle Road, Camden, NJ, 08103",856-966-4663,"When you are far from home, your child is in the hospital, and you have not had anything to eat the entire day, except for a vending machine, the last thought you sh ... (More)",1983,No
https://www.charitynavigator.org/ein/222430361,AMERICAN FEDERATION OF TEACHERS,222430361,,,"Not rated, Not currently rated, This organization is not rated",,"5705 MAIN STREET, ROMULUS, NY, 14541-9551",,Mission not available,1967,Yes
https://www.charitynavigator.org/ein/222430620,Tlf Foundation A Nj Nonprofit Corporation,222430620,,,"Not rated, Not currently rated, This organization is not rated",,"5 SPLIT ROCK DR, CHERRY HILL, NJ, 08003-1220",,Mission not available,1986,Yes
https://www.charitynavigator.org/ein/222430789,LAMBS ROAD CATHEDRAL,222430789,,,"Not rated, Not currently rated, This organization is not rated",,"190 LAMBS RD, SEWELL, NJ, 08080-3905",,Mission not available,1964,Yes
https://www.charitynavigator.org/ein/222430802,The American Friends of Bnot Torah Institute,222430802,79%,3,,,"PO BOX 300596, BROOKLYN, NY, 11230-0596",,RELIGIOUS EDUCATION,1986,No
https://www.charitynavigator.org/ein/222430908,LIFE CHAPEL ASSEMBLY OF GOD CHURCH,222430908,,,"Not rated, Not currently rated, This organization is not rated",,"3118 BRIDGE AVE, PT PLEASANT, NJ, 08742-3469",,Mission not available,1983,Yes
https://www.charitynavigator.org/ein/222431105,Islamic Center of America,222431105,,,"Not rated, Not currently rated, This organization is not rated",,"215 N ORATON PKWY, EAST ORANGE, NJ, 07017-4411",,Mission not available,1983,Yes
https://www.charitynavigator.org/ein/222430913,NEW PROGESSIVE CATHEDRAL CHURCH OF GOD IN CHRIST,222430913,,,"Not rated, Not currently rated, This organization is not rated",,"CHRIST IN CHRIST 410 CHILI AVENUE, ROCHESTER, NY, 14611-0000",,Mission not available,1969,Yes
https://www.charitynavigator.org/ein/222431065,United Way of Hunterdon County,222431065,86%,3,,http://www.uwhunterdon.org/,"4 Walter East Foran Boulevard, Flemington, NJ, 08822",908-782-3414,"United Way of Hunterdon County is a community center of volunteerism, leadership, and philanthropy that envisions a community where all individuals and families achi ... (More)",1985,No
https://www.charitynavigator.org/ein/222431127,CALVARY ASSEMBLY OF GOD,222431127,,,"Not rated, Not currently rated, This organization is not rated",,"120 MECHANIC ST, HIGHTSTOWN, NJ, 08520-3606",,Mission not available,1964,Yes
https://www.charitynavigator.org/ein/222431294,M-Ark Project Inc.,222431294,96%,4,,http://WWW.MARKPROJECT.ORG,"43355 STATE ROUTE 28, ARKVILLE, NY, 12406-1557",845-586-3500,"To protect and revitalize the area's housing, economic, human, natural, and physical resources in order to enhance its sustainable economic development and quality o ... (More)",1983,No
https://www.charitynavigator.org/ein/222431298,VROOM STREET EVANGELICAL FREE CHURCH OF JERSEY CITY,222431298,,,"Not rated, Not currently rated, This organization is not rated",,"155 VROOM ST, JERSEY CITY, NJ, 07306-4511",,Mission not available,1965,Yes
https://www.charitynavigator.org/ein/222431332,KINGS COMMUNITY BAPTIST CHURCH,222431332,,,"Not rated, Not currently rated, This organization is not rated",,"395 KINGS HWY N, CHERRY HILL, NJ, 08034-1013",,Mission not available,1955,Yes
https://www.charitynavigator.org/ein/222431490,EVANGEL CHAPEL,222431490,,,"Not rated, Not currently rated, This organization is not rated",,"505 STATE HWY 28, BRIDGEWATER, NJ, 08807-2493",,Mission not available,1964,Yes
https://www.charitynavigator.org/ein/222431501,SAINT PAULS UNITED METHODIST CHURCH,222431501,,,"Not rated, Not currently rated, This organization is not rated",,"714 HERBERTSVILLE RD, BRICK, NJ, 08724-1109",,Mission not available,1974,Yes
https://www.charitynavigator.org/ein/222431386,VERNON YOUTH SOCCER INC VYS,222431386,,,"Not rated, Not currently rated, This organization is not rated",,"PO BOX 732, VERNON, NJ, 07462-0732",,Mission not available,2015,Yes
https://www.charitynavigator.org/ein/222431667,Vanguard Christian Church,222431667,,,"Not rated, Not currently rated, This organization is not rated",,"375 PAYNE AVE, N TONAWANDA, NY, 14120-6911",,Mission not available,2000,Yes
https://www.charitynavigator.org/ein/222432179,National Housing Institute,222432179,88%,3,,http://WWW.SHELTERFORCE.ORG,"125 GLENRIDGE AVE UNIT 1547, MONTCLAIR, NJ, 07042-6859",973-509-1600,"THE NATIONAL HOUSING INSTITUTE (NHI), FOUNDED IN 1975, IS AN INDEPENDENT NONPROFIT ORGANIZATION THAT EXAMINES THE ISSUES CAUSING THE CRISIS IN HOUSING AND COMMUNITY ... (More)",1985,No
https://www.charitynavigator.org/ein/222432213,New Jersey Festival Orchestra,222432213,96%,4,,http://www.njfestivalorchestra.org,"224 E BROAD ST STE 6, WESTFIELD, NJ, 07090-5102",,"The Organization offers a series of musical concerts to the general public. The Organization is commited to bringing world class music to audiences in Westfield, thr ... (More)",1985,No
https://www.charitynavigator.org/ein/222431796,Brain Injury Alliance of New Jersey Inc.,222431796,95%,4,,http://WWW.BIANJ.ORG,"825 GEORGES RD STE 2, N BRUNSWICK, NJ, 08902-3357",732-745-0200,"BRAIN INJURY ALLIANCE OF NEW JERSEY, INC.'S MISSION IS TO IMPROVE THE QUALITY OF LIFE FOR ANYONE IMPACTED BY BRAIN INJURY BY PROVIDING SUPPORT, ADVOCACY, AND INFORMA ... (More)",1983,No
https://www.charitynavigator.org/ein/222432405,Barnabas House Church,222432405,,,"Not rated, Not currently rated, This organization is not rated",,"178 E MAIN ST, HAMBURG, NY, 14075-5259",,Mission not available,1983,Yes
https://www.charitynavigator.org/ein/222432180,Friends of Howell Living Historical,222432180,76%,3,,,"101 HUNTER RD, TITUSVILLE, NJ, 08560-1902",609-737-3299,THE ORGANIZATION WAS ESTABLISHED TO SUPPORT AND ASSIST THE MERCER COUNTY PARK COMMISSION IN OPERATING THE FARM AS AN EDUCATIONAL FACILITY THAT PRESERVES AND INTERPRE ... (More),1987,No
https://www.charitynavigator.org/ein/222432409,Chautauqua Hospice and Palliative Care,222432409,96%,4,,http://WWW.CHPC.CARE,"20 W FAIRMOUNT AVE, Lakewood, NY, 14750-1702",716-338-0033,To provide comprehensive Palliative/Hospice Care and Education,1983,No
https://www.charitynavigator.org/ein/222432417,New York Association on Independent Living,222432417,81%,3,,http://WWW.ILNY.ORG,"155 WASHINGTON AVE, ALBANY, NY, 12210-2337",518-465-4650,REPRESENTING INDEPENDENT LIVING CENTERS THROUGHOUT NEW YORK STATE,1983,No
https://www.charitynavigator.org/ein/222432901,EMMANUEL TABERNACLE ASSEMBLY,222432901,,,"Not rated, Not currently rated, This organization is not rated",,"416 BOWER ST, LINDEN, NJ, 07036-2620",,Mission not available,1964,Yes
https://www.charitynavigator.org/ein/222433530,Carolyn Dorfman Dance Co,222433530,78%,3,,,"2780 MORRIS AVE STE 2C, UNION, NJ, 07083-4848",908-687-8855,"TRANSLATE HUMAN EXPERIENCES,RELATIONSHIPS, & CONTEMPORARY ISSUES INTO DANCE. CDDC ENGAGES COMMUNITIES IN THEIR ART AND CREATIVE PROCESS THROUGH INNOVATIVE MODERN DAN ... (More)",1983,No
https://www.charitynavigator.org/ein/222432921,CHRIST MEMORIAL LUTHERAN CHURCH,222432921,,,"Not rated, Not currently rated, This organization is not rated",,"114 OLD STAGE RD, E BRUNSWICK, NJ, 08816-4818",,Mission not available,1941,Yes
https://www.charitynavigator.org/ein/222432973,NEW JERSEY STATE POLICEMENS BENEVOLENT ASSOCIATION INC,222432973,,,"Not rated, Not currently rated, This organization is not rated",,"PO BOX 1912, NEW BRUNSWICK, NJ, 08903-1912",,Mission not available,2014,Yes
https://www.charitynavigator.org/ein/222433792,Ohel Yaacob Congregation A K A Ocean Avenue Synagogue,222433792,,,"Not rated, Not currently rated, This organization is not rated",,"PO BOX 243, DEAL, NJ, 07723-0243",,Mission not available,1984,Yes
https://www.charitynavigator.org/ein/222433829,AMERICAN FEDERATION OF STATE COUNTY & MUNICIPAL EMPLOYEES,222433829,,,"Not rated, Not currently rated, This organization is not rated",,"500 MANILA AVE APT 6H, JERSEY CITY, NJ, 07302-1742",,Mission not available,1957,Yes
https://www.charitynavigator.org/ein/222433886,Veterans United Military Memorial Museum Inc.,222433886,,,"Not rated, Not currently rated, This organization is not rated",,"5576 ROUTE 9, TUCKERTON, NJ, 08087-3412",,Mission not available,1985,Yes
https://www.charitynavigator.org/ein/222433889,Warren County College Foundation Inc.,222433889,97%,4,,http://WCCCFOUNDATION.ORG,"475 ROUTE 57 WEST STE 208, WASHINGTON, NJ, 07882-4343",908-835-9222,"TO ASSIST THE COUNTY COLLEGE IN GROWTH THROUGH SCHOLARSHIPS, PROGRAMS, AND FACILITIES TO ENHANCE EDUCATIONAL OPPORTUNITIES TO THOSE SEEKING POST-SECONDARY EDUCATION ... (More)",1983,No
https://www.charitynavigator.org/ein/222433931,LAKE MOHAWK YACHT CLUB,222433931,,,"Not rated, Not currently rated, This organization is not rated",,"PO BOX 29, SPARTA, NJ, 07871-0029",,Mission not available,1983,Yes
https://www.charitynavigator.org/ein/222434062,Prisoners Web,222434062,,,"Not rated, Not currently rated, This organization is not rated",,"13 WEISS DR, MIDDLESEX, NJ, 08846-1310",,Mission not available,1983,Yes
https://www.charitynavigator.org/ein/222434213,New Liberty Cathedral,222434213,,,"Not rated, Not currently rated, This organization is not rated",,"PO BOX 205, WILLINGBORO, NJ, 08046-0205",,Mission not available,1983,Yes
https://www.charitynavigator.org/ein/222434221,Westwood Church of Christ,222434221,,,"Not rated, Not currently rated, This organization is not rated",,"57 W CENTRE ST, WOODBURY, NJ, 08096-2318",,Mission not available,1985,Yes
https://www.charitynavigator.org/ein/222434238,Alumni Association of the M H Katze - Nbach School for the Deaf,222434238,,,"Not rated, Not currently rated, This organization is not rated",,"119 OLD BRIDGE TPKE, E BRUNSWICK, NJ, 08816-3117",,Mission not available,2011,Yes
https://www.charitynavigator.org/ein/222434364,Germantown Library,222434364,97%,4,,,"31 PALATINE PARK RD, GERMANTOWN, NY, 12526-5310",518-537-5800,"MAINTAIN AND IMPROVE THE QUALITY OF LIFE FOR ALL CITIZENS OF OUR COMMUNITY BY PROVIDING RESOURCES THAT ENHANCE AND CONTRIBUTE TO INDIVIDUAL KNOWLEDGE, ENLIGHTENMENT ... (More)",1983,No
https://www.charitynavigator.org/ein/222434851,Pike Library,222434851,,,"Not rated, Not currently rated, This organization is not rated",,"PO BOX 246, PIKE, NY, 14130-0246",,Mission not available,2023,Yes
https://www.charitynavigator.org/ein/222435173,NEW JERSEY STATE POLICEMENS BENEVOLENT ASSOCIATION INC,222435173,,,"Not rated, Not currently rated, This organization is not rated",,"PO BOX 862, TINTON FALLS, NJ, 07724-0862",732-542-3400,FOR THE GOOD AND BENEFIT OF ITS MEMBERS AND THE COMMUNITY,2014,Yes
https://www.charitynavigator.org/ein/222435656,Pentecost Inspirational Baptist Church,222435656,,,"Not rated, Not currently rated, This organization is not rated",,"575 PRINCE AVE, WILLIAMSTOWN, NJ, 08094-8839",,Mission not available,1983,Yes
