url,name,ein,score,star_rating,keywords,website,address,phone,organization_mission,IRS_ruling_year,contain_keywords
https://www.charitynavigator.org/ein/010777850,H.E.R.O.E.S. Care,010777850,96%,4,,https://heroescare.org/,"4558 Gravois Village Center, High Ridge, MO, 63049",636-600-0096,H.E.R.O.E.S. Care is a collaborative effort among well established non-governmental organizations (NGOs) designed to provide complete and proactive support for membe ... (More),2014,No
https://www.charitynavigator.org/ein/010777876,Grace Point Church Incorporated,010777876,,,"Not currently rated, Not rated, This organization is not rated",,"2910 MERIWETHER RD, SHREVEPORT, LA, 71108-5402",,Mission not available,2004,Yes
https://www.charitynavigator.org/ein/010777882,Community Housing III Inc.,010777882,97%,4,,http://REACHCDC.ORG,"4150 S MOODY AVE, PORTLAND, OR, 97239-4417",503-231-0682,"TO PROVIDE LOW-INCOME HOUSING TO LOW-INCOME, ELDERLY PERSONS IN PORTLAND, OREGON",2003,No
https://www.charitynavigator.org/ein/010777918,PTA TEXAS CONGRESS,010777918,,,"Not currently rated, Not rated, This organization is not rated",,"4400 LAKEVIEW BLVD, DENTON, TX, 76208-5898",,Mission not available,1967,Yes
https://www.charitynavigator.org/ein/010778112,Victory in Praise,010778112,,,"Not currently rated, Not rated, This organization is not rated",,"PO BOX 576712, MODESTO, CA, 95357-6712",,Mission not available,2004,Yes
https://www.charitynavigator.org/ein/010778376,Oak Hills Soccer Club,010778376,,,"Not currently rated, Not rated, This organization is not rated",,"3300 NW 185TH AVE 335, PORTLAND, OR, 97229-3406",,Mission not available,2003,Yes
https://www.charitynavigator.org/ein/010778461,Sacramento Ultimate Players Association,010778461,,,"Not currently rated, Not rated, This organization is not rated",,"PO BOX 162466, SACRAMENTO, CA, 95816-2466",,Mission not available,2019,Yes
https://www.charitynavigator.org/ein/010778558,OMEGA TEACHING NETWORK INC,010778558,,,"Not currently rated, Not rated, This organization is not rated",,"315 E CENTRAL AVE, VALDOSTA, GA, 31601-5703",,Mission not available,1998,Yes
https://www.charitynavigator.org/ein/010778616,Cortez Racing Association A California Corporation,010778616,,,"Not currently rated, Not rated, This organization is not rated",,"2907 SHELTER ISLAND DRIVE STE 105-5, SAN DIEGO, CA, 92106-2797",,Mission not available,2003,Yes
https://www.charitynavigator.org/ein/010778671,Templo La Hermosa Inc.,010778671,,,"Not currently rated, Not rated, This organization is not rated",,"1016 S MILLER RD, VALRICO, FL, 33594-4764",,Mission not available,2003,Yes
https://www.charitynavigator.org/ein/010778962,Texas Archive of the Moving Image,010778962,77%,3,,http://www.texasarchive.org,"3908 AVENUE B, AUSTIN, TX, 78751-4515",512-485-3073,Educate the public about preserving Texas' film and video heritage.,2003,No
https://www.charitynavigator.org/ein/010780147,Calvery Chapel Biscayne Bay Inc.,010780147,,,"Not currently rated, Not rated, This organization is not rated",,"14476 SW 161ST PL, MIAMI, FL, 33196-5768",,Mission not available,2004,Yes
https://www.charitynavigator.org/ein/010780689,Hollenbeck Police Activities League,010780689,96%,4,,http://WWW.LAPDHOLLENBECKPAL.ORG,"126 N ST LOUIS ST, LOS ANGELES, CA, 90033-2835",323-224-0152,"THROUGH A PARTNERSHIP WITH LOS ANGELES POLICE DEPARTMENT, TO PREPARE AND EMPOWER UNDERSERVED AND UNDERPRIVILEDGED YOUTH TO LEAD RESPONSIBLE, PRODUCTIVE, AND FULFILLI ... (More)",2003,No
https://www.charitynavigator.org/ein/010779990,COLLEGE STATION ISD COUNCIL OF PARENT TEACHERS ORGANIZATIONS,010779990,,,"Not currently rated, Not rated, This organization is not rated",,"900 ROCK PRAIRIE RD, COLLEGE STA, TX, 77845-8353",,Mission not available,1999,Yes
https://www.charitynavigator.org/ein/010780925,Roswell Christian Center Inc.,010780925,,,"Not currently rated, Not rated, This organization is not rated",,"109 E CHARLESTON RD, ROSWELL, NM, 88203-0803",,Mission not available,2003,Yes
https://www.charitynavigator.org/ein/010780934,Lake County International Charter School,010780934,96%,4,,http://WWW.LCICS.ORG,"15850 ARMSTRONG STREET, MIDDLETOWN, CA, 95461-0000",707-987-3063,OPERATION OF A CALIFORNIA PUBLIC CHARTER SCHOOL SERVING STUDENTS IN GRADES K-8.,2005,No
https://www.charitynavigator.org/ein/010781635,Each One Reach One Deliverance Ministries Inc.,010781635,,,"Not currently rated, Not rated, This organization is not rated",,"2455 RETREAT POINT PKWY, HOSCHTON, GA, 30548-7400",,Mission not available,2005,Yes
https://www.charitynavigator.org/ein/010781792,CAMINO A LA GLORIA,010781792,,,"Not currently rated, Not rated, This organization is not rated",,"PO BOX 1711, CLEWISTON, FL, 33440-1711",,Mission not available,1964,Yes
https://www.charitynavigator.org/ein/010781852,Bread of Life Ministries,010781852,,,"Not currently rated, Not rated, This organization is not rated",,"2000 COX AVE, MODESTO, CA, 95358-1034",,Mission not available,2006,Yes
https://www.charitynavigator.org/ein/010782045,Hixson Youth Athletic Association,010782045,,,"Not currently rated, Not rated, This organization is not rated",,"PO BOX 1343, HIXSON, TN, 37343-5343",,Mission not available,2023,Yes
https://www.charitynavigator.org/ein/010782138,Lifting Jesus Higher Ministries,010782138,,,"Not currently rated, Not rated, This organization is not rated",,"7235 RIDGELINE DR, RIVERSIDE, CA, 92509-5514",,Mission not available,2006,Yes
https://www.charitynavigator.org/ein/010782255,Solomons Porch Ministries,010782255,,,"Not currently rated, Not rated, This organization is not rated",,"1920 SW 3RD TER, CAPE CORAL, FL, 33991-1327",,Mission not available,2004,Yes
https://www.charitynavigator.org/ein/010782281,PTA TEXAS CONGRESS,010782281,,,"Not currently rated, Not rated, This organization is not rated",,"7200 SNUG HARBOR CIR, FRISCO, TX, 75036-9201",,Mission not available,1967,Yes
https://www.charitynavigator.org/ein/010782318,PTA FLORIDA CONGRESS,010782318,,,"Not currently rated, Not rated, This organization is not rated",,"1250 WILLIAMS RD, BRANDON, FL, 33510-2270",,Mission not available,1971,Yes
https://www.charitynavigator.org/ein/010782540,Humbled One Church,010782540,,,"Not currently rated, Not rated, This organization is not rated",,"4000 GREEN AVE, LOS ALAMITOS, CA, 90720-3402",,Mission not available,2010,Yes
https://www.charitynavigator.org/ein/010782946,Sons of Encouragement,010782946,,,"Not currently rated, Not rated, This organization is not rated",,"31018 WILDCAT DR, BULVERDE, TX, 78163-4550",,Mission not available,2003,Yes
https://www.charitynavigator.org/ein/010783081,Chinese American Cooperation Council,010783081,69%,2,,https://www.caccusa.org,"PO BOX 12028, PLEASANTON, CA, 94588-2028",408-390-3639,To Promote Cultural Heritage and Enhance Friendship in the Chinese American Community and Facilitate the Cultural and Business Exchanges and Corporation Between the ... (More),2005,No
https://www.charitynavigator.org/ein/010783226,Bruised Apples Mentoring Program,010783226,,,"Not currently rated, Not rated, This organization is not rated",,"PO BOX 152292, AUSTIN, TX, 78715-2292",,Mission not available,2016,Yes
https://www.charitynavigator.org/ein/010783423,Vision Communications International,010783423,77%,3,,http://www.VisionCommunications.org,"412 MILLS ST, FORT WORTH, TX, 76102-1829",214-827-0620,"Vision Communications produces Christian television programming that is broadcast in the Middle East, Europe, and North Africa.",2004,No
https://www.charitynavigator.org/ein/010783518,Chapmans Retreat Elementary Pto,010783518,,,"Not currently rated, Not rated, This organization is not rated",,"1000 SECLUDED LN, SPRING HILL, TN, 37174-6120",,Mission not available,2007,Yes
https://www.charitynavigator.org/ein/010783590,FOUR PEAKS WOMANS CLUB,010783590,,,"Not currently rated, Not rated, This organization is not rated",,"16142 E GLENPOINT DR, FOUNTAIN HLS, AZ, 85268-3116",,Mission not available,2003,Yes
https://www.charitynavigator.org/ein/010783591,Fathers Show Resource Program,010783591,,,"Not currently rated, Not rated, This organization is not rated",,"4860 CHAMBERS RD STE 108, DENVER, CO, 80239-5152",,Mission not available,2004,Yes
https://www.charitynavigator.org/ein/010784332,Seckman Ice Hockey Club,010784332,53%,1,,,"PO BOX 375, IMPERIAL, MO, 63052-0375",,THE CLUB OPERATES 3 YOUTH HOCKEY TEAMS. TEAMS ARE FORMED TO BENEFIT MORAL GROWTH AND PHYSICAL ADVANCEMENT OF THE PLAYERS. THIS IS ACCOMPLISHED THROUGH TEAM COMPETITI ... (More),2005,No
https://www.charitynavigator.org/ein/010784491,For the Kid in All of US Inc.,010784491,76%,3,,http://WWW.FORTHEKID.ORG,"PO BOX 8364, ATLANTA, GA, 31106-0364",404-263-6937,THE ORGANIZATION ENHANCES THE HOLIDAY SEASON FOR CHILDREN IN NEED BY COLLECTING AND DISTRIBUTING TOYS AND OTHER GIFT ITEMS DURING THE HOLIDAY SEASON AND BACK TO SCHO ... (More),2003,No
https://www.charitynavigator.org/ein/010784674,Iglesia Pentecostes El Mana Corp,010784674,,,"Not currently rated, Not rated, This organization is not rated",,"16331 US HIGHWAY 301, DADE CITY, FL, 33523-2442",,Mission not available,2003,Yes
https://www.charitynavigator.org/ein/010784835,Kerala Association of Kansas City,010784835,,,"Not currently rated, Not rated, This organization is not rated",,"12181 CRAIG ST, OVERLAND PARK, KS, 66213-1474",,Mission not available,2018,Yes
https://www.charitynavigator.org/ein/010784885,Moab Trails Alliance,010784885,,,"Not currently rated, Not rated, This organization is not rated",,"240 E 300 S, MOAB, UT, 84532-2622",,Mission not available,2003,Yes
https://www.charitynavigator.org/ein/010784962,Boca Raton Njrotc Cadet Parent Organization Inc.,010784962,,,"Not currently rated, Not rated, This organization is not rated",,"5519 NW 15TH CT, BOCA RATON, FL, 33486-0000",,Mission not available,2005,Yes
https://www.charitynavigator.org/ein/010785222,New Medinah Education Foundation,010785222,,,"Not currently rated, Not rated, This organization is not rated",,"215 MOBILE ST, HATTIESBURG, MS, 39401-3492",,Mission not available,2006,Yes
https://www.charitynavigator.org/ein/010785223,American Legion,010785223,,,"Not currently rated, Not rated, This organization is not rated",,"PO BOX 1689, FERNLEY, NV, 89408-1689",,Mission not available,1946,Yes
https://www.charitynavigator.org/ein/010785524,World History Connected the Journal of Learning and Teaching,010785524,,,"Not currently rated, Not rated, This organization is not rated",,"PO BOX 6272, SNOWMASS VLG, CO, 81615-6272",,Mission not available,2003,Yes
https://www.charitynavigator.org/ein/010785601,Faithful Servants Community Health Education Services Inc.,010785601,,,"Not currently rated, Not rated, This organization is not rated",,"9480 POINCIANA PLACE, FORT LAUDERDALE, FL, 33324-4887",,Mission not available,2023,Yes
https://www.charitynavigator.org/ein/010786082,T W Ministries Inc.,010786082,13%,0,,http://WWW.TWMINISTRIES.ORG,"3782 GALT PL, DOUGLASVILLE, GA, 30135-7737",404-557-0794,"T.W. Ministries Inc. is organized exclusively for religious, charitable and educational purposes which achieved through evanglism seminars, workshop seminar.",2004,No
https://www.charitynavigator.org/ein/010786312,Missouri Valley Eclipse,010786312,76%,3,,http://WWW.ECLIPSEBASKETBALL.COM,"PO BOX 344, DE SOTO, KS, 66018-0344",913-558-8442,THE MISSION OF THE PROGRAM IS TO FOSTER NATIONAL AMATEUR SPORTS AND DEVELOP AMATEUR ATHLETES FOR THAT COMPETITION.,2003,No
https://www.charitynavigator.org/ein/010786514,Christian Church of the Living God Rehabilitation Center,010786514,,,"Not currently rated, Not rated, This organization is not rated",,"1020 SMITH ST SW, ATLANTA, GA, 30310-3624",,Mission not available,2005,Yes
https://www.charitynavigator.org/ein/010786632,Middle Tennessee Mission Outreach Inc.,010786632,76%,3,,http://WWW.MTMO.ORG,"5341 CROSS PLAINS RD, WHITE HOUSE, TN, 37188-5168",,PROVIDE LEADERSHIP FOR MISSION TRIPS TO HELP THIRD WORLD COUNTRIES WITH CONSTRUCTION PROJECTS AND RELIGIOUS EVANGELISM,2003,No
https://www.charitynavigator.org/ein/010787214,Canoe Creek Christian Church of St. Cloud Florida Inc.,010787214,,,"Not currently rated, Not rated, This organization is not rated",,"4080 PINE TREE DR, SAINT CLOUD, FL, 34772-8702",,Mission not available,2020,Yes
https://www.charitynavigator.org/ein/010787406,Safety Harbor Chamber of Commerce Foundation Inc.,010787406,,,"Not currently rated, Not rated, This organization is not rated",,"200 MAIN ST, SAFETY HARBOR, FL, 34695-3643",,Mission not available,2023,Yes
https://www.charitynavigator.org/ein/010787618,L S U Track & Field Officials Association,010787618,,,"Not currently rated, Not rated, This organization is not rated",,"LSU BOX 18316, BATON ROUGE, LA, 70803-0001",,Mission not available,2004,Yes
https://www.charitynavigator.org/ein/010787737,Microbusiness Enterprise Corporation of Ascension,010787737,,,"Not currently rated, Not rated, This organization is not rated",,"PO BOX 220, PRAIRIEVILLE, LA, 70769-0220",,Mission not available,2004,Yes
https://www.charitynavigator.org/ein/010788133,AMERICAN COVENANT SENIOR HOUSING FOUNDATION INC,010788133,,,"Not currently rated, Not rated, This organization is not rated",,"431 1ST AVE W, KALISPELL, MT, 59901-4835",,Mission not available,2024,Yes
https://www.charitynavigator.org/ein/010788363,Northeast Montana Fort Peck Tribal M A S H Unit,010788363,,,"Not currently rated, Not rated, This organization is not rated",,"4360 ROAD 2037, BROCKTON, MT, 59213-9413",,Mission not available,2003,Yes
https://www.charitynavigator.org/ein/010788677,Faith in God Missionary Baptist Church,010788677,,,"Not currently rated, Not rated, This organization is not rated",,"7545 OLD MILITARY RD, THEODORE, AL, 36582-2455",,Mission not available,2013,Yes
https://www.charitynavigator.org/ein/010788764,Windhorse Sanctuary Inc.,010788764,,,"Not currently rated, Not rated, This organization is not rated",,"597 NE RIDGE LOOP, MADISON, FL, 32340-3699",,Mission not available,2004,Yes
https://www.charitynavigator.org/ein/010788829,CHRISTIAN METHODIST EPISCOPAL CHURCH,010788829,,,"Not currently rated, Not rated, This organization is not rated",,"825 AVENUE C, GADSDEN, AL, 35901-2369",,Mission not available,1980,Yes
https://www.charitynavigator.org/ein/010788855,Boukai Family Foundation,010788855,,,"Not currently rated, Not rated, This organization is not rated",,"32 EDELMAN, IRVINE, CA, 92618-4312",,Mission not available,2003,Yes
https://www.charitynavigator.org/ein/010789012,Urban Synergy Inc.,010789012,,,"Not currently rated, Not rated, This organization is not rated",,"6012 BUFFRIDGE TRL, DALLAS, TX, 75252-2366",,Mission not available,2016,Yes
https://www.charitynavigator.org/ein/010789717,Angell Foundation,010789717,,,"Review Before Proceeding, Not currently rated, Not rated, This organization is not rated",,"11150 W OLYMPIC BLVD STE 915, LOS ANGELES, CA, 90064-1859",,Mission not available,2003,Yes
https://www.charitynavigator.org/ein/010789735,Iglesia Cristiana North Houston,010789735,,,"Not currently rated, Not rated, This organization is not rated",,"2020 BENDING BOUGH LN, SPRING, TX, 77388-6203",,Mission not available,2004,Yes
https://www.charitynavigator.org/ein/010789794,Community Fellowship Ministries Inc.,010789794,,,"Not currently rated, Not rated, This organization is not rated",,"612 COHRAN STORE RD, DOUGLASVILLE, GA, 30134-7286",,Mission not available,2004,Yes
https://www.charitynavigator.org/ein/010789964,Unity of the Faith Inc.,010789964,,,"Not currently rated, Not rated, This organization is not rated",,"450 PONOKA ST, SEBASTIAN, FL, 32958-3902",,Mission not available,2003,Yes
https://www.charitynavigator.org/ein/010790158,Teams in Action,010790158,,,"Not currently rated, Not rated, This organization is not rated",,"2525 S DAYTON WAY APT 1707, DENVER, CO, 80231-3916",,Mission not available,2016,Yes
https://www.charitynavigator.org/ein/010790282,EVANGELISTIC OUTREACH,010790282,,,"Not currently rated, Not rated, This organization is not rated",,"306 DEROUEN ST, WELSH, LA, 70591-5410",,Mission not available,1964,Yes
https://www.charitynavigator.org/ein/010790411,TULSA-HOPE INTERNATIONAL MINISTRIES CHURCH OF GOD MIS01,010790411,,,"Not currently rated, Not rated, This organization is not rated",,"7030E SOUTH LEWIS AVE PMB 175 8086, TULSA, OK, 74136-3904",,Mission not available,1972,Yes
https://www.charitynavigator.org/ein/010790552,Theater Arts Group,010790552,87%,3,,,"1604 N CAHUENGA BLVD STE A, LOS ANGELES, CA, 90028-6257",323-461-2020,THE THEATER ARTS GROUP WAS FORMED TO SUPPORT THE AMERICAN CINEMATHEQUE.,2003,No
https://www.charitynavigator.org/ein/010790428,Ascension St. Joseph Foundation,010790428,92%,4,,https://stjosephhealthfoundation.org/,"PO BOX 45998, SAINT LOUIS, MO, 63145-5998",314-733-8000,"TO ACTIVELY SEEK AND INVEST CHARITABLE SUPPORT FOR ASCENSION ST. JOSEPH HOSPITAL, SO THAT THEY MAY IMPROVE THE HEALTH AND WELL-BEING OF ALL THE PEOPLE IN THE COMMUNI ... (More)",2003,No
https://www.charitynavigator.org/ein/010790530,Mount Miguel High School Foundation Inc.,010790530,,,"Not rated, Confirmed Revocation, Not currently rated, This organization is not rated, Review Before Proceeding",,"2910 BUENA VISTA AVE, LEMON GROVE, CA, 91945-2407",,Mission not available,2003,Yes
https://www.charitynavigator.org/ein/010790827,Harvest Community Church of Jay Inc.,010790827,,,"Not currently rated, Not rated, This organization is not rated",,"2828 HARVEST RD, JAY, FL, 32565-4813",,Mission not available,2005,Yes
https://www.charitynavigator.org/ein/010790641,J Austin White Cultural Center Inc.,010790641,97%,4,,http://WWW.JAUSTINWHITECULTURALCENTER.COM,"PO BOX 316, EUDORA, AR, 71640-0316",870-355-4599,"THE ORGANIZATION'S MISSION IS TO PROVIDE EXPOSURE TO MUSIC, ART, THEATRE AND OTHER ACTIVITIES TO THE CHILDREN AND YOUTH OF SOUTHEAST ARKANSAS, AN ISOLATED AREA LACKI ... (More)",2003,No
https://www.charitynavigator.org/ein/010790908,H E R Weekend Inc.,010790908,,,"Not currently rated, Not rated, This organization is not rated",,"PO BOX 77, WOODLAND HLS, CA, 91365-0077",,Mission not available,2004,Yes
https://www.charitynavigator.org/ein/010790991,Parkview Outreach Community Center Inc.,010790991,76%,3,,https://www.parkviewmedicalclinic.org/,"1205 DR MARTIN L KING JR WAY, HAINES CITY, FL, 33844-3490",,PROVIDING NO COST HEALTH CARE SERVICES TO RESIDENTS WHO ARE UNDER 200 PERCENT OF THE FEDERAL POVERTY GUIDELINES,2007,No
https://www.charitynavigator.org/ein/010791025,Dr Jeffery Butler Educational Advancement and Development Corpor,010791025,,,"Not currently rated, Not rated, This organization is not rated",,"3860 AMBERLY DR UNIT I, INGLEWOOD, CA, 90305-3440",,Mission not available,2007,Yes
https://www.charitynavigator.org/ein/010791076,Moving Foward Community Center Inc.,010791076,,,"Not currently rated, Not rated, This organization is not rated",,"1884 VALLEY WOODS DR, RIVERDALE, GA, 30296-1863",,Mission not available,2004,Yes
https://www.charitynavigator.org/ein/010791209,Lady Eagle Basketball Booster Club,010791209,,,"Not currently rated, Not rated, This organization is not rated",,"2211 N AUSTIN AVE, GEORGETOWN, TX, 78626-4514",,Mission not available,2014,Yes
https://www.charitynavigator.org/ein/010791221,PHI MU FRATERNITY,010791221,,,"Not currently rated, Not rated, This organization is not rated",,"400 WESTPARK DR, PEACHTREE CTY, GA, 30269-1482",,Mission not available,1944,Yes
https://www.charitynavigator.org/ein/010791428,Coyle School Foundation,010791428,,,"Not currently rated, Not rated, This organization is not rated",,"PO BOX 122, COYLE, OK, 73027-0122",,Mission not available,2007,Yes
https://www.charitynavigator.org/ein/010791551,Life House Foundation for Children,010791551,81%,3,,http://www.lifehousefoundation.org,"PO BOX 1005, GLENDORA, CA, 91740-1005",909-918-4656,"CHILDREN DEVELOPMENT LIFE HOUSE FOUNDATION FOCUSES IN THE DEVELOPMENT OF CHILDREN, THEIR FAMILIES AND COMMUNITIES THROUGH SPONSORSHIP AND LEADERSHIP TRAINING.",2014,No
https://www.charitynavigator.org/ein/010791591,United Samoan Pentecostal Church of Fort Ord Inc.,010791591,,,"Not currently rated, Not rated, This organization is not rated",,"2660 GENEVA AVE, DALY CITY, CA, 94014-1519",,Mission not available,2003,Yes
https://www.charitynavigator.org/ein/010791603,California State Fair Memorial Plaza Foundation,010791603,,,"Not currently rated, Not rated, This organization is not rated",,"225 SPRING ST, PLEASANTON, CA, 94566-6625",916-262-3070,THE CALIFORNIA STATE FAIR MEMORIAL PLAZA FOUNDATION WILL SERVE TO EDUCATE PUBLIC THROUGH ADVANCING AN UNDERSTANDING OF THE TRAGEDY OF SEPTEMBER 11.,2003,Yes
https://www.charitynavigator.org/ein/010791915,NAMPA CHEER STARS,010791915,,,"Not currently rated, Not rated, This organization is not rated",,"3784, NAMPA, ID, 83653-0000",,Mission not available,2024,Yes
https://www.charitynavigator.org/ein/010792123,UTAH STATE ASSEMBLY OF AST,010792123,,,"Not currently rated, Not rated, This organization is not rated",,"PO BOX 986, WEST JORDAN, UT, 84084-0986",,Mission not available,2014,Yes
https://www.charitynavigator.org/ein/010792266,Mount Zion Evangelistic Assembly Inc.,010792266,,,"Not currently rated, Not rated, This organization is not rated",,"6604 NW 134TH ST, OKLAHOMA CITY, OK, 73142-5909",,Mission not available,2008,Yes
https://www.charitynavigator.org/ein/010792599,TEXAS STATE TEACHERS ASSOCIATION,010792599,,,"Not currently rated, Not rated, This organization is not rated",,"8716 N MOPAC EXPY, AUSTIN, TX, 78759-8321",,Mission not available,1964,Yes
https://www.charitynavigator.org/ein/010792632,Cb House of Blessings,010792632,,,"Not currently rated, Not rated, This organization is not rated",,"7020 EAST PKWY, SACRAMENTO, CA, 95823-2502",,Mission not available,2006,Yes
https://www.charitynavigator.org/ein/010792702,Urban Ministries Inc.,010792702,,,"Not currently rated, Not rated, This organization is not rated",,"414 PRAIRIE ST S, UNION SPRINGS, AL, 36089-1933",,Mission not available,2003,Yes
https://www.charitynavigator.org/ein/010792931,BROWARD WOMENS EMERGENCY FUND INC,010792931,,,"Not currently rated, Not rated, This organization is not rated",http://BWEFUND.ORG,"2215 CYPRESS ISLAND DR APT 602, POMPANO BEACH, FL, 33069-4490",954-383-8860,TO ASSIST WOMEN WHO NEED HELP PAYING FOR THEIR ABORTION,1994,Yes
https://www.charitynavigator.org/ein/010793285,Partners Global Foundation Inc.,010793285,,,"Not currently rated, Not rated, This organization is not rated",,"604 FORT WORTH AVE APT 3140, DALLAS, TX, 75208-0298",,Mission not available,2004,Yes
https://www.charitynavigator.org/ein/010793986,Propel Inc.,010793986,85%,3,,http://WWW.PROPELYOURFUTURE.ORG,"2500 NW 5th Avenue, Boca Raton, FL, 33431",561-955-8553,"OUR MISSION IS TO FOSTER THE LEADERSHIP POTENTIAL, ACADEMIC AND CAREER SUCCESS, AND HEALTHY LIVING CHOICES OF YOUTH (AGES 10-24) AT-RISK OF OR ALREADY ON THE FRINGES ... (More)",2004,No
https://www.charitynavigator.org/ein/010794740,Character Council of Edmond Inc.,010794740,,,"Not currently rated, Not rated, This organization is not rated",,"PO BOX 392, EDMOND, OK, 73083-0392",,Mission not available,2004,Yes
https://www.charitynavigator.org/ein/010794834,International Society for Autism,010794834,96%,4,,http://WWW.AUTISM-INSAR.ORG,"400 ADMIRAL BLVD, KANSAS CITY, MO, 64106-1508",860-586-7500,THE PRIMARY PURPOSE OF THE INTERNATIONAL SOCIETY FOR AUTISM RESEARCH (INSAR) IS TO FOSTER AUTISM RESEARCH BY NEW AND ESTABLISHED AUTISM RESEARCHERS BY BRINGING AUTIS ... (More),2003,No
https://www.charitynavigator.org/ein/010794778,Community Prayer Band,010794778,,,"Not currently rated, Not rated, This organization is not rated",,"PO BOX 811, CLEWISTON, FL, 33440-0811",,Mission not available,2004,Yes
https://www.charitynavigator.org/ein/010795050,Texas Lettering Arts Council,010795050,53%,1,,https://learn.txlac.org/,"PO BOX 3126, COPPELL, TX, 75019-7001",214-957-1736,"The Texas Lettering Arts Council seeks to educate and train children and adults about the history if written language, handwriting and the calligraphic lettering art ... (More)",2005,No
https://www.charitynavigator.org/ein/010795152,Christian Friends of New Americans,010795152,81%,3,,http://www.cfna-stl.org,"4019 S GRAND BLVD, SAINT LOUIS, MO, 63118-3407",314-517-8513,Partnering with LCMS congregations for purposes of cross-cultural ministry among immigrants and refugees in the greater St. Louis area.,2009,No
https://www.charitynavigator.org/ein/010795306,District 6 VFW Auxiliary,010795306,,,"Not currently rated, Not rated, This organization is not rated",,"PO BOX 316, BROADUS, MT, 59317-0316",,Mission not available,2018,Yes
https://www.charitynavigator.org/ein/010795543,Nalls Foundation Inc.,010795543,58%,1,,,"131 PERSIA AVE, SAN FRANCISCO, CA, 94112-2717",415-505-6427,RESIDENTIAL CARE AND TREATMENT OF EMOTIONALLY AND PHYSICALLY NEGLECTED CHILDREN.,2004,No
https://www.charitynavigator.org/ein/010795924,Plainville Community Foundation Inc.,010795924,73%,2,,,"605 S MAIN ST, PLAINVILLE, KS, 67663-2814",785-737-3554,"TO FUND INITIATIVES TO ENHANCE QUALITY OF LIFE FOR PLAINVILLE, KS RESIDENTS",2004,No
https://www.charitynavigator.org/ein/010796052,Grace Kingdom Church,010796052,,,"Not currently rated, Not rated, This organization is not rated",,"2398 TYLER WAY, DECATUR, GA, 30032-6328",,Mission not available,2005,Yes
https://www.charitynavigator.org/ein/010796248,Wellspring International Church Inc.,010796248,,,"Not currently rated, Not rated, This organization is not rated",,"PO BOX 3168, SARASOTA, FL, 34230-3168",,Mission not available,2004,Yes
https://www.charitynavigator.org/ein/010796302,ST PATRICKS ANGLICAN MISSION,010796302,,,"Not currently rated, Not rated, This organization is not rated",,"13616 GARDEN GROVE CT, HOUSTON, TX, 77082-3401",,Mission not available,2004,Yes
