url,name,ein,score,star_rating,keywords,website,address,phone,organization_mission,IRS_ruling_year,contain_keywords
https://www.charitynavigator.org/ein/237060338,Charles M Cappellino Foundation Inc.,237060338,,,"Not currently rated, Not rated, This organization is not rated",,"5155 HARROGATE CT, NAPLES, FL, 34112-3665",,Mission not available,1970,Yes
https://www.charitynavigator.org/ein/237060354,Gospel Assembly Church,237060354,,,"Not currently rated, Not rated, This organization is not rated",,"PO BOX 18657, KANSAS CITY, MO, 64133-8657",,Mission not available,1961,Yes
https://www.charitynavigator.org/ein/237060412,VETERANS OF FOREIGN WARS DEPARTMENT OF CALIFORNIA,237060412,,,"Review Before Proceeding, Not currently rated, Not rated, This organization is not rated",,"7576 STOCKTON BLVD, SACRAMENTO, CA, 95823-3923",,Mission not available,2000,Yes
https://www.charitynavigator.org/ein/237060413,Learning Disabilities Association of Washington,237060413,,,"Not currently rated, Not rated, This organization is not rated",,"1811 EAGLE HARBOR LN NE, BAINBRIDGE IS, WA, 98110-2142",,Mission not available,1970,Yes
https://www.charitynavigator.org/ein/237060355,Gospel Assembly Church,237060355,,,"Not currently rated, Not rated, This organization is not rated",,"1215 JULES ST, ST JOSEPH, MO, 64501-2321",,Mission not available,1970,Yes
https://www.charitynavigator.org/ein/237060404,COUNTY ENGINEERS ASSOCIATION OF CALIFORNIA,237060404,,,"Review Before Proceeding, Not currently rated, Not rated, This organization is not rated",http://WWW.CEACCOUNTIES.ORG,"11068 SHILOH CT, ALTA LOMA, CA, 91737-7810",909-948-5947,AFFILIATION OF COUNTY PUBLIC WORKS ENGINEERS,1970,Yes
https://www.charitynavigator.org/ein/237060426,PTA MISSOURI CONGRESS,237060426,,,"Not currently rated, Not rated, This organization is not rated",,"1407 NASHUA RD, LIBERTY, MO, 64068-3368",,Mission not available,1971,Yes
https://www.charitynavigator.org/ein/237060422,PROVARSU STUDY CLUB,237060422,,,"Not currently rated, Not rated, This organization is not rated",,"1316 PENNSYLVANIA AVENUE, FORT WORTH, TX, 76104-0000",,Mission not available,1970,Yes
https://www.charitynavigator.org/ein/237060437,NEWTON COUNTY FARM BUREAU,237060437,,,"Not currently rated, Not rated, This organization is not rated",,"PO BOX 388, JASPER, AR, 72641-0388",,Mission not available,1970,Yes
https://www.charitynavigator.org/ein/237060439,PRAYER OF FAITH TEMPLE CHURCH OF FORT WORTH TEXAS,237060439,,,"Not currently rated, Not rated, This organization is not rated",,"608 N SYLVANIA AVE, FORT WORTH, TX, 76111-2420",,Mission not available,1970,Yes
https://www.charitynavigator.org/ein/237060506,AMERICAN FEDERATION OF GOVERNMENT EMPLOYEES,237060506,,,"Not currently rated, Not rated, This organization is not rated",,"14538 OAK BRANCH RD, VICTORVILLE, CA, 92392-6111",,Mission not available,1970,Yes
https://www.charitynavigator.org/ein/237060561,Boys & Girls Clubs of Palm Beach County,237060561,96%,4,,http://www.bgcpbc.org/,"800 Northpoint Parkway, Suite 204, West Palm Beach, FL, 33407",561-683-3287,"Founded in 1971, the Boys & Girls Clubs of Palm Beach County is a youth development organization dedicated to promoting the educational, vocational, health leadershi ... (More)",1970,No
https://www.charitynavigator.org/ein/237060568,DESERT MOTORCYCLE CLUB INC,237060568,,,"Not currently rated, Not rated, This organization is not rated",,"1524 ALAMEDA ST, POMONA, CA, 91768-1803",,Mission not available,1970,Yes
https://www.charitynavigator.org/ein/237060502,AMERICAN FEDERATION OF GOVERNMENT EMPLOYEES,237060502,,,"Not currently rated, Not rated, This organization is not rated",,"75 VIRGINIA BEACH DR, MIAMI, FL, 33149-1003",,Mission not available,1940,Yes
https://www.charitynavigator.org/ein/237060599,Sunshine Childrens Home,237060599,94%,4,,,"PO BOX 713, CARTHAGE, MO, 64836-0713",417-358-5722,PROVIDEING ASSISTANCE TO THE DEVELOPMENTALLY DISABLED,1970,No
https://www.charitynavigator.org/ein/237060442,SIXTY TWO CLUB,237060442,,,"Not currently rated, Not rated, This organization is not rated",,"1316 PENNSYLVANIA AVE, FORT WORTH, TX, 76104-2111",,Mission not available,1970,Yes
https://www.charitynavigator.org/ein/237060605,Washington University Medical Center,237060605,,,"Not currently rated, Not rated, This organization is not rated",,"1408 TOWER GROVE AVE, SAINT LOUIS, MO, 63110-3810",314-747-2334,"To provide and assist its member organizations in providing hospital facilities, physical properties, and programs appropriate for the care and treatment of patients ... (More)",1967,Yes
https://www.charitynavigator.org/ein/237060624,Cedar Shores Community Chapel,237060624,,,"Not currently rated, Not rated, This organization is not rated",,"195 COUNTY ROAD 1524, MORGAN, TX, 76671-3164",,Mission not available,1970,Yes
https://www.charitynavigator.org/ein/237060681,SOUTHEAST DISTRICT BAR ASSOCIATION,237060681,,,"Not currently rated, Not rated, This organization is not rated",http://WWW.SEDBA.ORG,"8504 FIRESTONE BLVD SUITE 189, DOWNEY, CA, 90241-4926",562-287-4311,PROMOTION OF HIGHER ETHICAL AND LEGAL STANDARDS,1957,Yes
https://www.charitynavigator.org/ein/237060661,Assistance League of Tustin,237060661,76%,3,Review Before Proceeding,http://WWW.ALTUSTIN.ORG,"445 EL CAMINO REAL, TUSTIN, CA, 92780-4305",714-544-2612,"THE PURPOSE OF THE ORGANIZATION IS TO CARRY ON A PROGRAM OF PHILANTHROPIC WORK IN THE COMMUNITY, TO CONTROL AND ADMINISTER AT LEAST ONE MAJOR PHILANTHROPIC PROJECT.",1968,Yes
https://www.charitynavigator.org/ein/237060672,KINGSLAND VOLUNTEER FIRE DEPARTMENT,237060672,,,"Not currently rated, Not rated, This organization is not rated",,"PO BOX 350, KINGSLAND, TX, 78639-0350",,Mission not available,1970,Yes
https://www.charitynavigator.org/ein/237060686,Grace Bible Church,237060686,,,"Not currently rated, Not rated, This organization is not rated",,"218 COUNTRY ESTATES DR, SAN MARCOS, TX, 78666-1100",,Mission not available,1970,Yes
https://www.charitynavigator.org/ein/237060725,JAPANESE AMERICAN CITIZENS LEAGUE,237060725,,,"Review Before Proceeding, Not currently rated, Not rated, This organization is not rated",,"12953 BRANFORD ST, PACOIMA, CA, 91331-4303",,Mission not available,1970,Yes
https://www.charitynavigator.org/ein/237060727,Boys & Girls Clubs of Central Wyoming,237060727,95%,4,,http://www.bgccw.org/,"1701 East K Street, Casper, WY, 82601",307-234-2456,The Boys & Girls Clubs of Central Wyoming are safe places to learn and grow and have fun. Young people need to know that someone cares about them. We offer that and ... (More),1970,No
https://www.charitynavigator.org/ein/237060754,Listen Foundation Inc.,237060754,93%,4,,,"6950 E BELLEVIEW AVE STE 203, GREENWOOD VLG, CO, 80111-1633",,The Listen Foundation provides for and assists children who are deaf or hard of hearing and their families with access to a proven speech language and listening ther ... (More),1970,No
https://www.charitynavigator.org/ein/237060732,ASSOCIATION OF DESK & DERRICK CLUBS,237060732,,,"Not currently rated, Not rated, This organization is not rated",,"113 LINCOLN DRICE, PATTERSON, LA, 70392-0000",,Mission not available,1991,Yes
https://www.charitynavigator.org/ein/237060805,MARINE CORPS LEAGUE,237060805,,,"Not currently rated, Not rated, This organization is not rated",,"PO BOX 181473, CORP CHRISTI, TX, 78480-1473",,Mission not available,1970,Yes
https://www.charitynavigator.org/ein/237060875,PTA IDAHO CONGRESS,237060875,,,"Not currently rated, Not rated, This organization is not rated",,"600 CHASTAIN DR, CHUBBUCK, ID, 83202-2559",,Mission not available,1970,Yes
https://www.charitynavigator.org/ein/237060940,Pokrov Church,237060940,,,"Not currently rated, Not rated, This organization is not rated",,"ROUTE 1 BOX 176E, GERVAIS, OR, 97026-9801",,Mission not available,1970,Yes
https://www.charitynavigator.org/ein/237060908,Cardwell Community Church Inc.,237060908,,,"Not currently rated, Not rated, This organization is not rated",,"289 MCKEOWN LN, CARDWELL, MT, 59721-9611",,Mission not available,1970,Yes
https://www.charitynavigator.org/ein/237060873,AMERICAN POSTAL WORKERS UNION,237060873,,,"Not currently rated, Not rated, This organization is not rated",,"10672, COLLEGE STATION, TX, 77842-0000",,Mission not available,1973,Yes
https://www.charitynavigator.org/ein/237060945,SACRAMENTO MUSICIANS UNION HALL ASSN,237060945,,,"Not currently rated, Not rated, This organization is not rated",,"5716 FOLSOM BLVD 104, SACRAMENTO, CA, 95819-4608",,Mission not available,1952,Yes
https://www.charitynavigator.org/ein/237060946,Salem Rotary Foundation,237060946,94%,4,,,"PO BOX 3981, SALEM, OR, 97302-0981",503-364-6339,"FOSTER, DEVELOP, PROMOTE AND ENCOURAGE THE HEALTH, EDUCATION AND THE GENERAL WELFARE OF YOUNG PEOPLE, PRINCIPALLY OF THE CITY OF SALEM, OREGON AND ITS ENVIRONS",1970,No
https://www.charitynavigator.org/ein/237060949,TACOMA INBOARD RACING ASSOCIATION INC,237060949,,,"Not currently rated, Not rated, This organization is not rated",,"22809 NE 159TH ST, WOODINVILLE, WA, 98077-7400",,Mission not available,1970,Yes
https://www.charitynavigator.org/ein/237060950,NORTHWEST ASSOCIATION OF MOTHERS OF TWINS CLUB,237060950,,,"Not currently rated, Not rated, This organization is not rated",,"PO BOX 111948, TACOMA, WA, 98411-1948",,Mission not available,1986,Yes
https://www.charitynavigator.org/ein/237060955,Christs Church of Marylhurst Oregon,237060955,,,"Not currently rated, Not rated, This organization is not rated",,"4200 SE JENNINGS AVE, PORTLAND, OR, 97267-6415",,Mission not available,1970,Yes
https://www.charitynavigator.org/ein/237060947,Seaside Kids Incorporated,237060947,,,"Not currently rated, Not rated, This organization is not rated",,"PO BOX 275, SEASIDE, OR, 97138-0275",,Mission not available,1970,Yes
https://www.charitynavigator.org/ein/237061080,NATIONAL ASSOCIATION OF WOMEN IN CONSTRUCTION,237061080,,,"Not currently rated, Not rated, This organization is not rated",,"PO BOX 14995, SPOKANE VLY, WA, 99214-0995",,Mission not available,1961,Yes
https://www.charitynavigator.org/ein/237061115,Jackson State University Development Foundation Inc.,237061115,35%,0,,,"PO BOX 17144, JACKSON, MS, 39217-0001",,"TO PROVIDE FINANCIAL SUPPORT TO THE JSU ACADEMIC PROGRAMS, STUDENT SCHOLARSHIPS AS WELL AS GENERAL UNIVERSITY SUPPORT",1970,No
https://www.charitynavigator.org/ein/237061112,Eastern Wyoming College Foundation,237061112,84%,3,,,"3200 W C ST, TORRINGTON, WY, 82240-1699",307-532-8200,THE EASTERN WYOMING COLLEGE FOUNDATION WAS ESTABLISHED IN 1964 AS AN INDEPENDENT NON- PROFIT CORPORATION TO ENGAGE COMMUNITY INTEREST AND ENHANCE THE QUALITY AND SCO ... (More),1970,No
https://www.charitynavigator.org/ein/237061157,Full Gospel Pentacostal Church,237061157,,,"Not currently rated, Not rated, This organization is not rated",,"1312 N ROBINSON ST, CLEBURNE, TX, 76031-2616",,Mission not available,1970,Yes
https://www.charitynavigator.org/ein/237061160,Big Valley Cemetery Association,237061160,,,"Not currently rated, Not rated, This organization is not rated",,"1383 FM 3295, QUANAH, TX, 79252-7465",,Mission not available,1970,Yes
https://www.charitynavigator.org/ein/237061161,HISTORY CLUB,237061161,,,"Not currently rated, Not rated, This organization is not rated",,"233 VERNA TRL N, FORT WORTH, TX, 76108-4263",,Mission not available,1947,Yes
https://www.charitynavigator.org/ein/237061089,NATIONAL ASSOCIATION OF WOMEN IN CONSTRUCTION,237061089,,,"Not currently rated, Not rated, This organization is not rated",,"PO BOX 152955, TAMPA, FL, 33684-2955",,Mission not available,1970,Yes
https://www.charitynavigator.org/ein/237061214,Ashton Foundation Inc.,237061214,,,"Not currently rated, Not rated, This organization is not rated",,"170 CHILEAN AVENUE PH EW, PALM BEACH, FL, 33480-4403",,Mission not available,1970,Yes
https://www.charitynavigator.org/ein/237061117,AMERICAN LEGION AUXILIARY,237061117,,,"Not currently rated, Not rated, This organization is not rated",,"PO BOX 116, GLENDO, WY, 82213-0116",,Mission not available,1946,Yes
https://www.charitynavigator.org/ein/237061317,PTA CALIFORNIA CONGRESS OF PARENTS TEACHERS & STUDENTS INC,237061317,,,"Review Before Proceeding, Not currently rated, Not rated, This organization is not rated",,"2250 TRACY AVE, SIMI VALLEY, CA, 93063-0000",,Mission not available,1943,Yes
https://www.charitynavigator.org/ein/237061234,International Education Research Foundation,237061234,96%,4,,http://WWW.IERF.ORG,"PO BOX 3665, CULVER CITY, CA, 90231-3665",310-258-9451,TO RESEARCH & DISSEMINATE INFORMATION ON WORLD EDUCATIONAL SYSTEMS,1971,No
https://www.charitynavigator.org/ein/237061323,EPIPHANY LUTHERAN CHURCH,237061323,,,"Not currently rated, Not rated, This organization is not rated",,"800 W RAY RD, CHANDLER, AZ, 85225-6717",,Mission not available,1941,Yes
https://www.charitynavigator.org/ein/237061281,AMERICAN ASSOCIATION OF UNIVERSITY WOMEN,237061281,,,"Not currently rated, Not rated, This organization is not rated",,"PO BOX 2228, HUNTSVILLE, AL, 35804-2228",,Mission not available,2010,Yes
https://www.charitynavigator.org/ein/237061377,ST THERESA CATHOLIC CHURCH AUSTIN TEXAS,237061377,,,"Not currently rated, Not rated, This organization is not rated",,"4311 SMALL DR, AUSTIN, TX, 78731-3634",,Mission not available,1946,Yes
https://www.charitynavigator.org/ein/237061365,NATIONAL ASSOCIATION OF LETTER CARRIERS,237061365,,,"Not currently rated, Not rated, This organization is not rated",,"140 BLOCK ST, MARION, AR, 72364-1956",,Mission not available,1971,Yes
https://www.charitynavigator.org/ein/237061413,BETHLEHEM LUTHERAN CHURCH,237061413,,,"Not currently rated, Not rated, This organization is not rated",,"1423 8TH AVE N, JAX BCH, FL, 32250-3555",,Mission not available,1941,Yes
https://www.charitynavigator.org/ein/237061421,RETAIL WHOLESALE & DEPARTMENT STORE UNION,237061421,,,"Not currently rated, Not rated, This organization is not rated",,"1901 10TH AVE S, BIRMINGHAM, AL, 35205-2601",,Mission not available,1943,Yes
https://www.charitynavigator.org/ein/237061425,ST PATRICKS EPISCOPAL CHURCH,237061425,,,"Not currently rated, Not rated, This organization is not rated",,"4755 N PEACHTREE RD, ATLANTA, GA, 30338-5812",,Mission not available,1972,Yes
https://www.charitynavigator.org/ein/237061422,RETAIL WHOLESALE & DEPARTMENT STORE UNION,237061422,,,"Not currently rated, Not rated, This organization is not rated",,"1901 10TH AVE S, BIRMINGHAM, AL, 35205-2601",,Mission not available,1943,Yes
https://www.charitynavigator.org/ein/237061351,ALPHA DELTA KAPPA SORORITY INC,237061351,,,"Not currently rated, Not rated, This organization is not rated",,"1615 W 92ND ST, KANSAS CITY, MO, 64114-3210",,Mission not available,1970,Yes
https://www.charitynavigator.org/ein/237061492,PTA MISSOURI CONGRESS,237061492,,,"Not currently rated, Not rated, This organization is not rated",,"20404ETRUMANROAD, INDEPENDENCE, MO, 64056-0000",,Mission not available,1972,Yes
https://www.charitynavigator.org/ein/237061597,Charles O & Rena Barber Selders Foundation % Trust Dept,237061597,,,"Not currently rated, Not rated, This organization is not rated",,"PO BOX 653067, DALLAS, TX, 75265-3067",,Mission not available,1971,Yes
https://www.charitynavigator.org/ein/237061499,Hale Kipa Inc.,237061499,96%,4,,http://WWW.HALEKIPA.ORG,"91-2128 OLD FORT WEAVER ROAD, EWA BEACH, HI, 96706-1911",808-589-1829,"HALE KIPA PROVIDES OPPORTUNITIES AND ENVIRONMENTS THAT STRENGTHEN AND ENCOURAGE YOUTH, THEIR FAMILIES AND COMMUNITIES TO ACTUALIZE THEIR POTENTIAL AND SOCIAL RESPONS ... (More)",1970,No
https://www.charitynavigator.org/ein/237061608,NATIONAL ASSOCIATION OF LETTER CARRIERS,237061608,,,"Not currently rated, Not rated, This organization is not rated",,"PO BOX 11315, BOZEMAN, MT, 59719-1315",,Mission not available,1971,Yes
https://www.charitynavigator.org/ein/237061503,NATIONAL SOCIETY OF THE SONS OF THE AMERICAN REVOLUTION,237061503,,,"Not currently rated, Not rated, This organization is not rated",,"275 WOODRIDGE DR, GENEVA, FL, 32732-9268",,Mission not available,1970,Yes
https://www.charitynavigator.org/ein/237061635,SAINT PHILIP LUTHERAN CHURCH,237061635,,,"Not currently rated, Not rated, This organization is not rated",,"8850 DAVONA DR, DUBLIN, CA, 94568-1132",,Mission not available,1941,Yes
https://www.charitynavigator.org/ein/237061634,SAINT PAUL LUTHERAN CHURCH,237061634,,,"Not currently rated, Not rated, This organization is not rated",,"105 ASH ST, SUSANVILLE, CA, 96130-4539",,Mission not available,1941,Yes
https://www.charitynavigator.org/ein/237061638,Synergics,237061638,,,"Not currently rated, Not rated, This organization is not rated",,"PO BOX 10267, HONOLULU, HI, 96816-0267",,Mission not available,1973,Yes
https://www.charitynavigator.org/ein/237061612,Davis Friends Meeting,237061612,,,"Not currently rated, Not rated, This organization is not rated",,"PO BOX 4477, DAVIS, CA, 95617-4477",,Mission not available,1973,Yes
https://www.charitynavigator.org/ein/237061622,Mt. Hood Community College District Foundation Inc.,237061622,81%,3,,http://WWW.MHCC.EDU/FOUNDATION,"26000 SE STARK STREET, GRESHAM, OR, 97030-0000",503-491-7206,TO BE A UNIFYING FORCE PROVIDING RESOURCES VITAL TO QUALITY EDUCATION AND COMMUNITY LIFE.,1970,No
https://www.charitynavigator.org/ein/237061702,Bruce Lindorf Memorial Foundation,237061702,,,"This organization is not rated, Confirmed Revocation, Not rated, Not currently rated, Review Before Proceeding",,"51 WEST CENTER 604, OREM, UT, 84057-4605",,Mission not available,1970,Yes
https://www.charitynavigator.org/ein/237061714,DELTA KAPPA GAMMA SOCIETY,237061714,,,"Not currently rated, Not rated, This organization is not rated",,"PO BOX 277, POINT LOOKOUT, MO, 65726-0277",,Mission not available,1971,Yes
https://www.charitynavigator.org/ein/237061712,DELTA KAPPA GAMMA SOCIETY INTERNATIONAL,237061712,,,"Not currently rated, Not rated, This organization is not rated",,"13020 S ROBINSON AVE, MOORE, OK, 73170-1408",,Mission not available,1970,Yes
https://www.charitynavigator.org/ein/237061751,INTERNATIONAL ASSOCIATION OF LIONS CLUBS,237061751,,,"Not currently rated, Not rated, This organization is not rated",,"PO BOX 4794, KAILUA KONA, HI, 96745-4794",,Mission not available,1940,Yes
https://www.charitynavigator.org/ein/237061646,ASCENSION LIVING BETHLEHEM WOODS VILLAGE,237061646,79%,3,,,"PO BOX 45998, SAINT LOUIS, MO, 63145-5998",314-733-8000,TO IMPROVE THE HEALTH AND WELL-BEING OF ALL PEOPLE IN THE COMMUNITIES WE SERVE.,1946,No
https://www.charitynavigator.org/ein/237061681,W W Keen & Madeleine A K Butcher Fam Fdn,237061681,,,"Not currently rated, Not rated, This organization is not rated",,"2110 PARK AVE, KEMAH, TX, 77565-3023",,Mission not available,1970,Yes
https://www.charitynavigator.org/ein/237061719,DELTA KAPPA GAMMA SOCIETY INTERNATIONAL,237061719,,,"Not currently rated, Not rated, This organization is not rated",,"9402 OXTED LN, SPRING, TX, 77379-6622",,Mission not available,1971,Yes
https://www.charitynavigator.org/ein/237061788,PTA CALIFORNIA CONGRESS OF PARENTS TEACHERS & STUDENTS INC,237061788,,,"Review Before Proceeding, Not currently rated, Not rated, This organization is not rated",,"1001 S EAST ST, ANAHEIM, CA, 92805-5749",,Mission not available,1963,Yes
https://www.charitynavigator.org/ein/237061801,The Learning Disabilities Association of Georgia,237061801,,,"Not currently rated, Not rated, This organization is not rated",,"1366 NORTH DRUID HILLS ROAD, BROOKHAVEN, GA, 30319-0000",,Mission not available,2013,Yes
https://www.charitynavigator.org/ein/237061795,Fayette County Historical Society Inc.,237061795,,,"Not currently rated, Not rated, This organization is not rated",,"PO BOX 534, FAYETTE, AL, 35555-0534",,Mission not available,2016,Yes
https://www.charitynavigator.org/ein/237061836,Valhalla Elementary School Parent Faculty Association,237061836,73%,2,,,"530 KIKI DR, PLEASANT HILL, CA, 94523-1799",925-687-1700,PROMOTE/SUPPORT EDUCATION AT VALHALLA ELEMENTARY SCHOOL,1970,No
https://www.charitynavigator.org/ein/237061831,Unitarian Church of San Mateo,237061831,,,"Not currently rated, Not rated, This organization is not rated",,"300 E SANTA INEZ AVE, SAN MATEO, CA, 94401-2506",,Mission not available,1960,Yes
https://www.charitynavigator.org/ein/237061816,St. Thomas High School Foundation,237061816,88%,3,,http://WWW.STHS.ORG,"4500 MEMORIAL DR, HOUSTON, TX, 77007-7332",713-864-6348,MONITOR THE INVESTMENTS FOR ST. THOMAS HIGH SCHOOL'S ENDOWED GIFTS,1970,No
https://www.charitynavigator.org/ein/237061868,Flat Top Independent Methodist Church,237061868,,,"Not currently rated, Not rated, This organization is not rated",,"STAR ROUTE, SODDY, TN, 37379-9801",,Mission not available,1970,Yes
https://www.charitynavigator.org/ein/237061938,LITTLE LEAGUE BASEBALL INC,237061938,,,"Review Before Proceeding, Not currently rated, Not rated, This organization is not rated",,"11006 MASCARELL AVE, MISSION HILLS, CA, 91345-1613",,Mission not available,1967,Yes
https://www.charitynavigator.org/ein/237061848,American Board of Clinical Neurophysiology Inc.,237061848,,,"Not currently rated, Not rated, This organization is not rated",,"111 E UNIVERSITY DR STE 105 PMB 355, DENTON, TX, 76209-2094",,Mission not available,1970,Yes
https://www.charitynavigator.org/ein/237061900,Missouri Park and Recreation Scholarship Charitable Trust,237061900,,,"Not currently rated, Not rated, This organization is not rated",,"1906 CORONA RD STE 100, COLUMBIA, MO, 65203-5937",,Mission not available,2016,Yes
https://www.charitynavigator.org/ein/237061947,Union Prince of Peace Missionary Baptist Church,237061947,,,"Not currently rated, Not rated, This organization is not rated",,"4807 S WESTERN AVE, LOS ANGELES, CA, 90062-2325",,Mission not available,1970,Yes
https://www.charitynavigator.org/ein/237061941,SOUTHERN CALIFORNIA OPERATING AND MAINTENANCE ENGINEERS,237061941,,,"Not currently rated, Not rated, This organization is not rated",,"PO BOX 990, WEST COVINA, CA, 91793-0990",626-646-1079,TO PROVIDE TRAINING PROGRAMS FOR EMPLOYEES IN THE ENGINEERING AND MAINTENANCE INDUSTRY,1970,Yes
https://www.charitynavigator.org/ein/237061960,Space Coast Recovery Inc.,237061960,81%,3,,http://WWW.SPACECOASTRECOVERY.COM,"1215 LAKE DR, COCOA, FL, 32922-6293",321-632-5958,SPACE COAST RECOVERY IS DEDICATED TO EMPOWERING OUR CLIENTS TO CHOOSE RECOVERY FROM ADDICTION.,1970,No
https://www.charitynavigator.org/ein/237061981,Berean Baptist Church,237061981,,,"Not currently rated, Not rated, This organization is not rated",,"8630 S 60 E, SANDY, UT, 84070-0000",,Mission not available,1970,Yes
https://www.charitynavigator.org/ein/237061989,Brazil Christian Mission,237061989,,,"Not currently rated, Not rated, This organization is not rated",,"PO BOX 12, ANTHONY, KS, 67003-0012",,Mission not available,1964,Yes
https://www.charitynavigator.org/ein/237061995,Chattahoochee Valley Educational Foundation,237061995,71%,2,,http://WWW.SPRINGWOODSCHOOL.COM,"PO BOX 1030, LANETT, AL, 36863-1030",334-644-2191,"OPERATION OF EDUCATIONAL INSTITUTION FOR GRADES ONE THROUGH TWELVE, AND KINDERGARTEN INCLUDING SCHOLASTICS, ATHLETICS, AND OTHER RELATED FUNCTIONS AND ACTIVITIES.",1970,No
https://www.charitynavigator.org/ein/237061992,Casa De Redwood Foundation,237061992,84%,3,,http://WWW.BARCELON.COM,"590 LENNON LN STE 110, WALNUT CREEK, CA, 94598-5923",925-951-0762,"TO PROVIDE LOW-INCOME RENTAL HOUSING FOR THE ELDERLY, INCLUDING RELATED FACILITIES AND SERVICES, WHICH ARE SPECIFICALLY DESIGNED TO MEET THE PHYSICAL, SOCIAL AND PSY ... (More)",1970,No
https://www.charitynavigator.org/ein/237061997,Christine Center Inc.,237061997,,,"Not currently rated, Not rated, This organization is not rated",,"11701 NW 12TH AVE, MIAMI, FL, 33168-6220",,Mission not available,1970,Yes
https://www.charitynavigator.org/ein/237061998,Daystar Community Church,237061998,,,"Not currently rated, Not rated, This organization is not rated",,"PO BOX 1866, OAKLAND, CA, 94604-1866",,Mission not available,1970,Yes
https://www.charitynavigator.org/ein/237062020,EDMONDSON TELFORD FOUNDATION,237062020,,,"Not currently rated, Not rated, This organization is not rated",,"PO BOX 3430, GAINESVILLE, GA, 30503-3430",,Mission not available,1970,Yes
https://www.charitynavigator.org/ein/237062014,Furth Family Foundation,237062014,,,"Not currently rated, Not rated, This organization is not rated",,"710 EL CAMINO DEL MAR, SAN FRANCISCO, CA, 94121-1016",,Mission not available,1969,Yes
https://www.charitynavigator.org/ein/237062013,Delhi Pentecostal Church,237062013,,,"Not currently rated, Not rated, This organization is not rated",,"PO BOX 141, DELHI, CA, 95315-0141",,Mission not available,1970,Yes
https://www.charitynavigator.org/ein/237062027,Family Housing and Adult Resources Inc.,237062027,92%,4,,http://www.FHAR.org,"20 EAST 20TH AVE FL2, SAN MATEO, CA, 94403-1319",650-403-0403,Family Housing and Adult Resources Inc. FHAR serves people with developmental disabilities. FHAR's mission is to assist each program participant to reach his or her ... (More),1970,No
https://www.charitynavigator.org/ein/237062033,Himalayan Academy,237062033,60%,2,,http://www.himalayanacademy.com,"107 KAHOLALELE RD, KAPAA, HI, 96746-9304",808-822-3012,"HINDU RELIGIOUS EDUCATION. OUR MOST SIGNIFICANT ACTIVITIES INCLUDE: HINDUISM TODAY MAGAZINE, CREATION, SALES AND GIVEAWAY OF OUR HINDU PUBLICATIONS, LECTURES, TRAVEL ... (More)",1970,No
https://www.charitynavigator.org/ein/237062028,San Jose Museum of Art,237062028,98%,4,,http://www.sjmusart.org/,"110 South Market Street, San Jose, CA, 95113",408-271-6840,The San Jos Museum of Art nurtures empathy and connection by engaging communities with socially relevant contemporary art.,1970,No
https://www.charitynavigator.org/ein/237062041,Inspiration for Youth Inc.,237062041,,,"Not currently rated, Not rated, This organization is not rated",,"6516 VICTORIA PL S, MOBILE, AL, 36608-6009",,Mission not available,1970,Yes
