url,name,ein,score,star_rating,keywords,website,address,phone,organization_mission,IRS_ruling_year,contain_keywords
https://www.charitynavigator.org/ein/270859143,Sooneverse Inc.,270859143,71%,2,,,"1900 NORTHWEST EXPRESSWAYSUITE1601, OKLAHOMA CITY, OK, 73118-0000",405-424-2282,"SOONERVERSE SHALL FACILITATE MANAGEMENT FUNCTIONS RELATED TO INFORMATION, EXCHANGE, CARE DELIVERY TRANSFORMATION AND PRACTICE MANAGEMENT REQUIRED IN COMMUNITY HEALTH ... (More)",2011,No
https://www.charitynavigator.org/ein/270861096,MCCLOUD GARDEN CLUB,270861096,,,"Not currently rated, This organization is not rated, Not rated",,"PO BOX 610, MCCLOUD, CA, 96057-0610",,Mission not available,2024,Yes
https://www.charitynavigator.org/ein/270859660,West Central Texas Regional Foundation,270859660,85%,3,,http://WWW.WCTCOG.ORG/RF_INDEX.PHP,"3702 LOOP 322, ABILENE, TX, 79602-7300",325-793-8414,"TO IMPROVE THE HEALTH, EDUCATION, SAFETY, HOUSING, ENVIRONMENT AND GENERAL WELFARE OF THE CITIZENS AND TO PLAN FOR THE FUTURE DEVELOPMENT OF THE AREA EMBRACED BY THE ... (More)",2010,No
https://www.charitynavigator.org/ein/270861336,Ciclistas Del Valle Cycling Club Inc.,270861336,,,"Not currently rated, This organization is not rated, Not rated",,"PO BOX 744, MODESTO, CA, 95353-0744",,Mission not available,2020,Yes
https://www.charitynavigator.org/ein/270861056,New Start Community Sevice Inc.,270861056,,,"Not currently rated, This organization is not rated, Not rated",,"14117 N LAKE BRANCH LN, HOUSTON, TX, 77044-1561",,Mission not available,2011,Yes
https://www.charitynavigator.org/ein/270861342,Purpose Community Housing Inc.,270861342,,,"Not currently rated, This organization is not rated, Not rated",,"8123 RICHLAND DR, HOUSTON, TX, 77028-1941",,Mission not available,2010,Yes
https://www.charitynavigator.org/ein/270861466,Phoenix Philanthropists,270861466,,,"Not currently rated, This organization is not rated, Not rated",,"428 E THUNDERBIRD RD STE 105, PHOENIX, AZ, 85022-5229",,Mission not available,2010,Yes
https://www.charitynavigator.org/ein/270861314,Foundation for Pediatric Acute Care and Quality,270861314,,,"Not currently rated, This organization is not rated, Not rated",,"7777 FOREST LN STE D569, DALLAS, TX, 75230-6903",,Mission not available,2014,Yes
https://www.charitynavigator.org/ein/270861293,California Indian Environmental Alliance,270861293,52%,1,,http://WWW.CIEAWEB.ORG,"PO BOX 2128, BERKELEY, CA, 94702-0128",510-848-2043,"CIEA's mission is to protect and restore California Indian Peoples' cultural traditions, ancestral territories, means of subsistence and environmental health.",2010,No
https://www.charitynavigator.org/ein/270861630,Gateway to Housing Inc.,270861630,,,"Not currently rated, This organization is not rated, Not rated",,"160 CONGRESS PARK DRIVE, DELRAY BEACH, FL, 33445-4724",,Mission not available,2017,Yes
https://www.charitynavigator.org/ein/270862006,Little Prophet Foundation,270862006,,,"Not currently rated, This organization is not rated, Not rated",,"2308 ARROYO AVE, MCALLEN, TX, 78504-6311",,Mission not available,2010,Yes
https://www.charitynavigator.org/ein/270862011,Roads Education Organization,270862011,96%,4,,http://PIVOTNORTHVALLEY.COM,"1390 E 9TH ST STE 190, CHICO, CA, 95928-5966",530-636-4362,TO ENABLE STUDENTS TO ACCOMPLISH THEIR EDUCATIONAL GOALS.,2012,No
https://www.charitynavigator.org/ein/270862166,Northtulsa100 Inc.,270862166,,,"Not currently rated, This organization is not rated, Not rated",,"PO BOX 50637, TULSA, OK, 74150-0637",,Mission not available,2015,Yes
https://www.charitynavigator.org/ein/270862227,ROCKY MOUNTAIN MUSTANG ROUNDUP,270862227,,,"Not currently rated, This organization is not rated, Not rated",,"PO BOX 21707, DENVER, CO, 80221-0707",,Mission not available,2010,Yes
https://www.charitynavigator.org/ein/270861620,Everlasting Gospel Adventist Church,270861620,,,"Not currently rated, This organization is not rated, Not rated",,"PO BOX 2392, CYPRESS, CA, 90630-1892",,Mission not available,2009,Yes
https://www.charitynavigator.org/ein/270862321,WESLEYAN TABERNACLE OF RECONCILIATION,270862321,,,"Not currently rated, This organization is not rated, Not rated",,"7194 NW 6TH CT, MIAMI, FL, 33150-3604",,Mission not available,1970,Yes
https://www.charitynavigator.org/ein/270862327,Gilbert Centennial Elementary Parent Teacher Org Inc.,270862327,,,"Not currently rated, This organization is not rated, Not rated",,"3507 S RANCH HOUSE PKWY, GILBERT, AZ, 85297-4945",,Mission not available,2024,Yes
https://www.charitynavigator.org/ein/270863058,Vista Academy in Garland Pto,270863058,,,"Not currently rated, This organization is not rated, Not rated",,"3024 ANITA DR, GARLAND, TX, 75041-2708",,Mission not available,2011,Yes
https://www.charitynavigator.org/ein/270862779,Ateam Ministries,270862779,76%,3,,http://WWW.ATEAMMINISTRIES.ORG,"1809 OXMOOR RD, HOMEWOOD, AL, 35209-3505",205-401-8232,"TO PROVIDE SPIRITUAL, EMOTIONAL AND FINANCIAL SUPPORT TO FAMILIES WITH CHILDREN WHO HAVE BEEN DIAGNOSED WITH ONCOLOGY OR HEMATOLOGY RELATED DISEASES.",2009,No
https://www.charitynavigator.org/ein/270861744,Miles City Convent Keepers,270861744,76%,3,,http://MCACAD.WIXSITE.COM/CONVENTKEEPS,"1411 LEIGHTON BLVD, MILES CITY, MT, 59301-2633",406-853-5001,TO PRESERVE THE ARCHITECTUAL INTEGRITY OF THE STRUCTURE AND THE SIGNIFICANCE OF THE MILES CITY ACADEMY BUILDING AS IT RELATES TO EASTERN MONTANA'S HISTORY,2010,No
https://www.charitynavigator.org/ein/270863139,Troup County Center for Strategic Planning Inc.,270863139,83%,3,,http://WWW.TROUPCOUNTYSTRATEGICPLANNING.COM,"100 RIDLEY AVENUE SUITE 2200, LAGRANGE, GA, 30240-2724",706-298-3639,"TROUP COUNTY CENTER FOR STRATEGIC PLANNING, INC. (THE ""CENTER"") IS A NON- PROFIT ORGANIZATION ORGANIZED IN 2009 TO CARRY OUT INITIATIVES SET FORTH IN TROUP COUNTY'S ... (More)",2010,No
https://www.charitynavigator.org/ein/270863197,THE ELEVATION MOVEMENT,270863197,,,"Not currently rated, This organization is not rated, Not rated",,"PO BOX 66598, SCOTTS VALLEY, CA, 95067-6598",,Mission not available,1969,Yes
https://www.charitynavigator.org/ein/270862478,Pi Hope,270862478,,,"Not currently rated, This organization is not rated, Not rated",,"203 N WASHINGTON STREET, SPOKANE, WA, 99201-0233",,Mission not available,2012,Yes
https://www.charitynavigator.org/ein/270863181,Premier Athletics Track Club Inc.,270863181,,,"Not currently rated, This organization is not rated, Not rated",,"3732 LARAMIE RD, ELLENWOOD, GA, 30294-6654",,Mission not available,2012,Yes
https://www.charitynavigator.org/ein/270863541,LOS CHARROS HERRADERO DE AUSTIN,270863541,,,"Not currently rated, This organization is not rated, Not rated",,"12014 MOORE RD, AUSTIN, TX, 78719-9653",,Mission not available,2009,Yes
https://www.charitynavigator.org/ein/270864209,Firehouse Creative Productions Inc.,270864209,,,"Not currently rated, This organization is not rated, Not rated",,"1560 LAWTON AVE, MACON, GA, 31201-1510",,Mission not available,2009,Yes
https://www.charitynavigator.org/ein/270864306,Tlc Relief Inc.,270864306,82%,3,,,"1229 VARDON CT, TRINITY, FL, 34655-4644",727-789-1813,HELP AND SUPPORT NEEDY FAMILIES. ASSISTANCE FOR EDUCATING CHEILDREN,2010,No
https://www.charitynavigator.org/ein/270863572,Founders Classical Academy of Carrollton Pto,270863572,,,"Not currently rated, This organization is not rated, Not rated",,"2400 N JOSEY LN, CARROLLTON, TX, 75006-1617",,Mission not available,2012,Yes
https://www.charitynavigator.org/ein/270864845,King Educational Foundation,270864845,,,"Not currently rated, This organization is not rated, Not rated, Review Before Proceeding",,"4465 W 60TH ST, LOS ANGELES, CA, 90043-3503",,Mission not available,2010,Yes
https://www.charitynavigator.org/ein/270864414,Harold C and Marilyn A Hohbach Foundation,270864414,,,"Not currently rated, This organization is not rated, Not rated",,"195 PAGE MILL RD STE 172, PALO ALTO, CA, 94306-2073",,Mission not available,2009,Yes
https://www.charitynavigator.org/ein/270865318,East County Transitional Living Center Inc.,270865318,91%,4,,https://ectlc.org/,"1527 E MAIN ST, EL CAJON, CA, 92021-5902",619-442-0457,"To provide transitional living and restore lives. (See schedule O)Since 2009, East County Transitional Living Center has been tirelessly committed to breaking the cy ... (More)",2010,No
https://www.charitynavigator.org/ein/270864431,Friends of the Alameda Animal Shelter,270864431,97%,4,,http://WWW.ALAMEDAANIMALSHELTER.ORG,"1590 FORTMANN WAY, ALAMEDA, CA, 94501-1272",510-337-8565,"FRIENDS OF THE ALAMEDA ANIMAL SHELTER (FAAS), A 501(C)(3) NONPROFIT, MANAGES THE OPEN-INTAKE CITY OF ALAMEDA SHELTER. FAAS NEVER EUTHANIZES FOR TIME OR SPACE; SAVING ... (More)",2009,No
https://www.charitynavigator.org/ein/270865371,Portuguese International Parents Association,270865371,,,"Not currently rated, This organization is not rated, Not rated",,"660 SW 3RD ST, MIAMI, FL, 33130-2312",,Mission not available,2011,Yes
https://www.charitynavigator.org/ein/270864987,Fervent Servant Ministries Inc.,270864987,,,"Not currently rated, This organization is not rated, Not rated",,"168 SPUNKY CREEK DR, CATOOSA, OK, 74015-2312",,Mission not available,2010,Yes
https://www.charitynavigator.org/ein/270865579,The Experience Christian Center Inc.,270865579,,,"Not currently rated, This organization is not rated, Not rated",,"2425 N HIAWASSEE RD, ORLANDO, FL, 32818-3962",,Mission not available,2010,Yes
https://www.charitynavigator.org/ein/270865588,Hispanic Community Connection Conexion Comunidad Hispana,270865588,,,"Not currently rated, This organization is not rated, Not rated",,"2470 S REDWOOD RD STE 209, SALT LAKE CTY, UT, 84119-2197",,Mission not available,2014,Yes
https://www.charitynavigator.org/ein/270865548,Imperial Neighborhood Park Association,270865548,,,"Not currently rated, This organization is not rated, Not rated",,"2828 S FILMORE ST, SALT LAKE CTY, UT, 84106-3547",,Mission not available,2010,Yes
https://www.charitynavigator.org/ein/270865596,Mission of Christs Church Inc.,270865596,,,"Not currently rated, This organization is not rated, Not rated",,"2109 EVENING SUN DR, PLANO, TX, 75093-3800",,Mission not available,2010,Yes
https://www.charitynavigator.org/ein/270865931,Sundance Equine Assisted Therapies,270865931,,,"Not currently rated, This organization is not rated, Not rated",,"1840 COUNTY ROAD 297, CROWELL, TX, 79227-4500",,Mission not available,2010,Yes
https://www.charitynavigator.org/ein/270866019,Christian Chefs International,270866019,80%,3,,http://WWW.CHRISTIANCHEFS.ORG,"289 SPRUCE ST 1484, CANNON BEACH, OR, 97110-3202",503-794-4083,TEACH CULINARY SKILLS WITH BIBLICAL MINDSET,2012,No
https://www.charitynavigator.org/ein/270866070,Lillys Fostering Hearts,270866070,,,"Review Before Proceeding, This organization is not rated, Confirmed Revocation, Not rated, Not currently rated",,"10790 TERNEZ DR, MOORPARK, CA, 93021-9767",,Mission not available,2010,Yes
https://www.charitynavigator.org/ein/270865881,WORLDWIDE CHURCH OF GOD MEDFORD OREGON,270865881,,,"Not currently rated, This organization is not rated, Not rated",,"218 PERRYDALE AVE, MEDFORD, OR, 97501-2041",,Mission not available,1959,Yes
https://www.charitynavigator.org/ein/270865868,Pmah Ohana Medical Missions Inc.,270865868,,,"Not currently rated, This organization is not rated, Not rated",,"PO BOX 1294, PEARL CITY, HI, 96782-8294",,Mission not available,2010,Yes
https://www.charitynavigator.org/ein/270866602,US Naval Sea Cadets Seal Beach Battalion Inc.,270866602,,,"Not currently rated, This organization is not rated, Not rated",,"11206 LEXINGTON DR, LOS ALAMITOS, CA, 90720-5001",,Mission not available,2012,Yes
https://www.charitynavigator.org/ein/270866098,CALIFORNIA CIVIL RIGHTS FOUNDATION,270866098,,,"Not currently rated, This organization is not rated, Not rated",,"34383 ALVARADO-NILES ROAD SUITE 251, UNION CITY, CA, 94587-4455",,Mission not available,2011,Yes
https://www.charitynavigator.org/ein/270866071,PTA FLORIDA CONGRESS,270866071,,,"Not currently rated, This organization is not rated, Not rated",,"650 EAST RIVER FALCONS WAY, ORLANDO, FL, 32833-2779",,Mission not available,1971,Yes
https://www.charitynavigator.org/ein/270866657,Iglesia Hispana El Reino De Dios Inc.,270866657,,,"Not currently rated, This organization is not rated, Not rated",,"2902 N LEONARD RD, ST JOSEPH, MO, 64506-1787",,Mission not available,2010,Yes
https://www.charitynavigator.org/ein/270866260,UNITED STATES FENCING ASSOCIATION,270866260,,,"Not currently rated, This organization is not rated, Not rated",,"2655 N SANDSTONE WAY, FLAGSTAFF, AZ, 86004-7633",,Mission not available,2004,Yes
https://www.charitynavigator.org/ein/270866903,Molina Center Inc.,270866903,,,"Not currently rated, This organization is not rated, Not rated",,"PO BOX 127, MOLINA, CO, 81646-0127",,Mission not available,2014,Yes
https://www.charitynavigator.org/ein/270866966,Were Glad Youre Here,270866966,,,"Not currently rated, This organization is not rated, Not rated",,"15610 SE BYBEE DR, PORTLAND, OR, 97236-7835",,Mission not available,2010,Yes
https://www.charitynavigator.org/ein/270867202,End Times Harvest International Ministries Inc.,270867202,,,"Not currently rated, This organization is not rated, Not rated",,"500 SW DEER RUN, PORT ST LUCIE, FL, 34953-8210",,Mission not available,2010,Yes
https://www.charitynavigator.org/ein/270867999,Alexandria Urban Renewal Association,270867999,,,"Not currently rated, This organization is not rated, Not rated",,"PO BOX 71, ALEXANDRIA, LA, 71309-0071",,Mission not available,2010,Yes
https://www.charitynavigator.org/ein/270868610,Daily Audio Bible,270868610,75%,3,,http://WWW.DAILYAUDIOBIBLE.COM,"PO BOX 1996, SPRING HILL, TN, 37174-1996",615-405-0227,DAILY PODCAST OF BIBLE READINGS IN MULLTIPLE LANGUAGES.,2010,No
https://www.charitynavigator.org/ein/270867004,Magdalene Hope Inc.,270867004,,,"Not currently rated, This organization is not rated, Not rated",,"PO BOX 2631, BAKERSFIELD, CA, 93303-2631",,Mission not available,2010,Yes
https://www.charitynavigator.org/ein/270869004,Arnold Dwight England Foundation,270869004,,,"Not currently rated, This organization is not rated, Not rated",,"402 OLD KNOXVILLE HWY, NEW TAZEWELL, TN, 37825-6729",,Mission not available,2010,Yes
https://www.charitynavigator.org/ein/270868305,New Orleans Military and Maritime Academy Inc.,270868305,96%,4,,http://NOMMA.NET,"425 OBANNON ST, NEW ORLEANS, LA, 70114-1571",504-227-3810,"TO EDUCATE HIGH SCHOOL STUDENTS, NO MATTER THEIR BACKGROUND OR PREVIOUS SCHOOL EXPERIENCE, TO FULLY ACHIEVE THEIR PERSONAL AND ACADEMIC POTENTIAL THROUGH THE ACQUISI ... (More)",2010,No
https://www.charitynavigator.org/ein/270869012,Wecats Corp,270869012,,,"Not currently rated, This organization is not rated, Not rated",,"3216 BREEZY WAY, ZEPHYRHILLS, FL, 33541-6807",,Mission not available,2010,Yes
https://www.charitynavigator.org/ein/270869075,Al-Amin Center of Florida Inc.,270869075,,,"Not currently rated, This organization is not rated, Not rated",,"8101 S MILITARY TRL, BOYNTON BEACH, FL, 33436-1503",,Mission not available,2009,Yes
https://www.charitynavigator.org/ein/270868701,Challenge America,270868701,98%,4,,http://WWW.CHALLENGEAMERICA.COM,"PO BOX 4467, BASALT, CO, 81621-4467",970-279-1323,"CHALLENGE AMERICA CONNECTS SERVICE MEMBERS, VETERANS AND THEIR FAMILIES TO RESOURCES AND SOLUTIONS THAT BUILD COMMUNITY AND GIVE PURPOSE TO THEIR LIVES.",2010,No
https://www.charitynavigator.org/ein/270869582,Plan C Initiative Inc.,270869582,,,"Not currently rated, This organization is not rated, Not rated",,"1455 TREETOP DR, PALM HARBOR, FL, 34683-2837",,Mission not available,2011,Yes
https://www.charitynavigator.org/ein/270870444,Communities for Police Canines,270870444,,,"Not currently rated, This organization is not rated, Not rated",,"PO BOX 991575, REDDING, CA, 96099-1575",,Mission not available,2012,Yes
https://www.charitynavigator.org/ein/270869532,God Across America,270869532,,,"Not currently rated, This organization is not rated, Not rated",,"1201 GLORY WAY BLVD 19, BRADENTON, FL, 34212-3007",,Mission not available,2023,Yes
https://www.charitynavigator.org/ein/270870159,Riverton Swim Club,270870159,,,"Not currently rated, This organization is not rated, Not rated",,"PO BOX 1396, RIVERTON, WY, 82501-0159",,Mission not available,2012,Yes
https://www.charitynavigator.org/ein/270869273,Chelsea Hicks Foundation,270869273,83%,3,,http://WWW.CHELSEAHICKSFOUNDATION.ORG,"PO BOX 755, TUALATIN, OR, 97062-0755",503-367-5747,"WHEN SERIOUS ILLNESS IMPACTS A YOUNG PERSON'S CHILDHOOOD AND A FAMILY'S WELLBEING, THE CHELSEA HICKS FOUNDATION'S CREATIVE PROGRAMS PROVIDE HOPE, SUPPORT AND OPPORTU ... (More)",2010,No
https://www.charitynavigator.org/ein/270870730,Timothy Maguire Foundation,270870730,,,"Not currently rated, This organization is not rated, Not rated, Review Before Proceeding",,"5625 E NAUNI VALLEY DR, PARADISE VLY, AZ, 85253-5124",,Mission not available,2010,Yes
https://www.charitynavigator.org/ein/270871052,Coins for A Cause Inc.,270871052,,,"Not currently rated, This organization is not rated, Not rated",,"2050 STATE HIGHWAY 178, SENECA, KS, 66538-2097",,Mission not available,2010,Yes
https://www.charitynavigator.org/ein/270871113,Lamrim Center,270871113,,,"Not currently rated, This organization is not rated, Not rated",,"409 E LAS FLORES AVE, ARCADIA, CA, 91006-4862",,Mission not available,2010,Yes
https://www.charitynavigator.org/ein/270870463,NATIONAL BANANA PUDDING FESTIVAL,270870463,,,"Not currently rated, This organization is not rated, Not rated",,"118 CHURCH ST, CENTERVILLE, TN, 37033-1634",,Mission not available,2010,Yes
https://www.charitynavigator.org/ein/270870858,Northlake Homeless Coalition,270870858,33%,0,,http://WWW.NORTHLAKEHOMELESS.ORG,"116 VILLAGE STREET STE 2, SLIDELL, LA, 70458-5300",,THE NORTHLAKE HOMELESSS COALITION IS A NETWORK OF PRIVATE AND PUBLIC SERVICE PROVIDERS WORKING TOGETHER TO END THE RAVAGES OF HOMELESSNESS IN THE SOUTHEASTERN LOUISI ... (More),2011,No
https://www.charitynavigator.org/ein/270871457,New Jerusalem International Ministries,270871457,,,"Not currently rated, This organization is not rated, Not rated",,"150 COLFAX AVE, MODESTO, CA, 95354-3052",,Mission not available,2014,Yes
https://www.charitynavigator.org/ein/270871188,Healthy Paws Foundation,270871188,,,"Not currently rated, This organization is not rated, Not rated",,"PO BOX 50034, BELLEVUE, WA, 98015-0034",,Mission not available,2009,Yes
https://www.charitynavigator.org/ein/270871226,Developments for Africa,270871226,,,"Not currently rated, This organization is not rated, Not rated",,"PO BOX 310, CEDAR HILL, TX, 75106-0310",,Mission not available,2010,Yes
https://www.charitynavigator.org/ein/270871525,Chikara Foundation Inc.,270871525,,,"Not currently rated, This organization is not rated, Not rated",,"PO BOX 2156, LA HABRA, CA, 90632-2156",,Mission not available,2014,Yes
https://www.charitynavigator.org/ein/270871309,Indian Health Alliance,270871309,,,"Not currently rated, This organization is not rated, Not rated",,"741 CANON RIDGE RD, CANON CITY, CO, 81212-9153",,Mission not available,2009,Yes
https://www.charitynavigator.org/ein/270871859,Growing Up With Kids,270871859,,,"Not currently rated, This organization is not rated, Not rated",,"44659 PARKMEADOW DR, FREMONT, CA, 94539-6528",,Mission not available,2010,Yes
https://www.charitynavigator.org/ein/270871903,Nevada Police Foundation,270871903,,,"Not currently rated, This organization is not rated, Not rated",http://NEVADAPOLICEFOUNDATION.ORG,"5245 VISTA BLVD, SPARKS, NV, 89436-6390",775-351-9396,"THE NEVADA POLICE FOUNDATION'S PURPOSE IS TO PROVIDE SUPPORT,RESOURCES AND FINANCIAL ASSISTANCE TO NEVADA POLICE OFFICERS AND THEIR FAMILIES",2010,Yes
https://www.charitynavigator.org/ein/270871557,Kathryn A Basile Foster A Dream Foundation Inc.,270871557,,,"Not currently rated, This organization is not rated, Not rated",,"PO BOX 7338, PORT ST LUCIE, FL, 34985-7338",,Mission not available,2010,Yes
https://www.charitynavigator.org/ein/270871907,IGLESIA BETEL ASAMBLEA DE DIOS,270871907,,,"Not currently rated, This organization is not rated, Not rated",,"906 DARLINGTON WAY SW, ROME, GA, 30161-6135",,Mission not available,1964,Yes
https://www.charitynavigator.org/ein/270871990,Cookeville First United Methodist Church Foundation Inc.,270871990,73%,2,,,"165 E BROAD ST, COOKEVILLE, TN, 38501-3211",931-526-2177,"TO AID AND SUPPORT THE PROGRAMS, MINISTRY, WORKS, GOALS OBJECTIVES AND INITIATIVES OF THE COOKEVILLE FIRST UNITED METHODIST CHURCH",2011,No
https://www.charitynavigator.org/ein/270872124,Music Unites Inc.,270872124,77%,3,Review Before Proceeding,http://WWW.MUSICUNITES.ORG,"2700 NEILSON WAY APT 629, SANTA MONICA, CA, 90405-4016",201-768-7684,PLEASE SEE SCH O,2009,Yes
https://www.charitynavigator.org/ein/270872542,Police Athletic League of Northport Housing Authority Inc.,270872542,,,"Not currently rated, This organization is not rated, Not rated",,"39 WEST CIRCLE, NORTHPORT, AL, 35476-0000",,Mission not available,2010,Yes
https://www.charitynavigator.org/ein/270872017,U N Peace University,270872017,,,"Not currently rated, This organization is not rated, Not rated",,"501 W GLENOAKS BLVD STE 336, GLENDALE, CA, 91202-2896",,Mission not available,2010,Yes
https://www.charitynavigator.org/ein/270872589,Friends of Alafia Inc.,270872589,,,"Not currently rated, This organization is not rated, Not rated",,"14326 S COUNTY ROAD 39, LITHIA, FL, 33547-1401",,Mission not available,2010,Yes
https://www.charitynavigator.org/ein/270872152,Iglesia Cristiana Ensenanzas De Jesus Lakeland Inc.,270872152,,,"Not currently rated, This organization is not rated, Not rated",,"PO BOX 895, KATHLEEN, FL, 33849-0895",,Mission not available,2010,Yes
https://www.charitynavigator.org/ein/270872834,CHI ALPHA CAMPUS MINISTRIES NSU CHI ALPHA,270872834,,,"Not currently rated, This organization is not rated, Not rated",,"PO BOX 1455, TAHLEQUAH, OK, 74465-1455",,Mission not available,1964,Yes
https://www.charitynavigator.org/ein/270872772,Building Students International,270872772,,,"Not currently rated, This organization is not rated, Not rated",,"2147 OVERLAND AVE STE 100, BILLINGS, MT, 59102-6478",,Mission not available,2013,Yes
https://www.charitynavigator.org/ein/270872646,Johns Creek High School Band Booster Association Inc.,270872646,,,"Not currently rated, This organization is not rated, Not rated",,"5575 STATE BRIDGE RD, JOHNS CREEK, GA, 30022-8165",,Mission not available,2012,Yes
https://www.charitynavigator.org/ein/270872953,American Legion Auxiliary Gunn Highway Memorial Unit 147 Inc.,270872953,,,"Not currently rated, This organization is not rated, Not rated",,"PO BOX 83, ODESSA, FL, 33556-0083",,Mission not available,2016,Yes
https://www.charitynavigator.org/ein/270872803,Leonard &laila Rose Foundations,270872803,,,"Not currently rated, This organization is not rated, Not rated, Review Before Proceeding",,"600 SPRING RD OFC, MOORPARK, CA, 93021-1215",,Mission not available,2009,Yes
https://www.charitynavigator.org/ein/270873017,Yakima Valley Society for Cultural Education,270873017,,,"Not currently rated, This organization is not rated, Not rated",,"1406 W CHESTNUT AVE, YAKIMA, WA, 98902-3831",,Mission not available,2019,Yes
https://www.charitynavigator.org/ein/270873619,Mid Cities Family Baptist Church,270873619,,,"Not currently rated, This organization is not rated, Not rated",,"3175 COLLINS RD, BURLESON, TX, 76028-1911",,Mission not available,2010,Yes
https://www.charitynavigator.org/ein/270873229,Dominican Sisters of Tamhiep,270873229,,,"Not currently rated, This organization is not rated, Not rated",,"2934 LANDERSHIRE LN, GARLAND, TX, 75044-5962",,Mission not available,2014,Yes
https://www.charitynavigator.org/ein/270873889,Canine Soulmates Rescue,270873889,,,"Not currently rated, This organization is not rated, Not rated",,"PO BOX 494, GRAPEVINE, TX, 76099-0494",,Mission not available,2015,Yes
https://www.charitynavigator.org/ein/270873158,LIGHT TO THE WORLD CHURCH,270873158,,,"Not currently rated, This organization is not rated, Not rated",,"PO BOX 462, BELLEVUE, WA, 98009-0462",,Mission not available,1964,Yes
https://www.charitynavigator.org/ein/270873452,Pop the Habit,270873452,,,"Not currently rated, This organization is not rated, Not rated",,"3352 GONI ROAD, CARSON CITY, NV, 89706-8006",,Mission not available,2009,Yes
https://www.charitynavigator.org/ein/270874147,Mutts on A Mission Inc.,270874147,,,"Not currently rated, This organization is not rated, Not rated",,"3125 N 159TH AVE, GOODYEAR, AZ, 85395-8188",,Mission not available,2011,Yes
https://www.charitynavigator.org/ein/270874213,Lucky Dog Rescue Inc.,270874213,,,"Not currently rated, This organization is not rated, Not rated",,"PO BOX 56512, HOUSTON, TX, 77256-0000",,Mission not available,2009,Yes
https://www.charitynavigator.org/ein/270874537,Arizona State University Womens Rugby Football Club,270874537,,,"Not currently rated, This organization is not rated, Not rated",,"400 E APACHE BLVD, TEMPE, AZ, 85287-0001",,Mission not available,2019,Yes
https://www.charitynavigator.org/ein/270874555,Cms Orchestra Booster,270874555,,,"Not currently rated, This organization is not rated, Not rated",,"4600 COLBY DR, FRISCO, TX, 75035-6013",,Mission not available,2015,Yes
https://www.charitynavigator.org/ein/270875775,Throw Away Kids Network,270875775,,,"Not currently rated, This organization is not rated, Not rated",,"PO BOX 1116, MABLETON, GA, 30126-1001",,Mission not available,2014,Yes
https://www.charitynavigator.org/ein/270874698,Hancock Elementary School Foundation,270874698,,,"Not currently rated, This organization is not rated, Not rated",,"3303 TAUSSIG ST, SAN DIEGO, CA, 92124-3501",,Mission not available,2020,Yes
