url,name,ein,score,star_rating,keywords,website,address,phone,organization_mission,IRS_ruling_year,contain_keywords
https://www.charitynavigator.org/ein/113332971,Hong Teh Temple Corporation,113332971,,,"Not rated, Not currently rated, This organization is not rated",,"4356 MURRAY ST, FLUSHING, NY, 11355-1329",,Mission not available,1996,Yes
https://www.charitynavigator.org/ein/113333294,Friends of Port Maria Inc.,113333294,,,"Not rated, Not currently rated, This organization is not rated",,"55 E 57TH ST, BROOKLYN, NY, 11203-3709",,Mission not available,2003,Yes
https://www.charitynavigator.org/ein/113333468,PTA NEW YORK CONGRESS,113333468,,,"Not rated, Not currently rated, This organization is not rated",,"1 JOHNSON PL, WOODMERE, NY, 11598-1312",,Mission not available,1954,Yes
https://www.charitynavigator.org/ein/113333475,Yeshiva Ketana of Bensonhurst Inc.,113333475,,,"Not rated, Not currently rated, This organization is not rated",,"953 CONEY ISLAND AVE, BROOKLYN, NY, 11230-1401",,Mission not available,1997,Yes
https://www.charitynavigator.org/ein/113333530,Zion Deliverance Temple Inc.,113333530,,,"Not rated, Not currently rated, This organization is not rated",,"248 MARION ST, BROOKLYN, NY, 11233-2304",,Mission not available,1998,Yes
https://www.charitynavigator.org/ein/113333751,Beacon Light Foundation Inc.,113333751,,,"Not rated, Not currently rated, This organization is not rated",,"C/O A BENNETT-2725 SOUNDVIEW AVE, PECONIC, NY, 11958-0000",,Mission not available,1996,Yes
https://www.charitynavigator.org/ein/113334312,Kehilah Kashrus Inc.,113334312,80%,3,,,"1138 E 14TH ST, BROOKLYN, NY, 11230-4814",,KASHRUS SUPERVISION,1997,No
https://www.charitynavigator.org/ein/113333895,Lerner Family Foundation Inc.,113333895,,,"Not rated, Not currently rated, This organization is not rated",,"3084 BEDFORD AVE, BROOKLYN, NY, 11210-3714",,Mission not available,1996,Yes
https://www.charitynavigator.org/ein/113333983,Ohr Haner,113333983,,,"Not rated, Not currently rated, This organization is not rated",,"1654 53RD ST, BROOKLYN, NY, 11204-1420",,Mission not available,1996,Yes
https://www.charitynavigator.org/ein/113334578,Ezekiel Prophecy Spiritual Baptist Church Inc.,113334578,,,"Not rated, Not currently rated, This organization is not rated",,"806 CROWN STREET, BROOKLYN, NY, 11213-5813",,Mission not available,1997,Yes
https://www.charitynavigator.org/ein/113334780,Beth Shalom Shabazi,113334780,,,"Not rated, Not currently rated, This organization is not rated",,"4419 12TH AVE, BROOKLYN, NY, 11219-2015",,Mission not available,1997,Yes
https://www.charitynavigator.org/ein/113334248,PTA NEW YORK CONGRESS,113334248,,,"Not rated, Not currently rated, This organization is not rated",,"740 EDGEWOOD DR, WESTBURY, NY, 11590-5409",,Mission not available,1954,Yes
https://www.charitynavigator.org/ein/113333846,GRACE INTERNATIONAL MINISTRIES,113333846,,,"Not rated, Not currently rated, This organization is not rated",,"2037 PITMAN AVE, BRONX, NY, 10466-1922",,Mission not available,1997,Yes
https://www.charitynavigator.org/ein/113334959,Hope Restoration Ministries World-Wide Inc.,113334959,53%,1,,,"10101 SPRINGFIELD BLVD, QUEENS VLG, NY, 11429-1621",,TO SERVE THE COMMUNITY BY REACHING OU TO THE POOR AND NEEDY,1998,No
https://www.charitynavigator.org/ein/113335036,Enrichment Center Inc.,113335036,79%,3,,,"750 HICKSVILLE RD, SEAFORD, NY, 11783-1328",516-520-6000,"THE ENRICHMENT CENTER, INC. IS A NOT-FOR-PROFIT WHOSE PRIMARY PURPOSE IS TO OFFER EDUCATIONAL PROGRAMS IN A SUPERVISED ENVIRONMENT THAT SUPPLEMENT THE EDUCATIONAL NE ... (More)",1998,No
https://www.charitynavigator.org/ein/113334875,Rescue Hook Ladder & Bucket Company No 1,113334875,,,"Not rated, Not currently rated, This organization is not rated",,"189 EARLE AVE, LYNBROOK, NY, 11563-2612",,Mission not available,2021,Yes
https://www.charitynavigator.org/ein/113334328,Cr Ministries Inc.,113334328,,,"Not rated, Not currently rated, This organization is not rated",,"179 N FRANKLIN ST, HEMPSTEAD, NY, 11550-1313",,Mission not available,1998,Yes
https://www.charitynavigator.org/ein/113335344,Yeshivat Ohel Torah,113335344,75%,3,,,"2600 OCEAN AVE, BROOKLYN, NY, 11229-4507",718-332-2600,To conduct a school for Hebrew religious education,1997,No
https://www.charitynavigator.org/ein/113335508,Linymetro Area Parents & Other Surv Ivors of Murdered Victims Outreac,113335508,,,"Not rated, Not currently rated, This organization is not rated",,"41 WESTWOOD DR, SHIRLEY, NY, 11967-3026",,Mission not available,2018,Yes
https://www.charitynavigator.org/ein/113335250,S Z & P R Zedakah Fund,113335250,,,"Not rated, Not currently rated, This organization is not rated",,"1244 49TH ST, BROOKLYN, NY, 11219-3011",,Mission not available,1996,Yes
https://www.charitynavigator.org/ein/113335514,REDEEMED OUTREACH MINISTRIES & PUBLICATIONS INTERNATIONAL INC,113335514,,,"Not rated, Not currently rated, This organization is not rated",,"229-19 MERRICK BLVD STE 376, LAURELTON, NY, 11413-2108",,Mission not available,2004,Yes
https://www.charitynavigator.org/ein/113335787,Kehillas Bais Tzvi of Cedarhurst Inc.,113335787,,,"Not rated, Not currently rated, This organization is not rated",,"391 OAKLAND AVE, CEDARHURST, NY, 11516-1319",,Mission not available,1997,Yes
https://www.charitynavigator.org/ein/113335807,One Way Church of New York,113335807,,,"Not rated, Not currently rated, This organization is not rated",,"211 55 45 DR, BAYSIDE, NY, 11361-3359",,Mission not available,1997,Yes
https://www.charitynavigator.org/ein/113335918,Little Flock House of Prayers Inc.,113335918,,,"Not rated, Not currently rated, This organization is not rated",,"2141 PACIFIC ST, BROOKLYN, NY, 11233-4011",,Mission not available,1997,Yes
https://www.charitynavigator.org/ein/113336158,Nami Huntington Incorporated,113336158,,,"Not rated, Not currently rated, This organization is not rated",,"32 BARNSLEY CRES, MOUNT SINAI, NY, 11766-2802",,Mission not available,2015,Yes
https://www.charitynavigator.org/ein/113336257,Beth Gavriel Bukharian Congregation,113336257,,,"Not rated, Not currently rated, This organization is not rated",,"6635 108TH ST, FOREST HILLS, NY, 11375-2244",,Mission not available,1998,Yes
https://www.charitynavigator.org/ein/113336273,Saul and Marion Kleinkramer Foundation,113336273,,,"Not rated, Not currently rated, This organization is not rated",,"1271 AVENUE OF THE AMERICAS 42ND F, NEW YORK, NY, 10020-1300",,Mission not available,1996,Yes
https://www.charitynavigator.org/ein/113336446,PTA NEW YORK CONGRESS,113336446,,,"Not rated, Not currently rated, This organization is not rated",,"189DUNTONAVE, EASTPATCHOGUE, NY, 11772-0000",,Mission not available,1954,Yes
https://www.charitynavigator.org/ein/113336541,Iglesia Cristiana Unida Inc.,113336541,,,"Not rated, Not currently rated, This organization is not rated",,"221 JERUSALEM AVE, HEMPSTEAD, NY, 11550-6434",,Mission not available,1998,Yes
https://www.charitynavigator.org/ein/113336600,Congregation Shalom Inc.,113336600,,,"Not rated, Not currently rated, This organization is not rated",,"261 LOCUST LN, EAST HILLS, NY, 11577-1412",,Mission not available,1997,Yes
https://www.charitynavigator.org/ein/113336917,Masjid Darul Islam Inc.,113336917,,,"Not rated, Not currently rated, This organization is not rated",,"4230 UNION ST APT 309, FLUSHING, NY, 11355-2517",,Mission not available,1998,Yes
https://www.charitynavigator.org/ein/113336788,Veterans Home Volunteer Alliance at Nys Veterans Home at St. Albans,113336788,,,"Not rated, Not currently rated, This organization is not rated",,"17850 LINDEN BLVD, JAMAICA, NY, 11434-1467",,Mission not available,2019,Yes
https://www.charitynavigator.org/ein/113336925,BETH SHALOM CENTER,113336925,,,"Not rated, Not currently rated, This organization is not rated",,"510 BRIGHTON BEACH AVENUE SUITE 157, BROOKLYN, NY, 11235-6404",,Mission not available,1964,Yes
https://www.charitynavigator.org/ein/113337077,Congregation Keren Mordechi,113337077,,,"Not rated, Not currently rated, This organization is not rated",,"287 DIVISION AVE APT 3D, BROOKLYN, NY, 11211-7326",,Mission not available,1996,Yes
https://www.charitynavigator.org/ein/113337247,Abundant Life Baptist Church of N Y City Inc.,113337247,,,"Not rated, Not currently rated, This organization is not rated",,"81 METROPOLITAN OVAL APT 4A, BRONX, NY, 10462-6421",,Mission not available,1997,Yes
https://www.charitynavigator.org/ein/113336915,GUILD OF ADMINISTRATIVE OFFICERS- SUFFOLK COUNTY COMMUNITY COLLEGE,113336915,,,"Not rated, Not currently rated, This organization is not rated",,"533 COLLEGE RD, SELDEN, NY, 11784-2851",,Mission not available,1997,Yes
https://www.charitynavigator.org/ein/113337302,Korean Hope Evangelical Church of Ny,113337302,,,"Not rated, Not currently rated, This organization is not rated",,"5859 208TH ST, OAKLAND GDNS, NY, 11364-1734",,Mission not available,1996,Yes
https://www.charitynavigator.org/ein/113337370,International Prayer Warriors Church,113337370,,,"Not rated, Not currently rated, This organization is not rated",,"4701 SNYDER AVE, BROOKLYN, NY, 11203-4223",,Mission not available,1998,Yes
https://www.charitynavigator.org/ein/113336929,Bethel New Life in Christ Ministry Inc.,113336929,,,"Not rated, Not currently rated, This organization is not rated",,"2085 NOSTRAND AVE, BROOKLYN, NY, 11210-2549",,Mission not available,2001,Yes
https://www.charitynavigator.org/ein/113337730,The Sidney and Loretta Teich Foundation Inc.,113337730,,,"Not rated, Not currently rated, This organization is not rated",,"7 COBBLESTONE CT, CENTERPORT, NY, 11721-1162",,Mission not available,2005,Yes
https://www.charitynavigator.org/ein/113337742,Williamsburg Keren Chassanim Inc.,113337742,,,"Not rated, Not currently rated, This organization is not rated",,"199 LEE AVE, BROOKLYN, NY, 11211-8919",,Mission not available,1996,Yes
https://www.charitynavigator.org/ein/113338212,Wmsbg-Kolel Damesek Eliezer Inc.,113338212,,,"Not rated, Not currently rated, This organization is not rated",,"45 MAIN ST STE 804, BROOKLYN, NY, 11201-1076",,Mission not available,1997,Yes
https://www.charitynavigator.org/ein/113338421,All Nations Disciple Church of New York,113338421,,,"Not rated, Not currently rated, This organization is not rated",,"14148 33RD AVE, FLUSHING, NY, 11354-3138",,Mission not available,1997,Yes
https://www.charitynavigator.org/ein/113337914,Temple of Mercy-Charity Corporation,113337914,,,"Not rated, Not currently rated, This organization is not rated",,"13523 37TH AVE, FLUSHING, NY, 11354-4119",,Mission not available,1997,Yes
https://www.charitynavigator.org/ein/113338459,NORTH BABYLON TEACHERS ORGANIZATION BENEFIT TR FUND,113338459,,,"Not rated, Not currently rated, This organization is not rated",,"5 JARDINE PL, NORTH BABYLON, NY, 11703-4203",,Mission not available,1998,Yes
https://www.charitynavigator.org/ein/113338471,Congregation Magen Avot,113338471,,,"Not rated, Not currently rated, This organization is not rated",,"1437 47TH ST, BROOKLYN, NY, 11219-2757",,Mission not available,1997,Yes
https://www.charitynavigator.org/ein/113338936,501 PROPERTIES LTD,113338936,,,"Not rated, Not currently rated, This organization is not rated",,"501 WILLIAM FLOYD PKWY, SHIRLEY, NY, 11967-3416",,Mission not available,1996,Yes
https://www.charitynavigator.org/ein/113338053,New Strides Inc.,113338053,85%,3,,http://www.mercyhaven.org,"859 CONNETQUOT AVE STE 10, ISLIP TERRACE, NY, 11752-1400",631-277-8300,"NEW STRIDES, INC. IS AN AFFILIATE OF MERCY HAVEN, INC. MERCY HAVENS MISSION IS TO ACKNOWLEDGE THE DIGNITY AND POTENTIAL OF PEOPLE WHO ARE HOMELESS, LIVING WITH MENTA ... (More)",1997,No
https://www.charitynavigator.org/ein/113338946,Human Care Services for Families & Children Inc.,113338946,96%,4,,http://www.hcsny.org,"1042 38TH ST, BROOKLYN, NY, 11219-1011",718-854-2747,TO PROVIDE COMMUNITY BASED SERVICES TO THE DEVELOPMENTALLY DISABLED.,1997,No
https://www.charitynavigator.org/ein/113339075,Old Field Farms Ltd.,113339075,,,"Not rated, Not currently rated, This organization is not rated",,"140 HARBOR RD, SAINT JAMES, NY, 11780-1109",,Mission not available,2003,Yes
https://www.charitynavigator.org/ein/113339324,Friends of Seeach Sode Inc.,113339324,73%,2,,,"C/O MARTIN KURANT 5 WASHINGTON AVE, LAKEWOOD, NJ, 08701-0000",917-653-9042,CHARITY TO HELP SPECIAL NEEDS CHILDREN,2005,No
https://www.charitynavigator.org/ein/113339557,MARINE CORPS LEAGUE,113339557,,,"Not rated, Not currently rated, This organization is not rated",,"PO BOX 7, LYNBROOK, NY, 11563-0007",,Mission not available,1946,Yes
https://www.charitynavigator.org/ein/113339498,MESSIAH KOREAN LUTHERAN CHURCH,113339498,,,"Not rated, Not currently rated, This organization is not rated",,"19665 45TH RD, FLUSHING, NY, 11358-3511",,Mission not available,1988,Yes
https://www.charitynavigator.org/ein/113339915,Pavers & Rd Builders Dist Aprntshp Skill Improvement & Safety Fund,113339915,65%,2,,,"17-20 WHITESTONE EXPRESSWAY, WHITESTONE, NY, 11357-3065",718-961-6961,"COLLECTIVELY BARGAINED MULTI-EMPLOYER APPRENTICESHIP, SKILL IMPROVEMENT & SAFETY FUND PROVIDES EDUCATION, INSTRUCTION, TRAINING & TESTING ON BEHALF OF EMPLOYEES OF C ... (More)",1999,No
https://www.charitynavigator.org/ein/113340483,New Horizon Gospel Ministries Inc.,113340483,,,"Not rated, Not currently rated, This organization is not rated",,"212 E 39TH ST, BROOKLYN, NY, 11203-2905",,Mission not available,1997,Yes
https://www.charitynavigator.org/ein/113340433,East Islip Student Athletes Booster Club Inc.,113340433,,,"Not rated, Not currently rated, This organization is not rated",,"PO BOX 398, EAST ISLIP, NY, 11730-0398",,Mission not available,1997,Yes
https://www.charitynavigator.org/ein/113340215,Petri School of Irish Dancing Foundation,113340215,,,"Not rated, Not currently rated, This organization is not rated",,"35 AVENUE D, HOLBROOK, NY, 11741-2336",,Mission not available,2001,Yes
https://www.charitynavigator.org/ein/113340908,Deliverance Tabernacle Church of Christ Inc.,113340908,,,"Not rated, Not currently rated, This organization is not rated",,"14401 SUTTER AVE, S OZONE PARK, NY, 11436-1832",,Mission not available,1997,Yes
https://www.charitynavigator.org/ein/113340753,Kefalos Society of America Inc.,113340753,33%,0,,,"2043 STEINWAY ST, ASTORIA, NY, 11105-1635",718-204-8491,"AID AND ASSISTANCE TO THOSE IN NEED PROVIDE INFORMATIVE, EDUCATIONAL AND CULTURAL EVENTS FOR SOCIETY AND COMMUNITY MEMBERS.",1998,No
https://www.charitynavigator.org/ein/113340959,INDEPENDENT ASSOCIATION OF ACCOUNTANTS OF BROOKLYN INC,113340959,,,"Not rated, Not currently rated, This organization is not rated",,"2751 CONEY ISLAND AVE, BROOKLYN, NY, 11235-5004",,Mission not available,2023,Yes
https://www.charitynavigator.org/ein/113340969,Jamaica Hospital Medical Center,113340969,,,"Not rated, Not currently rated, This organization is not rated",,"8900 VAN WYCK EXPY, JAMAICA, NY, 11418-2832",718-206-6291,TO PROVIDE UNDERSERVED COMMUNITIES SERVED BY JAMAICA HOSPITAL MEDICAL CENTER WITH ACCESS TO QUALITY AMBULATORY MEDICAL CARE.,1996,Yes
https://www.charitynavigator.org/ein/113341395,The George Walker Jr Community Coalition Inc.,113341395,,,"Not rated, Not currently rated, This organization is not rated",,"127 PENNSYLVANIA AVE, BROOKLYN, NY, 11207-2428",,Mission not available,1997,Yes
https://www.charitynavigator.org/ein/113341633,Williamsburg African Methodist Episcopal Zion Church,113341633,,,"Not rated, Not currently rated, This organization is not rated",,"40 HOWARD AVE, BROOKLYN, NY, 11221-4013",,Mission not available,1997,Yes
https://www.charitynavigator.org/ein/113341649,Mountain of Fire and Miracles Ministries,113341649,,,"Not rated, Not currently rated, This organization is not rated",,"180 BLAKE AVE, BROOKLYN, NY, 11212-5002",,Mission not available,1997,Yes
https://www.charitynavigator.org/ein/113341771,Long Island Ballet Theatre,113341771,,,"Not rated, Not currently rated, This organization is not rated",,"310 NEW YORK AVENUE, HUNTINGTON, NY, 11743-3392",,Mission not available,2002,Yes
https://www.charitynavigator.org/ein/113342008,Congregation Yaldei Kodesh Inc.,113342008,,,"Not rated, Not currently rated, This organization is not rated",,"4500 9TH AVE, BROOKLYN, NY, 11220-1607",,Mission not available,1999,Yes
https://www.charitynavigator.org/ein/113341663,Southampton Town Aquatics and Recreation Corporation,113341663,,,"Not rated, Not currently rated, This organization is not rated",,"PO BOX 939, SOUTHAMPTON, NY, 11969-0939",,Mission not available,1997,Yes
https://www.charitynavigator.org/ein/113341990,JESUS IS J U S T I C E MISSION,113341990,,,"Not rated, Not currently rated, This organization is not rated",,"PO BOX 940300, ROCKAWAY PARK, NY, 11694-0300",,Mission not available,1997,Yes
https://www.charitynavigator.org/ein/113342049,Cong Minchas Eluzer D Munkatch,113342049,,,"Not rated, Not currently rated, This organization is not rated",,"PO BOX 190892, BROOKLYN, NY, 11219-0892",,Mission not available,1996,Yes
https://www.charitynavigator.org/ein/113342182,East River North Housing Development Fund Company Inc.,113342182,79%,3,,,"430 E 118TH ST APT 1E, NEW YORK, NY, 10035-4327",212-427-8716,THE ORGANIZATION PROVIDES 98 SUBSIDIZED RESIDENTIAL HOUSING APARTMENT UNITS TO LOW INCOME FAMILIES UNDER FEDERAL HOUSING PROGRAMS.,2005,No
https://www.charitynavigator.org/ein/113342286,Carol M Baldwin Breast Cancer Research Fund Inc.,113342286,79%,3,,http://WWW.FINDACURE.ORG,"14 TECHNOLOGY DR STE 2, EAST SETAUKET, NY, 11733-3469",631-444-4300,"THE PURPOSE OF THE FUND IS TO SUPPORT NEW AND ESTABLISHED RESEARCHERS AT ACADEMIC INSTITUTIONS WHO ARE INVESTIGATING THE CAUSES, PREVENTION AND TREATMENT OF BREAST C ... (More)",1996,No
https://www.charitynavigator.org/ein/113342186,HOLY MOUNTAIN KOREAN LUTHERAN MISSION CONGREGATION,113342186,,,"Not rated, Not currently rated, This organization is not rated",,"7415 43RD AVE, ELMHURST, NY, 11373-1806",,Mission not available,1941,Yes
https://www.charitynavigator.org/ein/113342472,Gurwin Jewish-Fay J Lindner Residences Inc.,113342472,81%,3,,http://LINDNER.GURWIN.ORG,"50 HAUPPAUGE RD, COMMACK, NY, 11725-4403",631-715-8500,TO PROVIDE A SUPPORTIVE RESIDENTIAL ENVIRONMENT FOR THE ELDERLY.,1997,No
https://www.charitynavigator.org/ein/113342284,Nehemiah Christian Outreach Ministries,113342284,,,"Not rated, Not currently rated, This organization is not rated",,"4622 FLATLANDS AVE, BROOKLYN, NY, 11234-3117",,Mission not available,1997,Yes
https://www.charitynavigator.org/ein/113342461,Ethos Percussion Group Inc.,113342461,,,"Not rated, Not currently rated, This organization is not rated",,"SHRK CPAS 3000 MARCUS AVE 1W5, LAKE SUCCESS, NY, 11042-0000",,Mission not available,1996,Yes
https://www.charitynavigator.org/ein/113342670,LITTLE LIGHTS CHRISTIAN PRESCHOOL,113342670,,,"Not rated, Not currently rated, This organization is not rated",,"189 BURR RD, E NORTHPORT, NY, 11731-5406",,Mission not available,1988,Yes
https://www.charitynavigator.org/ein/113342747,Jewish Union to Disseminate Education & Assistance,113342747,,,"Not rated, Not currently rated, This organization is not rated",,"2986 BEDFORD AVE, BROOKLYN, NY, 11210-2832",,Mission not available,1996,Yes
https://www.charitynavigator.org/ein/113342803,La Mission D Evangelisation Et De Deliverance,113342803,,,"Not rated, Not currently rated, This organization is not rated",,"3325 SNYDER AVE, BROOKLYN, NY, 11203-3872",,Mission not available,1997,Yes
https://www.charitynavigator.org/ein/113342876,Church of God of the Assemblies of God of Portuguese Language Inc.,113342876,,,"Not rated, Not currently rated, This organization is not rated",,"3510 CRESCENT ST, ASTORIA, NY, 11106-3920",,Mission not available,1997,Yes
https://www.charitynavigator.org/ein/113342896,New York Metropolitan Martial Arts Foundation Inc.,113342896,,,"Not rated, Not currently rated, This organization is not rated",,"226 BEACH 132ND ST, BELLE HARBOR, NY, 11694-1410",,Mission not available,1997,Yes
https://www.charitynavigator.org/ein/113343057,Nazareth Holiness Full Gospel Church of God Inc.,113343057,,,"Not rated, Not currently rated, This organization is not rated",,"16208 SOUTH RD, JAMAICA, NY, 11433-1608",,Mission not available,2000,Yes
https://www.charitynavigator.org/ein/113343103,Cong Bais Rabbenu,113343103,,,"Not rated, Not currently rated, This organization is not rated",,"BOX 1122 OLD CHELSEA STA, NEW YORK, NY, 10011-0000",,Mission not available,1996,Yes
https://www.charitynavigator.org/ein/113343150,American Friends of Hadrat Melech Inc.,113343150,,,"Not rated, Not currently rated, This organization is not rated",,"CO E RUDY 711 AVENUE R, BROOKLYN, NY, 11223-0000",,Mission not available,1997,Yes
https://www.charitynavigator.org/ein/113343543,Riverhead Foundation for Marine Research and Preservation,113343543,88%,3,,http://NYMARINERESCUE.ORG,"467 E MAIN ST, RIVERHEAD, NY, 11901-2556",631-369-9840,MARINE MAMMAL STRANDING & EDUCATION,1996,No
https://www.charitynavigator.org/ein/113343740,Thomas and Jeanne Elmezzi Private Foundation,113343740,,,"Not rated, Not currently rated, This organization is not rated",,"31-10 23RD STREET, ASTORIA, NY, 11106-4585",,Mission not available,1997,Yes
https://www.charitynavigator.org/ein/113343580,Hope for the Children Foundation Inc.,113343580,,,"Not rated, Not currently rated, This organization is not rated",http://WWW.HOPEFORTHECHILDREN.ORG,"9021 SPRINGFIELD BLVD, QUEENS VLG, NY, 11428-1352",,"The mission statement of the organization is ""Let us go about our lives in such a way so as to give Hope for the children"".THE HOPE FOR THE CHILDREN FOUNDATION INC. ... (More)",2012,Yes
https://www.charitynavigator.org/ein/113343779,Ministro Puerta De Paz Inc.,113343779,,,"Not rated, Not currently rated, This organization is not rated",,"69 MYRTLE ST, CRANFORD, NJ, 07016-3456",,Mission not available,2006,Yes
https://www.charitynavigator.org/ein/113343889,Bethel Assembly Inc.,113343889,,,"Not rated, Not currently rated, This organization is not rated",,"16229 76TH RD, FLUSHING, NY, 11366-1039",,Mission not available,1998,Yes
https://www.charitynavigator.org/ein/113343941,Fort Greene Strategic Neighborhood Action Partnership,113343941,50%,1,,,"324 MYRTLE AVE, BROOKLYN, NY, 11205-3280",718-694-6957,"PROVIDES REFERRAL, SOCIAL SERVICES AND INSURANCE REGISTRATION TO THE SURROUNDING COMMUNITY.",1996,No
https://www.charitynavigator.org/ein/113343989,South American and West Indian Baptist Church Inc.,113343989,,,"Not rated, Not currently rated, This organization is not rated",,"26 ESSEX PL, VALLEY STREAM, NY, 11580-2304",,Mission not available,1998,Yes
https://www.charitynavigator.org/ein/113343213,Roy and Sherry Decarava Foundation,113343213,,,"Not rated, Not currently rated, This organization is not rated",,"201 EASTERN PKWY APT 5G, BROOKLYN, NY, 11238-6158",,Mission not available,1999,Yes
https://www.charitynavigator.org/ein/113344197,LINKS INC,113344197,,,"Not rated, Not currently rated, This organization is not rated",,"PO BOX 110295, CAMBRIA HTS, NY, 11411-0295",,TO PROVIDE CULTURAL CIVIC EDUCATION PROGRAM,1961,Yes
https://www.charitynavigator.org/ein/113344204,Christian Recovery Outreach Ministries Inc.,113344204,,,"Not rated, Not currently rated, This organization is not rated",,"PO BOX 370511, BROOKLYN, NY, 11237-0511",,Mission not available,2001,Yes
https://www.charitynavigator.org/ein/113344328,Vaad Hachinuch Olumi,113344328,,,"Not rated, Not currently rated, This organization is not rated",,"1472 52ND ST APT 2B, BROOKLYN, NY, 11219-3927",,Mission not available,1998,Yes
https://www.charitynavigator.org/ein/113344363,Talmud Torah Tashbar,113344363,,,"Not rated, Not currently rated, This organization is not rated",,"327 HEWES ST, BROOKLYN, NY, 11211-7402",,Mission not available,1996,Yes
https://www.charitynavigator.org/ein/113344389,Make the Road New York,113344389,97%,4,,http://www.maketheroad.org/,"301 Grove Street, Brooklyn, NY, 11237",718-418-7690,"Make the Road New York promotes economic justice, equity and opportunity for all New Yorkers through community and electoral organizing, strategic policy advocacy, l ... (More)",1998,No
https://www.charitynavigator.org/ein/113344071,Panthracian Union of America Orpheus Inc.,113344071,,,"Not rated, Not currently rated, This organization is not rated",,"PO BOX 3280, ASTORIA, NY, 11103-0280",,Mission not available,2014,Yes
https://www.charitynavigator.org/ein/113344382,WHITESTONE BOOSTERS CIVIC ASSOCIATION INC,113344382,,,"Not rated, Not currently rated, This organization is not rated",,"PO BOX 570067, WHITESTONE, NY, 11357-0067",718-767-7232,SEE SCHEDULE O,1997,Yes
https://www.charitynavigator.org/ein/113344451,J&H Gross Family Foundation,113344451,,,"Not rated, Not currently rated, This organization is not rated",,"1224 EAST 24TH STREET, BROOKLYN, NY, 11210-0000",,Mission not available,1998,Yes
https://www.charitynavigator.org/ein/113344408,Cong Zichron David,113344408,,,"Not rated, Not currently rated, This organization is not rated",,"PO BOX 320, BROOKLYN, NY, 11211-0320",,Mission not available,1996,Yes
https://www.charitynavigator.org/ein/113344440,Iglesia Cristiana Pentecostal Las Maravillas Del Exodo,113344440,,,"Not rated, Not currently rated, This organization is not rated",,"2242 BRAGG ST APT 3F, BROOKLYN, NY, 11229-5418",,Mission not available,2000,Yes
https://www.charitynavigator.org/ein/113344884,Eglise De Bethesda,113344884,,,"Not rated, Not currently rated, This organization is not rated",,"18225 JAMAICA AVE, HOLLIS, NY, 11423-2329",,Mission not available,2002,Yes
https://www.charitynavigator.org/ein/113345348,Greater Soy Pentecostal Outreach Ministries Inc.,113345348,,,"Not rated, Not currently rated, This organization is not rated",,"919 MYRTLE AVE APT 4M, BROOKLYN, NY, 11206-6525",,Mission not available,1997,Yes
