url,name,ein,score,star_rating,keywords,website,address,phone,organization_mission,IRS_ruling_year,contain_keywords
https://www.charitynavigator.org/ein/300249426,Senior Rides and More (Volunteer Interfaith Caregivers SW),300249426,91%,4,,http://www.SeniorRidesandMore.org,"9600 S GESSNER RD, Houston, TX, 77071-1002",713-772-8181,"Serve the frail, elderly and health impaired.",2004,No
https://www.charitynavigator.org/ein/300249703,"The Serenbe Institute for Art, Culture & the Environment",300249703,95%,4,,http://www.southfultoninstitute.org/,"10455 Atlanta Newnan Road, Chattahoochee Hills, GA, 30268",770-463-1110,"The South Fulton Institute is a regional catalyst for the advancement of the arts, culture & environment that enriches lives and communities.",2004,No
https://www.charitynavigator.org/ein/300250111,Outreach International Foundation Inc.,300250111,,,"This organization is not rated, Not currently rated, Not rated",,"11853 HARBOUR TOWN PKWY, FAYETTEVILLE, GA, 30215-8045",,Mission not available,2018,Yes
https://www.charitynavigator.org/ein/300250353,WOMEN IN AVIATION,300250353,,,"This organization is not rated, Not currently rated, Not rated",,"37428 JASON WAY, FREMONT, CA, 94536-3722",,Mission not available,2003,Yes
https://www.charitynavigator.org/ein/300250537,Center for Innovative Social Change Inccisc,300250537,,,"This organization is not rated, Not currently rated, Not rated",,"113 QUEEN ALMA DR, JACKSON, MS, 39209-2304",,Mission not available,2004,Yes
https://www.charitynavigator.org/ein/300250767,Palermo Lakes Inc.,300250767,74%,2,,http://WWW.EHDOC.ORG,"5311 NW 7TH STREET, MIAMI, FL, 33126-3384",954-835-9200,"OPERATION OF LOW INCOME HOUSING FOR THE ELDERLY AND HANDICAPPED, REGULATED AND ASSISTED BY THE DEPARTMENT OF HOUSING AND URBAN DEVELOPMENT (HUD).",2004,No
https://www.charitynavigator.org/ein/300251432,PTA TEXAS CONGRESS,300251432,,,"This organization is not rated, Not currently rated, Not rated",,"100 GROSENBACHER RD N, SAN ANTONIO, TX, 78253-4716",,Mission not available,1967,Yes
https://www.charitynavigator.org/ein/300249707,Khmer Buddhist Relief,300249707,,,"This organization is not rated, Not currently rated, Not rated",,"2630 N GRAND AVE, SANTA ANA, CA, 92705-8706",,Mission not available,2004,Yes
https://www.charitynavigator.org/ein/300251682,Pioneer Housing Project I,300251682,,,"This organization is not rated, Not currently rated, Not rated",,"4575 GALLEY RD STE 100D, COLORADO SPGS, CO, 80915-2747",,Mission not available,2004,Yes
https://www.charitynavigator.org/ein/300251811,Immigrant American Foundation,300251811,,,"Confirmed Revocation, This organization is not rated, Not currently rated, Not rated, Review Before Proceeding",,"802 ROBINSON ST, LOS ANGELES, CA, 90026-2704",,Mission not available,2004,Yes
https://www.charitynavigator.org/ein/300252186,Lasting Impact Mission Inc.,300252186,,,"This organization is not rated, Not currently rated, Not rated",,"5740 EVERS ROAD, SAN ANTONIO, TX, 78238-0000",,Mission not available,2005,Yes
https://www.charitynavigator.org/ein/300252279,DRAYTON BAPTIST CHURCH,300252279,,,"This organization is not rated, Not currently rated, Not rated",,"2505 RIVER RD, VIENNA, GA, 31092-8518",,Mission not available,1964,Yes
https://www.charitynavigator.org/ein/300251837,Nehemiah House Inc. of Indiana,300251837,,,"This organization is not rated, Not currently rated, Not rated",,"928 CLUB PKWY, NASHVILLE, TN, 37221-1935",,Mission not available,2007,Yes
https://www.charitynavigator.org/ein/300253481,WORD OF FAITH CHRISTIAN CENTER CHURCH INC OF GEORGIA,300253481,,,"This organization is not rated, Not currently rated, Not rated",,"3059 S COBB DR SE, SMYRNA, GA, 30080-7809",,Mission not available,1998,Yes
https://www.charitynavigator.org/ein/300252373,Ikebana International Honolulu Chapter 56,300252373,,,"This organization is not rated, Not currently rated, Not rated",,"PO BOX 61306, HONOLULU, HI, 96839-1306",,Mission not available,2011,Yes
https://www.charitynavigator.org/ein/300253797,Newport Harbor High School Girls Basketball Booster Club,300253797,,,"This organization is not rated, Not currently rated, Not rated, Review Before Proceeding",,"600 IRVINE AVE, NEWPORT BEACH, CA, 92663-5412",,Mission not available,2004,Yes
https://www.charitynavigator.org/ein/300252052,BEAUTIFUL VIEW GARDEN CLUB,300252052,,,"This organization is not rated, Not currently rated, Not rated",,"PO BOX 171, BUENA VISTA, GA, 31803-0171",,Mission not available,2004,Yes
https://www.charitynavigator.org/ein/300254320,KIONONIA DYNAMICS INC,300254320,,,"This organization is not rated, Not currently rated, Not rated",,"2979 CENTERWOOD DR, JAX, FL, 32218-9208",,Mission not available,2024,Yes
https://www.charitynavigator.org/ein/300254378,Faith Walkers United Corporation,300254378,,,"This organization is not rated, Not currently rated, Not rated",,"RR 3 BOX 30, OKARCHE, OK, 73762-9516",,Mission not available,2005,Yes
https://www.charitynavigator.org/ein/300254314,New Lease on Life Transitional Shelter,300254314,,,"This organization is not rated, Not currently rated, Not rated",,"4227 S BUDLONG AVE, LOS ANGELES, CA, 90037-2316",,Mission not available,2005,Yes
https://www.charitynavigator.org/ein/300254429,NORTHEAST COBB BUSINESS ASSOCIATION INC,300254429,,,"This organization is not rated, Not currently rated, Not rated",,"3595 CANTON RD, MARIETTA, GA, 30066-2658",,Mission not available,2014,Yes
https://www.charitynavigator.org/ein/300254400,Lakeview Ministerial Outreach,300254400,,,"This organization is not rated, Not currently rated, Not rated",,"270 BURWOOD DR, MEMPHIS, TN, 38109-6755",,Mission not available,2004,Yes
https://www.charitynavigator.org/ein/300254526,The Well of the High Desert,300254526,,,"This organization is not rated, Not currently rated, Not rated",,"PO BOX 413, VICTORVILLE, CA, 92393-0413",,Mission not available,2004,Yes
https://www.charitynavigator.org/ein/300254488,Adams Hillcrest Cemetery Association,300254488,,,"This organization is not rated, Not currently rated, Not rated",,"PO BOX 186, BONNE TERRE, MO, 63628-0186",,Mission not available,2005,Yes
https://www.charitynavigator.org/ein/300254995,Arkansas Hunger Relief Alliance Inc.,300254995,96%,4,,http://ARHUNGERALLIANCE.ORG,"1400 W MARKHAM ST STE 304, LITTLE ROCK, AR, 72201-1844",501-399-9999,THE ALLIANCE COLLABORATES AS A STATEWIDE VOICE ADVANCING EQUITABLE SOLUTIONS TO HUNGER.,2004,No
https://www.charitynavigator.org/ein/300255022,New Community Church of Destiny Inc.,300255022,,,"This organization is not rated, Not currently rated, Not rated",,"631 W 10TH ST, LAKELAND, FL, 33805-4334",,Mission not available,2004,Yes
https://www.charitynavigator.org/ein/300254528,Tualatin Valley Creates,300254528,81%,3,,http://www.tvcreates.org,"12470 SW 1ST ST STE 203, BEAVERTON, OR, 97005-0541",503-567-1713,"Tualatin Valley Creates drives the development of inclusive, resilient, creative communities using arts, culture, heritage and humanities. TVC offers professional de ... (More)",2005,No
https://www.charitynavigator.org/ein/300254988,Marler Road Church of Christ Inc.,300254988,,,"This organization is not rated, Not currently rated, Not rated",,"PO BOX 640548, PIKE ROAD, AL, 36064-0548",,Mission not available,2006,Yes
https://www.charitynavigator.org/ein/300255276,The Association of Israels Decorative Arts,300255276,97%,4,,http://WWW.AIDAARTS.ORG,"2201 NW 30TH PLACE SUITE A, POMPANO BEACH, FL, 33069-1026",954-969-8786,"TO FOSTER THE DEVELOPMENT OF CONTEMPORARY DECORATIVE ARTISTS FROM ISRAEL BY CONNECTING THEM TO INTERNATIONAL GALLERIES, INSTITUTIONS, AND COLLECTORS.",2004,No
https://www.charitynavigator.org/ein/300255277,Scripps Ranch Football Booster Club Inc.,300255277,,,"This organization is not rated, Not currently rated, Not rated",,"10410 FALCON WAY, SAN DIEGO, CA, 92131-1126",,Mission not available,2018,Yes
https://www.charitynavigator.org/ein/300255520,Midwest Behavioral Healthcare Management Inc.,300255520,,,"This organization is not rated, Not currently rated, Not rated",,"1800 COMMUNITY, CLINTON, MO, 64735-8804",,Mission not available,2005,Yes
https://www.charitynavigator.org/ein/300255495,LIVING OAKS COMMUNITY CHURCH,300255495,,,"This organization is not rated, Not currently rated, Not rated",,"1534 N MOORPARK RD, THOUSAND OAKS, CA, 91360-5129",,Mission not available,1969,Yes
https://www.charitynavigator.org/ein/300255508,Mount Up Ministries of Appling Inc.,300255508,,,"This organization is not rated, Not currently rated, Not rated",,"PO BOX 6887, AUGUSTA, GA, 30916-6887",,Mission not available,2005,Yes
https://www.charitynavigator.org/ein/300255522,Pathways Psychiatric Hospital Inc.,300255522,82%,3,,http://www.royal-oaks-hospital.org,"1800 COMMUNITY, CLINTON, MO, 64735-8804",660-647-7218,"TO PROVIDE BEHAVIORAL, PSYCHIATRY,AND CLINICAL SERVICES TO THE GENERAL PUBLIC.",2005,No
https://www.charitynavigator.org/ein/300256097,Tartaglino Richards Family Foundation,300256097,,,"This organization is not rated, Not currently rated, Not rated",,"2525 KNIGHT ST STE 450, DALLAS, TX, 75219-3980",,Mission not available,2004,Yes
https://www.charitynavigator.org/ein/300256431,CITY CLERK AND MUNICIPAL FINANCE OFFICERS OF KANSAS,300256431,,,"This organization is not rated, Not currently rated, Not rated",,"128 N 1ST ST, OSBORNE, KS, 67473-2002",,Mission not available,2005,Yes
https://www.charitynavigator.org/ein/300257406,Iglesia De Dios Manantial En El Desierto,300257406,,,"This organization is not rated, Not currently rated, Not rated",,"PO BOX 1571, SANTA ANA, CA, 92702-1571",,Mission not available,2004,Yes
https://www.charitynavigator.org/ein/300257417,Laurence S Weiss and Edith G Weiss Foundation Inc.,300257417,,,"This organization is not rated, Not currently rated, Not rated",,"2431 SW 28TH AVE, FT LAUDERDALE, FL, 33312-4554",,Mission not available,2004,Yes
https://www.charitynavigator.org/ein/300257535,Pear Grove Inc.,300257535,94%,4,,,"2211 NORFOLK ST STE 614, HOUSTON, TX, 77098-4044",713-526-9470,PROVIDES HOUSING TO DISABLED PERSONS UNDER SECTION 811 OF THE NATIONAL HOUSING ACT UNDER AGREEMENT WITH THE DEPARTMENT OF HUD.,2004,No
https://www.charitynavigator.org/ein/300257638,Freedom Worship Center Milan,300257638,,,"This organization is not rated, Not currently rated, Not rated",,"7614 HIGHWAY 104 W, CEDAR GROVE, TN, 38321-7040",,Mission not available,2005,Yes
https://www.charitynavigator.org/ein/300256334,W H Adamson High School Alumni Association,300256334,,,"This organization is not rated, Not currently rated, Not rated",,"PO BOX 4753, DALLAS, TX, 75208-0753",,Mission not available,2004,Yes
https://www.charitynavigator.org/ein/300258329,Mary Mother of the Church Foundation,300258329,,,"This organization is not rated, Not currently rated, Not rated",,"848 DRAKES DREAM DR, GRAVOIS MILLS, MO, 65037-7859",,Mission not available,2005,Yes
https://www.charitynavigator.org/ein/300258491,Puente A La Salud Comunitaria,300258491,90%,4,,http://www.puentemexico.org,"1131-A E 6TH ST, AUSTIN, TX, 78702-0000",512-479-8774,"Puente promotes the cultivation and consumption of amaranth, combined with other traditional and strategic crops, to encourage the diversification of local agricultu ... (More)",2005,No
https://www.charitynavigator.org/ein/300258546,New Beginning Church of Our Lord Jesus Christ,300258546,,,"This organization is not rated, Not currently rated, Not rated",,"12634 STONERIDGE DR, FLORISSANT, MO, 63033-4619",,Mission not available,2006,Yes
https://www.charitynavigator.org/ein/300256823,The Ark Foundation,300256823,,,"This organization is not rated, Not currently rated, Not rated",,"1026 18TH ST, MIAMI BEACH, FL, 33139-2410",,Mission not available,2004,Yes
https://www.charitynavigator.org/ein/300258743,CHRISTIAN METHODIST EPISCOPAL CHURCH,300258743,,,"This organization is not rated, Not currently rated, Not rated",,"2175 JOHN R LYNCH STREET, JACKSON, MS, 39209-7432",,Mission not available,1980,Yes
https://www.charitynavigator.org/ein/300259067,Firefighters Charity Fund,300259067,,,"This organization is not rated, Not currently rated, Not rated",,"1109 S 50TH ST, TACOMA, WA, 98408-3613",,Mission not available,2004,Yes
https://www.charitynavigator.org/ein/300258041,Dfw Hmong Alliance Church of the Christian & Missionary Alliance,300258041,,,"This organization is not rated, Not currently rated, Not rated",,"6007 W PLEASANT RIDGE RD, ARLINGTON, TX, 76016-4408",,Mission not available,2004,Yes
https://www.charitynavigator.org/ein/300259119,Promise Connection Church,300259119,,,"This organization is not rated, Not currently rated, Not rated",,"6125 W SAM HOUSTON PKWY N STE 505, HOUSTON, TX, 77041-5130",,Mission not available,2004,Yes
https://www.charitynavigator.org/ein/300259443,Triumph Ministries International Network,300259443,,,"This organization is not rated, Not currently rated, Not rated",,"1605 SHAMROCK LN, DEER PARK, TX, 77536-3943",,Mission not available,2005,Yes
https://www.charitynavigator.org/ein/300259599,Centerstage Theatre Company,300259599,71%,2,,http://WWW.CENTERSTAGETHEATRECOMPANY.ORG,"901 FRONT ST, LOUISVILLE, CO, 80027-1838",303-746-5289,"THE CENTERSTAGE THEATRE COMPANY PROVIDES EDUCATIONAL AND ENRICHING THEATER EXPERIENCES FOR YOUTH AND ADULTS IN THE COMMUNITY WHILE OFFERING HIGH QUALITY, REASONABLY ... (More)",2004,No
https://www.charitynavigator.org/ein/300259776,Wharf Road Manor Homeowners Association Inc.,300259776,57%,1,,,"1100 WATER ST STE 1A, SANTA CRUZ, CA, 95062-1546",831-426-8013,TO PROVIDE AFFORADABLE HOUSING FOR LOW TO MODERATE INCOME HOUSEHOLDS,2005,No
https://www.charitynavigator.org/ein/300259101,Automata Arts,300259101,76%,3,,http://www.automata-la.org,"504 CHUNG KING CT, LOS ANGELES, CA, 90012-1709",213-503-2425,Presented various public performances using puppets and other media,2004,No
https://www.charitynavigator.org/ein/300260008,Somali Bantu Community of San Diego,300260008,,,"This organization is not rated, Not currently rated, Not rated",http://SBANTUCOFSD.COM,"4389 EL CAJON BLVD, SAN DIEGO, CA, 92105-1226",,"TO FACILITATE THE RESETTLEMENT OF THE SOMALI BANTU COMMUNITY IN AMERICA. PROGRAMS FOR EDUCATION, CULTURE & ECONOMIC OPPORTUNITY TO PROMOTE SELF-SUFFICIENCY IN SD",2005,Yes
https://www.charitynavigator.org/ein/300259783,UNITED DAUGHTERS OF THE CONFEDERACY,300259783,,,"This organization is not rated, Not currently rated, Not rated",,"772 NANDINA WAY, WAXAHACHIE, TX, 75165-0000",,Mission not available,1967,Yes
https://www.charitynavigator.org/ein/300260371,For the Love of Animals Dog and Cat Rescue,300260371,,,"This organization is not rated, Not currently rated, Not rated",,"2152 GRAYDON AVE, MONROVIA, CA, 91016-4739",,Mission not available,2013,Yes
https://www.charitynavigator.org/ein/300260999,Plano Metropolitan Ballet Inc.,300260999,,,"This organization is not rated, Not currently rated, Not rated",,"3131 CUSTER RD STE 195, PLANO, TX, 75075-4423",,Mission not available,2004,Yes
https://www.charitynavigator.org/ein/300260363,New Leaf Missionary Baptist Church,300260363,,,"This organization is not rated, Not currently rated, Not rated",,"PO BOX 41458, DALLAS, TX, 75241-0458",,Mission not available,2005,Yes
https://www.charitynavigator.org/ein/300261283,Hatch,300261283,77%,3,,http://HATCHEXPERIENCE.ORG,"PO BOX 6340, BOZEMAN, MT, 59771-6340",928-203-6484,"Hatch is a global network of pivotal thought leaders whose collaborations result in innovations across a broad spectrum of disciplines and industries, addressing glo ... (More)",2005,No
https://www.charitynavigator.org/ein/300261277,Hawaii Book & Music Festival,300261277,,,"This organization is not rated, Not currently rated, Not rated",,"47-231 KAMAKOI RD, KANEOHE, HI, 96744-5057",,Mission not available,2004,Yes
https://www.charitynavigator.org/ein/300261002,Love Delivers Inc.,300261002,,,"This organization is not rated, Not currently rated, Not rated",,"PO BOX 70973, RICHMOND, CA, 94807-0973",,Mission not available,2005,Yes
https://www.charitynavigator.org/ein/300261284,Bartow Collaborative Inc.,300261284,,,"This organization is not rated, Not currently rated, Not rated",,"475 E MAIN ST, CARTERSVILLE, GA, 30121-3353",,Mission not available,2005,Yes
https://www.charitynavigator.org/ein/300261436,College Orchestra Directors Association,300261436,,,"This organization is not rated, Not currently rated, Not rated",,"1018 S WALNUT ST, SHERMAN, TX, 75090-8546",,Mission not available,2004,Yes
https://www.charitynavigator.org/ein/300261311,Hospice Gift of Love,300261311,,,"This organization is not rated, Not currently rated, Not rated",,"306 E RANDOL MILL RD STE 100, ARLINGTON, TX, 76011-5841",,Mission not available,2014,Yes
https://www.charitynavigator.org/ein/300261644,Central Utah Recreation & Park Association,300261644,,,"This organization is not rated, Not currently rated, Not rated",,"125 S MAIN ST, VINEYARD, UT, 84059-6556",,Mission not available,2014,Yes
https://www.charitynavigator.org/ein/300261776,Iglesia De Dios Fe Y Verdad,300261776,,,"This organization is not rated, Not currently rated, Not rated",,"1607 E BIRCH ST, DEMING, NM, 88030-7028",,Mission not available,2004,Yes
https://www.charitynavigator.org/ein/300261779,One Way Ministries an Agape Church of God,300261779,,,"This organization is not rated, Not currently rated, Not rated",,"962 MISSOURI ST, SAN DIEGO, CA, 92109-2512",,Mission not available,2005,Yes
https://www.charitynavigator.org/ein/300261916,Spectrum Elemetary Ptso,300261916,,,"This organization is not rated, Not currently rated, Not rated",,"2846 S SPECTRUM WAY, GILBERT, AZ, 85295-6176",,Mission not available,2005,Yes
https://www.charitynavigator.org/ein/300261648,A Matter of Heart Ministries Inc.,300261648,,,"This organization is not rated, Not currently rated, Not rated",,"10860 NW 18TH CT, PLANTATION, FL, 33322-6477",,Mission not available,2005,Yes
https://www.charitynavigator.org/ein/300261558,His Cause Church International Inc.,300261558,,,"This organization is not rated, Not currently rated, Not rated",,"2940 NW 210TH TER, MIAMI, FL, 33056-1453",,Mission not available,2005,Yes
https://www.charitynavigator.org/ein/300262003,IMPACT MINISTRIES NON- DENOMINATIONAL CHURCH INC,300262003,,,"This organization is not rated, Not currently rated, Not rated",,"2066 7TH AVE S, ST PETERSBURG, FL, 33712-2202",,Mission not available,2005,Yes
https://www.charitynavigator.org/ein/300262389,LAWRENCE PLACE HOA INC,300262389,,,"This organization is not rated, Not currently rated, Not rated",,"4001 HANS ST, PEARLAND, TX, 77584-1805",,Mission not available,2011,Yes
https://www.charitynavigator.org/ein/300261996,Iglesia Biblica Bautista Filadelfia,300261996,,,"This organization is not rated, Not currently rated, Not rated",,"1956 S TOWNE AVE, POMONA, CA, 91766-5701",,Mission not available,2005,Yes
https://www.charitynavigator.org/ein/300262488,Mission Evangelique Du Christianisme Inc.,300262488,,,"This organization is not rated, Not currently rated, Not rated",,"535 NW 54TH ST, MIAMI, FL, 33127-1923",,Mission not available,2004,Yes
https://www.charitynavigator.org/ein/300262478,Abundant Praise Inc.,300262478,,,"This organization is not rated, Not currently rated, Not rated",,"25362 STATE HIGHWAY 34, MARBLE HILL, MO, 63764-5905",,Mission not available,2004,Yes
https://www.charitynavigator.org/ein/300262533,Riverside County Fire Explorer Advisory Committee,300262533,,,"This organization is not rated, Not currently rated, Not rated, Review Before Proceeding",,"16902 BUNDY AVE, RIVERSIDE, CA, 92518-1507",,Mission not available,2005,Yes
https://www.charitynavigator.org/ein/300262481,Kansas City Actors Theatre Inc.,300262481,81%,3,,http://KCACTORS.ORG,"PO BOX 414260, KANSAS CITY, MO, 64141-4260",816-361-5228,PRODUCE AND PROMOTE LIVE THEATRE LED BY PRACTICING ARTISTS FROM GREATER KANSAS CITY.,2004,No
https://www.charitynavigator.org/ein/300262528,Spiritual Warfare Church & Training Institute Central,300262528,,,"This organization is not rated, Not currently rated, Not rated",,"PO BOX 450606, FT LAUDERDALE, FL, 33345-0606",,Mission not available,2005,Yes
https://www.charitynavigator.org/ein/300263187,Z Krewe Inc.,300263187,,,"This organization is not rated, Not currently rated, Not rated",http://www.zkrewe.net,"PO BOX 58134, NASSAU BAY, TX, 77258-8134",281-798-9207,"Z Krewe, Inc. is dedicated to promoting and supporting the City of Galveston, and the surrounding area's Mardi Gras festivals and local charities.",2018,Yes
https://www.charitynavigator.org/ein/300263500,DAWAT-E-HADIYAH AMERICA,300263500,,,"This organization is not rated, Not currently rated, Not rated",,"5177 DOUGLAS FIR RD, CALABASAS, CA, 91302-1440",,Mission not available,1992,Yes
https://www.charitynavigator.org/ein/300262844,Surf City Synagogue,300262844,,,"This organization is not rated, Not currently rated, Not rated",,"9121 ATLANTA AVE STE 121, HUNTINGTN BCH, CA, 92646-6309",,Mission not available,2004,Yes
https://www.charitynavigator.org/ein/300263514,Zimbabwe Aids Treatment Assistance Project,300263514,,,"This organization is not rated, Not currently rated, Not rated",,"9763 E CRESTLINE CIR, GREENWOOD VLG, CO, 80111-3636",,Mission not available,2004,Yes
https://www.charitynavigator.org/ein/300263689,Jasper Area Ministerial Emergency Service Inc.,300263689,,,"This organization is not rated, Not currently rated, Not rated",,"1604 4TH AVE S, JASPER, AL, 35501-4630",,Mission not available,2004,Yes
https://www.charitynavigator.org/ein/300263811,Total Man Ministries,300263811,,,"This organization is not rated, Not currently rated, Not rated",,"PO BOX 5728, COLUMBUS, GA, 31906-0728",,Mission not available,2011,Yes
https://www.charitynavigator.org/ein/300263904,California Alpine Club Foundation,300263904,,,"This organization is not rated, Not currently rated, Not rated, Review Before Proceeding",,"PO BOX 2180, MILL VALLEY, CA, 94942-2180",,Mission not available,2004,Yes
https://www.charitynavigator.org/ein/300264417,Polk Arts Alliance Inc.,300264417,,,"This organization is not rated, Not currently rated, Not rated",,"6739 ENGLELAKE DR, LAKELAND, FL, 33813-3715",,Mission not available,2004,Yes
https://www.charitynavigator.org/ein/300264816,Iglesia De Dios Camino De Santidad- north Hollywood,300264816,,,"This organization is not rated, Not currently rated, Not rated",,"6241 BECK AVE APT 214, N HOLLYWOOD, CA, 91606-4077",,Mission not available,2004,Yes
https://www.charitynavigator.org/ein/300264994,CATHOLIC UNION OF TEXAS THE KJT,300264994,,,"This organization is not rated, Not currently rated, Not rated",,"PO BOX 297, LA GRANGE, TX, 78945-0297",,Mission not available,1940,Yes
https://www.charitynavigator.org/ein/300265098,Macon Rhf Housing Inc.,300265098,81%,3,,http://WWW.RHF.ORG,"911 N STUDEBAKER ROAD, LONG BEACH, CA, 90815-4900",562-257-5100,"MACON RHF HOUSING, INC. IS A NOT-FOR-PROFIT CORPORATION FORMED IN ACCORDANCE WITH THE NOT-FOR-PROFIT STATUTES OF THE STATE OF GEORGIA. THE CORPORATION WAS FORMED FOR ... (More)",2005,No
https://www.charitynavigator.org/ein/300265118,Helping Hands Support Inc.,300265118,77%,3,,,"1859 NORTHGATE BLVD, SARASOTA, FL, 34234-0000",,"HELPING HANDS SUPPORT EXISTS TO PROVIDE AN EASY, TAX-EFFICIENT WAY FOR INDIVIDUALS, FAMILIES AND ORGANIZATIONS TO GIVE CHARITABLY TO ORGANIZATIONS THAT PROVIDE CARE ... (More)",2004,No
https://www.charitynavigator.org/ein/300263694,James F Keppel Foundation,300263694,,,"This organization is not rated, Not currently rated, Not rated",,"3411 OAK AVE, MIAMI, FL, 33133-0000",,Mission not available,2004,Yes
https://www.charitynavigator.org/ein/300264130,PTA TEXAS CONGRESS,300264130,,,"This organization is not rated, Not currently rated, Not rated",,"10700 INGRAM RD, SAN ANTONIO, TX, 78245-2103",,Mission not available,1967,Yes
https://www.charitynavigator.org/ein/300265339,Desoto Children and Youth Charity Fund Inc.,300265339,,,"This organization is not rated, Not currently rated, Not rated",,"2223 OAKLEY GREEN DR, SUN CITY CTR, FL, 33573-7175",,Mission not available,2014,Yes
https://www.charitynavigator.org/ein/300265747,Church of H O P E International Ministries,300265747,,,"This organization is not rated, Not currently rated, Not rated",,"1211 COUNTY ROAD 45, TUSKEGEE, AL, 36083-5938",,Mission not available,2005,Yes
https://www.charitynavigator.org/ein/300265119,Streams in the Wasteland Christian Ministries Inc.,300265119,,,"This organization is not rated, Not currently rated, Not rated",http://WWW.STREAMSINTHEWASTELAND.COM,"7129 S WOODGREEN RD, WEST JORDAN, UT, 84084-2628",801-563-8005,"SUPPORT A FAITH BASED COMMUNITY IN SALT LAKE COUNTY, UTAH IN ORDER TO MEET MANY OF THE UNMET NEEDS OF THE RELIGIOUS COMMUNITY THROUGH SPIRITUAL INSTRUCTION AND ENCOU ... (More)",2004,Yes
https://www.charitynavigator.org/ein/300265819,The Aaron I Fleischman Foundation Inc.,300265819,,,"This organization is not rated, Not currently rated, Not rated",,"3310 MARY ST STE 501, MIAMI, FL, 33133-5344",,Mission not available,2004,Yes
https://www.charitynavigator.org/ein/300266073,Heart of Passion Inc.,300266073,,,"This organization is not rated, Not currently rated, Not rated",,"448 HIGHLAND PARK TRACE, PINE MOUNTAIN, GA, 31822-0000",,Mission not available,2014,Yes
https://www.charitynavigator.org/ein/300266310,Alice Moseley Folk Art and Antique Museum,300266310,,,"This organization is not rated, Not currently rated, Not rated",,"1928 DEPOT WAY, BAY ST LOUIS, MS, 39520-4548",,Mission not available,2018,Yes
https://www.charitynavigator.org/ein/300266316,Gift Foundation of Hawaii,300266316,83%,3,,http://GIFT.FOUNDATION,"1288 ALA MOANA BLVD STE 208, HONOLULU, HI, 96814-4233",808-545-7722,TO MAKE CHARITABLE GIFTS AND GRANTS IN THE STATE OF HAWAII.,2004,No
https://www.charitynavigator.org/ein/300266314,Bso Ivy Foundation Inc.,300266314,,,"This organization is not rated, Not currently rated, Not rated",,"PO BOX 16045, OKLAHOMA CITY, OK, 73113-2045",,Mission not available,2004,Yes
