url,name,ein,score,star_rating,keywords,website,address,phone,organization_mission,IRS_ruling_year,contain_keywords
https://www.charitynavigator.org/ein/262878379,Jared Jamail Memorial Fund,262878379,,,"Not rated, This organization is not rated, Not currently rated",,"2003 FOLEY RD, CROSBY, TX, 77532-7248",,Mission not available,2009,Yes
https://www.charitynavigator.org/ein/262879020,MOBILE SPORTS AUTHORITY INC,262879020,,,"Not rated, This organization is not rated, Not currently rated",http://www.mobilesportsauthority.com,"301 GOVERNMENT ST STE 204, MOBILE, AL, 36602-2699",,"Mobile Sports Authority, Inc. brings sporting events and activities to the City of Mobile and Mobile County. These events enhance economic impact, tax revenue, and m ... (More)",2009,Yes
https://www.charitynavigator.org/ein/262879140,Bayard Rustin Lgbtq Coalition,262879140,,,"Not rated, This organization is not rated, Not currently rated",,"226 BROAD ST, SAN FRANCISCO, CA, 94112-2927",,Mission not available,2022,Yes
https://www.charitynavigator.org/ein/262879319,Persian American Association of Northern California,262879319,,,"Not rated, This organization is not rated, Not currently rated",,"50 CRESTA DR APT 2, SAN RAFAEL, CA, 94903-5555",,Mission not available,2009,Yes
https://www.charitynavigator.org/ein/262879850,Stephen and Marianne Garber Foundation Inc.,262879850,,,"Not rated, This organization is not rated, Not currently rated",,"780 TANGLEWOOD TRL, ATLANTA, GA, 30327-4524",,Mission not available,2012,Yes
https://www.charitynavigator.org/ein/262879478,DEPARTMENT OF ALABAMA AUXILIARY TO THE VFW OF THE U S,262879478,,,"Not rated, This organization is not rated, Not currently rated",,"1616 HEROES ST, SCOTTSBORO, AL, 35768-2416",,Mission not available,2010,Yes
https://www.charitynavigator.org/ein/262879537,Central Louisiana Amateur Radio Club Inc.,262879537,,,"Not rated, This organization is not rated, Not currently rated",,"PO BOX 4652, PINEVILLE, LA, 71361-4652",,Mission not available,2022,Yes
https://www.charitynavigator.org/ein/262879881,National City Police Department Explorers Post 2859,262879881,,,"Not rated, This organization is not rated, Review Before Proceeding, Not currently rated",,"1200 NATIONAL CITY BLVD, NATIONAL CITY, CA, 91950-4302",,Mission not available,2021,Yes
https://www.charitynavigator.org/ein/262880050,Endured Alliance Group,262880050,,,"Not rated, This organization is not rated, Not currently rated",,"690 STOCK LN, FERNLEY, NV, 89408-9770",,Mission not available,2015,Yes
https://www.charitynavigator.org/ein/262879924,Job Lamour Foundation Inc.,262879924,,,"Not rated, This organization is not rated, Not currently rated",,"2134 DOCK ST, WEST PALM BCH, FL, 33401-7558",,Mission not available,2009,Yes
https://www.charitynavigator.org/ein/262880509,Kearns High School Band Boosters,262880509,,,"Not rated, This organization is not rated, Not currently rated",,"4717 W PEAK DR, WEST JORDAN, UT, 84088-7850",,Mission not available,2015,Yes
https://www.charitynavigator.org/ein/262880594,The Covenant School of Jacksonville Inc.,262880594,,,"Not rated, This organization is not rated, Not currently rated",,"2300 BARTRAM RD, JACKSONVILLE, FL, 32207-2623",,"THE COVENANT SCHOOL OF JACKSONVILLE, INC., IS DEDICATED TO OFFERING A QUALITY CHRISTIAN EDUCATION FOR PRE-KINDERGARTEN THROUGH 12TH GRADE STUDENTS IN JACKSONVILLE, F ... (More)",2009,Yes
https://www.charitynavigator.org/ein/262880384,COLORADO MASONIC PROPERTIES INC,262880384,,,"Not rated, This organization is not rated, Not currently rated",,"PO BOX 632029, LITTLETON, CO, 80163-2029",,Mission not available,2013,Yes
https://www.charitynavigator.org/ein/262880664,St. Johns River Festival of the Arts Inc. in Historic Sanford Fl,262880664,,,"Not rated, This organization is not rated, Not currently rated",,"PO BOX 223, SANFORD, FL, 32772-0223",,Mission not available,2009,Yes
https://www.charitynavigator.org/ein/262880388,Power Environmental Energy Research Institute,262880388,47%,0,,http://www.peeri.org,"738 ARROW GRAND CIR, COVINA, CA, 91722-2147",,"PEER is dedicated to bridging the gap between academic research and technology commercialization. As such, PEER?s missions include: keep abreast with most recent bre ... (More)",2009,No
https://www.charitynavigator.org/ein/262880695,Rescue Ministries International,262880695,,,"Not rated, This organization is not rated, Not currently rated",,"6520 TRENTLAND PARK DR, ABERDEEN, WA, 98520-7947",,Mission not available,2008,Yes
https://www.charitynavigator.org/ein/262880620,Synergy Community Development Inc.,262880620,,,"Not rated, This organization is not rated, Not currently rated",,"735 BAY AVE, DEFUNIAK SPGS, FL, 32435-2842",,Mission not available,2009,Yes
https://www.charitynavigator.org/ein/262881347,Tennessee Valley Coalition to End Homelessness Inc.,262881347,60%,2,,,"PO BOX 27051, KNOXVILLE, TN, 37927-7051",865-438-5111,"PROVIDING SERVICES TO CLIENTS TO ASSIST IN PREVENTING HOMELESSNESS, TRAINING PARTNER ORGANIZATIONS ON REPORTING SYSTEM AND REPORTING TO GOVERNMENTS, STATISTICAL INFO ... (More)",2008,No
https://www.charitynavigator.org/ein/262880970,Hope & Healing Helping Hands Ministry Inc.,262880970,,,"Not rated, This organization is not rated, Not currently rated",,"3724 BROWN DR, DECATUR, GA, 30034-5543",,Mission not available,2009,Yes
https://www.charitynavigator.org/ein/262881452,Hogar Maria Foundation Inc.,262881452,,,"Not rated, This organization is not rated, Not currently rated",,"512 NE 25TH AVE, CAPE CORAL, FL, 33909-2803",,Mission not available,2009,Yes
https://www.charitynavigator.org/ein/262882192,Hamp Michael Post Number 70 the American Legion,262882192,,,"Not rated, This organization is not rated, Not currently rated",,"PO BOX 178, ARCADIA, LA, 71001-0178",,Mission not available,2013,Yes
https://www.charitynavigator.org/ein/262881707,Petra Foundation Inc.,262881707,,,"Not rated, This organization is not rated, Not currently rated",,"PO BOX 1144, COVINGTON, GA, 30015-1144",,Mission not available,2008,Yes
https://www.charitynavigator.org/ein/262881383,Vietnamese Community Church,262881383,,,"Not rated, This organization is not rated, Not currently rated",,"7769 TOPANGA CANYON BLVD, CANOGA PARK, CA, 91304-5543",,Mission not available,2009,Yes
https://www.charitynavigator.org/ein/262882847,PILOT CLUB OF LOS LUNAS,262882847,,,"Not rated, This organization is not rated, Not currently rated",,"PO BOX 2182, LOS LUNAS, NM, 87031-2181",,Mission not available,2014,Yes
https://www.charitynavigator.org/ein/262882799,Womensource Inc.,262882799,82%,3,,http://WWW.WOMENSOURCE.INFO,"PO BOX 684, GAINESVILLE, GA, 30503-0684",770-503-9060,WOMENSOURCE PROVIDES EDUCATIONAL PROGRAMMING TO EMPOWER WOMEN.,2009,No
https://www.charitynavigator.org/ein/262882898,Better Pensacola Forum Inc.,262882898,,,"Not rated, This organization is not rated, Not currently rated",,"321 N DEVILLIERS ST SUITE 208, PENSACOLA, FL, 32502-0000",,Mission not available,2014,Yes
https://www.charitynavigator.org/ein/262882430,Friends of Assam and Seven Sisters,262882430,,,"Not rated, This organization is not rated, Not currently rated",,"3314 FREEPORT DR, CORONA, CA, 92881-0920",,Mission not available,2010,Yes
https://www.charitynavigator.org/ein/262883174,STARFIRE MINISTRIES,262883174,,,"Not rated, This organization is not rated, Not currently rated",,"PO BOX 17425, MISSOULA, MT, 59808-7425",,Mission not available,2010,Yes
https://www.charitynavigator.org/ein/262883184,Greater Polson Community Foundation Inc.,262883184,100%,4,,http://WWW.POLSONFOREVER.ORG,"PO BOX 314, POLSON, MT, 59860-0314",406-883-4723,Grant to Polson Area 501(c)3 Entities,2008,No
https://www.charitynavigator.org/ein/262883248,OCONEE COUNTY INC,262883248,,,"Not rated, This organization is not rated, Not currently rated",,"329 JUNCTION CT, WINDER, GA, 30680-5601",,Mission not available,2021,Yes
https://www.charitynavigator.org/ein/262883459,Literacy Council of West Alabama Inc.,262883459,,,"Not rated, This organization is not rated, Not currently rated",,"3834 21ST ST, TUSCALOOSA, AL, 35401-3922",,Mission not available,2009,Yes
https://www.charitynavigator.org/ein/262884045,Gospel Media Publishing,262884045,,,"Not rated, This organization is not rated, Not currently rated",,"1095 S 800 E, OREM, UT, 84097-7251",,Mission not available,2012,Yes
https://www.charitynavigator.org/ein/262884109,Refocus Ministries,262884109,,,"Not rated, This organization is not rated, Not currently rated",,"6004 HENNING OAKS CV, ARLINGTON, TN, 38002-5365",,Mission not available,2009,Yes
https://www.charitynavigator.org/ein/262884041,Wine Country Curling Club Inc.,262884041,,,"Not rated, This organization is not rated, Not currently rated",,"8257 HARDESTER DR, SACRAMENTO, CA, 95828-7518",916-747-7743,"The organization shall provide recreational opportunities for all curlers. Wine Country Curling club, Inc. (WCCC)is dedicated to the promotion and coordination of th ... (More)",2014,Yes
https://www.charitynavigator.org/ein/262883468,Swift Wings Foundation,262883468,,,"Not rated, This organization is not rated, Not currently rated",,"924 W WOLFENSBERGER RD, CASTLE ROCK, CO, 80109-9631",,Mission not available,2009,Yes
https://www.charitynavigator.org/ein/262884628,Corazon Roxas Foundation,262884628,,,"Not rated, This organization is not rated, Not currently rated",,"329 PRIMROSE ROAD BOX 117451, BURLINGAME, CA, 94010-4093",,Mission not available,2008,Yes
https://www.charitynavigator.org/ein/262884264,Navy Legacy Flight Foundation,262884264,69%,2,,https://navylegacyflight.org,"PO BOX 3100, JACKSON, WY, 83001-3100",307-733-9251,TO SUPPORT THE UNITED STATES NAVY RECRUITING PROGRAM AND MAINTAIN AND INCREASE THE PUBLIC'S INTEREST IN THE UNITED STATES NAVY'S AVIATION PROGRAM BY PROVIDING VINTAG ... (More),2009,No
https://www.charitynavigator.org/ein/262883988,Adult and Teen Challenge of the Upper Cumberland Inc.,262883988,88%,3,,http://www.teenchallengeuc.org,"200 FREEDOM LN, LIVINGSTON, TN, 38570-2900",888-688-0470,To assist individuals with life-controlling problems.,2009,No
https://www.charitynavigator.org/ein/262885481,DEMOLAY INTERNATIONAL,262885481,,,"Not rated, This organization is not rated, Not currently rated",,"PO BOX 130205, TAMPA, FL, 33681-0205",,Mission not available,1996,Yes
https://www.charitynavigator.org/ein/262885635,Islamic Center of Fullerton,262885635,,,"Not rated, This organization is not rated, Not currently rated",,"515 W VALENCIA DR STE H, FULLERTON, CA, 92832-2102",,Mission not available,2008,Yes
https://www.charitynavigator.org/ein/262884937,Roney Family Foundation,262884937,,,"Not rated, This organization is not rated, Not currently rated",,"HC 65 BOX 527042, CONCHO, AZ, 85924-8512",,Mission not available,2008,Yes
https://www.charitynavigator.org/ein/262885753,Old Town Actors Studio Inc.,262885753,,,"Not rated, This organization is not rated, Not currently rated",,"PO BOX 4144, POCATELLO, ID, 83205-4144",,Mission not available,2009,Yes
https://www.charitynavigator.org/ein/262885102,Centro De Vida,262885102,,,"Not rated, This organization is not rated, Not currently rated",,"PO BOX 542193, GREENACRES, FL, 33454-2193",,Mission not available,2013,Yes
https://www.charitynavigator.org/ein/262886652,Prhs Touchdown Club Inc.,262886652,,,"Not rated, This organization is not rated, Not currently rated",,"6555 SUGARLOAF PKWY, DULUTH, GA, 30097-4930",678-957-3100,"The organization's purpose is to provide educational, financial, social, and other support for the Peachtree Ridge High School football programs and their activities ... (More)",2010,Yes
https://www.charitynavigator.org/ein/262886846,Wounded Veterans Relief Fund,262886846,96%,4,,http://www.wvrf.org,"300 Prosperity Farms Road, Suite F, North Palm Beach, FL, 33408",561-855-4207,Providing urgently needed financial relief and critical dental care to qualified service-connected disabled Florida veterans.,2009,No
https://www.charitynavigator.org/ein/262885777,Emmanuel Charisma Church,262885777,,,"Not rated, This organization is not rated, Not currently rated",,"14610 ADMIRALTY WAY APT H103, LYNNWOOD, WA, 98087-1304",,Mission not available,2014,Yes
https://www.charitynavigator.org/ein/262886960,EMERSON CUMBERLAND PRESBYTERIAN MEMORIAL CEMETERY ASSOCIATION INC,262886960,,,"Not rated, This organization is not rated, Not currently rated",,"102 N HAZEL, EMERSON, AR, 71740-0000",,Mission not available,2009,Yes
https://www.charitynavigator.org/ein/262886512,NEWCOMERS CLUB OF GREATER HUNTSVILLE,262886512,,,"Not rated, This organization is not rated, Not currently rated",,"PO BOX 953, HUNTSVILLE, AL, 35804-0953",,Mission not available,2010,Yes
https://www.charitynavigator.org/ein/262887051,Clan Strachan Scottish Heritage Society Inc.,262887051,,,"Not rated, This organization is not rated, Not currently rated",http://www.clanstrachan.org,"30730 SAN PASQUAL RD, TEMECULA, CA, 92591-1520",951-760-8575,"The organization is to promote the history, tradition , and heritage of the Scottish, culture; encourage education, the collection and preservation of records, tradi ... (More)",2009,Yes
https://www.charitynavigator.org/ein/262887301,Club 21 Learning and Resource Center Inc.,262887301,82%,3,,,"539 N LAKE AVE, PASADENA, CA, 91101-1217",626-844-1821,Club 21 Learning and Resource Center provides the educational tools and resources that enable individuals with Down syndrome to be fully included.,2009,No
https://www.charitynavigator.org/ein/262886437,Memphis Songwriters Association Inc.,262886437,,,"Not rated, This organization is not rated, Not currently rated",,"550 S MAIN ST, MEMPHIS, TN, 38103-4810",,Mission not available,2016,Yes
https://www.charitynavigator.org/ein/262887582,NATIONAL CENTER FOR LESBIAN RIGHTS SOCIAL JUSTICE FUND,262887582,,,"Not rated, This organization is not rated, Review Before Proceeding, Confirmed Revocation, Not currently rated",,"870 MARKET ST STE 370, SAN FRANCISCO, CA, 94102-3009",,Mission not available,2008,Yes
https://www.charitynavigator.org/ein/262887308,Ca Shanghai Friendship Association Incorporated,262887308,,,"Not rated, This organization is not rated, Review Before Proceeding, Confirmed Revocation, Not currently rated",,"1050 CONNECTICUT DR, REDWOOD CITY, CA, 94061-2058",,Mission not available,2009,Yes
https://www.charitynavigator.org/ein/262887408,Gibeon Church of God in Christ,262887408,,,"Not rated, This organization is not rated, Not currently rated",,"4175 PARKER RD, FLORISSANT, MO, 63033-3247",,Mission not available,2018,Yes
https://www.charitynavigator.org/ein/262886973,Cal Turner Family Foundation Inc.,262886973,,,"Not rated, This organization is not rated, Not currently rated",,"333 11TH AVE S STE 500, NASHVILLE, TN, 37203-5630",,Mission not available,2009,Yes
https://www.charitynavigator.org/ein/262888557,Les Amis De Port De Paix Inc.,262888557,,,"Not rated, This organization is not rated, Not currently rated",,"6416 NE 2ND AVE, MIAMI, FL, 33138-6007",,Mission not available,2011,Yes
https://www.charitynavigator.org/ein/262888545,GREAT COMMISSION FOR WOMEN AND CHILDREN INC,262888545,,,"Not rated, This organization is not rated, Not currently rated",,"22 W MOUNTAIN LN, GRAND PRAIRIE, TX, 75052-6208",,Mission not available,1964,Yes
https://www.charitynavigator.org/ein/262887856,Iglesia De Dios Restauracion Torre Fuerte,262887856,,,"Not rated, This organization is not rated, Not currently rated",,"4554 E CHARLESTON BLVD, LAS VEGAS, NV, 89104-5525",,CHRISTIAN RELIGIOUS ACTIVITIES,2014,Yes
https://www.charitynavigator.org/ein/262889014,Anpd Organization,262889014,,,"Not rated, This organization is not rated, Not currently rated",,"375 REDONDO AVE 421, LONG BEACH, CA, 90814-2656",,Mission not available,2009,Yes
https://www.charitynavigator.org/ein/262889026,Center for Nonprofit Leadership of the Sierra,262889026,,,"Not rated, This organization is not rated, Not currently rated",,"200 LITTON DR STE 226, GRASS VALLEY, CA, 95945-5040",,Mission not available,2008,Yes
https://www.charitynavigator.org/ein/262889009,Islamic School of Silicon Valley,262889009,,,"Not rated, This organization is not rated, Not currently rated",,"1682 SWALLOW DR, SUNNYVALE, CA, 94087-5018",,Mission not available,2009,Yes
https://www.charitynavigator.org/ein/262887967,Re:wild (fka Global Wildlife Conservation),262887967,100%,4,,https://www.rewild.org,"P.O. Box 129, Austin, TX, 78767",512-868-6062,"Re:wild protects and restores the wild. We have a singular and powerful focus: the wild as the most effective solution to the interconnected climate, biodiversity an ... (More)",2009,No
https://www.charitynavigator.org/ein/262889801,Mayday Pit Bull Rescue & Advocacy,262889801,,,"Not rated, This organization is not rated, Not currently rated",,"PO BOX 72406, PHOENIX, AZ, 85050-0000",,Mission not available,2009,Yes
https://www.charitynavigator.org/ein/262889948,Citadel Church Inc.,262889948,,,"Not rated, This organization is not rated, Not currently rated",,"1051 ARLINGTON RD N, JACKSONVILLE, FL, 32211-5810",,Mission not available,2014,Yes
https://www.charitynavigator.org/ein/262890340,Canines in Crisis,262890340,,,"Not rated, This organization is not rated, Not currently rated",,"13976 KLONDIKE RD, DE SOTO, MO, 63020-5500",,Mission not available,2010,Yes
https://www.charitynavigator.org/ein/262890913,McNeil Organization Inc.,262890913,,,"Not rated, This organization is not rated, Not currently rated",,"2696 ALIX WAY, LITHIA SPGS, GA, 30122-6410",,Mission not available,2018,Yes
https://www.charitynavigator.org/ein/262889550,WOODCREEK OUTREACH REHABILITATION DEVELOPMENT,262889550,,,"Not rated, This organization is not rated, Not currently rated",,"1595 S KESSLER AVE, SCHULENBURG, TX, 78956-5279",936-661-6557,"TO HIRE AND EMPLOYE INDVIDUALS WHO ARE OFTEN UNACCEPTABLE TO TRADITIONAL EMPLOYMENT, MANY OF THE EMPLOYED PERSONNEL HAVE A HISTORY OF SUBSTANCE ABUSE OR ALOCHOL DEPE ... (More)",2008,Yes
https://www.charitynavigator.org/ein/262890804,Long Beach Felines Inc.,262890804,,,"Not rated, This organization is not rated, Not currently rated",,"PO BOX 15704, LONG BEACH, CA, 90815-0704",,Mission not available,2011,Yes
https://www.charitynavigator.org/ein/262891037,Phi Sig Foundation,262891037,,,"Not rated, This organization is not rated, Not currently rated",,"1311 S FLORENCE ST, KIRKSVILLE, MO, 63501-4446",,Mission not available,2008,Yes
https://www.charitynavigator.org/ein/262893066,Colton Volunteer Firefighter Association,262893066,,,"Not rated, This organization is not rated, Not currently rated",,"20987 S HIGHWAY 211, COLTON, OR, 97017-9446",,Mission not available,2010,Yes
https://www.charitynavigator.org/ein/262893584,Friends of Bear Canyon,262893584,,,"Not rated, This organization is not rated, Not currently rated",,"4645 PITT ST NE, ALBUQUERQUE, NM, 87111-6012",,Mission not available,2017,Yes
https://www.charitynavigator.org/ein/262891822,Friends of Wycliffe Hall Oxford Inc.,262891822,69%,2,,http://WWW.FRIENDSOFWYCLIFFEHALL.ORG,"707 NICOLET AVE STE 100, WINTER PARK, FL, 32789-4699",407-628-1965,"FRIENDS OF WYCLIFFE HALL OXFORD, INC. IS A PUBLIC CHARITY FOR RELIGIOUS EDUCATION. THE ORGANIZATION WAS FOUNDED TO STRENGTHEN TIES BETWEEN WYCLIFFE HALL OXFORD (AN E ... (More)",2008,No
https://www.charitynavigator.org/ein/262893678,California Alliance for Jazz,262893678,,,"Not rated, This organization is not rated, Not currently rated",,"4195 CHINO HILLS PARKWAY PO BOX 210, CHINO HILLS, CA, 91709-2618",,Mission not available,2009,Yes
https://www.charitynavigator.org/ein/262893650,Barry and Renee Honig Charitable Foundation Inc.,262893650,,,"Not rated, This organization is not rated, Not currently rated",,"5058 WINDSOR PARKE DR, BOCA RATON, FL, 33496-1637",,Mission not available,2009,Yes
https://www.charitynavigator.org/ein/262893844,JIMENA: Jews Indigenous to the Middle East and North Africa,262893844,68%,2,,http://jimena.org,"459 FULTON ST STE 207, SAN FRANCISCO, CA, 94102-4365, Mail donations to:, P.O. Box 6872, San Rafael, CA, 949903",415-626-5062,"JIMENAs mission is to achieve universal recognition for the history, heritage, and rights of the one million Jewish refugees from the Middle East and North Africa a ... (More)",2008,No
https://www.charitynavigator.org/ein/262891810,Lewistown Youth Baseball and Softball Association,262891810,,,"Not rated, This organization is not rated, Not currently rated",,"PO BOX 3655, LEWISTOWN, MT, 59457-3655",,Mission not available,2015,Yes
https://www.charitynavigator.org/ein/262893012,Kobes Arts,262893012,,,"Not rated, This organization is not rated, Not currently rated",,"3817 HAWTHORNE AVE, DALLAS, TX, 75219-2212",,Mission not available,2009,Yes
https://www.charitynavigator.org/ein/262894221,NORTH WINDWARD BAPTIST CHURCH OF HAWAII,262894221,,,"Not rated, This organization is not rated, Not currently rated",,"PO BOX 177, HAUULA, HI, 96717-0177",,Mission not available,1963,Yes
https://www.charitynavigator.org/ein/262894319,Black Canyon City Archery Club,262894319,76%,3,,,"PO BOX 250, BLACK CYN CTY, AZ, 85324-0250",623-696-6310,PROVIDE TRAINING IN THE PROPER HANDLING OF ARCHERY EQUIPMENT AND OPERATION OF ARCHERY EQUIPMENT AND FACILITATE BOTH COMPETITIVE AND NON-COMPETITIVE ARCHERY SHOOTING.,2010,No
https://www.charitynavigator.org/ein/262894089,BRIDE OF CHRIST BAPTIST CHURCH OF BAINBRIDGE GEORGIA INC,262894089,,,"Not rated, This organization is not rated, Not currently rated",,"135 COUNTRY CLUB RD, BAINBRIDGE, GA, 39819-6532",,Mission not available,1964,Yes
https://www.charitynavigator.org/ein/262894615,Operation Blocks for the Brave,262894615,,,"Not rated, This organization is not rated, Not currently rated",,"7128 YUMA WAY, BAKERSFIELD, CA, 93308-6409",,Mission not available,2012,Yes
https://www.charitynavigator.org/ein/262894628,Parkside Child Development Center,262894628,67%,2,,,"3248 A ISLETA BLVD SW, ALBUQUERQUE, NM, 87105-5833",505-459-3294,TO PROVIDE QUALITY CHILD CARE AND EDUCATION FOR LOW-INCOME FAMILIES SO PARENTS CAN WORK,2011,No
https://www.charitynavigator.org/ein/262895216,Running Hope Inc.,262895216,,,"Not rated, This organization is not rated, Not currently rated",,"9030 WINDSOR HILL PSGE, SUWANEE, GA, 30024-5507",,Mission not available,2014,Yes
https://www.charitynavigator.org/ein/262895869,New Beginning of Lagrange Cdc Inc.,262895869,,,"Not rated, This organization is not rated, Not currently rated",,"506 WARE ST, LAGRANGE, GA, 30241-3450",,Mission not available,2008,Yes
https://www.charitynavigator.org/ein/262895165,Angel S Foster Family Network Okc Inc.,262895165,94%,4,,,"PO BOX 31746, EDMOND, OK, 73003-0030",405-285-6193,"THE ANGELS MISSION IS ""DRIVE SYSTEMATIC CHANGE, CHAMPION FOSTER FAMILIES""",2009,No
https://www.charitynavigator.org/ein/262896110,Gospel Outreach Church of Tacoma,262896110,,,"Not rated, This organization is not rated, Not currently rated",,"7401 WALLER RD E, TACOMA, WA, 98443-1110",,Mission not available,2008,Yes
https://www.charitynavigator.org/ein/262894732,Lambert Lacrosse Booster Club Inc.,262894732,83%,3,,http://WWW.LONGHORNLACROSSE.COM,"7030 BRIXTON PLACE, SUWANEE, GA, 30024-0000",,"SUPPORT LAMBERT HIGH SCHOOL LACROSSE PROGRAM AND PROMOTE THE SPORT OF LACROSSE IN FORSYTH COUNTY, GEORGIA THROUGH FUNDRAISING ACTIVITIES AND SPONSORSHIP OF CAMPS",2010,No
https://www.charitynavigator.org/ein/262896649,Manchester Youth Football League,262896649,,,"Not rated, This organization is not rated, Not currently rated",,"PO BOX 266, MANCHESTER, TN, 37349-0266",,Mission not available,2014,Yes
https://www.charitynavigator.org/ein/262897129,Morningstar International Inc.,262897129,,,"Not rated, This organization is not rated, Not currently rated",,"PO BOX 870921, STONE MTN, GA, 30087-0024",,Mission not available,2009,Yes
https://www.charitynavigator.org/ein/262896880,Lakeway Soccer Club,262896880,,,"Not rated, This organization is not rated, Not currently rated",,"PO BOX 1181, TALBOTT, TN, 37877-1181",,Mission not available,2013,Yes
https://www.charitynavigator.org/ein/262896837,AMERICAN LEGION AUXILIARY TO C JAMES SMITH POST 6 AMERICAN LEGION,262896837,,,"Not rated, This organization is not rated, Not currently rated",,"PO BOX 151, CHOTEAU, MT, 59422-0151",,Mission not available,2017,Yes
https://www.charitynavigator.org/ein/262897225,Oikos Christian Ministries,262897225,,,"Not rated, This organization is not rated, Not currently rated",,"PO BOX 1726, GRANDBURY, TX, 76048-8726",,Mission not available,2010,Yes
https://www.charitynavigator.org/ein/262897482,Asphalt Pavement Association of Oregon Education Foundation Inc.,262897482,,,"Not rated, This organization is not rated, Not currently rated",,"5240 GAFFIN RD SE, SALEM, OR, 97317-9261",,Mission not available,2009,Yes
https://www.charitynavigator.org/ein/262897541,National Charity League - Lake Sammamish Chapter,262897541,,,"Not rated, This organization is not rated, Not currently rated",,"3020 ISSAQUAH PINE LAKE RD SE 558, SAMMAMISH, WA, 98075-7253",,Mission not available,2009,Yes
https://www.charitynavigator.org/ein/262897850,Azpoa Foundation Inc.,262897850,,,"Not rated, This organization is not rated, Not currently rated",,"3039 W PEORIA SUITE C102-413, PHOENIX, AZ, 85029-5212",,Mission not available,2016,Yes
https://www.charitynavigator.org/ein/262897816,Church in Hayward,262897816,,,"Not rated, This organization is not rated, Not currently rated",,"2226 SLEEPY HOLLOW AVE, HAYWARD, CA, 94545-3428",,Mission not available,2017,Yes
https://www.charitynavigator.org/ein/262898150,American Eagle Soccer Association,262898150,,,"Not rated, This organization is not rated, Not currently rated",,"1275 S DAHLIA ST, DENVER, CO, 80246-7840",,Mission not available,2009,Yes
