url,name,ein,score,star_rating,keywords,website,address,phone,organization_mission,IRS_ruling_year,contain_keywords
https://www.charitynavigator.org/ein/300266319,Mammoth Lakes Friends of the Library,300266319,,,"This organization is not rated, Not currently rated, Not rated",,"PO BOX 1468, MAMMOTH LAKES, CA, 93546-1468",760-934-4932,Support programs at the Mammoth Lakes Branch Library.,2004,Yes
https://www.charitynavigator.org/ein/300266326,The Autocrat Golf Club Inc.,300266326,,,"This organization is not rated, Not currently rated, Not rated",,"PO BOX 8057, NEW ORLEANS, LA, 70182-8057",,Mission not available,2004,Yes
https://www.charitynavigator.org/ein/300266327,Faith Family Church of Jackson Inc.,300266327,,,"This organization is not rated, Not currently rated, Not rated",,"147 LAKEVIEW RD, JACKSON, GA, 30233-5218",,Mission not available,2005,Yes
https://www.charitynavigator.org/ein/300267207,The Metro Area Community Empowerment Center Inc.,300267207,,,"This organization is not rated, Not currently rated, Not rated",,"859 GORE RD, JACKSON, MS, 39212-9688",,Mission not available,2011,Yes
https://www.charitynavigator.org/ein/300267025,Pangilenian Association USA,300267025,,,"This organization is not rated, Not currently rated, Not rated",,"10507 ROSE RIVER FALLS AVE, BAKERSFIELD, CA, 93312-1859",,Mission not available,2004,Yes
https://www.charitynavigator.org/ein/300267768,Impact Discipleship Ministries Inc.,300267768,,,"This organization is not rated, Not currently rated, Not rated",,"2564 HIGHWAY 154, NEWNAN, GA, 30265-1735",,Mission not available,2004,Yes
https://www.charitynavigator.org/ein/300268027,Gods House of Deliverance,300268027,,,"This organization is not rated, Not currently rated, Not rated",,"1717 E 57TH ST, TACOMA, WA, 98404-4402",,Mission not available,2005,Yes
https://www.charitynavigator.org/ein/300268048,GLORY UNLIMITED EVANGELISTIC MINISTRIES INTERNATIONAL,300268048,,,"This organization is not rated, Not currently rated, Not rated",,"PO BOX 1016, COPPERAS COVE, TX, 76522-5016",,Mission not available,1964,Yes
https://www.charitynavigator.org/ein/300268155,Merea Ministry Inc.,300268155,,,"This organization is not rated, Not currently rated, Not rated",,"358 HIGHWAY 6 W, BATESVILLE, MS, 38606-2559",,Mission not available,2005,Yes
https://www.charitynavigator.org/ein/300268208,Greater North Dallas High School Alumni Association,300268208,,,"This organization is not rated, Not currently rated, Not rated",,"2302 MOSER AVE, DALLAS, TX, 75206-7030",,Mission not available,2004,Yes
https://www.charitynavigator.org/ein/300268709,Northwest Junior Rodeo Association,300268709,,,"This organization is not rated, Not currently rated, Not rated",,"7351 SALMONBERRY CREEK LN SE, PORT ORCHARD, WA, 98367-4534",,Mission not available,2014,Yes
https://www.charitynavigator.org/ein/300267603,INTERNATIONAL ASSOCIATION OF FIRE FIGHTERS,300267603,,,"This organization is not rated, Not currently rated, Not rated",,"PO BOX 4985, SANTA FE, NM, 87502-4985",,Mission not available,1959,Yes
https://www.charitynavigator.org/ein/300268732,Meshnick Charitable Family Foundation,300268732,,,"This organization is not rated, Not currently rated, Not rated",,"7173 MONTRICO DR, BOCA RATON, FL, 33433-6929",,Mission not available,2005,Yes
https://www.charitynavigator.org/ein/300268743,Missions of Compassion,300268743,,,"This organization is not rated, Not currently rated, Not rated",,"22360 REDWOOD RD, CASTRO VALLEY, CA, 94546-7112",,Mission not available,2004,Yes
https://www.charitynavigator.org/ein/300268757,Forney Isd Education Leadership Foundation Inc.,300268757,69%,2,,http://www.forneyisdfoundation.org,"600 S BOIS D ARC ST, FORNEY, TX, 75126-9677",469-762-4100,The Forney ISD Education Leadership Foundation's purpose is to enable and empower teaching and learning throughout Forney Independent School District (FISD). The too ... (More),2005,No
https://www.charitynavigator.org/ein/300269134,ALPHA PHI INTERNATIONAL FRATERNITY INC,300269134,,,"This organization is not rated, Not currently rated, Not rated",https://www.purduealphaphi.com/,"1985 S JOSEPHINE ST, DENVER, CO, 80210-4207",847-316-8925,Alpha Phi is a sisterhood of women supporting each other in lifelong achievement.,1968,Yes
https://www.charitynavigator.org/ein/300269143,Laguna Youth Baseball League Inc.,300269143,76%,3,,http://LAGUNAYOUTHBASEBALL.COM,"5050 LAGUNA BLVD STE 112 PMB 318, ELK GROVE, CA, 95758-4151",916-394-3258,THE PRIMARY OBJECTIVE OF THE LEAGUE IS TO DEVELOP AND PROMOTE IN CHILDREN (USUALLY OF AGES FIVE TO TWELVE) THROUGH THE MEDIUM OF PROPERLY SUPERVISED AND COMPETITIVE ... (More),2004,No
https://www.charitynavigator.org/ein/300269343,Hamakua Center for Vedic Enlightenment,300269343,,,"This organization is not rated, Not currently rated, Not rated",,"44-2650 KALOPA MAUKA RD, HONOKAA, HI, 96727-6821",,Mission not available,2004,Yes
https://www.charitynavigator.org/ein/300269354,Agape Asia Network,300269354,86%,3,,http://www.agapeasia.org,"PO BOX 4211, Chattanooga, TN, 37405-0211",423-902-5629,"Humanitarian aid for abandoned, vulnerable and sick children in Asia.",2005,No
https://www.charitynavigator.org/ein/300269652,Quail Run Parent Teacher Organization Incorporated,300269652,,,"This organization is not rated, Not currently rated, Not rated",,"1130 INVERNESS DR, LAWRENCE, KS, 66049-3809",,Mission not available,2004,Yes
https://www.charitynavigator.org/ein/300269653,Tillamook Serenity Club,300269653,,,"This organization is not rated, Not currently rated, Not rated",,"PO BOX 1023, TILLAMOOK, OR, 97141-1023",,Mission not available,2005,Yes
https://www.charitynavigator.org/ein/300269817,Pass the Blessings Foundation,300269817,,,"This organization is not rated, Not currently rated, Not rated",,"5944 CORAL RIDGE DRIVE SUITE 304, CORAL SPRINGS, FL, 33076-3300",,Mission not available,2005,Yes
