url,name,ein,score,star_rating,keywords,website,address,phone,organization_mission,IRS_ruling_year,contain_keywords
https://www.charitynavigator.org/ein/262852553,Coffee County Health Council,262852553,,,"Not rated, This organization is not rated, Not currently rated",,"1343 MCARTHUR ST, MANCHESTER, TN, 37355-2425",,Mission not available,2009,Yes
https://www.charitynavigator.org/ein/262852304,KC TECH COUNCIL INC,262852304,,,"Not rated, This organization is not rated, Not currently rated",,"1100 MAIN ST, KANSAS CITY, MO, 64105-2120",,"THE ASSOCIATIONS PURPOSE IS TO DEVELOP AND PROMOTE THE IT INDUSTRY IN THE KC METRO AREA THROUGH EDUCATIONAL PROGRAMS, EVENTS, AND PEER NETWORKING",2009,Yes
https://www.charitynavigator.org/ein/262852923,Buddhist Global Relief,262852923,95%,4,,,"2020 Route 301, Carmel, NY, 10512",201-895-9977,"TO ALLEVIATE SUFFERING, POVERTY AND OPPRESSION THROUGH DIRECT AID, ECONOMIC AND TECHNICAL ASSISTANCE, EDUCATION AND OTHER FORMS OF CHARITABLE ASSISTANCE TO PEOPLE IN ... (More)",2009,No
https://www.charitynavigator.org/ein/262853132,Everyones Church Inc.,262853132,,,"Not rated, This organization is not rated, Not currently rated",,"5370 STATE ROUTE 9, SEDRO WOOLLEY, WA, 98284-7871",,Mission not available,2009,Yes
https://www.charitynavigator.org/ein/262853072,Climbers of Hueco Tanks Coalition,262853072,,,"Not rated, This organization is not rated, Not currently rated",,"6604 HERITAGE RIDGE WAY, EL PASO, TX, 79912-8124",,Mission not available,2023,Yes
https://www.charitynavigator.org/ein/262853455,KINGS WAY MINISTRIES,262853455,,,"Not rated, This organization is not rated, Not currently rated",,"PO BOX 20492, ST SIMONS IS, GA, 31522-7792",,Mission not available,1991,Yes
https://www.charitynavigator.org/ein/262853159,Acpa Research & Education Foundation,262853159,94%,4,,,"5605 N MACARTHUR BLVD STE 340, IRVING, TX, 75038-2677",972-506-7216,TO PROVIDE FUNDING FOR RESEARCH THAT SUPPORTS THE LONG-TERM COMPETITIVENESS OF THE PRE-CAST CONCRETE PIPE AND BOX CULVERT INDUSTRY IN THE UNITED STATES.,2008,No
https://www.charitynavigator.org/ein/262855113,Nicaragua Education Fund,262855113,,,"Not rated, This organization is not rated, Not currently rated",,"7353 W GREEN LAKE DR N, SEATTLE, WA, 98103-4828",,Mission not available,2010,Yes
https://www.charitynavigator.org/ein/262854157,Mayan Miracle Foundation,262854157,76%,3,,http://WWW.MAYANMIRACLEFOUNDATION.ORG,"340 W 500 N, N SALT LAKE, UT, 84054-2772",801-295-1690,THE MAYAN MIRACLE FOUNDATION'S GOAL IS TO PROVIDE ASSISTANCE TO MAYAN VILLAGES IN CENTRAL AMERICA.,2009,No
https://www.charitynavigator.org/ein/262855304,Art Quilters Unlimited Inc.,262855304,,,"Not rated, This organization is not rated, Not currently rated",,"PO BOX 7205, FORT MYERS, FL, 33919-0205",,Mission not available,2015,Yes
https://www.charitynavigator.org/ein/262854804,Hope Without Boundaries,262854804,,,"Not rated, This organization is not rated, Not currently rated",,"639 SANTA CAMELIA DR, SOLANA BEACH, CA, 92075-1611",,Mission not available,2008,Yes
https://www.charitynavigator.org/ein/262854403,Gh Outreach of Del Norte,262854403,77%,3,Review Before Proceeding,,"700 E WASHINGTON BLVD, CRESCENT CITY, CA, 95531-8164",,G H OUTREACH OF DEL NORTE IS A NON-PROFIT SERVICE CORPORATION FUNDED BY STATE AND FEDERAL GOVERNMENT AND IS A SERVICE PROVIDER TOR THE DEVELOPMENTALLY DISABLED. THE ... (More),2009,Yes
https://www.charitynavigator.org/ein/262855259,Dependency Advocacy Center,262855259,96%,4,,http://WWW.SCCDAC.ORG,"31 N 2ND ST STE 300, SAN JOSE, CA, 95113-1232",408-995-0714,PROVIDE ZEALOUS LEGAL REPRESENTATION TO INDIGENT CLIENTS IN JUVENILE DEPENDENCY SYSTEM.,2009,No
https://www.charitynavigator.org/ein/262855622,Chuck Obremski Ministries Inc.,262855622,,,"Not rated, This organization is not rated, Not currently rated",,"8 ANZA ST, NEWPORT BEACH, CA, 92663-4416",,Mission not available,2009,Yes
https://www.charitynavigator.org/ein/262855867,EDMOND TRINITY CHRISTIAN CHURCH,262855867,,,"Not rated, This organization is not rated, Not currently rated",,"1400 NW 178TH ST, EDMOND, OK, 73012-4028",,Mission not available,1951,Yes
https://www.charitynavigator.org/ein/262856336,Jesus Cares - McNairy County,262856336,82%,3,,,"120 W COURT AVE, SELMER, TN, 38375-2102",,"TO ASSIST THOSE IN NEED IN OUR COMMUNITY BY PROVIDING TWO TYPES OF AID: 1. DIRECT AID - ASSISTANCE WITH UTILITES, TELEPHONE, RENT, AND MISCELLANEOUS NEEDS, AND 2. TR ... (More)",2009,No
https://www.charitynavigator.org/ein/262856198,Mpowrd,262856198,,,"Not rated, This organization is not rated, Review Before Proceeding, Not currently rated",,"33917 N 23RD LN, PHOENIX, AZ, 85085-5054",623-581-0284,"TO EMPOWER ALL YOUTH TO BELIEVE IN, TO FOCUS UPON, AND TO COMMIT TO POSITIVE PERSONAL SUCCESS THROUGH OUR PROVEN MPOWRD LEADERSHIP PROGRAM.",2009,Yes
https://www.charitynavigator.org/ein/262856290,Wings of Jacob,262856290,,,"Not rated, This organization is not rated, Not currently rated",,"22310 SAVANNAH HTS, VON ORMY, TX, 78073-3007",,Mission not available,2010,Yes
https://www.charitynavigator.org/ein/262856413,24 Hours for Hank Inc.,262856413,83%,3,,http://WWW.24HOURSFORHANK.ORG,"542 WHISKEY JACK RD, SANDPOINT, ID, 83864-8809",208-255-8255,RAISING FUNDS FOR MEDICAL RESEARCH FOR DISEASE CYSTINOSIS,2009,No
https://www.charitynavigator.org/ein/262856534,Massen-Greene Charitable Trust,262856534,,,"Not rated, This organization is not rated, Not currently rated",,"PO BOX 3708, HONOLULU, HI, 96811-3708",,Mission not available,2010,Yes
https://www.charitynavigator.org/ein/262856544,Massen-Greene Charitable Fund,262856544,,,"Not rated, This organization is not rated, Not currently rated",,"PO BOX 3708, HONOLULU, HI, 96811-3708",,Mission not available,2011,Yes
https://www.charitynavigator.org/ein/262858477,AMERICAN INNS OF COURT FOUNDATION,262858477,,,"Not rated, This organization is not rated, Not currently rated",,"76347 VETERANS WAY STE 3076, YULEE, FL, 32097-5404",,Mission not available,1986,Yes
https://www.charitynavigator.org/ein/262858436,Christ the Builder,262858436,,,"Not rated, This organization is not rated, Not currently rated",,"1151 ALLEN TOUSSAINT BLVD, NEW ORLEANS, LA, 70124-4333",,Mission not available,2009,Yes
https://www.charitynavigator.org/ein/262857663,Adams-Coggin Family Foundation,262857663,,,"Not rated, This organization is not rated, Not currently rated",,"1942 DILTON MANKIN RD, MURFREESBORO, TN, 37127-6902",,Mission not available,2011,Yes
https://www.charitynavigator.org/ein/262859118,ARKADELPHIA REGIONAL ECONOMIC DEVELOPMENT ALLIANCE,262859118,,,"Not rated, This organization is not rated, Not currently rated",,"PO BOX 400, ARKADELPHIA, AR, 71923-0400",870-246-1460,"The mission is directing the economic growth of Clark County, securing job creation with existing industries while expanding the job market by actively soliciting ne ... (More)",2010,Yes
https://www.charitynavigator.org/ein/262859342,Americas Freedom Foundation Inc.,262859342,,,"Not rated, This organization is not rated, Not currently rated",,"4626 N 300 W STE 300, PROVO, UT, 84604-7766",,Mission not available,2015,Yes
https://www.charitynavigator.org/ein/262858540,Society for Color and Appearance in Dentistry,262858540,,,"Not rated, This organization is not rated, Not currently rated",,"2715 GARDEN FALLS DR, MANVEL, TX, 77578-7823",,Mission not available,2009,Yes
https://www.charitynavigator.org/ein/262857745,Christopher W and Joni Q Hall Foundation Inc.,262857745,,,"Not rated, This organization is not rated, Not currently rated",,"18200 OLD PELICAN BAY DRIVE, FORT MYERS BEACH, FL, 33931-0000",,Mission not available,2010,Yes
https://www.charitynavigator.org/ein/262858885,DELTA SIGMA THETA SORORITY,262858885,,,"Not rated, This organization is not rated, Not currently rated",,"PO BOX 699, MADISON, MS, 39130-0699",,Mission not available,1952,Yes
https://www.charitynavigator.org/ein/262859779,Media and Democracy Coalition,262859779,,,"Not rated, This organization is not rated, Not currently rated",,"1299 ROSE ST, BERKELEY, CA, 94702-1105",,Mission not available,2009,Yes
https://www.charitynavigator.org/ein/262860159,Willits Bend - Roaring Fork Housing Inc.,262860159,,,"Not rated, This organization is not rated, Not currently rated",,"211 MIDLAND AVE STE 201, BASALT, CO, 81621-8374",,Mission not available,2017,Yes
https://www.charitynavigator.org/ein/262859953,International Mountain Bicycling Association or Imba,262859953,,,"Not rated, This organization is not rated, Not currently rated",,"PO BOX 2127, TELLURIDE, CO, 81435-2127",,Mission not available,2015,Yes
https://www.charitynavigator.org/ein/262859810,Cpe of Central California,262859810,,,"Not rated, This organization is not rated, Not currently rated",,"CPECC 1303 E HERNDON, FRESNO, CA, 93720-0000",,Mission not available,2009,Yes
https://www.charitynavigator.org/ein/262860005,ARIZONA BACH FESTIVAL INC,262860005,,,"Not rated, This organization is not rated, Not currently rated",,"PO BOX 34403, PHOENIX, AZ, 85067-4403",,Mission not available,2024,Yes
https://www.charitynavigator.org/ein/262860242,Iglesia Cristiana De Susan Moore,262860242,,,"Not rated, This organization is not rated, Not currently rated",,"5485 COUNTY HIGHWAY 57, ONEONTA, AL, 35121-4943",,Mission not available,2015,Yes
https://www.charitynavigator.org/ein/262860508,FOUNDATION PARACLETS,262860508,,,"Not rated, This organization is not rated, Not currently rated",,"229 SE 25TH AVE, BOYNTON BEACH, FL, 33435-7623",,Mission not available,2009,Yes
https://www.charitynavigator.org/ein/262860846,Ruff Patch Rescue,262860846,,,"Not rated, This organization is not rated, Not currently rated",,"1872 W 12510 S, RIVERTON, UT, 84065-4012",,Mission not available,2010,Yes
https://www.charitynavigator.org/ein/262860492,Faith and Care Home Health Agency,262860492,72%,2,,,"835 1ST ST, HEMPSTEAD, TX, 77445-5541",979-826-2428,"Faith And Care Home Health Agency, Inc. promotes educational development and caters to the relief of the aged, poor and disabled to combat community deteriorations.",2009,No
https://www.charitynavigator.org/ein/262861361,Friends of the Arboretum,262861361,,,"Not rated, This organization is not rated, Not currently rated",,"175 GOV HOGG PARKWAY, QUITMAN, TX, 75783-0000",,Mission not available,2012,Yes
https://www.charitynavigator.org/ein/262860761,Low Income Housing Coalition of Alabama,262860761,,,"Not rated, This organization is not rated, Not currently rated",http://WWW.LIHCA.ORG,"PO BOX 130159, BIRMINGHAM, AL, 35213-0159",205-939-0411,TO INCREASE HOUSING OPPORTUNITIES FOR ALABAMIANS WITH THE GREATEST FINANCIAL NEED.,2009,Yes
https://www.charitynavigator.org/ein/262860714,AMERICAN INNS OF COURT FOUNDATION,262860714,,,"Not rated, This organization is not rated, Not currently rated",,"501 RIVERSIDE AVE STE 903, JACKSONVILLE, FL, 32202-4940",,Mission not available,1986,Yes
https://www.charitynavigator.org/ein/262861138,Larry & Elaine Smith Family Foundation Inc.,262861138,,,"Not rated, This organization is not rated, Not currently rated",,"850 NE SPANISH RIVER BLVD APT 14, BOCA RATON, FL, 33431-6167",,Mission not available,2010,Yes
https://www.charitynavigator.org/ein/262861858,ALASKANS TOGETHER FOR EQUALITY INC,262861858,,,"Not rated, This organization is not rated, Not currently rated",,"PO BOX 202453, ANCHORAGE, AK, 99520-2453",,Mission not available,2009,Yes
https://www.charitynavigator.org/ein/262861681,San Diego Falun Dafa Association,262861681,56%,1,,,"7925 SILVERTON AVE, SAN DIEGO, CA, 92126-6350",,TO PROMOTE CHINESE CULTURE BY PRESENTING SHEN YUN PERFORMANCE AND TO TEACH FALUN DAFA.,2009,No
https://www.charitynavigator.org/ein/262862017,Lafayette Boys Basketball Association Inc.,262862017,,,"Not rated, This organization is not rated, Not currently rated",,"3745 MEADOW LN, LAFAYETTE, CA, 94549-3035",,Mission not available,2010,Yes
https://www.charitynavigator.org/ein/262863512,POP WARNER LITTLE SCHOLARS INC,262863512,,,"Not rated, This organization is not rated, Not currently rated",,"109TH AVE APT 401, REDWOOD CITY, CA, 94463-0000",,Mission not available,1994,Yes
https://www.charitynavigator.org/ein/262863522,Alaskans Together Foundation Inc.,262863522,,,"Not rated, This organization is not rated, Not currently rated",,"PO BOX 202453, ANCHORAGE, AK, 99520-2453",,Mission not available,2009,Yes
https://www.charitynavigator.org/ein/262863654,Hood River County Christmas Project,262863654,,,"Not rated, This organization is not rated, Not currently rated",,"PO BOX 872, HOOD RIVER, OR, 97031-0029",,Mission not available,2008,Yes
https://www.charitynavigator.org/ein/262864518,Iglesia De Cristo - Miel,262864518,,,"Not rated, This organization is not rated, Not currently rated",,"810 OLDRIDGE PL, LOWELL, AR, 72745-9094",,Mission not available,2009,Yes
https://www.charitynavigator.org/ein/262864735,Sports Kidz Az Inc.,262864735,81%,3,,http://SPORTSKIDZAZ.ORG,"39506 N DAISY MTN DR SUITE 122 PMB, PHOENIX, AZ, 85086-1665",661-860-0067,"SPORTS KIDZ AZ SERVE COMMUNITIES THROUGHOUT ARIZONA BY PROVIDING ATHLETICS TO HOMESCHOOLED FAMILIES, AFTER-SCHOOL ATHLETES, AND UNDERPRIVILEGED YOUTH.",2008,No
https://www.charitynavigator.org/ein/262864750,Freedom Pantry for Veterans,262864750,,,"Not rated, This organization is not rated, Not currently rated",,"1614 S 74TH AVE, YAKIMA, WA, 98908-1972",,Mission not available,2018,Yes
https://www.charitynavigator.org/ein/262864819,Yahtok Ya Animal Sanctuary Inc.,262864819,,,"Not rated, This organization is not rated, Not currently rated",,"PO BOX 92, LA CROSSE, FL, 32658-0092",,Mission not available,2009,Yes
https://www.charitynavigator.org/ein/262864832,NATIONAL ASSOCIATION OF NEGRO BUSINESS & PROFESSIONAL WOMENS CLU,262864832,,,"Not rated, This organization is not rated, Not currently rated",,"155 NE 158TH ST, MIAMI, FL, 33162-4210",,Mission not available,1998,Yes
https://www.charitynavigator.org/ein/262864993,Hemispherectomy Angels Inc.,262864993,43%,0,,,"604 PANAMA CT, GRANBURY, TX, 76048-2585",817-265-8160,TO ENCOURAGE AND SUPPORT IMPACTED FAMILIES BY CONNECTING THEM WITH OTHER FAMILIES WHO HAVE HAD A HEMISPHERECTOMY OR SIMILAR SURGERY. TO WORK TOGETHER WITH MEDICAL PR ... (More),2008,No
https://www.charitynavigator.org/ein/262864037,Historic Fox Theatre Restorations,262864037,69%,2,,http://www.centraliafoxtheatre.com,"123 S TOWER AVE, CENTRALIA, WA, 98531-4221",,To restore the 1930s Historic Fox Theatre in downtown Centralia Washington and after restoration operate as a performing arts center,2009,No
https://www.charitynavigator.org/ein/262865955,VETERANS OF FOREIGN WARS OF THE UNITED STATES AUXILIARY,262865955,,,"Not rated, This organization is not rated, Review Before Proceeding, Not currently rated",,"PO BOX 6944, CRESTLINE, CA, 92325-6944",,Mission not available,2000,Yes
https://www.charitynavigator.org/ein/262866189,Cline Family Foundation,262866189,,,"Not rated, This organization is not rated, Not currently rated",,"3825 PGA BLVD STE 1005, PALM BCH GDNS, FL, 33410-2991",,Mission not available,2008,Yes
https://www.charitynavigator.org/ein/262866233,BRIAN KISNER OUTREACH,262866233,,,"Not rated, This organization is not rated, Not currently rated",,"PO BOX 2301, RIVERVIEW, FL, 33568-2301",,Mission not available,1964,Yes
https://www.charitynavigator.org/ein/262866493,Renewed Deliverance Christian Ministry Inc.,262866493,,,"Not rated, This organization is not rated, Not currently rated",,"300 10TH ST, LAKE PARK, FL, 33403-3167",,Mission not available,2011,Yes
https://www.charitynavigator.org/ein/262866396,Brentwood Mens Club,262866396,,,"Not rated, This organization is not rated, Not currently rated",,"10 QUAIL CT, BRENTWOOD, CA, 94513-5406",,Mission not available,2024,Yes
https://www.charitynavigator.org/ein/262864582,Steven Nathaniel Wolkoff Foundation,262864582,,,"Not rated, This organization is not rated, Not currently rated",,"2121 NW SAVIER ST APT 1104, PORTLAND, OR, 97210-2156",,Mission not available,2010,Yes
https://www.charitynavigator.org/ein/262867535,Daniel Academy - Atlanta Inc.,262867535,76%,3,,http://www.hopeacademygwinnett.org,"1446 CALVIN DAVIS CIR, LAWRENCEVILLE, GA, 30043-3609",,We are an informal school that facilitates the learning of those who are home schooled. We provide a Christian social environment for learning.,2012,No
https://www.charitynavigator.org/ein/262867596,Ambassador Baskets-Extraordinary Inc.,262867596,,,"Not rated, This organization is not rated, Not currently rated",,"5858 110TH ST, JACKSONVILLE, FL, 32244-2972",,Mission not available,2009,Yes
https://www.charitynavigator.org/ein/262867626,DON & DELORA BLACKERBY,262867626,,,"Not rated, This organization is not rated, Not currently rated",,"FM 40 E 12114, ACUFF, TX, 79364-0000",,Mission not available,2010,Yes
https://www.charitynavigator.org/ein/262866992,JOHNSON HOLT DITCH INC,262866992,,,"Not rated, This organization is not rated, Not currently rated",,"120 DALLY LN, BUFFALO, WY, 82834-9493",,Mission not available,2022,Yes
https://www.charitynavigator.org/ein/262867829,Heritage Generals Homerun Club,262867829,,,"Not rated, This organization is not rated, Not currently rated",,"151 DAFFRON RD, RINGGOLD, GA, 30736-5415",,Mission not available,2016,Yes
https://www.charitynavigator.org/ein/262868623,Cornerstone Baptist Church of Hernando County Inc.,262868623,,,"Not rated, This organization is not rated, Not currently rated",,"13171 TARA ST, SPRING HILL, FL, 34609-1013",,Mission not available,2009,Yes
https://www.charitynavigator.org/ein/262868695,Clinton Cross Country Booster Club,262868695,,,"Not rated, This organization is not rated, Not currently rated",,"221 VIEWPOINTE CV, CLINTON, MS, 39056-6079",,Mission not available,2014,Yes
https://www.charitynavigator.org/ein/262868769,Hypatia Inc.,262868769,,,"Not rated, This organization is not rated, Not currently rated",,"578 COLINA VIS, VENTURA, CA, 93003-1354",,Mission not available,1986,Yes
https://www.charitynavigator.org/ein/262868166,Coral Ridge Korean American Presbyterian Church Inc.,262868166,,,"Not rated, This organization is not rated, Not currently rated",,"2600 SW 85TH AVE, DAVIE, FL, 33328-1206",,Evangelical religious activities to help people find God love the church distransforming communities,2016,Yes
https://www.charitynavigator.org/ein/262869034,TEMPLO DE ALABANZA,262869034,,,"Not rated, This organization is not rated, Not currently rated",,"4340 ALISON JANE DR NE, KENNESAW, GA, 30144-1714",,Mission not available,1964,Yes
https://www.charitynavigator.org/ein/262869247,Stillwaters at Riverside,262869247,,,"Not rated, This organization is not rated, Not currently rated",,"604 INGALLS AVE, PASCAGOULA, MS, 39567-4934",,Mission not available,2009,Yes
https://www.charitynavigator.org/ein/262869386,Hope For Paws,262869386,92%,4,,http://WWW.HOPEFORPAWS.ORG,"3940 Laurel Canyon Blvd #140, Studio City, CA, 91604",310-880-1416,HOPE FOR PAWS RESCUES DOGS AND ALL OTHER ANIMALS WHO ARE SUFFERING ON THE STREETS AND IN SHELTERS. OUR GOAL IS TO EDUCATE PEOPLE ON THE IMPORTANCE OF COMPANION ANIMA ... (More),2008,No
https://www.charitynavigator.org/ein/262869738,Ycab International Inc.,262869738,,,"Not rated, This organization is not rated, Not currently rated",,"5555 GLENRIDGE CONNECTOR, ATLANTA, GA, 30342-4759",,"YCAB International's mission is to empower youth through a holistic development program. Previously the organization was inactive, but during COVID-19 Pandemic was i ... (More)",2010,Yes
https://www.charitynavigator.org/ein/262870689,Ted and Joyce Smith Family Foundation,262870689,,,"Not rated, This organization is not rated, Not currently rated",,"PO BOX 8799, FRESNO, CA, 93747-8799",,Mission not available,2010,Yes
https://www.charitynavigator.org/ein/262868726,Center Street Ministries,262868726,,,"Not rated, This organization is not rated, Not currently rated",,"9337-B KATY FREEWAY NO 263, HOUSTON, TX, 77024-1515",,Mission not available,2009,Yes
https://www.charitynavigator.org/ein/262870528,Dfw Connection Point Church Inc.,262870528,,,"Not rated, This organization is not rated, Not currently rated",,"PO BOX 1086, WYLIE, TX, 75098-1086",,Mission not available,2019,Yes
https://www.charitynavigator.org/ein/262872406,Dharma Treasure Inc.,262872406,,,"Not rated, This organization is not rated, Not currently rated",,"PO BOX 232, PEARCE, AZ, 85625-0232",,Mission not available,2009,Yes
https://www.charitynavigator.org/ein/262872587,Evergreen Development Network,262872587,69%,2,,http://networkcharterschool.net,"2550 PORTLAND ST, EUGENE, OR, 97405-3127",541-344-1229,"Evergreen Development Network (EDN) provides educational and administrative services, at cost, to Network Charter School. EDN owns and manages the building which is ... (More)",2010,No
https://www.charitynavigator.org/ein/262872689,Ce Blake Ministries Inc.,262872689,,,"Not rated, This organization is not rated, Not currently rated",,"3045 CRENSHAW BLVD, LOS ANGELES, CA, 90016-4264",323-733-8300,"CHRIST CENTERED MINISTERIAL SERMONS: TO PRIMARILY OFFER ""CHRIST"" CENTERED MINISTERIAL SERMONS & ATTEND SPEAKING ENGAGEMENTS AS REQUESTED FROM RECOGNIZED CLERGY WITH ... (More)",2009,Yes
https://www.charitynavigator.org/ein/262872486,Jet City Rollerderby,262872486,,,"Not rated, This organization is not rated, Not currently rated",,"PO BOX 3401, EVERETT, WA, 98213-8401",,Mission not available,2009,Yes
https://www.charitynavigator.org/ein/262874268,ORANGE COUNTY BONSAI SOCIETY INC,262874268,,,"Not rated, This organization is not rated, Not currently rated",,"409 S REDWOOD AVE, BREA, CA, 92821-5418",,Mission not available,2024,Yes
https://www.charitynavigator.org/ein/262874057,The Lake Sumter Lions Charities Inc.,262874057,,,"Not rated, This organization is not rated, Not currently rated",,"9357 SE 176TH SAFFOLD ST, THE VILLAGES, FL, 32162-3816",,Mission not available,2008,Yes
https://www.charitynavigator.org/ein/262874447,Sanctuary of Praise Church Houston Texas,262874447,,,"Not rated, This organization is not rated, Not currently rated",,"12918 OLD PINE LANE, HOUSTON, TX, 77015-0000",,Mission not available,2009,Yes
https://www.charitynavigator.org/ein/262874282,Beacon Academy of Nevada,262874282,72%,2,,http://WWW.BANV.ORG,"7360 W FLAMINGO RD, LAS VEGAS, NV, 89147-5404",,"TO OFFER AT-RISK HIGH SCHOOL STUDENTS THE CHOICE OF AN INNOVATIVE AND RELEVANT EDUCATION, WHICH PROVIDES THE FLEXIBILITY AND SUPPORT TO GRADUATE FROM HIGH SCHOOL WIT ... (More)",2021,No
https://www.charitynavigator.org/ein/262875281,Skyhill of Northern Colorado Inc.,262875281,,,"Not rated, This organization is not rated, Not currently rated",,"6501 BRITTANY ST, FORT COLLINS, CO, 80525-5918",,Mission not available,2009,Yes
https://www.charitynavigator.org/ein/262875686,KNIGHTS OF COLUMBUS,262875686,,,"Not rated, This organization is not rated, Not currently rated",,"1425 E SHELBY DR, MEMPHIS, TN, 38116-7219",,Mission not available,1940,Yes
https://www.charitynavigator.org/ein/262875548,Community Worship Center of Perryton Inc.,262875548,,,"Not rated, This organization is not rated, Not currently rated",,"PO BOX 845, PERRYTON, TX, 79070-0845",,Mission not available,2008,Yes
https://www.charitynavigator.org/ein/262876893,Lung Transplant Support Organization Inc.,262876893,,,"Not rated, This organization is not rated, Not currently rated",,"PO BOX 13322, PHOENIX, AZ, 85002-3322",,Mission not available,2009,Yes
https://www.charitynavigator.org/ein/262876575,Sonntag Family Foundation,262876575,,,"Not rated, This organization is not rated, Not currently rated",,"5202 E EXETER BLVD, PHOENIX, AZ, 85018-3011",,Mission not available,2010,Yes
https://www.charitynavigator.org/ein/262877043,HABITAT FOR HUMANITY INTERNATIONAL INC,262877043,83%,3,,http://www.habitatmontezumaorg,"10 W MAIN ST STE 101, CORTEZ, CO, 81321-3145",970-565-8312,"Seeking to put God's love into action, Habitat for Humanity of Montezuma County brings people together to build homes, communities, and hope. The organization also h ... (More)",1987,No
https://www.charitynavigator.org/ein/262877520,The Good Shepherd Residential Services,262877520,,,"Not rated, This organization is not rated, Not currently rated",,"3604 FAIRMEADE DR, NASHVILLE, TN, 37218-1603",,Mission not available,2015,Yes
https://www.charitynavigator.org/ein/262877564,Larry David Foundation Inc.,262877564,,,"Not rated, This organization is not rated, Not currently rated",,"11812 SAN VICENTE BLVD 4TH FL, LOS ANGELES, CA, 90049-6625",,Mission not available,2008,Yes
https://www.charitynavigator.org/ein/262876976,Hellenic Community Foundation,262876976,36%,0,,http://WWW.HCFSLC.ORG,"PO BOX 520370, SALT LAKE CTY, UT, 84152-0370",801-931-9399,"TO DEVELOP AND OPERATE A COMMUNITY CENTER AND ENGAGE IN RELATED CHARITABLE AND EDUCATIONAL PURPOSES TO SUPPORT THE EDUCATION, CULTURE, AND HERITAGE OF THE GREEK COMM ... (More)",2009,No
https://www.charitynavigator.org/ein/262878035,OUR DAILY BREAD MINISTRIES,262878035,,,"Not rated, This organization is not rated, Not currently rated",http://www.dailybreadcc.org/,"1108 DOUGLAS ST, CRESCENT CITY, CA, 95531-2440",707-464-7771,"FEED THE BODY, SOUL AND SPIRIT WITH HOT MEALS AND EMERGENCY FOOD FOR THE HUNGRY, CLOTHING AND BEDDING AND LIFE RECOVERY DRUG, ALCOHOL AND SPIRITUAL COUNSELING AT NO ... (More)",1970,Yes
https://www.charitynavigator.org/ein/262878181,ALBANY DOUGHERTY ECONOMIC DEVELOPMENT COMMISSION INC,262878181,,,"Not rated, This organization is not rated, Not currently rated",,"125 PINE AVE STE 200, ALBANY, GA, 31701-4810",229-434-0044,"THE ORGANIZATION'S FOCUS IS ON BUSINESS RECRUITMENT AND DEVELOPMENT, BUSINESS RETENTION AND EXPANSION, AND MARKETING AND RESEARCH FOR THE ALBANY-DOUGHERTY COUNTY, GE ... (More)",2010,Yes
https://www.charitynavigator.org/ein/262878472,10 Women of Hope Inc.,262878472,,,"Not rated, This organization is not rated, Not currently rated",,"PO BOX 1263, MARIETTA, GA, 30061-1263",,Mission not available,2009,Yes
