url,name,ein,score,star_rating,keywords,website,address,phone,organization_mission,IRS_ruling_year,contain_keywords
https://www.charitynavigator.org/ein/743229638,John D Mineck Foundation,743229638,94%,4,,,"19 OLD COUNTY RD, HINGHAM, MA, 02043-3519",781-741-5123,MAKING GRANTS FOR CHARITABLE AND EDUCATIONAL PURPOSES IN THE MEMORY OF JOHN D. MINECK,2007,No
https://www.charitynavigator.org/ein/743229742,Lamoille County Unit for Special Investigations,743229742,,,"Not currently rated, Not rated, This organization is not rated",http://WWW.LAMOILLESIU.ORG,"PO BOX 16, HYDE PARK, VT, 05655-0016",802-851-8116,"LCSIU IS A MULTI-DISCIPLINARY TASK FORCE CREATED TO CONDUCT CRIMINAL INVESTIGATIONS, AND PROVIDE VICTIM SERVICES IN RESPONSE TO REPORTS OF CHILD SEXUAL ABUSE, SEXUAL ... (More)",2009,Yes
https://www.charitynavigator.org/ein/743230002,Central Maine Family Christmas Dinner,743230002,,,"Not currently rated, Not rated, This organization is not rated",,"PO BOX 2712, WATERVILLE, ME, 04903-2712",,Mission not available,2015,Yes
https://www.charitynavigator.org/ein/743230353,Amazing Grace Charismatic Prayer Ministries A Nj Non Profit Corp,743230353,,,"Not currently rated, Not rated, This organization is not rated",,"19 ELBERTA RD, MAPLEWOOD, NJ, 07040-1805",,Mission not available,2018,Yes
https://www.charitynavigator.org/ein/743230404,Wrentham Elementary Schools Trust Inc.,743230404,,,"Not currently rated, Not rated, This organization is not rated",,"PO BOX 852, WRENTHAM, MA, 02093-0852",,Mission not available,2017,Yes
https://www.charitynavigator.org/ein/743230488,Friends of Teddy Ebersols Red Sox Fields Inc.,743230488,,,"Not currently rated, Not rated, This organization is not rated",,"4 JERSEY ST, BOSTON, MA, 02215-4148",,Mission not available,2007,Yes
https://www.charitynavigator.org/ein/743230952,Lakeland Lacrosse Association,743230952,,,"Not currently rated, Not rated, This organization is not rated",,"PO BOX 751, RINGWOOD, NJ, 07456-0751",,Mission not available,2008,Yes
https://www.charitynavigator.org/ein/743231035,MARYKNOLL LAY MISSIONERS FOUNDATION,743231035,,,"Not currently rated, Not rated, This organization is not rated",,"PO BOX 307, MARYKNOLL, NY, 10545-0307",,Mission not available,1946,Yes
https://www.charitynavigator.org/ein/743231209,TRINITY TEMPLE CHURCH OF GOD IN CHRIST,743231209,,,"Not currently rated, Not rated, This organization is not rated",,"285 DIXWELL AVE, NEW HAVEN, CT, 06511-3417",,Mission not available,1969,Yes
https://www.charitynavigator.org/ein/743231404,Maina Foundation,743231404,83%,3,,,"8 PEPPERMINT RDG, OLD LYME, CT, 06371-2803",860-434-3984,"INCREASE BREAST CANCER AWARENESS, EARLY SCREENING AND DIAGNOSIS OF BREAST CANCER AND WORK WITH THE HOSPITALS TO HELP ECONOMICALLY DISADVANTAGED PATIENTS WITH CANCER ... (More)",2008,No
https://www.charitynavigator.org/ein/743232291,Cross School Past Students Association Inc.,743232291,73%,2,,http://crosspschool.com,"1029 E 227TH ST, BRONX, NY, 10466-4817",718-909-8960,SEE ATTACHED COPY OF MISSION STATEMENT,2012,No
https://www.charitynavigator.org/ein/743232315,Transformational Education Network Inc.,743232315,,,"Not currently rated, Not rated, This organization is not rated",,"9845 WESLEY RD, HOUGHTON, NY, 14744-8740",,Mission not available,2013,Yes
https://www.charitynavigator.org/ein/743233437,Holt Association of America Inc.,743233437,,,"Not currently rated, Not rated, This organization is not rated",,"295 PELHAM ST, METHUEN, MA, 01844-1476",,Mission not available,2016,Yes
https://www.charitynavigator.org/ein/743234212,Emmanual Voice Outreach Ministry,743234212,,,"Not currently rated, Not rated, This organization is not rated",,"PO BOX 93, GLENRIDGE, NJ, 07028-0093",,Mission not available,2009,Yes
https://www.charitynavigator.org/ein/743234491,Nantucket Dreamland,743234491,80%,3,,http://www.nantucketdreamland.org/,"P.O. Box 989, Nantucket, MA, 02554",508-332-4822,"The Nantucket Dreamland is a nonprofit organization dedicated to enriching the cultural and intellectual life of Nantucket by providing year-round films, educational ... (More)",2008,No
https://www.charitynavigator.org/ein/743234570,Providence Community Radio Inc.,743234570,,,"Not currently rated, Not rated, This organization is not rated",,"365 EDDY STREET, PROVIDENCE, RI, 02903-4252",,Mission not available,2023,Yes
https://www.charitynavigator.org/ein/743235343,ALPHA EPSILON PHI SORORITY,743235343,,,"Not currently rated, Not rated, This organization is not rated",,"11 LAKE AVENUE EXT STE 1A, DANBURY, CT, 06811-5258",,Mission not available,2011,Yes
https://www.charitynavigator.org/ein/743236008,VETERANS OF FOREIGN WARS AUXILIARY,743236008,,,"Not currently rated, Not rated, This organization is not rated",,"15 CHURCH ST, PENNSVILLE, NJ, 08070-2122",,Mission not available,2010,Yes
https://www.charitynavigator.org/ein/743236811,Universal Wisdom Fellowship,743236811,,,"Not currently rated, Not rated, This organization is not rated",,"156 SHADOW RIDGE RD, STAMFORD, CT, 06905-1814",,Mission not available,2008,Yes
https://www.charitynavigator.org/ein/743236898,Read to Succeed Inc.,743236898,79%,3,,http://WWW.READTOSUCCEEDRI.ORG,"6 WATER VALLEY RD, HOPE, RI, 02831-1108",401-828-5751,TO ENCOURAGE ELEMENTARY SCHOOL STUDENTS TO READ DURING THEIR SUMMER VACATION.,2009,No
https://www.charitynavigator.org/ein/743238803,Full Gospel Church of Christ of the Apostolic Faith,743238803,,,"Not currently rated, Not rated, This organization is not rated",,"1608 PORTER RD, UNION, NJ, 07083-4322",,Mission not available,2008,Yes
https://www.charitynavigator.org/ein/743238578,Covenant Preparatory School Inc.,743238578,81%,3,,http://WWW.COVENANTPREP.ORG,"474 WOODLAND ST, HARTFORD, CT, 06112-1839",860-547-0289,PROVIDE A CHALLENGING AND SUPPORTIVE LEARNING ENVIRONMENT FOR STUDENTS,2008,No
https://www.charitynavigator.org/ein/743239026,Elizabeth Ave School Pto,743239026,,,"Not currently rated, Not rated, This organization is not rated",,"363 ELIZABETH AVE, SOMERSET, NJ, 08873-1101",,Mission not available,2015,Yes
https://www.charitynavigator.org/ein/743239232,Liberty Resources Behavioral Healthcare Inc.,743239232,,,"Not currently rated, Not rated, This organization is not rated",,"1045 JAMES STREET, SYRACUSE, NY, 13203-2730",,Mission not available,2009,Yes
https://www.charitynavigator.org/ein/743239262,VETERANS OF FOREIGN WARS AUXILIARY,743239262,,,"Not currently rated, Not rated, This organization is not rated",,"100 MAIN ST, LITTLE FERRY, NJ, 07643-1516",,Mission not available,2010,Yes
https://www.charitynavigator.org/ein/743239619,Matan Bsaiser Foundation,743239619,,,"Not currently rated, Not rated, This organization is not rated",,"141 E WILLOW TREE RD, SPRING VALLEY, NY, 10977-0000",,Mission not available,2009,Yes
https://www.charitynavigator.org/ein/743239633,Saint Padre Pio Miracle Foundation Inc.,743239633,,,"Not currently rated, Not rated, This organization is not rated",,"507 ANDOVER CT, MASSAPEQUA, NY, 11758-6554",,Mission not available,2008,Yes
https://www.charitynavigator.org/ein/743239819,Great Peoples Foundation,743239819,,,"Not currently rated, Not rated, This organization is not rated",,"1580 MIRIAM CT, ELMONT, NY, 11003-4401",,Mission not available,2009,Yes
https://www.charitynavigator.org/ein/743240307,Empire State Law Enforcement Training Network,743240307,,,"Not currently rated, Not rated, This organization is not rated",,"PO BOX 66, LEWIS, NY, 12950-0066",,Mission not available,2020,Yes
https://www.charitynavigator.org/ein/743240323,Take Stock Inc.,743240323,,,"Not currently rated, Not rated, This organization is not rated",,"PO BOX 3624, JERSEY CITY, NJ, 07303-3624",,Mission not available,2008,Yes
https://www.charitynavigator.org/ein/743240601,Soul2soulz Inc.,743240601,,,"Not currently rated, Not rated, This organization is not rated",,"1038 UNION STREET B2, BROOKLYN, NY, 11225-1283",,Mission not available,2010,Yes
https://www.charitynavigator.org/ein/743240977,Reconstruction of A Village,743240977,,,"Not currently rated, Not rated, This organization is not rated",,"13026 231ST ST, LAURELTON, NY, 11413-1832",,Mission not available,2008,Yes
https://www.charitynavigator.org/ein/743241709,NEW ENGLAND FRANCHISE ASSOCIATION INC,743241709,,,"Not currently rated, Not rated, This organization is not rated",,"2 MAIN ST STE 300, STONEHAM, MA, 02180-3389",,Mission not available,2015,Yes
https://www.charitynavigator.org/ein/743241723,DEPARTMENT OF NEW YORK VFW AUXILIARY,743241723,,,"Not currently rated, Not rated, This organization is not rated",,"113 KEEFE ST 115, ELMIRA, NY, 14904-2322",,Mission not available,2009,Yes
https://www.charitynavigator.org/ein/743242178,MARINE CORPS LEAGUE,743242178,,,"Not currently rated, Not rated, This organization is not rated",,"2 SHARON CT, SHELTON, CT, 06484-4226",,Mission not available,1946,Yes
https://www.charitynavigator.org/ein/743243227,DEPARTMENT OF NEW YORK VFW AUXILIARY,743243227,,,"Not currently rated, Not rated, This organization is not rated",,"111-113DEER STREET, DUNKIRK, NY, 14048-1609",,Mission not available,2009,Yes
https://www.charitynavigator.org/ein/743243566,RUTGERS THE STATE UNIVERSITY OF NJ,743243566,,,"Not currently rated, Not rated, This organization is not rated",,"2 ACADEMY DR, WESTAMPTON, NJ, 08060-3826",,Mission not available,2013,Yes
https://www.charitynavigator.org/ein/743244042,RUTGERS THE STATE UNIVERSITY OF NJ,743244042,,,"Not currently rated, Not rated, This organization is not rated",,"1623 WHITESVILLE RD, TOMS RIVER, NJ, 08755-1166",,Mission not available,2013,Yes
https://www.charitynavigator.org/ein/743244044,RUTGERS THE STATE UNIVERSITY OF NJ,743244044,,,"Not currently rated, Not rated, This organization is not rated",,"1623 WHITESVILLE RD, TOMS RIVER, NJ, 08755-1166",,Mission not available,2013,Yes
https://www.charitynavigator.org/ein/743244488,Animal Zone International Inc.,743244488,,,"Not currently rated, Not rated, This organization is not rated",,"109 THIRD AVENUE T 1, NEW YORK, NY, 10003-0000",,Mission not available,2008,Yes
https://www.charitynavigator.org/ein/743245639,DEPARTMENT OF NEW YORK VFW AUXILIARY,743245639,,,"Not currently rated, Not rated, This organization is not rated",,"74 MULCAHY BLVD, ROCHESTER, NY, 14624-4480",,Mission not available,2009,Yes
https://www.charitynavigator.org/ein/743245728,New York Covenant Community Development Corporation,743245728,,,"Not currently rated, Not rated, This organization is not rated",,"500 MAIN ST, NEW ROCHELLE, NY, 10801-6304",,Mission not available,2008,Yes
https://www.charitynavigator.org/ein/743246381,L Arche D Alliance Full Gospel Apostolic Church of God Inc.,743246381,,,"Not currently rated, Not rated, This organization is not rated",,"PO BOX 10731, NEWBURGH, NY, 12552-0731",,Mission not available,2008,Yes
https://www.charitynavigator.org/ein/743248920,Bridgewell Merrimac Housing Corporation,743248920,62%,2,,http://WWW.BRIDGEWELL.ORG,"10 DEARBORN ROAD, PEABODY, MA, 01960-8836",339-883-2115,LOW INCOME HOUSING FOR THE HANDICAPPED,2008,No
https://www.charitynavigator.org/ein/743246568,AMERICAN FEDERATION OF TEACHERS,743246568,,,"Not currently rated, Not rated, This organization is not rated",,"424 CHURCHILL LN, FAYETTEVILLE, NY, 13066-2543",,Mission not available,1967,Yes
https://www.charitynavigator.org/ein/743249134,KENILWORTH BAPTIST CHURCH,743249134,,,"Not currently rated, Not rated, This organization is not rated",,"24 KENILWORTH PL, BROOKLYN, NY, 11210-2328",,Mission not available,1955,Yes
https://www.charitynavigator.org/ein/743250228,Emek Hatalmud,743250228,,,"Not currently rated, Not rated, This organization is not rated",,"1274 49TH STREET 549, BROOKLYN, NY, 11219-3011",,Mission not available,2015,Yes
https://www.charitynavigator.org/ein/743250377,MASSACHUSETTS BREWERS GUILD,743250377,,,"Not currently rated, Not rated, This organization is not rated",,"PO BOX 2096, FRAMINGHAM, MA, 01703-2096",508-405-9115,TO PROMOTE CRAFT BREWING AND TO PROTECT THE INTERESTS OF CRAFT BREWERS IN MASSACHUSETTS.,2008,Yes
https://www.charitynavigator.org/ein/743251015,Friends of Frost Free Library,743251015,83%,3,,http://WWW.FROSTFREELIBRARY.COM,"PO BOX 743, KEENE, NH, 03431-0743",603-876-4479,PROVIDE CHARITABLE AND EDUCATIONAL SUPPORT FOR THE SERVICES AND PROGRAMS THAT STRENGTHEN FAMILY AND COMMUNITY VALUES OFFERED AT THE FROST FREE LIBRARY.,2014,No
https://www.charitynavigator.org/ein/743251619,COALITION FOR ANIMALS,743251619,,,"Not currently rated, Not rated, This organization is not rated",,"48 MOUNTAIN VIEW LN, PORT MURRAY, NJ, 07865-4081",,Mission not available,2002,Yes
https://www.charitynavigator.org/ein/743251702,Choreo Theatro Center Inc.,743251702,,,"Not currently rated, Not rated, This organization is not rated",,"POULOS 3101 VERNON BLVD 309, ASTORIA, NY, 11106-0000",,Mission not available,2008,Yes
https://www.charitynavigator.org/ein/743252648,Aroostook River Fish and Game Club,743252648,,,"Not currently rated, Not rated, This organization is not rated",,"PO BOX 765, ASHLAND, ME, 04732-0765",,Mission not available,2021,Yes
https://www.charitynavigator.org/ein/743253465,DEPARTMENT OF MASSACHUSETTS VFW AUXILIARY,743253465,,,"Not currently rated, Not rated, This organization is not rated",,"PO BOX 355, HUMAROCK, MA, 02047-0355",,Mission not available,2009,Yes
https://www.charitynavigator.org/ein/743253001,Rockwater Church Inc.,743253001,,,"Not currently rated, Not rated, This organization is not rated",,"14527 GUY R BREWER BLVD, JAMAICA, NY, 11434-4926",,Mission not available,2011,Yes
https://www.charitynavigator.org/ein/743253789,BAR HARBOR MASONIC BUILDING ASSOCIATION,743253789,,,"Not currently rated, Not rated, This organization is not rated",,"1378 ROUTE 102, BAR HARBOR, ME, 04609-0000",,THE MASONIC LODGE BUILDING ASSOCIATION HOLDS THE TITLE TO THE LODGE REAL ESTATE USED TO HOLD LODGE FUNCTIONS AND MEETINGS. THE ASSOCIATION RENTS THE BUILDING TO THE ... (More),2017,Yes
https://www.charitynavigator.org/ein/743254338,Resurrection Kingdom Ministries,743254338,,,"Not currently rated, Not rated, This organization is not rated",,"PO BOX 493, WEST ORANGE, NJ, 07052-0493",,Mission not available,2014,Yes
https://www.charitynavigator.org/ein/743255044,Kick for Nick Foundation Inc.,743255044,,,"Not currently rated, Not rated, This organization is not rated",,"52 TUCKER ST, DANBURY, CT, 06810-5133",,Mission not available,2008,Yes
https://www.charitynavigator.org/ein/743254529,Iglesia De Diof Pentecostal C L A Una Nueva Esperanza,743254529,,,"Not currently rated, Not rated, This organization is not rated",,"100 WALES ST APT 2, ABINGTON, MA, 02351-1882",,Mission not available,2012,Yes
https://www.charitynavigator.org/ein/743255391,MASSACHUSETTS CHAPTER FOR CENTRAL SERVICE PROFESSIONALS MCCSP,743255391,,,"Not currently rated, Not rated, This organization is not rated",,"1888, FRAMINGHAM, MA, 02026-0000",,Mission not available,2010,Yes
https://www.charitynavigator.org/ein/743255712,Warren United Soccer Club Inc.,743255712,,,"Not currently rated, Not rated, This organization is not rated",,"22 GIBSON PL, WASHINGTON, NJ, 07882-1727",,Mission not available,2010,Yes
https://www.charitynavigator.org/ein/743255729,Red Devil Pride Club Inc.,743255729,,,"Not currently rated, Not rated, This organization is not rated",,"PO BOX 157, CTR MORICHES, NY, 11934-0157",,Mission not available,2010,Yes
https://www.charitynavigator.org/ein/743255785,NEW JERSEY STATE FEDERATION OF WOMENS CLUBS,743255785,,,"Not currently rated, Not rated, This organization is not rated",,"PO BOX 7284, N ARLINGTON, NJ, 07031-7284",,Mission not available,1998,Yes
https://www.charitynavigator.org/ein/743256296,Arvin Hart Fire Company,743256296,,,"Not currently rated, Not rated, This organization is not rated",,"PO BOX 288, STILLWATER, NY, 12170-0288",,Mission not available,2015,Yes
https://www.charitynavigator.org/ein/743256459,ST PAULS EVANGELICAL REFORMED CHURCH,743256459,,,"Not currently rated, Not rated, This organization is not rated",,"PO BOX 1160, PERTH AMBOY, NJ, 08862-1160",,Mission not available,1986,Yes
https://www.charitynavigator.org/ein/743256793,Iglesia Evangelica Pentecostal Fuente De Vida Eterna,743256793,,,"Not currently rated, Not rated, This organization is not rated",,"270 CHESTNUT ST, LYNN, MA, 01902-2855",,Mission not available,2011,Yes
https://www.charitynavigator.org/ein/743257714,MOUNTAIN VIEW TABERNACLE,743257714,,,"Not currently rated, Not rated, This organization is not rated",,"PO BOX 53, WATERVILLE, VT, 05492-0053",,Mission not available,1964,Yes
https://www.charitynavigator.org/ein/743257979,Advocacy Coalition for Positive Change,743257979,,,"Not currently rated, Not rated, This organization is not rated",,"140 DEKRUIF PLACE, BRONX, NY, 10475-2201",,Mission not available,2009,Yes
https://www.charitynavigator.org/ein/743258052,MIDNIGHT SUN INC II,743258052,,,"Not currently rated, Not rated, This organization is not rated",,"10 STATE HOUSE SQUARE 12TH FLOOR, HARTFORD, CT, 06103-3602",860-616-9200,The organization's mission is to act as a real property title holding company.,2008,Yes
https://www.charitynavigator.org/ein/743258254,A VOICE IN THE WILDERNESS MINISTRIES,743258254,,,"Not currently rated, Not rated, This organization is not rated",,"24 AMHERST RD, STOUGHTON, MA, 02072-1706",,Mission not available,1991,Yes
https://www.charitynavigator.org/ein/743259263,NATIONAL ASSOCIATION OF GOVERNMENT EMPLOYEES LOCAL R1-195,743259263,,,"Not currently rated, Not rated, This organization is not rated",,"220 BINNEY ST, CAMBRIDGE, MA, 02142-1026",,Mission not available,2009,Yes
https://www.charitynavigator.org/ein/743259015,Frank and Ruby Cousins Memorial Scholarship Foundation Inc.,743259015,,,"Not currently rated, Not rated, This organization is not rated",,"246 HIGH ST, NEWBURYPORT, MA, 01950-3827",,Mission not available,2009,Yes
https://www.charitynavigator.org/ein/743260325,Midcoast Printmakers Inc.,743260325,,,"Not currently rated, Not rated, This organization is not rated",,"PO BOX, SOUTH BRISTOL, ME, 04568-0000",,Mission not available,2009,Yes
https://www.charitynavigator.org/ein/743260512,VFW AUXILIARY DEPARTMENT OF CONNECTICUT INC,743260512,,,"Not currently rated, Not rated, This organization is not rated",,"7 WINDSOR AVE, PLAINFIELD, CT, 06374-1037",,Mission not available,2009,Yes
https://www.charitynavigator.org/ein/743260853,Music Makers Foundation Inc.,743260853,,,"Not currently rated, Not rated, This organization is not rated",,"883 CAMBRIDGE ST, CAMBRIDGE, MA, 02141-1430",,Mission not available,2023,Yes
https://www.charitynavigator.org/ein/743260986,Connecticut Social Work Oncology Group Inc.,743260986,,,"Not currently rated, Not rated, This organization is not rated",,"120 PROSPECT ST APT 50, RIDGEFIELD, CT, 06877-4649",,Mission not available,2009,Yes
https://www.charitynavigator.org/ein/743261256,Senior Agenda Coalition of Rhode Island,743261256,,,"Not currently rated, Not rated, This organization is not rated",,"70 BATH ST, PROVIDENCE, RI, 02908-4849",401-440-4165,To improve Rhode Island's long term care system for seniors.,2009,Yes
https://www.charitynavigator.org/ein/743261554,Striving Together Equals Progress Inc.,743261554,,,"Not currently rated, Not rated, This organization is not rated",,"PO BOX 22192, NEWARK, NJ, 07101-2192",,Mission not available,2016,Yes
https://www.charitynavigator.org/ein/743262299,AMERICAN LEGION AUXILIARY,743262299,,,"Not currently rated, Not rated, This organization is not rated",,"PO BOX 83, WESTFORD, NY, 13488-0083",,Mission not available,1946,Yes
https://www.charitynavigator.org/ein/746052440,Unico National Incorporated,746052440,33%,0,,http://WWW.UNICO.ORG,"271 US HIGHWAY 46 STE A, FAIRFIELD, NJ, 07004-2440",973-808-0035,THE ORGANIZATION IS DEDICATED TO PROMOTING A POSITIVE IMAGE OF THE ITALIAN-AMERICAN COMMUNITY,2015,No
https://www.charitynavigator.org/ein/746060868,LAURA ELDRIDGE HOSPITAL ASSOCIATION,746060868,,,"Not currently rated, Not rated, This organization is not rated",,"40 DANBURY ROAD PO BOX 810, WILTON, CT, 06897-0000",203-761-2000,VOLUNTARY MEDICAL SERVICES FOR RETIRED EMPLOYEES,1945,Yes
https://www.charitynavigator.org/ein/746075205,ALPHA LAMBDA DELTA,746075205,,,"Not currently rated, Not rated, This organization is not rated",,"6800 PITTSFORD PALMYRA RD STE 340, FAIRPORT, NY, 14450-3514",,Mission not available,1965,Yes
https://www.charitynavigator.org/ein/746080434,Cedam International,746080434,,,"Not currently rated, Not rated, This organization is not rated",,"2 FOX RD, CROTON HDSN, NY, 10520-2004",,Mission not available,1967,Yes
https://www.charitynavigator.org/ein/746087318,ALPHA LAMBDA DELTA,746087318,,,"Not currently rated, Not rated, This organization is not rated",,"6800 PITTSFORD PALMYRA RD STE 340, FAIRPORT, NY, 14450-3514",,Mission not available,1951,Yes
https://www.charitynavigator.org/ein/746087319,ALPHA LAMBDA DELTA,746087319,,,"Not currently rated, Not rated, This organization is not rated",,"6800 PITTSFORD PALMYRA RD STE 340, FAIRPORT, NY, 14450-3514",,Mission not available,1951,Yes
https://www.charitynavigator.org/ein/746087320,ALPHA LAMBDA DELTA,746087320,,,"Not currently rated, Not rated, This organization is not rated",,"6800 PITTSFORD PALMYRA RD STE 340, FAIRPORT, NY, 14450-3514",,Mission not available,1951,Yes
https://www.charitynavigator.org/ein/746104449,ARMY AVIATION ASSOCIATION OF AMERICA INC,746104449,,,"Not currently rated, Not rated, This organization is not rated",,"593 MAIN ST, MONROE, CT, 06468-2806",,Mission not available,1967,Yes
https://www.charitynavigator.org/ein/746107017,ALPHA LAMBDA DELTA,746107017,,,"Not currently rated, Not rated, This organization is not rated",,"6800 PITTSFORD PALMYRA RD STE 340, FAIRPORT, NY, 14450-3514",,Mission not available,1968,Yes
https://www.charitynavigator.org/ein/746345100,Arnold J and Irene B Kocurek Family Foundation,746345100,,,"Not currently rated, Not rated, This organization is not rated",,"PO BOX 1532, PENNINGTON, NJ, 08534-0691",,Mission not available,1988,Yes
https://www.charitynavigator.org/ein/746516326,Co Tw Frank C Meyer Trust 2 16-230330,746516326,,,"Not currently rated, Not rated, This organization is not rated",,"C/O NBT BANK NA 52 S BROAD ST, NORWICH, NY, 13815-0000",,Mission not available,2003,Yes
https://www.charitynavigator.org/ein/746517836,IRR TRUST UNDER AGREEMENT DOROTHY VGRIFFITHS CHARITIES,746517836,,,"Not currently rated, Not rated, This organization is not rated",,"C/O NBT BANK NA 52 S BROAD ST, NORWICH, NY, 13815-0000",,Mission not available,,Yes
https://www.charitynavigator.org/ein/746521599,Gustavo Posse Foundation,746521599,,,"Not currently rated, Not rated, This organization is not rated",,"100 BELVIDERE ST 10TH FLOOR E, BOSTON, MA, 02199-7622",,Mission not available,2003,Yes
https://www.charitynavigator.org/ein/746522970,Masliansky Family Charitable Foundation,746522970,,,"Not currently rated, Not rated, This organization is not rated",,"728 BERRY CT, W HEMPSTEAD, NY, 11552-3401",,Mission not available,2003,Yes
https://www.charitynavigator.org/ein/746528872,KPMG LLP HEALTH PLANS TR,746528872,,,"Not currently rated, Not rated, This organization is not rated",,"3 CHESTNUT RIDGE RD, MONTVALE, NJ, 07645-1842",314-244-4042,PROVISION OF HEALTH AND DENTAL BENEFITS TO ELIGIBLE MEMBERS,2003,Yes
https://www.charitynavigator.org/ein/746531573,Judith Ann Labieniec Charitable Foundation,746531573,,,"Not currently rated, Not rated, This organization is not rated",,"27 TALL TIMBERS DR, FARMINGTON, CT, 06032-3179",,Mission not available,2004,Yes
https://www.charitynavigator.org/ein/746547247,Kennard L Bowlen Charitable Tr,746547247,,,"Not currently rated, Not rated, This organization is not rated",,"PO BOX 332, NEWBURYPORT, MA, 01950-0432",,Mission not available,2006,Yes
https://www.charitynavigator.org/ein/746558690,Arthur J Roth Family Foundation,746558690,,,"Not currently rated, Not rated, This organization is not rated",,"10 W COBBLE HILL RD, LOUDONVILLE, NY, 12211-1308",,Mission not available,2007,Yes
https://www.charitynavigator.org/ein/750761120,ELECTRICAL APPARATUS SERVICE ASSOCIATION INC,750761120,,,"Not currently rated, Not rated, This organization is not rated",,"43 TURPIN ST, ROCHESTER, NY, 14621-3918",,Mission not available,1949,Yes
https://www.charitynavigator.org/ein/751260145,Tupelo Press Inc.,751260145,64%,2,,http://WWW.TUPELOPRESS.ORG,"60 ROBERTS DRIVE, NORTH ADAMS, MA, 01247-3254",,TO PROVIDE THE COMMUNITY WITH AN INDEPENDENT LITERARY PRESS.,2003,No
https://www.charitynavigator.org/ein/751501000,NATIONAL ASSOCIATION FOR PUPIL TRANSPORTATION,751501000,,,"Not currently rated, Not rated, This organization is not rated",http://WWW.NAPT.ORG,"1971 WESTERN AVE, ALBANY, NY, 12203-5066",518-218-0867,"THE ASSOCIATION PROMOTES THE IMPROVEMENT OF ECONOMY AND SAFETY IN PUPIL TRANSPORTATION THROUGH EDUCATION AND AWARENESS, SERVING OVER 1,400 MEMBERS IN NORTH AMERICA.",,Yes
https://www.charitynavigator.org/ein/751563955,ALUMNAE ASSOCIATION OF MOUNT HOLYOKE COLLEGE INC,751563955,,,"Not currently rated, Not rated, This organization is not rated",,"50 COLLEGE ST, SOUTH HADLEY, MA, 01075-1423",,Mission not available,1979,Yes
https://www.charitynavigator.org/ein/751566102,Shirley French Lilac Inc.,751566102,,,"Not currently rated, Not rated, This organization is not rated",,"PO BOX 855, MADISON, CT, 06443-0855",,Mission not available,2004,Yes
https://www.charitynavigator.org/ein/751650769,Jesus to America Inc.,751650769,,,"Not currently rated, Not rated, This organization is not rated",,"71 PENNY DR, CALVERTON, NY, 11933-1131",,Mission not available,1979,Yes
https://www.charitynavigator.org/ein/751763185,Arbo Ministries,751763185,76%,3,,http://WWW.ARBOMINISTRIES.ORG,"14 CURTIS RD, GILFORD, NH, 03249-7864",800-276-2726,"PREACHING THE GOSPEL OF THE LORD JESUS CHRIST, AND TRAINING AND EDUCATING CHRISTIANS IN THE WORD OF GOD.",1984,No
