url,name,ein,score,star_rating,keywords,website,address,phone,organization_mission,IRS_ruling_year,contain_keywords
https://www.charitynavigator.org/ein/010758839,Dejaco Foundation,010758839,,,"Not rated, Confirmed Revocation, Not currently rated, This organization is not rated, Review Before Proceeding",,"1422 PELICAN PATH, THE VILLAGES, FL, 32162-2207",,Mission not available,2003,Yes
https://www.charitynavigator.org/ein/010758906,Riverwalk Education Foundation Inc.,010758906,81%,3,,http://WWW.SSTSCHOOLS.ORG,"1450 NE LOOP 410, SAN ANTONIO, TX, 78209-1513",210-957-1955,"OUR MISSION DRIVES ACADEMIC AND SOCIO-EMOTIONAL DEVELOPMENT (SEE SCHEDULE O) THROUGH A RIGOROUS COLLEGE PREPARATORY, STEM-BASED LEARNING MODEL. THE MODEL IS ANCHORED ... (More)",2003,No
https://www.charitynavigator.org/ein/010758985,Literacy for Haiti Inc.,010758985,,,"Not currently rated, Not rated, This organization is not rated",,"2610 13TH ST, CLARKSTON, WA, 99403-3206",,Mission not available,2003,Yes
https://www.charitynavigator.org/ein/010759029,International Checkers Association of North America Inc.,010759029,,,"Not currently rated, Not rated, This organization is not rated",,"12472 BERKELEY SQUARE DR, TAMPA, FL, 33626-2542",,Mission not available,2005,Yes
https://www.charitynavigator.org/ein/010759127,Shreveport Scottish Rite Foundation Inc.,010759127,63%,2,,http://shreveportscottishrite.com,"PO BOX 64, SHREVEPORT, LA, 71161-0064",318-221-9713,"TO PROTECT, PRESERVE, MAINTAIN AND RESTORE THE HISTORIC SCOTTISH RITE TEMPLE",2003,No
https://www.charitynavigator.org/ein/010759211,Way Christian Tabernacle,010759211,,,"Not currently rated, Not rated, This organization is not rated",,"1342 GLENWOOD AVE SE, ATLANTA, GA, 30316-2048",,Mission not available,2003,Yes
https://www.charitynavigator.org/ein/010759003,Rashi Academy,010759003,,,"Not currently rated, Not rated, This organization is not rated",,"6665 LONG BEACH BLVD, LONG BEACH, CA, 90805-2055",,Mission not available,2004,Yes
https://www.charitynavigator.org/ein/010759072,Nancy L Nixon Foundation,010759072,,,"Not currently rated, Not rated, This organization is not rated",,"9787 W ROXBURY PL, LITTLETON, CO, 80128-4135",,Mission not available,2003,Yes
https://www.charitynavigator.org/ein/010759859,Calvary Chapel McDonough,010759859,,,"Not currently rated, Not rated, This organization is not rated",,"2980 PHILLIPS BEND XING, BUFORD, GA, 30519-6768",,Mission not available,2003,Yes
https://www.charitynavigator.org/ein/010759872,Middle Tennessee Boxer Rescue Inc.,010759872,,,"Not currently rated, Not rated, This organization is not rated",,"615 BEECH CREEK RD S, BRENTWOOD, TN, 37027-3430",,Mission not available,2003,Yes
https://www.charitynavigator.org/ein/010760063,Janice Larsen Cancer Foundation,010760063,,,"Not currently rated, Not rated, This organization is not rated",,"205 LAKE ST S STE 300, KIRKLAND, WA, 98033-6492",,Mission not available,2004,Yes
https://www.charitynavigator.org/ein/010759380,Spinal Muscular Atrophy Foundation,010759380,,,"Review Before Proceeding, Not currently rated, Not rated, This organization is not rated",,"970 W BROADWAY STE E, JACKSON, WY, 83001-6403",,Mission not available,2003,Yes
https://www.charitynavigator.org/ein/010760115,GEUDAFEST PLANNING COMMITTEE,010760115,,,"Not currently rated, Not rated, This organization is not rated",,"PO BOX 4, GEUDA SPRINGS, KS, 67051-0004",,Mission not available,2003,Yes
https://www.charitynavigator.org/ein/010760132,United Enterprises Development Corporation,010760132,,,"Not currently rated, Not rated, This organization is not rated",,"2745 CAMPBELL ST, KANSAS CITY, MO, 64109-1119",,Mission not available,2023,Yes
https://www.charitynavigator.org/ein/010760054,Richard W Hotes Foundation,010760054,,,"Not currently rated, Not rated, This organization is not rated",,"205 LAKE ST S STE 300, KIRKLAND, WA, 98033-6492",,Mission not available,2004,Yes
https://www.charitynavigator.org/ein/010760434,Pearl Group,010760434,,,"Not currently rated, Not rated, This organization is not rated",,"PO BOX 822, CHATTANOOGA, TN, 37401-0822",,Mission not available,2003,Yes
https://www.charitynavigator.org/ein/010760435,Kingdom Youth Alliance Inc.,010760435,,,"Not currently rated, Not rated, This organization is not rated",,"5301 COUNTY ROAD 220, KINGDOM CITY, MO, 65262-2014",,Mission not available,2004,Yes
https://www.charitynavigator.org/ein/010760544,Waterfront Volunteer Fire Department Inc.,010760544,66%,2,,,"5515 SCOTTSBORO HWY, SCOTTSBORO, AL, 35769-9333",256-582-4895,VOLUNTEER FIRE DEPARTMENT,2003,No
https://www.charitynavigator.org/ein/010760838,Jesus Platform Ministries Inc.,010760838,,,"Not currently rated, Not rated, This organization is not rated",,"PO BOX 142994, FAYETTEVILLE, GA, 30214-6524",,Mission not available,2003,Yes
https://www.charitynavigator.org/ein/010760971,LIVING GRACE CHRISTIAN FELLOWSHIP,010760971,,,"Not currently rated, Not rated, This organization is not rated",,"9246 INGALLS ST, WESTMINSTER, CO, 80031-2820",,Mission not available,1959,Yes
https://www.charitynavigator.org/ein/010761645,Prayer Cathedral International,010761645,,,"Not currently rated, Not rated, This organization is not rated",,"4500 RED CIDER LN, LAS VEGAS, NV, 89130-5152",,Mission not available,2004,Yes
https://www.charitynavigator.org/ein/010761710,Meet the Need Ministries Inc.,010761710,87%,3,,http://www.meettheneed.org,"7853 GUNN HWY 254, TAMPA, FL, 33626-1611",813-527-0222,Meet The Need is organized for the purpose of matching charitable donors and recipients via an Internet website with a Christian orientation and for other religious ... (More),2004,No
https://www.charitynavigator.org/ein/010761875,Los Angeles Press Club,010761875,27%,0,,,"2535 W TEMPLE ST, LOS ANGELES, CA, 90026-4819",818-998-0911,"Education for Journalists. The organization is devoted to improving the spirit of journalism, raising the industry's standards, strengthening its integrity and impro ... (More)",2003,No
https://www.charitynavigator.org/ein/010761876,Starfleet Canine Aid Foundation,010761876,,,"Not currently rated, Not rated, This organization is not rated",,"11684 GERMANY RD, WILTON, CA, 95693-9698",,Mission not available,2003,Yes
https://www.charitynavigator.org/ein/010762198,Generous Hands Ministries Inc.,010762198,,,"Not currently rated, Not rated, This organization is not rated",,"PO BOX 294499, LEWISVILLE, TX, 75029-4499",,Mission not available,2004,Yes
https://www.charitynavigator.org/ein/010761305,New Way Christian Church Inc.,010761305,,,"Not currently rated, Not rated, This organization is not rated",,"313 COOK ST, LOUISVILLE, GA, 30434-1505",,Mission not available,2007,Yes
https://www.charitynavigator.org/ein/010762320,Ministerio Luza Las Naciones Inc.,010762320,52%,1,,,"6700 ANTOINE DR, HOUSTON, TX, 77091-1208",,To preach the Gospel of Jesus Christ.,2014,No
https://www.charitynavigator.org/ein/010762724,All Nations New Harvest Christian Center,010762724,,,"Not currently rated, Not rated, This organization is not rated",,"PO BOX 493908, REDDING, CA, 96049-3908",,Mission not available,2003,Yes
https://www.charitynavigator.org/ein/010763500,EMMANUEL BAPTIST CHURCH OF HOLINESS,010763500,,,"Not currently rated, Not rated, This organization is not rated",,"3420 DAVIE BLVD, FORT LAUDERDALE, FL, 33312-0000",,Mission not available,1969,Yes
https://www.charitynavigator.org/ein/010763618,Rang Jung Yeshe Buddhist Center,010763618,,,"Not currently rated, Not rated, This organization is not rated",,"301 E CAMINO REAL AVE, ARCADIA, CA, 91006-4262",,Mission not available,2004,Yes
https://www.charitynavigator.org/ein/010762954,Potters House Fellowship Worship Center,010762954,,,"Not currently rated, Not rated, This organization is not rated",,"1110 GRAND AVE, JACKSON, MS, 39203-2505",,Mission not available,2003,Yes
https://www.charitynavigator.org/ein/010763758,Camp Jeanne D Arc Foundation,010763758,,,"Not currently rated, Not rated, This organization is not rated",,"848 W 25TH ST UNIT B, HOUSTON, TX, 77008-1897",,Mission not available,2020,Yes
https://www.charitynavigator.org/ein/010764721,Foundation for Healthy Living,010764721,,,"Review Before Proceeding, Not currently rated, Not rated, This organization is not rated",,"8677 WILSHIRE BLVD, BEVERLY HILLS, CA, 90211-2927",,Mission not available,2003,Yes
https://www.charitynavigator.org/ein/010763297,Antioch A Full Gospel Baptist Church,010763297,,,"Not currently rated, Not rated, This organization is not rated",,"5247 FORD ST, BATON ROUGE, LA, 70811-5620",,Mission not available,2008,Yes
https://www.charitynavigator.org/ein/010764341,Coalesce Services Inc.,010764341,,,"Not currently rated, Not rated, This organization is not rated",,"1690 NW DENNIS GREEN RD, BRISTOL, FL, 32321-2980",,Mission not available,2004,Yes
https://www.charitynavigator.org/ein/010763815,Scotts Temple Church of the Living God,010763815,,,"Not currently rated, Not rated, This organization is not rated",,"224 GREENRIDGE CIR, LUFKIN, TX, 75904-0841",,Mission not available,2003,Yes
https://www.charitynavigator.org/ein/010764856,Florida C E R T Association Inc.,010764856,,,"Not currently rated, Not rated, This organization is not rated",,"196 MCLEOD RD, FROSTPROOF, FL, 33843-9455",,Mission not available,2014,Yes
https://www.charitynavigator.org/ein/010764879,Coastal Baseball Association,010764879,,,"Not currently rated, Not rated, This organization is not rated",,"209 APACHE RD, BRUNSWICK, GA, 31525-8524",,Mission not available,2003,Yes
https://www.charitynavigator.org/ein/010765234,New Building Stones,010765234,,,"Not currently rated, Not rated, This organization is not rated",,"2313 W JEFFERSON BLVD, LOS ANGELES, CA, 90018-3743",,Mission not available,2014,Yes
https://www.charitynavigator.org/ein/010764731,Texas County Museum of Art and History,010764731,33%,0,,,"PO BOX 344, LICKING, MO, 65542-0344",573-674-4799,To exhibit artifacts and fine art of historic and aesthetic value from around the world. To collect and preserve local history.,2003,No
https://www.charitynavigator.org/ein/010765610,Emmanuel International Ministry,010765610,,,"Not currently rated, Not rated, This organization is not rated",,"4546 NORTH ST APT 5247, BATON ROUGE, LA, 70806-3404",,Mission not available,2006,Yes
https://www.charitynavigator.org/ein/010765746,LITTLE LEAGUE BASEBALL INC,010765746,,,"Not currently rated, Not rated, This organization is not rated",,"4877 RR 1120, RIO FRIO, TX, 78879-7901",,Mission not available,1967,Yes
https://www.charitynavigator.org/ein/010764975,Crossroads Community Church,010764975,,,"Not currently rated, Not rated, This organization is not rated",,"25715 W 127TH ST, OLATHE, KS, 66061-9233",,Mission not available,2003,Yes
https://www.charitynavigator.org/ein/010762420,Chief Cliff Fire Service Area,010762420,,,"Not currently rated, Not rated, This organization is not rated",,"PO BOX 18, DAYTON, MT, 59914-0018",,Mission not available,2016,Yes
https://www.charitynavigator.org/ein/010765869,All Faith Church Inc.,010765869,,,"Not currently rated, Not rated, This organization is not rated",,"2823 MARCUS AVE, ST LOUIS, MO, 63115-1902",,Mission not available,2007,Yes
https://www.charitynavigator.org/ein/010765884,North Clackamas Christian School,010765884,81%,3,,http://WWW.NCCHRISTIANSCHOOL.COM,"19575 SEBASTIAN WAY, OREGON CITY, OR, 97045-8128",503-655-5961,"NORTH CLACKAMAS CHRISTIAN SCHOOL PARTNERS WITH CHRISTIAN PARENTS IN PROVIDING THEIR STUDENTS WITH A BIBLICALLY-BASED EDUCATION THAT PURSUES EXCELLENCE IN SPIRITUAL, ... (More)",2004,No
https://www.charitynavigator.org/ein/010765811,Carrie Dickerson Foundation,010765811,,,"Not currently rated, Not rated, This organization is not rated",,"PO BOX 652, OOLOGAH, OK, 74053-0652",,Mission not available,2003,Yes
https://www.charitynavigator.org/ein/010766568,Hands of Faith Ministry,010766568,,,"Not currently rated, Not rated, This organization is not rated",,"19007 LAKE RIDGE CT, MANVEL, TX, 77578-3794",,Mission not available,2014,Yes
https://www.charitynavigator.org/ein/010766792,Mowa Choctaw Cultural Center,010766792,,,"Not currently rated, Not rated, This organization is not rated",,"1080 RED FOX ROAD WEST, MOUNT VERNON, AL, 36560-2629",,Mission not available,2003,Yes
https://www.charitynavigator.org/ein/010766844,Furkids Animal Rescue and Shelters,010766844,98%,4,,http://furkids.org/,"5235 Union Hill Road, Cumming, GA, 30040",770-613-0880,"Furkids, headquartered in Atlanta, GA, operates the largest cage-free, no-kill shelter in the Southeast for rescued cats, and Sadie's Place, a no-kill shelter for do ... (More)",2003,No
https://www.charitynavigator.org/ein/010766887,His Hands Extended Inc.,010766887,,,"Not currently rated, Not rated, This organization is not rated",,"2614 CASHEL LN, POWDER SPGS, GA, 30127-1775",,Mission not available,2003,Yes
https://www.charitynavigator.org/ein/010767063,St. Rebekah Coptic Orthodox Church Inc.,010767063,,,"Not currently rated, Not rated, This organization is not rated",,"PO BOX 770268, ORLANDO, FL, 32877-0268",,Mission not available,2005,Yes
https://www.charitynavigator.org/ein/010767549,Travis County Women Lawyers Foundation,010767549,,,"Not currently rated, Not rated, This organization is not rated",,"PO BOX 1386, AUSTIN, TX, 78767-1386",,Mission not available,2003,Yes
https://www.charitynavigator.org/ein/010768191,Institute of Archaeomythology,010768191,,,"Review Before Proceeding, Not currently rated, Not rated, This organization is not rated",,"1645 FURLONG RD, SEBASTOPOL, CA, 95472-9416",,Mission not available,2003,Yes
https://www.charitynavigator.org/ein/010768301,Karnes County Humane Organization,010768301,76%,3,,http://KARNESCOUNTYHUMANE.ORG,"PO BOX 128, KENEDY, TX, 78119-0128",830-583-2212,THE MISSION OF THE KARNES COUNTY HUMANE ORGANIZATION (KCHO) IS TO ASSIST KARNES COUNTY ANIMAL CONTROL FACILITIES AND THE LOCAL COMMUNITY MEMBERS IN THEIR EFFORTS TO ... (More),2014,No
https://www.charitynavigator.org/ein/010768318,Pentecostal Maranatha Gospel Church Dallas,010768318,79%,3,,,"2319 GUTHRIE RD, GARLAND, TX, 75043-5945",214-923-9370,Member Assembly to worship God and fellowship,2005,No
https://www.charitynavigator.org/ein/010768390,Wilderness Ranch Firefighters Association Inc.,010768390,,,"Not currently rated, Not rated, This organization is not rated",,"421 RIMVIEW DR, BOISE, ID, 83716-3141",,Mission not available,2004,Yes
https://www.charitynavigator.org/ein/010768694,Lindsay Educational Foundation,010768694,,,"Not currently rated, Not rated, This organization is not rated",,"PO BOX 302, LINDSAY, OK, 73052-0302",,Mission not available,2003,Yes
https://www.charitynavigator.org/ein/010768799,VICTORY ASSEMBLY OF GOD CHURCH,010768799,,,"Not currently rated, Not rated, This organization is not rated",,"1055 MIDDLE TENNESSEE, MURFREESBORO, TN, 37130-0000",,Mission not available,1964,Yes
https://www.charitynavigator.org/ein/010768932,Broken Walls International Inc.,010768932,76%,3,,http://BROKENWALLSINTERNATIONAL.ORG,"1420 NW GILMAN BLVD 2241, ISSAQUAH, WA, 98027-5394",360-790-3892,"SUPPORT ""CHILDREN AT RISK"" IN ROMANIA.",2004,No
https://www.charitynavigator.org/ein/010769149,INTERNATIONAL UNION OF PAINTERS AND ALLIED TRADES,010769149,,,"Not currently rated, Not rated, This organization is not rated",,"5425 SPINDLE DR, HOUSTON, TX, 77086-4023",,Mission not available,1941,Yes
https://www.charitynavigator.org/ein/010769300,Lair Family Foundation,010769300,,,"Not currently rated, Not rated, This organization is not rated",,"1701 N COLLINS BLVD STE 245, RICHARDSON, TX, 75080-3789",,Mission not available,2003,Yes
https://www.charitynavigator.org/ein/010769304,House of Restoration Inc.,010769304,,,"Not currently rated, Not rated, This organization is not rated",,"PO BOX 1190, MABLETON, GA, 30126-1003",,Mission not available,2015,Yes
https://www.charitynavigator.org/ein/010769305,Kare Bears at Summerset III Vista,010769305,,,"Not currently rated, Not rated, This organization is not rated",,"1581 REGENT DR, BRENTWOOD, CA, 94513-6911",,Mission not available,2015,Yes
https://www.charitynavigator.org/ein/010769386,Brunelli Family Foundation,010769386,,,"Not currently rated, Not rated, This organization is not rated",,"915 CREEKDALE DR, RICHARDSON, TX, 75080-4907",,Mission not available,2003,Yes
https://www.charitynavigator.org/ein/010769456,Ventura Land Trust,010769456,87%,3,,http://VENTURALANDTRUST.ORG,"PO BOX 1284, VENTURA, CA, 93002-1284",805-643-8044,"TO PERMANENTLY PROTECT THE LAND, WATER, WILDLIFE AND SCENIC BEAUTY OF THE VENTURA REGION",2003,No
https://www.charitynavigator.org/ein/010769670,Expanding Young Minds Inc.,010769670,,,"Not currently rated, Not rated, This organization is not rated",,"2339 W HAMMER LN, STOCKTON, CA, 95209-2368",,Mission not available,2008,Yes
https://www.charitynavigator.org/ein/010769734,MERCY HILL CHURCH,010769734,,,"Not currently rated, Not rated, This organization is not rated",,"3757 HIGHWAY 25, JACKSON, MO, 63755-8097",,Mission not available,1965,Yes
https://www.charitynavigator.org/ein/010770184,Keith Nix Ministries,010770184,73%,2,,,"PO BOX 5739, SEVIERVILLE, TN, 37864-5739",865-773-0488,SPREADS THE GOSPEL OF JESUS CHRIST THROUGH PREACHING AND TEACHING THE WORD OF GOD WITH SPECIAL EMPHASIS ON TARGETING OF YOUNG PEOPLE.,2008,No
https://www.charitynavigator.org/ein/010770675,Springhill Development & Improvement Organization,010770675,,,"Not currently rated, Not rated, This organization is not rated",,"60 M P COMER RD, EUFAULA, AL, 36027-4718",,Mission not available,2015,Yes
https://www.charitynavigator.org/ein/010770747,NATIONAL ASSOCIATION OF GOVERNMENT EMPLOYEES,010770747,,,"Not currently rated, Not rated, This organization is not rated",,"PO BOX 3275, ST PETERSBURG, FL, 33731-3275",,Mission not available,1973,Yes
https://www.charitynavigator.org/ein/010770788,Shiloh Services Inc.,010770788,,,"Not currently rated, Not rated, This organization is not rated",,"115 SCOTCH PINE LN, COLUMBIA FLS, MT, 59912-8304",,Mission not available,2003,Yes
https://www.charitynavigator.org/ein/010771055,NORTH COWETA BAPTIST CHURCH,010771055,,,"Not currently rated, Not rated, This organization is not rated",,"PO BOX 919, PALMETTO, GA, 30268-0919",,Mission not available,1964,Yes
https://www.charitynavigator.org/ein/010772321,F R Double E Outreach Ministry,010772321,,,"Not currently rated, Not rated, This organization is not rated",,"7716 HWY 182 STE 102, MORGAN CITY, LA, 70380-2313",,Mission not available,2005,Yes
https://www.charitynavigator.org/ein/010771910,Saint Juvenaly of Alaska Mission,010771910,,,"Not currently rated, Not rated, This organization is not rated",,"PO BOX 158, ETNA, CA, 96027-0158",,Mission not available,2003,Yes
https://www.charitynavigator.org/ein/010772536,Aiko Institute,010772536,,,"Not rated, Confirmed Revocation, Not currently rated, This organization is not rated, Review Before Proceeding",,"480 W 6TH ST, CLAREMONT, CA, 91711-4201",,Mission not available,2013,Yes
https://www.charitynavigator.org/ein/010772839,Homes of Hope Inc.,010772839,90%,4,,,"36300 COUNTY ROAD Z, WRAY, CO, 80758-9720",970-576-0789,"Homes of Hope, Inc. is active in combating trafficking of persons. Our desire is to create a culture of freedom from the cycles of forced sex thereby restoring every ... (More)",2006,No
https://www.charitynavigator.org/ein/010773390,Pals Animal Rescue Inc.,010773390,,,"Not currently rated, Not rated, This organization is not rated",,"PO BOX 47342, WICHITA, KS, 67201-7342",,Mission not available,2003,Yes
https://www.charitynavigator.org/ein/010773520,California Indian Law Association Inc.,010773520,,,"Not currently rated, Not rated, This organization is not rated",,"13061 ROSEDALE HWY STE G 594, BAKERSFIELD, CA, 93314-7612",,Mission not available,2017,Yes
https://www.charitynavigator.org/ein/010773533,First Baptist Childrens Academy Inc.,010773533,80%,3,,,"1570 W MAIN ST, WAUCHULA, FL, 33873-9414",863-773-9185,"THIS ORGANIZATION IS ORGANIZED EXCLUSIVELY FOR CHARITABLE, RELIGIOUS, EDUCATIONAL, AND/OR SCIENTIFIC PURPOSES UNDER SECTION 501(C)(3) OF THE INTERNAL REVENUE CODE.",2004,No
https://www.charitynavigator.org/ein/010773863,SUMMIT PENTECOSTAL CHURCH OF GOD,010773863,,,"Not currently rated, Not rated, This organization is not rated",,"HWY 202 E, SUMMIT, AR, 72677-0000",,Mission not available,1959,Yes
https://www.charitynavigator.org/ein/010773957,Gifts of Love International,010773957,69%,2,,http://WWW.GOLI.ORG,"14382 WOODLAKE DR, CHESTERFIELD, MO, 63017-5714",636-887-8888,"TO SPREAD THE GOSPEL OF JESUS CHRIST BY SUPPORTING MISSIONARIES, CHURCHES AND ORPHANAGES THAT WORK WITH THE POOR, NEEDY AND ORPHANS IN FOREIGN COUNTRIES, THE USA AND ... (More)",2005,No
https://www.charitynavigator.org/ein/010774073,SOUTHERN OASIS PROPERTY OWNERS ASSOCIATION INC,010774073,,,"Not currently rated, Not rated, This organization is not rated",,"106 MERCURY ST, MISSION, TX, 78572-6395",,Mission not available,2003,Yes
https://www.charitynavigator.org/ein/010774114,Government Investment Officers Association,010774114,100%,4,,http://www.gioa.us,"10655 PARK RUN DR STE 120, LAS VEGAS, NV, 89144-4592",702-255-3224,Provide Training and Support and Training for Government Investment Officers,2006,No
https://www.charitynavigator.org/ein/010774995,Friends of Clarksville Mainstreet Inc.,010774995,,,"Not currently rated, Not rated, This organization is not rated",,"PO BOX 1122, CLARKSVILLE, TX, 75426-1122",,Mission not available,2004,Yes
https://www.charitynavigator.org/ein/010775179,Ecom Foundation for Development of Origin Resources,010775179,73%,2,,http://WWW.ECOMFOUNDATION.ORG,"13760 NOEL RD STE 500, DALLAS, TX, 75240-1362",,"FOUNDED IN 2006, THE ECOM FOUNDATION FOR DEVELOPMENT OF ORIGIN RESOURCES IS A 501(C)(3) CHARITY SET UP TO SUPPORT THE FARMING COMMUNITIES THAT GIVE US SO MUCH AROUND ... (More)",2006,No
https://www.charitynavigator.org/ein/010775315,Peace International Foundation,010775315,,,"Not currently rated, Not rated, This organization is not rated",,"513 MULBERRY ST, TEAGUE, TX, 75860-2127",,Mission not available,2004,Yes
https://www.charitynavigator.org/ein/010775897,KIWANIS INTERNATIONAL INC,010775897,,,"Not currently rated, Not rated, This organization is not rated",,"312, SAFETY HARBOR, FL, 34695-0000",,Mission not available,1940,Yes
https://www.charitynavigator.org/ein/010775956,ASSOCIATION FOR PROFESSIONALS IN INFECTION CTRL & EPIDEMIOLOGY INC,010775956,,,"Not currently rated, Not rated, This organization is not rated",,"529 OAK HILL CIR, HAMILTON, AL, 35570-6457",,Mission not available,1975,Yes
https://www.charitynavigator.org/ein/010776195,Deming Animal Guardians,010776195,78%,3,,http://DAGSHIPRESCUE.COM,"PO BOX 1275, DEMING, NM, 88031-1275",575-313-0626,REDUCE SUFFERING AND OVERPOPULATION OF COMPANION ANIMALS,2007,No
https://www.charitynavigator.org/ein/010776204,Texas Aerospace Education Foundation,010776204,,,"Not currently rated, Not rated, This organization is not rated",,"1965 REMINGTON LN, FRISCO, TX, 75033-7634",,Mission not available,2012,Yes
https://www.charitynavigator.org/ein/010776235,Friends of the Morgan County Library,010776235,,,"Not currently rated, Not rated, This organization is not rated",,"600 N HUNTER ST, VERSAILLES, MO, 65084-1830",,Mission not available,2003,Yes
https://www.charitynavigator.org/ein/010776470,Gods Acres Inc.,010776470,,,"Not currently rated, Not rated, This organization is not rated",,"1943 SW 16TH PL, DEERFIELD BCH, FL, 33442-6121",,Mission not available,2003,Yes
https://www.charitynavigator.org/ein/010776478,LYNNWOOD JAPANESE CHURCH,010776478,,,"Not currently rated, Not rated, This organization is not rated",,"7812 224TH ST SW, EDMONDS, WA, 98026-8336",,Mission not available,1964,Yes
https://www.charitynavigator.org/ein/010776583,TOASTMASTERS INTERNATIONAL,010776583,,,"Not currently rated, Not rated, This organization is not rated",,"130 EDWARD JONES BLVD 9TH FLOOR, MARYLAND HEIGHTS, MO, 63043-3000",,Mission not available,1945,Yes
https://www.charitynavigator.org/ein/010777020,Mount Sinai Baptist Church of Macon Inc.,010777020,,,"Not currently rated, Not rated, This organization is not rated",,"1310 EASTVIEW AVE, MACON, GA, 31217-4208",,Mission not available,2005,Yes
https://www.charitynavigator.org/ein/010777135,Jemaat Kristen Indonesia Synod,010777135,,,"Not currently rated, Not rated, This organization is not rated",,"3310 N G ST, SN BERNRDNO, CA, 92405-2714",,Mission not available,2003,Yes
https://www.charitynavigator.org/ein/010777320,Grays Temple Christian Methodist Episcopal Church Inc.,010777320,,,"Not currently rated, Not rated, This organization is not rated",,"523 18TH ST, WEST PALM BCH, FL, 33407-6423",,Mission not available,2024,Yes
https://www.charitynavigator.org/ein/010777554,Border Angels,010777554,76%,3,Review Before Proceeding,http://www.borderangels.org,"2258 ISLAND AVE, SAN DIEGO, CA, 92102-2921",619-487-0249,Border Angels promotes a culture of love through advocacy and education by creating a social consciousness and engaging in direct action to defend the rights of migr ... (More),2003,Yes
https://www.charitynavigator.org/ein/010777831,TAU EPSILON CHAPTER OF OMEGA PSI PHI FRATERNITY,010777831,,,"Not currently rated, Not rated, This organization is not rated",,"3100 CLEBURNE ST, HOUSTON, TX, 77004-4501",,Mission not available,2024,Yes
https://www.charitynavigator.org/ein/010777856,Literacy for Environmental Justice,010777856,81%,3,,http://www.lejyouth.org,"1150 CARROLL AVE, SAN FRANCISCO, CA, 94124-3751",415-282-6840,"Literacy for Environmental Justice (LEJ) was founded in 1998 by passionate Bayview-Hunters Point youth who saw the environmental injustices, pollution, and health cr ... (More)",2003,No
