url,name,ein,score,star_rating,keywords,website,address,phone,organization_mission,IRS_ruling_year,contain_keywords
https://www.charitynavigator.org/ein/237064196,ALPHA PHI INTERNATIONAL FRATERNITY INC,237064196,,,"Not currently rated, Not rated, This organization is not rated",http://www.az-alphaphi.com,"1985 S JOSEPHINE ST, DENVER, CO, 80210-4207",847-316-8925,Alpha Phi is a sisterhood of women supporting each other in lifelong achievement.,1968,Yes
https://www.charitynavigator.org/ein/237064201,CHINESE AMERICAN ENGINEERS & SCIENTISTS ASSOC OF S CALIFORNIA,237064201,,,"Not currently rated, Not rated, This organization is not rated",,"17827 ELAINE AVE, ARTESIA, CA, 90701-4124",,Mission not available,1970,Yes
https://www.charitynavigator.org/ein/237064209,Belle Plaine Community Chapel,237064209,,,"Not currently rated, Not rated, This organization is not rated",,"PO BOX 619, BELLE PLAINE, KS, 67013-0619",,Mission not available,1970,Yes
https://www.charitynavigator.org/ein/237064202,Christian Gospel Assemblies,237064202,,,"Not currently rated, Not rated, This organization is not rated",,"PO BOX 837, NEWBERG, OR, 97132-0837",,Mission not available,1970,Yes
https://www.charitynavigator.org/ein/237064236,PTA MISSOURI CONGRESS,237064236,,,"Not currently rated, Not rated, This organization is not rated",,"27600 E COLBERN RD, LEES SUMMIT, MO, 64086-8424",,Mission not available,1971,Yes
https://www.charitynavigator.org/ein/237064237,PTA MISSOURI CONGRESS,237064237,,,"Not currently rated, Not rated, This organization is not rated",,"15208 E 39TH ST S, INDEPENDENCE, MO, 64055-4239",,Mission not available,1971,Yes
https://www.charitynavigator.org/ein/237064239,PTA MISSOURI CONGRESS,237064239,,,"Not currently rated, Not rated, This organization is not rated",,"7100 N CHATHAM AVE, KANSAS CITY, MO, 64151-1714",,Mission not available,1971,Yes
https://www.charitynavigator.org/ein/237064245,SPRING BRANCH BOWLING CLUB INC,237064245,,,"Not currently rated, Not rated, This organization is not rated",,"PO BOX 85, SPRING BRANCH, TX, 78070-0085",,Mission not available,1970,Yes
https://www.charitynavigator.org/ein/237064241,PTA MISSOURI CONGRESS,237064241,,,"Not currently rated, Not rated, This organization is not rated",,"6410 BLUE RIDGE BLVD, RAYTOWN, MO, 64133-4827",,Mission not available,1971,Yes
https://www.charitynavigator.org/ein/237064287,PTA TEXAS CONGRESS,237064287,,,"Not currently rated, Not rated, This organization is not rated",,"525 BILLIE RUTH LN, HURST, TX, 76053-5406",,Mission not available,1967,Yes
https://www.charitynavigator.org/ein/237064292,INTERNATIONAL RIGHT OF WAY ASSOCIATION,237064292,,,"Not currently rated, Not rated, This organization is not rated",,"PO BOX 30013, RENO, NV, 89520-3013",,Mission not available,1967,Yes
https://www.charitynavigator.org/ein/237064316,PTA CALIFORNIA CONGRESS OF PARENTS TEACHERS & STUDENTS INC,237064316,,,"Not currently rated, Not rated, This organization is not rated",,"1400 E JANSS RD, THOUSAND OAKS, CA, 91362-2133",,Mission not available,1943,Yes
https://www.charitynavigator.org/ein/237064304,Macedonia Church of God in Christ of Val Verde,237064304,,,"Not currently rated, Not rated, This organization is not rated",,"30019 MARVIN AVE, SAUGUS, CA, 91384-4640",,Mission not available,1972,Yes
https://www.charitynavigator.org/ein/237064372,United Methodist Women of the California-Nevada Annual Conferenc,237064372,,,"Not currently rated, Not rated, This organization is not rated",,"602 BAYVIEW DR, APTOS, CA, 95003-5304",,Mission not available,1960,Yes
https://www.charitynavigator.org/ein/237064387,Radio Club of America Inc.,237064387,80%,3,,,"8500 RIDGEWOOD AVE APT 103, CPE CANAVERAL, FL, 32920-2151",,The mission is to study and contribute to the development of radio communications programs and provide a scholarship fund for needy and worthy students for the study ... (More),1989,No
https://www.charitynavigator.org/ein/237064397,Charles Lee Powell Foundation,237064397,,,"Not currently rated, Not rated, This organization is not rated",,"7742 HERSCHEL AVE STE A, LA JOLLA, CA, 92037-4444",,Mission not available,1966,Yes
https://www.charitynavigator.org/ein/237064413,First Congregational Endowment Fund,237064413,,,"Not currently rated, Not rated, This organization is not rated",,"6205 WILLOW DALE ST, HOUSTON, TX, 77087-3343",,Mission not available,1970,Yes
https://www.charitynavigator.org/ein/237064409,DELTA KAPPA GAMMA SOCIETY,237064409,,,"Not currently rated, Not rated, This organization is not rated",,"2650 US HIGHWAY 385, LITTLEFIELD, TX, 79339-5806",,Mission not available,1971,Yes
https://www.charitynavigator.org/ein/237064430,PTA MISSOURI CONGRESS,237064430,,,"Not currently rated, Not rated, This organization is not rated",,"7333 N WYANDOTTE ST, GLADSTONE, MO, 64118-1681",,Mission not available,1971,Yes
https://www.charitynavigator.org/ein/237064405,DELTA KAPPA GAMMA SOCIETY,237064405,,,"Not currently rated, Not rated, This organization is not rated",,"322 CEDAR LN, DUNLAP, TN, 37327-4618",,Mission not available,1971,Yes
https://www.charitynavigator.org/ein/237064442,ALPHA GAMMA DELTA FRATERNITY,237064442,,,"Not currently rated, Not rated, This organization is not rated",,"3003 BAY ST, SARASOTA, FL, 34237-7301",,Mission not available,1941,Yes
https://www.charitynavigator.org/ein/237064451,COMMUNICATION WORKERS OF AMERICA,237064451,,,"Not currently rated, Not rated, This organization is not rated",,"PO BOX 245128, PEMBROKE PNES, FL, 33024-0102",,Mission not available,1950,Yes
https://www.charitynavigator.org/ein/237064550,PTA CALIFORNIA CONGRESS OF PARENTS TEACHERS & STUDENTS INC,237064550,,,"Not currently rated, Not rated, This organization is not rated",,"1665 WEST DR, SAN MARINO, CA, 91108-2558",,Mission not available,1970,Yes
https://www.charitynavigator.org/ein/237064563,Sylers Temple of Divine Truth,237064563,,,"Not currently rated, Not rated, This organization is not rated",,"261 1/2 S ARROYO DR, SAN GABRIEL, CA, 91776-1001",,Mission not available,1970,Yes
https://www.charitynavigator.org/ein/237064582,FRIENDSHIP SCHILLER TEMPLE ASSOCIATION INC,237064582,,,"Not currently rated, Not rated, This organization is not rated",,"4444 MORRISON RD, DENVER, CO, 80219-2446",,Mission not available,1971,Yes
https://www.charitynavigator.org/ein/237064564,CENTRAL WASHINGTON PONY CLUB,237064564,,,"Not currently rated, Not rated, This organization is not rated",,"2460 S 38TH AVE, WEST RICHLAND, WA, 99353-7346",,Mission not available,1971,Yes
https://www.charitynavigator.org/ein/237064604,WYOMING STATE SHOOTING ASSOCIATION,237064604,,,"Not currently rated, Not rated, This organization is not rated",,"PO BOX 942, WORLAND, WY, 82401-0942",,Mission not available,1971,Yes
https://www.charitynavigator.org/ein/237064665,Greene County Historical Society,237064665,,,"Not currently rated, Not rated, This organization is not rated",,"PO BOX 3466, SPRINGFIELD, MO, 65808-3466",,Mission not available,1975,Yes
https://www.charitynavigator.org/ein/237064822,OPTIMIST INTERNATIONAL,237064822,,,"Review Before Proceeding, Not currently rated, Not rated, This organization is not rated",,"7400 EL CAJON BLVD STE 208, LA MESA, CA, 91942-7416",,Mission not available,1971,Yes
https://www.charitynavigator.org/ein/237064779,ALPHA DELTA KAPPA SORORITY INC,237064779,,,"Not currently rated, Not rated, This organization is not rated",,"336 S 600 W, TREMONTON, UT, 84337-1708",,Mission not available,1970,Yes
https://www.charitynavigator.org/ein/237064776,NATIONAL SOCIETY DAUGHTERS OF THE AMERICAN COLONISTS,237064776,,,"Not currently rated, Not rated, This organization is not rated",,"130 DEEP SPRINGS WAY, COVINGTON, GA, 30016-8813",,Mission not available,1945,Yes
https://www.charitynavigator.org/ein/237064873,SOCIETY FOR PRESERVATION & ENCRGMNT OF BARBERSHOP QUARTET SINGING AMER,237064873,,,"Not currently rated, Not rated, This organization is not rated",,"2001 W 32ND ST, PUEBLO, CO, 81008-1319",,Mission not available,1946,Yes
https://www.charitynavigator.org/ein/237064884,Assembly Property Corporation,237064884,,,"Not currently rated, Not rated, This organization is not rated",,"1016 S PROSPECT AVE, REDONDO BEACH, CA, 90277-4824",,Mission not available,1970,Yes
https://www.charitynavigator.org/ein/237064937,Acterra Action for A Healthy Planet,237064937,92%,4,,http://www.acterra.org,"3921 E BAYSHORE BLVD 210, PALO ALTO, CA, 94303-4326",650-962-9876,To bring people together to create local solutions for a healthy planet.,1973,No
https://www.charitynavigator.org/ein/237064986,AGRICULTURE COUNCIL OF AMERICA INC,237064986,,,"Not currently rated, Not rated, This organization is not rated",,"8700 STATE LINE ROAD, LEAWOOD, KS, 66206-1572",913-491-6500,"The Agriculture Council of America (ACA) is an organization uniquely composed of leaders in the agriculture, food and fiber communities dedicated to increasing the p ... (More)",1970,Yes
https://www.charitynavigator.org/ein/237065049,CENTERS FOR SPIRITUAL LIVING,237065049,,,"Not currently rated, Not rated, This organization is not rated",,"580 S BANANA RIVER DR, MERRITT ISLAND, FL, 32952-3006",,Mission not available,2014,Yes
https://www.charitynavigator.org/ein/237065047,NATIONAL EXCHANGE CLUB,237065047,,,"Not currently rated, Not rated, This organization is not rated",,"PO BOX 883, CALDWELL, ID, 83606-0000",,Mission not available,1950,Yes
https://www.charitynavigator.org/ein/237065055,FRATERNAL ORDER OF POLICE,237065055,,,"Not currently rated, Not rated, This organization is not rated",,"PO BOX 2225, FORT PIERCE, FL, 34954-2225",,Mission not available,1972,Yes
https://www.charitynavigator.org/ein/237065104,PTA ALABAMA CONGRESS,237065104,,,"Not currently rated, Not rated, This organization is not rated",,"1001 HAYSLAND RD SW, HUNTSVILLE, AL, 35802-3061",,Mission not available,1970,Yes
https://www.charitynavigator.org/ein/237065108,SOCIETY OF AMERICAN FORESTERS,237065108,,,"Not currently rated, Not rated, This organization is not rated",,"PO BOX 393, DAYTON, OR, 97114-0393",,Mission not available,1971,Yes
https://www.charitynavigator.org/ein/237065062,PTA FLORIDA CONGRESS,237065062,,,"Not currently rated, Not rated, This organization is not rated",,"7955 SW 152ND ST, PALMETTO BAY, FL, 33157-2317",,Mission not available,1971,Yes
https://www.charitynavigator.org/ein/237065174,PTA ALABAMA CONGRESS,237065174,,,"Not currently rated, Not rated, This organization is not rated",,"194 FIRST AVE, LUVERNE, AL, 36049-1616",,Mission not available,1970,Yes
https://www.charitynavigator.org/ein/237065064,ROYAL ORDER OF JESTERS,237065064,,,"Not currently rated, Not rated, This organization is not rated",,"5158 COUNTY RD 577, CENTER HILL, FL, 33514-0000",,Mission not available,1941,Yes
https://www.charitynavigator.org/ein/237065177,PTA ALABAMA CONGRESS,237065177,,,"Not currently rated, Not rated, This organization is not rated",,"7900 WHITTIER RD SW, HUNTSVILLE, AL, 35802-2929",,Mission not available,1970,Yes
https://www.charitynavigator.org/ein/237065119,THE DWELLING PLACE,237065119,,,"Not currently rated, Not rated, This organization is not rated",,"715 EL DORADO DR, WOODLAND, CA, 95695-0000",,Mission not available,1964,Yes
https://www.charitynavigator.org/ein/237065187,"Youth Haven, Florida",237065187,97%,4,,http://www.youthhavenswfl.org/,"5867 Whitaker Road, Naples, FL, 34112",239-774-2904,"Incorporated in 1969, Youth Haven is the only emergency residential shelter for children in Southwest Florida. Since inception, we have provided a home for thousands ... (More)",1970,No
https://www.charitynavigator.org/ein/237065123,CALVARY LUTHERAN CHURCH,237065123,,,"Not currently rated, Not rated, This organization is not rated",,"58251 S DIVISION RD, ST HELENS, OR, 97051-3240",,Mission not available,1941,Yes
https://www.charitynavigator.org/ein/237065205,SOCIETY OF AMERICAN FORESTERS,237065205,,,"Not currently rated, Not rated, This organization is not rated",,"245 COUNTY ROAD 2090, BURKEVILLE, TX, 75932-6444",,Mission not available,1971,Yes
https://www.charitynavigator.org/ein/237065210,SOCIETY OF AMERICAN FORESTERS,237065210,,,"Not currently rated, Not rated, This organization is not rated",,"PO BOX 190, BAKER CITY, OR, 97814-0190",,Mission not available,1971,Yes
https://www.charitynavigator.org/ein/237065237,Friends of the Library Graham Texas,237065237,,,"Not currently rated, Not rated, This organization is not rated",,"PO BOX 1142, GRAHAM, TX, 76450-1142",,Mission not available,1971,Yes
https://www.charitynavigator.org/ein/237065240,Greentree Fund,237065240,,,"Not currently rated, Not rated, This organization is not rated",,"5130 GREEN TREE RD, HOUSTON, TX, 77056-1406",,Mission not available,1971,Yes
https://www.charitynavigator.org/ein/237065242,Ecumenical Campus Ministry at Wichita Inc.,237065242,,,"Not currently rated, Not rated, This organization is not rated",,"BOX 56 WICHITA STATE UNIVERSITY, WICHITA, KS, 67260-0001",,Mission not available,1972,Yes
https://www.charitynavigator.org/ein/237065236,Denver Institute for Psychoanalysis,237065236,97%,4,,http://www.denverinstituteforpsychoanlaysis.org,"1890 N REVERE CT, AURORA, CO, 80045-7464",303-724-2666,"The Denver Institute for Psychoanalysis is organized for the purpose of providing psychoanalytic education for the qualified applicants, to advance scholarship and r ... (More)",1970,No
https://www.charitynavigator.org/ein/237065280,Desert Church of Christ,237065280,,,"Not currently rated, Not rated, This organization is not rated",,"PO BOX 697, BARSTON, CA, 92312-0697",,Mission not available,1971,Yes
https://www.charitynavigator.org/ein/237065289,BEAUTIFUL SAVIOR LUTHERAN CHURCH,237065289,,,"Not currently rated, Not rated, This organization is not rated",,"2306 MILTON WAY, MILTON, WA, 98354-9427",,Mission not available,1941,Yes
https://www.charitynavigator.org/ein/237065248,Sarofim Foundation,237065248,,,"Not currently rated, Not rated, This organization is not rated",,"PO BOX 52830, HOUSTON, TX, 77052-2830",,Mission not available,1971,Yes
https://www.charitynavigator.org/ein/237065347,NATIONAL ASSOCIATION OF LETTER CARRIERS,237065347,,,"Not currently rated, Not rated, This organization is not rated",,"4204 CARROLL DR W, HORN LAKE, MS, 38637-2785",,Mission not available,1971,Yes
https://www.charitynavigator.org/ein/237065485,Hunt County Fair Association Inc.,237065485,67%,2,,,"PO BOX 1403, GREENVILLE, TX, 75403-1403",903-454-1503,"THE ORGANIZATION PURPOSE IS TO ADVANCE THE CIVIC, AGRICULTURE AND COMMERCIAL WELL BEING OF HUNT COUNTY, TEXAS THROUGH THE PUBLIC EDUCATIONAL AND COMMUNITY EVENT KNOW ... (More)",1972,No
https://www.charitynavigator.org/ein/237065458,CANE RIDGE COMMUNITY CLUB,237065458,,,"Not currently rated, Not rated, This organization is not rated",,"PO BOX 878, ANTIOCH, TN, 37011-0878",,Mission not available,2012,Yes
https://www.charitynavigator.org/ein/237065244,SAINT ANDREWS LUTHERAN CHURCH AND CAMPUS CENTER,237065244,,,"Not currently rated, Not rated, This organization is not rated",,"1309 E GRAND AVE, LARAMIE, WY, 82070-4137",,Mission not available,1941,Yes
https://www.charitynavigator.org/ein/237065563,Navajo County Historical Society,237065563,,,"Not currently rated, Not rated, This organization is not rated",,"100 E ARIZONA ST, HOLBROOK, AZ, 86025-2602",,Mission not available,1970,Yes
https://www.charitynavigator.org/ein/237065594,Lighted Cross,237065594,,,"Not currently rated, Not rated, This organization is not rated",,"PO BOX 52, POMONA, CA, 91769-0052",,Mission not available,1977,Yes
https://www.charitynavigator.org/ein/237065358,PTA GEORGIA CONGRESS,237065358,,,"Not currently rated, Not rated, This organization is not rated",,"3450 NEW MACLAND RD, POWDER SPGS, GA, 30127-1927",,Mission not available,1970,Yes
https://www.charitynavigator.org/ein/237065604,PTA CALIFORNIA CONGRESS OF PARENTS TEACHERS & STUDENTS INC,237065604,,,"Not currently rated, Not rated, This organization is not rated",,"2925 FLETCHER ST, SIMI VALLEY, CA, 93065-5270",,Mission not available,1970,Yes
https://www.charitynavigator.org/ein/237065610,California Tennis Assn for Underprivileged Youth,237065610,,,"Review Before Proceeding, Not currently rated, Not rated, This organization is not rated",,"PO BOX 561122, LOS ANGELES, CA, 90056-0179",,Mission not available,1970,Yes
https://www.charitynavigator.org/ein/237065656,AMES LAKE WATER ASSOCIATION INC,237065656,,,"Not currently rated, Not rated, This organization is not rated",http://WWW.AMESLKWATER.ORG,"27905 NE 33RD ST, REDMOND, WA, 98053-5001",425-222-7003,"AMES LAKE WATER ASSOCIATION IS A CONSUMER OWNED COOPERATIVE WHICH PROVIDES WATER SERVICES TO OVER 1,100 MEMBERS IN A RURAL SERVICE AREA SURROUNDING AMES LAKE, WA.",1971,Yes
https://www.charitynavigator.org/ein/237065638,Theosophical Society in the Ojai Valley,237065638,,,"Not currently rated, Not rated, This organization is not rated",,"46 KROTONA ST, OJAI, CA, 93023-3901",,Mission not available,1971,Yes
https://www.charitynavigator.org/ein/237065663,CATHOLIC DAUGHTERS OF THE AMERICAS,237065663,,,"Not currently rated, Not rated, This organization is not rated",,"2204 NW DUSK DR, HERMISTON, OR, 97838-1090",,Mission not available,1946,Yes
https://www.charitynavigator.org/ein/237065617,SEATTLE CHAPTER ARCHITECTURAL SECRETARIES ASSOCIATION,237065617,,,"Not currently rated, Not rated, This organization is not rated",,"2001 WESTERN AVE STE 200, SEATTLE, WA, 98121-2114",,Mission not available,1970,Yes
https://www.charitynavigator.org/ein/237065662,CALIFORNIA SPECIAL DISTRICTS ASSOC,237065662,,,"Review Before Proceeding, Not currently rated, Not rated, This organization is not rated",http://www.csda.net,"11121 STREET STE 200, SACRAMENTO, CA, 95814-0000",916-442-7887,"CSDA is the voice for all special districts, providing members with the resources necessary to best serve their communities.",1970,Yes
https://www.charitynavigator.org/ein/237065664,China Graduate School of Theology Inc.,237065664,81%,3,,http://WWW.CGSTUS.ORG,"2400 WYANDOTTE STREET, MOUNTAIN VIEW, CA, 94043-2373",650-938-2478,SUPPORTING THE GREATER CHINA THEOLOGICAL EDUCATION AND TRAINING FOR THE VISION TO BUILD UP CHINESE CHURCHES TO FACE UNPRECEDENTED CHALLENGES AND OPPORTUNITIES FOR CH ... (More),1970,No
https://www.charitynavigator.org/ein/237065615,AMERICAN LEGION,237065615,,,"Not currently rated, Not rated, This organization is not rated",,"181 PASEO DEL SOL, LK HAVASU CTY, AZ, 86403-4636",,"SUPPORT US MILITARY, MILITARY FAMILIES, VETERENS AND FAMILIES, AND COMMUNITY VETEREN PROGRAMS.",1971,Yes
https://www.charitynavigator.org/ein/237065671,DELTA KAPPA GAMMA SOCIETY INTERNATIONAL,237065671,,,"Not currently rated, Not rated, This organization is not rated",,"3135 HADAM CT, TALLAHASSEE, FL, 32308-7909",,Mission not available,1971,Yes
https://www.charitynavigator.org/ein/237065666,DELTA KAPPA GAMMA SOCIETY INTERNATIONAL,237065666,,,"Not currently rated, Not rated, This organization is not rated",,"281 22ND RD NW, DUTTON, MT, 59433-9646",,Mission not available,1971,Yes
https://www.charitynavigator.org/ein/237065670,DELTA KAPPA GAMMA SOCIETY,237065670,,,"Not currently rated, Not rated, This organization is not rated",,"116 CHEROKEE DR, MAUMELLE, AR, 72113-7402",,Mission not available,1971,Yes
https://www.charitynavigator.org/ein/237065679,DELTA KAPPA GAMMA SOCIETY INTERNATIONAL,237065679,,,"Not currently rated, Not rated, This organization is not rated",,"PO BOX 1344, PEARL CITY, HI, 96782-8344",,Mission not available,1971,Yes
https://www.charitynavigator.org/ein/237065681,Fillman Foundation,237065681,,,"Not currently rated, Not rated, This organization is not rated",,"PO BOX 459, FAIR OAKS, CA, 95628-0459",,Mission not available,1991,Yes
https://www.charitynavigator.org/ein/237065683,Full Gospel Revival Church of Shafter,237065683,,,"Not currently rated, Not rated, This organization is not rated",,"PO BOX 607, SHAFTER, CA, 93263-0607",,Mission not available,1972,Yes
https://www.charitynavigator.org/ein/237065709,CHRIST FELLOWSHIP CHURCH OF CITRUS HEIGHTS,237065709,,,"Not currently rated, Not rated, This organization is not rated",,"5325 ELKHORN BLVD 335, SACRAMENTO, CA, 95842-2526",,Mission not available,1972,Yes
https://www.charitynavigator.org/ein/237065772,First Baptist Church of Palm Springs,237065772,,,"Not currently rated, Not rated, This organization is not rated",,"588 W ROSA PARKS RD, PALM SPRINGS, CA, 92262-2117",,Mission not available,1970,Yes
https://www.charitynavigator.org/ein/237065716,Islamic Society of Greater Houston,237065716,,,"Not currently rated, Not rated, This organization is not rated",,"3110 EASTSIDE ST, HOUSTON, TX, 77098-1910",,Mission not available,2015,Yes
https://www.charitynavigator.org/ein/237065719,INTERNATIONAL ASSOCIATION OF LIONS CLUBS,237065719,,,"Not currently rated, Not rated, This organization is not rated",,"PO BOX 1522, DUBOIS, WY, 82513-1522",,Mission not available,1971,Yes
https://www.charitynavigator.org/ein/237065743,KNIGHTS OF COLUMBUS,237065743,,,"Not currently rated, Not rated, This organization is not rated",,"PO BOX 1083, ROSWELL, NM, 88202-1083",,Mission not available,1940,Yes
https://www.charitynavigator.org/ein/237065839,CALIFORNIA FEDERATION OF WOMENS CLUBS,237065839,,,"Review Before Proceeding, Not currently rated, Not rated, This organization is not rated",,"PO BOX 4572, WESTLAKE VLG, CA, 91359-1572",,Mission not available,1998,Yes
https://www.charitynavigator.org/ein/237065812,DAUGHTERS OF CHARITY OF ST VINCENT DE PAUL PROVINCE OF THE WEST,237065812,,,"Not currently rated, Not rated, This organization is not rated",,"26000 ALTAMONT RD, LOS ALTOS HLS, CA, 94022-4317",,Mission not available,1946,Yes
https://www.charitynavigator.org/ein/237065843,Museum Society Inc.,237065843,,,"Not currently rated, Not rated, This organization is not rated",,"PO BOX 510991, PUNTA GORDA, FL, 33951-0991",,Mission not available,2023,Yes
https://www.charitynavigator.org/ein/237065837,WASHINGTON STATE LAW ENFORCEMENT ASSOCIATION INC,237065837,,,"Not currently rated, Not rated, This organization is not rated",http://WSLEA.ORG,"6947 COAL CREEK PKWY SE, NEWCASTLE, WA, 98059-3136",,The Associations primary purpose is to support a wide range of law enforcement and community programs and services.,1970,Yes
https://www.charitynavigator.org/ein/237065922,OMEGA PSI PHI FRATERNITY,237065922,,,"Not currently rated, Not rated, This organization is not rated",,"PO BOX 547, POMPANO BEACH, FL, 33061-0547",954-752-8130,"THE ORGANIZATION IS A FRATERNITY CHAPTER ORGANIZED FOR THE PURPOSE OF PROMOTING BROTHERHOOD, AND THE WELFARE OF THE COMMUNITY",1953,Yes
https://www.charitynavigator.org/ein/237065937,Peyton Forest Es PTA,237065937,,,"Not currently rated, Not rated, This organization is not rated",,"301 PEYTON RD SW, ATLANTA, GA, 30311-2133",,Mission not available,2016,Yes
https://www.charitynavigator.org/ein/237065946,ALPHA DELTA KAPPA SORORITY INC,237065946,,,"Not currently rated, Not rated, This organization is not rated",,"1615 W 92ND ST, KANSAS CITY, MO, 64114-3210",,Mission not available,1970,Yes
https://www.charitynavigator.org/ein/237065947,ALPHA DELTA KAPPA SORORITY INC,237065947,,,"Not currently rated, Not rated, This organization is not rated",,"1615 W 92ND ST, KANSAS CITY, MO, 64114-3210",,Mission not available,1970,Yes
https://www.charitynavigator.org/ein/237065900,OMEGA PSI PHI FRATERNITY,237065900,,,"Not currently rated, Not rated, This organization is not rated",,"PO BOX 771, COCOA, FL, 32923-0771",,Mission not available,1970,Yes
https://www.charitynavigator.org/ein/237065954,AMIGOS DE LAS AMERICAS,237065954,,,"Not currently rated, Not rated, This organization is not rated",,"5901 J WYOMING NE RM/STE 118, ALBUQUERQUE, NM, 87109-0000",,Mission not available,1980,Yes
https://www.charitynavigator.org/ein/237065957,Friends of the Sterling Municipal Library,237065957,,,"Not currently rated, Not rated, This organization is not rated",,"1 MARY ELIZABETH WILBANKS AVE, BAYTOWN, TX, 77520-0000",,Mission not available,1970,Yes
https://www.charitynavigator.org/ein/237065961,LITTLE LEAGUE BASEBALL INC,237065961,,,"Not currently rated, Not rated, This organization is not rated",,"1319 LIBERTY DR, ROCK SPRINGS, WY, 82901-6515",,Mission not available,1967,Yes
https://www.charitynavigator.org/ein/237066011,MADRONA BEACH WATER COMPANY INCORPORATED,237066011,,,"Not currently rated, Not rated, This organization is not rated",,"3403 STEAMBOAT ISLAND RD NW PMB 350, OLYMPIA, WA, 98502-4876",,Mission not available,2018,Yes
https://www.charitynavigator.org/ein/237066014,Modesto Church of Original Apostolic Faith,237066014,,,"Not currently rated, Not rated, This organization is not rated",,"505 FLOYD AVE, MODESTO, CA, 95350-3387",,Mission not available,1970,Yes
https://www.charitynavigator.org/ein/237066015,Mother Lode Bible Conference Inc.,237066015,,,"Not currently rated, Not rated, This organization is not rated",,"3363 COON HOLLOW RD, PLACERVILLE, CA, 95667-8127",,Mission not available,1970,Yes
https://www.charitynavigator.org/ein/237065983,BEAUX ARTS CLUB,237065983,,,"Not currently rated, Not rated, This organization is not rated",,"1316 PENNSYLVANIA AVENUE, FORT WORTH, TX, 76104-0000",,Mission not available,1970,Yes
https://www.charitynavigator.org/ein/237066001,Girls Shelter of Fort Smith Ark Inc.,237066001,76%,3,,,"PO BOX 3177, FORT SMITH, AR, 72913-3177",479-646-0444,"TO PROVIDE A SAFE, ENCOURAGING ATMOSPHERE IN A HOMELIKE SETTING FOR FEMALES AGED 12-17 YEARS THAT HAVE BEEN ORDERED THROUGH THE COURTS INTO OUR PROGRAM. TO PROMOTE P ... (More)",1970,No
https://www.charitynavigator.org/ein/237066010,Middle Georgia State University Foundation Inc.,237066010,97%,4,,http://WWW.MGA.EDU/FOUNDATION,"100 UNIVERSITY PKWY, MACON, GA, 31206-5100",478-471-2732,MIDDLE GEORGIA STATE UNIVERSITY FOUNDATION STRIVES TO IMPROVE THE LIVES OF PEOPLE IN CENTRAL GEORGIA BY ENABLING MIDDLE GEORGIA STATE UNIVERSITY TO ACHIEVE EXTRAORDI ... (More),1970,No
